name,Type,Plot Summary,Genre,Released,Status,Other name
Tropical-Rouge! Precure, Winter 2021 Anime, New Pretty Cure serie.," Action, Fantasy, Magic, Shoujo", 2021, Completed, トロピカル～ジュ！プリキュア
Tropical-Rouge! Precure Movie, Movie," The story takes place in the wintry land of Shantia, with Manatsu and the others invited to the land by its princess Sharon. But as they arrive, a mysterious monster attacks Shantia, and it is closed off to outsiders."," Action, Fantasy, Shoujo", 2021, Completed," Tropical Rouge! Precure Snow Princess and The Miracle Ring!, 映画 トロピカル〜ジュ!プリキュア 雪のプリンセスと奇跡の指輪!"
Trouble Chocolate, TV Series," Cacao, a student at Micro Grand Academy, wakes up one morning to find a girl made of wood sleeping in bed with him. She is Hinano, a tree spirit who possessed the body of a wooden puppet after Cacao messed up his magic teacher's spell. Having taken an instant liking to Cacao, Hinano enrolls in his school. Between Hinano, monsters, two strange twins and their four-eyed cat master, a demon boy, odd teachers and students, and the fact that he may have the potential to be one of the greatest magic users of all time, Cacao's life seems to have taken several turns for the worse...and the weird."," Comedy, Romance, Sci-Fi, Shounen", 1999, Completed, トラブルチョコレート
Trouble Chocolate (Dub), TV Series," Cacao, a student at Micro Grand Academy, wakes up one morning to find a girl made of wood sleeping in bed with him. She is Hinano, a tree spirit who possessed the body of a wooden puppet after Cacao messed up his magic teacher's spell. Having taken an instant liking to Cacao, Hinano enrolls in his school. Between Hinano, monsters, two strange twins and their four-eyed cat master, a demon boy, odd teachers and students, and the fact that he may have the potential to be one of the greatest magic users of all time, Cacao's life seems to have taken several turns for the worse...and the weird."," Comedy, Fantasy, Magic, Romance, School, Sci-Fi, Shounen", 1999, Completed, トラブルチョコレート
True Love Story, OVA," When Morisaki Yuuta ran into a girl in the school hallway that day, he had no idea his life would change forever. As a member of the photography club and a fledgling to the world of women, Yuuta's life has been turned upside down by the entrance of not one, but several women into his life! From old friends to new acquaintances, it will be tough figuring out who to choose!It is based on the latest installment of the True Love Story series of dating sims.", Romance, 2003, Completed," True Love Story Summer Days, and yet..."
True Tears, TV Series," Shinichiro is a student living in what would be a dream come true for most high school boys, but for him is mostly a frustration. A well liked girl in school named Hiromi has lived in his house for a year along with his family. Her father was a close friend of the family, and when he died they immediately took her in.She is popular and well liked, always smiles, is talented in sports- but Shinichiro knows there must be tears inside her. Having an artistic tendency, he makes watercolours of her and thinks about wishing to ease her tears. Yet he cannot bring up the nerve to talk to her even in his own home. She, too, is quiet and withdrawn in their house, quite unlike at school. Shinichiro is also distracted by teasing from his friend Nobuse for watching Hiromi from afar, a curse of bad luck from a strange girl named Noe, and being forced to perform Muhiga dancing. By helping Noe he hopes to ease his own problems, yet he seems to have difficulty helping himself. Genre"," Drama, Romance, School", 2008, Completed, true tears
True Tears Specials, Special, 30-second sketches/omakes based around the events of the TV series with little twists., Comedy, 2008, Completed,
Try Knights, Summer 2019 Anime," Riku Haruma enters high school without a future in sight. He sees people playing like monsters on the ground, jumping higher than anyone else, running fast, deciding to try their best. There, he sees Akira Kariya playing rugby, a sport he was once passionate about but gave up due to his physique. While Akira is running roughly, Riku gives him a piece of advice without thinking. From that, Riku feels his dying passion for the sport set ablaze, and his future starts to brighten up..."," Josei, School, Sports", 2019, Completed, トライナイツ
Tsubasa Chronicle (Dub), TV Series," During an excavation at the mysterious ruins in Clow Country, Syaoran discovers his childhood friend Princess Sakura appear on the site with wings that disperse into many feathers. As the feather's disappear to different dimensions, so does Sakura's memory. In attempts to save Sakura's life and restore her memory, Syaoran travels through to another world to find a solution. There's only one thing left he can do. Travel through to different dimensions to collect Sakura's feathers. Helping out with the quest is Kurogane, an exiled ninja from Japan Country who wishes to return to his world, the runaway magician, Fay, who desires to jump between each world never to return to his own and the white meat-bun shaped creature, Mokona."," Action, Adventure, Fantasy, Magic, Romance, Supernatural", 2005, Completed," Tsubasa RESERVoir CHRoNiCLE, Tsubasa"
Tsubasa Chronicle 2nd Season (Dub), TV Series," Syaoran, Sakura, Kurogane, Fai and Mokona's journey through to different world's continue as they search for Sakura's feathers. The fated journey slowly becomes more complicated for our travelers, as they find themselves diving deeper into more dangerous worlds. Takes place immediately after the first season. Based on the manga by CLAMP."," Action, Adventure, Drama, Fantasy, Mystery, Romance, Shounen, Supernatural", 2006, Completed," Tsubasa RESERVoir CHRoNiCLE Season Two, Tsubasa Chronicles - Second Season, Tsubasa"
Tsubasa Chronicle, OVA," Syaoran, a boy who wants to become an archeologist, and Sakura, a princess from the Clow Kingdom, are childhood friends with a close relationship. On a fateful night, Sakura lost all her memories as a result of a conspiracy to obtain her powers. In order to regain her memory, Syaoran seeks help from the witch, Yuuko. Yuuko tells Syaoran that he has to travel from one alternate reality to another to collect fragments of Sakura’s memory.However, even if Sakura regains her memory, she will have no recollection of Syaoran. Travelling together with them is Kurogane, a warrior who was exiled from his country, and Fye, a magician who wants to escape from his King. With the help of a magical creature, Mokona, they set off on an exciting journey through time and space. Genre"," Adventure, Drama, Fantasy, Romance, Shounen", 2007, Completed, Tsubasa RESERVoir CHRoNiCLE
Tsubasa Chronicle, OVA," Syaoran, a boy who wants to become an archeologist, and Sakura, a princess from the Clow Kingdom, are childhood friends with a close relationship. On a fateful night, Sakura lost all her memories as a result of a conspiracy to obtain her powers. In order to regain her memory, Syaoran seeks help from the witch, Yuuko. Yuuko tells Syaoran that he has to travel from one alternate reality to another to collect fragments of Sakura’s memory.However, even if Sakura regains her memory, she will have no recollection of Syaoran. Travelling together with them is Kurogane, a warrior who was exiled from his country, and Fye, a magician who wants to escape from his King. With the help of a magical creature, Mokona, they set off on an exciting journey through time and space. Genre"," Action, Adventure, Drama, Fantasy, Magic, Mystery, Romance, Shounen, Supernatural", 2009, Completed, Tsubasa RESERVoir CHRoNiCLE
Tsubasa Reservoir Chronicle, TV Series," Syaoran, a boy who wants to become an archeologist, and Sakura, a princess from the Clow Kingdom, are childhood friends with a close relationship. On a fateful night, Sakura lost all her memories as a result of a conspiracy to obtain her powers. In order to regain her memory, Syaoran seeks help from the witch, Yuuko. Yuuko tells Syaoran that he has to travel from one alternate reality to another to collect fragments of Sakura’s memory.However, even if Sakura regains her memory, she will have no recollection of Syaoran. Travelling together with them is Kurogane, a warrior who was exiled from his country, and Fye, a magician who wants to escape from his King. With the help of a magical creature, Mokona, they set off on an exciting journey through time and space. Genre"," Adventure, Fantasy, Magic, Romance", 2005, Completed, ツバサ・クロニクル
Tsubasa Reservoir Chronicle Movie, Movie," Shaoran and Sakura visit the Birdcage Land guided by Mokona-and-Modoki who were loaned by Yuuko, the Dimension Witch.This world was supposed to be a peaceful land where people lived with birds as partners. But now the king is oppressing his subjects"," Adventure, Fantasy", 2005, Completed, Tsubasa Chronicle
Tsubasa to Hotaru (2015), Special, Four episodes that will be aired on TV as segments within the children's television program Oha Suta.," Romance, School, Shoujo", 2015, Completed," Ribon x Oha Suta Specials, Tsubasa and Hotaru (2015), https"
Tsubasa to Hotaru (2016), Special," The story revolves around Tsubasa Sonokawa, a 15-year old high school girl who fell in love with her upperclassman when he saved her after she fainted at the train station from anemia. She thought it was a meeting of fate, and visited him at his class every day. However, he told her that her feelings were ""heavy,"" and he dumped her. She once again meets a boy after taking over her friend Yuri's job as boy's basketball team manager. She learns that she might have more of a connection with this boy named Aki than she first thought..."," Romance, School, Shoujo", 2016, Completed," Ribon x Oha Suta Specials, つばさとホタル"
Tsubasa, Movie," In their continuing journey to find the feathers that are the fragments of Sakura's lost memory, Syaoran, Kurogane, Fai, and Sakura move through time and space with Mokona. Here, they visit the ""Land of the Birdcage,"" a seemingly peaceful country where people and birds live together, each person having a bird companion. After a boy named Koruri confuses Syaoran and Sakura for ""bodyguards"" and attacks them, they learn that the king of the country possesses a mysterious power. Princess Tomoyo, Koruri, and the other oppressed citizens, having had their birds taken from them, live in hiding within the forest. In order to take back Sakura's feather, Syaoran and the others stand up against the scheming king."," Action, Adventure, Drama, Fantasy, Shounen", 2005, Completed, Tsubasa Chronicle
Tsubasa, OVA," subasa/xxxHOLiC ProjectA 4 part OVA released with the limited editions of the Tsubasa and xxxHOLiC volumes.There are two OVAs for each series, with plots linked together.They cover the Nihon Country Arc and scarcely some of the Celes Country Arc."," Action, Adventure, Drama, Fantasy, Magic, Mystery, Romance, Shounen, Supernatural", 2009, Completed, Tsubasa
Tsubasa, Movie," Continuing their journey from Record Country (the place that held the book of memories), Syaoran and company land into Tokyo Country, a blood-filled country under war from opposing factions for natural resources and survival. While reluctantly involved in the race to live, the group faces their own problems as certain revelations are made, changing their journey forever.A shocking betrayal and a battle that risks all of their lives. After this revelation, they will never be the same again."," Action, Adventure, Drama, Fantasy, Romance, Shounen", 2007, Completed, Tsubasa
Tsugu Tsugumomo, Spring 2020 Anime, Second season of Tsugumomo.," Action, Comedy, Ecchi, School, Seinen, Supernatural", 2020, Completed, 続・つぐもも
Tsugumomo, Spring 2017 Anime," Kazuya Kagami never goes anywhere without the precious ""Sakura Obi"" his mother gave him. One day a beautiful, kimono-clad girl named Kiriha appeared before him. Kiriha naturally began to live with Kazuya in his room. Then there's Chisato, Kazuya's childhood friend with glasses and a ponytail, who meddles in his affairs. Soon there's also an overprotective older sister who seems to want to take baths with him. Jumble in a huge-chested priestess, a good-looking sorceress named Kokuyoura, beautiful women, and hot girls, and Kazuya's happy, embarrassing, confusing life begins…"," Action, Comedy, Ecchi, School, Shounen, Supernatural", 2017, Completed, つぐもも
Tsugumomo (Dub), Spring 2017 Anime," Kazuya Kagami never goes anywhere without the precious ""Sakura Obi"" his mother gave him. One day a beautiful, kimono-clad girl named Kiriha appeared before him. Kiriha naturally began to live with Kazuya in his room. Then there's Chisato, Kazuya's childhood friend with glasses and a ponytail, who meddles in his affairs. Soon there's also an overprotective older sister who seems to want to take baths with him. Jumble in a huge-chested priestess, a good-looking sorceress named Kokuyoura, beautiful women, and hot girls, and Kazuya's happy, embarrassing, confusing life begins…"," Action, Comedy, Ecchi, School, Shounen, Supernatural", 2017, Completed, つぐもも
Tsugumomo OVA, OVA,," Action, Comedy, Ecchi, School, Seinen, Supernatural", 2019, Completed, つぐもも OVA
Tsuki ga Kirei, Spring 2017 Anime," Kotarou Azumi and Akane Mizuno became third year students at junior high school and are classmates for the first time. These two, along with fellow classmates, Chinatsu Nishio and Takumi Hira, relate to their peers through mutual understandings and feelings. As their final year at junior high school progresses, the group overcome their challenges to mature and become aware of changes in themselves."," Romance, School", 2017, Completed, 月がきれい
Tsuki ga Kirei (Dub), Spring 2017 Anime," Kotarou Azumi and Akane Mizuno became third year students at junior high school and are classmates for the first time. These two, along with fellow classmates, Chinatsu Nishio and Takumi Hira, relate to their peers through mutual understandings and feelings. As their final year at junior high school progresses, the group overcome their challenges to mature and become aware of changes in themselves.(Source"," Romance, School", 2017, Completed," Tsukigakirei, As the Moon, So Beautful., The Moon is Beautiful, 月がきれい"
Tsuki ga Kirei Special, Special, A series of unaired comedic shorts released with Blu-ray and DVD boxes of Tsuki ga Kirei.," Comedy, Romance, School", 2017, Completed," Tsukigakirei Special, The Moon is Beautiful, As the Moon, So Beautiful Special"
Tsuki ga Michibiku Isekai Douchuu, Summer 2021 Anime," The fantasy centers around Makoto Misumi, an ordinary high school boy summoned to an alternate world as a brave warrior. Unfortunately, the goddess of the world said with disdain, ""Your face is ugly,"" stripped him of his title, and banished him to the outermost fringes of the wilderness.While wandering the wilderness, Makoto encountered dragons, spiders, orcs, dwarves, and all sorts of other non-human species. Due to differences in the environment from his home world, Makoto now exhibits extraordinary powers in magic and combat. Thus, he survives in this world while dealing with various encounters. The curtain rises on the alternate-world social reform fantasy of a boy forsaken by gods and humans."," Adventure, Fantasy", 2021, Completed, 月が導く異世界道中 ; 月光下的异世界之旅 ; つきがみちびくいせかいどうちゅう ; Tsuki ga Michibiku Isekai Dochu ; Tsukimichi
Tsuki ga Michibiku Isekai Douchuu (Dub), Summer 2021 Anime," As part of a mysterious contract agreed upon by a goddess and his parents years ago, Makoto Misumi finds himself sent to another world to meet the goddess and become the hero. However, the deity deems Makoto to be ""hideous,"" refusing to even lay eyes upon him and revokes his heroic title. Disdainfully giving him the ability to understand all languages except the human language as compensation, the goddess drives Makoto off to the farthest edges of the wasteland, far from human civilization.Due to the disparity between Earth and this new world, Makoto's inherent physical and magical capabilities awaken, making him extremely powerful. He meets various demihumans and mythical beings who all end up being captivated with his characteristics and join Makoto in building a new community where all of them can peacefully coexist.Nevertheless, despite this success, Makoto still yearns to meet fellow humans. In a world where the goddess herself has barred him from interacting with his kind, it is up to Makoto and his companions to fulfill his desire—and perhaps reform society along the way."," Action, Adventure, Comedy, Fantasy, Isekai", 2021, Completed, Tsukimichi
Tsuki ga Michibiku Isekai Douchuu 2nd Season, TV Series, Second Season of Tsuki ga Michibiku Isekai Douchuu.," Action, Adventure, Comedy, Fantasy", 0, Upcoming, SUKIMICHI -Moonlit Fantasy- ; 月が導く異世界道中 ; Tsuki ga Michibiku Isekai Dōchū 2
Tsuki ga Noboru made ni, OVA," A father and daughter in Japan climb to the top of a ridge to watch the moonrise. As they wail, an old man tells them his story. An adaptation of Tetsuya Takeda's story about the relationship between a Japanese child and an American soldier."," Drama, Historical", 1991, Completed, 月がのぼるまでに
Tsuki to Laika to Nosferatu, Fall 2021 Anime," The first astronaut in human history was a vampire girl.Following the end of World War II, the world-dividing superpowers, Federal Republic of Zirnitra in the East and United Kingdom of Arnack in the West, turned their territorial ambitions toward space. Both countries have been competing fiercely for development.East history 1960. Gergiev, the chief leader of the Republic, announces the manned space flight program Project Mechtat (Dream), which, if successful, would be the first feat for humankind. At that time, Lev Leps, a substitute astronaut candidate, is ordered to perform a top secret mission. The ""Nosferatu Project""—a program that experiments with vampires prior to manned missions—will use Irina Luminesk as a test subject, and Lev is to monitor and train her.Even while trifled by the walls of the race and ego of the nations, Lev and Irina share a genuine sentiment as they aim for the universe."," Sci-Fi, Space, Vampire", 2021, Completed, 月とライカと吸血姫
Tsuki to Laika to Nosferatu (Dub), TV Series," On November 23, 1957, the whole world witnessed the Federal Republic of Zirnitra's monumental achievement of sending the first live animal—a dog—to outer space. Since then, the space race between the confederacy and its competitor, the United Kingdom of Arnack, has intensified; the two countries hope to one day send humans to the cosmos above.As a dog's biology is inherently different from a human's anatomy, there is no way to perfectly identify the risks involving space travel and its effects on an individual's body without actually sending someone for observation. However, Zirnitra's government has a potential solution"," Sci-Fi, Space, Vampire", 2021, Completed, 月とライカと吸血姫
Tsukimonogatari, TV Series," Synopsis""Please!—Do it, and get it over with."" Slowly but surely, Koyomi Araragi, who ""has been averting his eyes from reality,"" has no choice but to face it. February comes, and the college entrance exam is approaching. What is this ""change"" that is happening to his body that cannot be overlooked? The ""Monogatari"" begins to sprint towards its conclusion. This is Oddity taking place in the modern world! In a story of youth, a word of farewell is inevitable."," Comedy, Mystery, Romance, Supernatural", 2014, Completed, 憑物語
Tsukipro The Animation, Fall 2017 Anime,, Music, 2017, Completed,
Tsukipro The Animation 2, Summer 2021 Anime, Second season of Tsukipro The Animation., Music, 2021, Completed, ツキプロ・ジ・アニメーション 2 ; Tsukipro The Animation 2nd Season
Tsukiuta. The Animation, Summer 2016 Anime," In the anime series, the members of Six Gravity and Procellarum are all living in the same dorm building. Hajime Mutsuki and Haru Yayoi, the oldest members of Six Gravity, are first year university students. Each episode of the series will feature a different main character.", Music, 2016, Completed, ツキウタ。 THE ANIMATION
Tsukiuta. The Animation 2, Fall 2020 Anime, Second season of Tsukiuta. The Animation., Music, 2020, Completed," Tsukiuta. The Animation Second Season, Tsukiani. 2, ツキウタ. THE ANIMATION 2"
Tsukumogami Kashimasu, Summer 2018 Anime," The series is set during the Edo period, in the Fukagawa ward of old Edo (present-day Tokyo). Because the area is prone to fire and flooding, residents rent everyday items like pots, futons, and clothing from shops instead of purchasing them, so as not to impede them when they flee. Obeni and Seiji, an older sister and younger brother, run one such rental shop called Izumoya. However, mixed in with their inventory are tsukumogami, objects that have turned into spirits after a hundred years of existence. The siblings sometimes lend these sentient items to customers. Both Obeni and Seiji can see and talk to these spirits, and other tsukumogami often come to the store after hearing of the famed siblings.(Source"," Comedy, Demons, Historical, Slice of Life, Supernatural", 2018, Completed, つくもがみ貸します
Tsukuyomi Moon Phase, TV Series," Photographer Kohei Morioka, while on assignment for a magazine devoted to the occult, enters a dark castle in Germany where he encounters a young vampire girl named Hazuki who tries to turn him into her servant. While Kohei doesn’t succumb to Hazuki’s will, he does set her free from the barrier keeping her in the castle. He is surprised to find her living with him in Japan."," Comedy, Fantasy, Romance, Shounen, Vampire", 2004, Completed, 月詠 −MOON PHASE−
Tsukuyomi, TV Series," Morioka Kouhei wants to become a photographer. Unfortunately, he has the tendency to unintentionally capture the images of ghosts on film.One day, he visits an old castle in Germany where he meets a vampire girl, Hazuki. It turns out that Hazuki is confined in the castle against her will. She tries to turn Kouhei into her slave by sucking his blood, with the intent to have him break the device sealing her in the castle. Although Kouhei proves to be immune to the vampire's curse, he is eventually forced to help her. Hazuki successfully escapes from the castle and leaves for Japan to look for her mother.When she arrives in Japan, she goes to Kohei's house where he lives with his grandfather, who agrees to take in the girl. Due to his own childhood experiences, the sympathetic Kouhei agrees to aid Hazuki in her quest.However, other vampires, including Elfried and Count Kinkell, manage to track Hazuki to Japan. They will stop at nothing to retrieve her."," Comedy, Fantasy, Romance, Shounen, Vampire", 2004, Completed, 月詠 −MOON PHASE−; Tsukuyomi Moonphase
Tsukuyomi, OVA, DVD special.," Comedy, Supernatural, Vampire", 2006, Completed," 月詠 -MOON PHASE- おにいさま, ゆらゆらきらきらどんぶらこ これって, なーんだ?"
"Tsuma, Shougakusei ni Naru.", TV Series," Keisuke Niijima lost his beloved wife, Takae, 10 years ago. Since then, he doesn't feel alive and is seen as a gloomy man. The only family Keisuke is left with is his only daughter, Mai. Keisuke wants Mai to be happy but he has not done anything for his daughter other than providing living expenses. The father and daughter's time stopped 10 years ago. They are living in the same house but live very separate lives and do not communicate well. One day, an elementary school girl appears in front of Niijima's house and claims that she is the reincarnation of Takae."," Comedy, Drama, Romance, Slice of Life", 0, Upcoming,  小学生になる。; If my wife became an elementary school student.
Tsumiki no Ie, Movie," 8.16 Ranked #373Popularity #1431Members 63,788MovieOh! ProductionAdd to ListEpisodes", Drama, 2008, Completed," The House of Small Cubes, La Maison en Petits Cubes, つみきのいえ"
Tsundere Akuyaku Reijou Liselotte to Jikkyou no Endou-kun to Kaisetsu no Kobayashi-san, Winter 2023 Anime," On the outside, otome villainess Liselotte seems foul in every way, a purely evil character. However, as revealed in her diary, she was always hiding both her pain and her true feelings for Prince Siegward. While she keeps this locked away, an evil witch ultimately possesses her, leading to her demise—a tragic end for the tsundere villainess. This is how the story always goes, an end coded into the game MagiKoi.Broadcasting club members Aoto Endou and Shihono Kobayashi decide to play this game. In another universe, Prince Siegward hears their voices, believing it to be a divine revelation from a god and goddess. These voices clue him into something he never noticed before"," Comedy, Fantasy, Romance", 2023, Completed, Endo and Kobayashi Live! The Latest on Tsundere Villainess Lieselotte; ツンデレ悪役令嬢リーゼロッテと実況の遠藤くんと解説の小林さん
Tsurezure Children, Summer 2017 Anime," A series depicting various scenarios of young love. These stories range from a boy, crippled by his absolute lack of confidence in himself, cannot even accept the fact that the girl of his dreams actually asked him out on a date, to the near-psychotic girl that pours her own blood into her homemade chocolate in order to win his heart."," Comedy, Romance, School, Shounen", 2017, Completed," Tsure*Dure Children, Tsuredure Children, 徒然チルドレン"
