name,Type,Plot Summary,Genre,Released,Status,Other name
Shutsugeki! Machine Robo Rescue, TV Series," In the future, age is not a factor to determine whether someone can perform a certain task or not, but special talent and training. An organization, Machine Robo Rescue (MRR), was established for robots and children to become partner and rescue people from danger. Then 12 children with various abilities were selected and introduced as part of this program"," Action, Mecha, Sci-Fi", 2003, Completed," Machine Robo Rescue, Sortie!, 出撃！マシンロボレスキュー"
Shuumatsu Nani Shitemasu ka? Isogashii desu ka? Sukutte Moratte Ii desu ka?, Spring 2017 Anime," Five hundred years have passed since the humans went extinct at the hands of the fearsome and mysterious 'Beasts'. The surviving races now make their homes up on floating islands in the sky, out of reach of all but the most mobile of Beasts.Only a small group of young girls, the Leprechauns, can wield the ancient weapons needed to fend off invasions from these creatures. Into the girls’ unstable and fleeting lives, where a call to certain death could come at any moment, enters an unlikely character"," Drama, Fantasy, Romance, Sci-Fi", 2017, Completed," SukaSuka, What do you do at the end of the world? Are you busy? Will you save us?, 終末なにしてますか? 忙しいですか? 救ってもらっていいですか?"
Shuumatsu Nani Shitemasu ka? Isogashii desu ka? Sukutte Moratte Ii desu ka? (Dub), Spring 2017 Anime," Five hundred years have passed since the humans went extinct at the hands of the fearsome and mysterious 'Beasts'. The surviving races now make their homes up on floating islands in the sky, out of reach of all but the most mobile of Beasts.Only a small group of young girls, the Leprechauns, can wield the ancient weapons needed to fend off invasions from these creatures. Into the girls’ unstable and fleeting lives, where a call to certain death could come at any moment, enters an unlikely character"," Drama, Fantasy, Romance, Sci-Fi", 2017, Completed," SukaSuka, What do you do at the end of the world? Are you busy? Will you save us?, 終末なにしてますか? 忙しいですか? 救ってもらっていいですか?"
Shuumatsu no Harem, Winter 2022 Anime, The Man-Killer Virus," Ecchi, Harem, Sci-Fi, Shounen", 2022, Completed, 終末のハーレム ; しゅうまつのハーレム ; Shūmatsu no Hāremu ; World's End Harem
Shuumatsu no Izetta, Fall 2016 Anime," If I am promised to the princess, then I will fight for her sake.In 1939 C.E., the imperialist nation of Germania invaded a neighboring country. All at once, that war spread throughout Europe, and the era was dragged into a spiral of a great war.Then, in 1940, Germania's attack turned towards the Principality of Elystadt, a small Alps country abundant with beautiful water and greenery."," Action, Historical, Military", 2016, Completed," Izetta, The Last Witch, Izetta, Die Letzte Hexe, 終末のイゼッタ"
Shuumatsu no Izetta (Dub), Fall 2016 Anime," If I am promised to the princess, then I will fight for her sake. In 1939 C.E., the imperialist nation of Germania invaded a neighboring country. All at once, that war spread throughout Europe, and the era was dragged into a spiral of a great war. Then, in 1940, Germania's attack turned towards the Principality of Elystadt, a small Alps country abundant with beautiful water and greenery."," Action, Historical, Military", 2016, Completed, Izetta
Shuumatsu no Walküre, ONA," High above the realm of man, the gods of the world have convened to decide on a single matter"," Action, Drama, Seinen, Super Power, Supernatural", 2021, Completed," Record of Ragnarok; Shuumatsu no Valkyrie, Valkyrie of the End; 終末のワルキューレ"
Shuumatsu no Walküre (Dub), ONA," High above the realm of man, the gods of the world have convened to decide on a single matter"," Action, Drama, Seinen, Super Power, Supernatural", 2021, Completed," Shuumatsu no Valkyrie, Valkyrie of the End, Record of Ragnarok, 終末のワルキューレ"
Shuumatsu no Walküre 2nd Season, ONA, Second season of Shuumatsu no Walküre.," Action, Drama, Fantasy", 2023, Completed," Record of Ragnarok 2nd Season, Shuumatsu no Valkyrie, Valkyrie of the End; 終末のワルキューレ ; Shuumatsu no Walküre II"
Shuumatsu no Walküre II (Dub), ONA, Second season of Shuumatsu no Walküre.," Action, Drama, Fantasy, Mythology, Seinen", 2023, Completed," Record of Ragnarok II, Shuumatsu no Walküre 2nd Season, Record of Ragnarok 2nd Season, Shuumatsu no Valkyrie, Valkyrie of the End, 終末のワルキューレII"
Shy, TV Series," Just as the planet approached its third World War, individuals with superpowers appeared from around the globe to maintain peace. They became the symbols of their respective nations, striving to limit crime and bring evildoers to justice. Teenage heroine Teru ""Shy"" Momijiyama is Japan's representative in the world of heroes. When a mysterious threat called Amalareiks emerges, Shy must work together with her fellow heroes to stop them at all costs."," Action, Drama", 0, Upcoming, シャイ
Si Hai Jing Qi, ONA, No synopsis information has been added to this title. Help improve our database by adding a synopsis here.," Action, Adventure, Fantasy, Historical, Martial Arts, Military, Mystery", 2018, Completed, 四海鲸骑
Si Hai Jing Qi 2nd Season, ONA,," Action, Adventure, Fantasy, Historical, Martial Arts, Military, Mystery", 2019, Ongoing," Beyond the Ocean 2, 四海鲸骑 第2季"
Si Hai Jing Qi 3nd Season, ONA,," Action, Adventure, Fantasy, Historical, Martial Arts, Military, Mystery", 2021, Completed," Beyond the Ocean 3, 四海鲸骑"
Si Ling Bianma, ONA," “Ghost” is an online mobile game that Ye Yinyi always dreamed of completing, and to that end, has poured his blood and tears into it, even missing a date with his girlfriend. However, he learns about an alarming monster attack on a young woman near his house, a photograph of which shows the monster to bear a resemblance to the monster he designed. Why is the world of his mobile game appearing in real life?"," Fantasy, Game, Horror, Mystery, Parody, Psychological", 2013, Completed," Order Designer, 死灵编码"
Si Wu Xie, ONA," The story takes place in an era when humans and monsters coexist. According to legend, as long as humans and monsters practice together, they will reach the realm of innocence and achieve mutual happiness. But there are always some people, some monsters, because of their greed and desire, who went down the wrong path. In order to become a true dragon, our protagonist Xiao Li embarks on a journey to realize a thousand hopes for the people. As soon as he left the mountain, he met Qiushui, a demon slayer who would never give up until he caught him. In order to get rid of the autumn water, Xiao Li avoided all the roads, fighting, learning from the teacher, learning art, and causing trouble. I have made a lot of new friends, experienced many crises, and gained a lot of wisdom. It seems that I have also developed some subtle friendships with Qiushui unconsciously. Fate is such a thing, who knows? Just like when Empress Nuwa created humans and monsters, why incorporate good and evil into their souls? Maybe it's all exams, maybe it's all a guide to innocence"," Comedy, Fantasy, Slice of Life", 2020, Ongoing, 思无邪
Si Wuxie Mini, ONA,," Comedy, Fantasy, Slice of Life", 2022, Completed, The Era of Innocence Mini; Si Wuxie
Sidonia no Kishi, Spring 2014 Anime," It's been a thousand years since the Gauna, a strange alien race with no known method of communication, destroyed the solar system. A portion of humanity managed to escape using enormous ""seed ships"" like the Sidonia, which have allowed them to maintain the population while drifting through space. Nagate Tanikaze is a young man who has been raised deep in the bowels of the ship. When he goes into training to pilot the huge robotic weapons known as Gardes, Nagate is entrusted with piloting the legendary unit known as Tsugumori. Nagate and his fellow pilots put their lives on the line against the Gauna, in the ultimate battle for the survival of humanity!"," Action, Mecha, Sci-Fi, Seinen, Space", 2014, Completed," Knights of Sidonia, シドニアの騎士"
Sidonia no Kishi Movie, Movie, A recap of the first season of Sidonia no Kishi with additional scenes and re-edited sound effects.," Action, Mecha, Sci-Fi, Seinen, Space", 2015, Completed, 劇場版「シドニアの騎士」
Sidonia no Kishi, Movie," After the Earth was destroyed by mysterious alien lifeforms known as the Gauna, surviving remnants of the human race escaped to space in the enormous generation ship Sidonia. Having drifted through space for millennia, the Sidonia found itself once more under attack from Gauna for the first time in a century.Once again facing the threat of extinction, a temporary victory against the Gauna was eked out thanks to the human-Gauna hybrid Tsumugi Shiraui and ace Guardian mech pilot Nagate Tanikaze.10 years later... The people of Sidonia enjoy a brief respite. Peaceful days pass, during which Tsumugi begins to realize her feelings for Nagate, who is now celebrated as a hero of Sidonia. However, as Captain Kobayashi has always known, as long as the Gauna remain, peace cannot last.The decision is made"," Action, Mecha, Sci-Fi, Seinen, Space", 2021, Completed, Knights of Sidonia
Sidonia no Kishi, Movie," After the Earth was destroyed by mysterious alien lifeforms known as the Gauna, surviving remnants of the human race escaped to space in the enormous generation ship Sidonia. Having drifted through space for millennia, the Sidonia found itself once more under attack from Gauna for the first time in a century.Once again facing the threat of extinction, a temporary victory against the Gauna was eked out thanks to the human-Gauna hybrid Tsumugi Shiraui and ace Guardian mech pilot Nagate Tanikaze.10 years later... The people of Sidonia enjoy a brief respite. Peaceful days pass, during which Tsumugi begins to realize her feelings for Nagate, who is now celebrated as a hero of Sidonia. However, as Captain Kobayashi has always known, as long as the Gauna remain, peace cannot last.The decision is made"," Action, Mecha, Sci-Fi, Seinen, Space", 2021, Completed, Knights of Sidonia
Sidonia no Kishi, TV Series," Having narrowly avoided the collision with the asteroid, the Sidonia sets a course for the Lem system in order to wipe out the Gauna nest."," Action, Mecha, Sci-Fi, Seinen, Space", 2015, Completed, Knights of Sidonia
Sidonia no Kishi, TV Series," Having narrowly avoided the collision with the asteroid, the Sidonia sets a course for the Lem system in order to wipe out the Gauna nest."," Action, Mecha, Sci-Fi, Seinen, Space", 2015, Completed, Knights of Sidonia
Silent Mobius, TV Series, The year is 2023 and Alien Beings known as “Lucifer Hawks” have begun invading earth from another dimension.All that stands between them and the enslavement of the human race is the Attacked Mystification Police Department – a special division of the Tokyo Police staffed by women with amazing paranormal abilities.," Action, Comedy, Drama, Fantasy, Horror, Magic, Romance, Sci-Fi", 1998, Completed, サイレントメビウス
Silent Mobius (Dub), TV Series," The year is 2023 and Alien Beings known as ""Lucifer Hawks"" have begun invading earth from another dimension. All that stands between them and the enslavement of the human race is the Attacked Mystification Police Department - a special division of the Tokyo Police staffed by women with amazing paranormal abilities."," Action, Comedy, Drama, Fantasy, Horror, Magic, Romance, Sci-Fi", 1998, Completed, サイレントメビウス
Silent Mobius, Movie," In a futuristic Tokyo, several policewomen fight a monster. One of them, Katsumi Liqueur, remembers where she saw it before... Katsumi Liqueur, an American-born woman of Japanese descent, travels to Tokyo to visit her mother, Fuyuka, who is sick in the hospital. She takes a shortcut through an alley after her taxi gets stuck in traffic, only to encounter a monster and two policewomen fighting it. Later, she meets their chief, Rally Cheyenne, who, it seems, has been expecting her, though Katsumi has never met her before. The policewomen want Katsumi to help them fight the monster, but Katsumi, who does not want to believe in magic, resists."," Adventure, Sci-Fi, Supernatural", 1991, Completed, サイレントメビウス／THE MOTION PICTURE
Silent Mobius, Movie," This sequel to the Silent Mobius The Movie 1 continues the timeline of the flashback section of the first movie (Katsumis initial contact with AMP), using some more ideas and persons from the Manga, and being slightly less incompatible to the Silent Mobius series from 1998."," Adventure, Demons, Fantasy, Sci-Fi, Seinen", 1992, Completed," Silent Möbius 2, サイレントメビウス2"
Silver Spoon, TV Series," The young boy named Hachiken Yuugo apparently aspires to live separated from his family. So he takes his chances by enrolling to an agriculture school, one which requires its students to live at a dormitory. He thinks, with his talent in studying, no problem will arise no matter what kind of school he goes to. But he is proven wrong. Grown up as all-easy-to-get city boy, he is forced to uncover not-too-convenient truths about agricultural life. Enjoy the story of Hachiken, as he is trying to keep up with his friends, farmers' heirs who are already accustomed to hardworking farm life."," Comedy, School, Shounen, Slice of Life", 2013, Completed," Gin no Saji, 銀の匙"
Silver Spoon S2, Winter 2014 Anime, Second season of Gin no Saji.," Comedy, School, Shounen, Slice of Life", 2014, Completed," Gin no Saji 2nd Season, 銀の匙2ndシーズン"
Simoun, TV Series, Plot Summary," Drama, Magic, Military, Romance, Shoujo Ai", 2006, Completed, シムーン
Sin, Spring 2017 Anime," You, will you be a worshipper of the devil lords? These beautiful lords lead humans to the seven deadly sins"," Ecchi, Fantasy", 2017, Completed," The 7 Deadly Sins, sin 七つの大罪"
