name,Type,Plot Summary,Genre,Released,Status,Other name
Ookami-san to Shichinin no Nakama-tachi (Dub), TV Series," Ookami Ryouko is a spunky and, by some accounts, rather manly high school girl. She is tall, speaks in a traditionally masculine way and is very proficient in fighting. Ookami-san's best friend is the small and high-pitched voiced Akai Ringo. Incidentally, the two are rather flat-chested, a fact the Narrator (voiced by Arai ""Kuroko"" Satomi of Railgun fame) is all too eager to point out.Ookami and Ringo are members of the Otogi Bank, a club in Otogi High School that assists students with their problems in return for their assistance on a different problem at a later date; thus the Otogi Bank is effectively a loan institute for problems where you can take out a loan for a solved problem but you have to repay it sooner or later.The Otogi Bank is able to solve any problem and will go to any lengths to do so, often leading the members to danger or mayhem. Since most of the members of the club are female, another male is needed for the more dangerous assignments. Thus, the scopophobic (the fear of being looked at) Morino Ryoushi is inducted as a member, right after he confesses his love for Ookami..."," Comedy, Parody, Romance", 2010, Completed," Okami-San and Her Seven Companions,Ookami-san to Shichinin no Nakamatachi, Okamisan and Seven Companions,オオカミさんと七人の仲間たち"
Ookamikakushi, TV Series," The story follows Hiroshi Kuzumi, a 16-year-old student who has just moved to the seemingly serene village of Jogamachi. Nestled in the mountains far away from the city, the village is divided by a river that separates old Jogamachi from new Jogamachi. Young Hiroshi soon discovers that the village is ancient as well as mysterious traditions and customs have been kept alive over the ages. Although a bit bewildered by the new environment, Hiroshi begins to settle into his new life. While he has never been the type to win any popularity contests, he quickly earns the affection of his classmates. That is with the exception of aloof class president, Nemuru Kushinada, whose only words to Hiroshi are a warning to stay away from old part of town. It is there that terror and mystery await him."," Action, Horror, Mystery, Supernatural", 2010, Completed, Okamikakushi
Ookiku Furikabutte, TV Series," Mihashi Ren is the quirky ace pitcher of Nishiura high school's newly formed baseball team. He, however, has hit rock-bottom in terms of confidence and self-belief, thanks to a traumatic three years in his middle school - Mihoshi academy - and switched to Nishiura just to get away from it all. The team's catcher, Abe Takaya, thinks otherwise and believes that Mihashi has the control and skill required, and with his lead, could take them all the way to Koshien.Guided by an enterprising coach and an innovative mentor, the team slowly gel as a unit and train hard to make a mark in the upcoming summer tournament."," Comedy, Sports", 2007, Completed," Big Windup!, Swing Big!, おおきく振りかぶって"
Ookiku Furikabutte (Dub), TV Series," Ren Mihashi was the ace of his middle school's baseball team, but due to his poor pitching, they could never win. Constant losses eventually lead to his teammates bullying him and reached the point where his teammates no longer tried to win, causing Mihashi to graduate with little self-esteem. As a result, Mihashi decides to go to a high school in a different prefecture where he has no intention of playing baseball. Unfortunately, upon his arrival at Nishiura High, he is dragged into joining their new team as the starting pitcher.Although unwilling at first, Mihashi realizes that this is a place where he will be accepted for who he is; with help from the catcher Takaya Abe, he starts to have more confidence in his own abilities. Abe, seeing the potential in Mihashi, makes it a goal to help him become a pitcher worthy of being called an ace."," Comedy, Seinen, Sports", 2007, Completed," Big Windup!, おおきく振りかぶって"
Ookiku Furikabutte Season 2, TV Series," Mihashi Ren is the quirky ace pitcher of Nishiura high school’s newly formed baseball team. He, however, has hit rock-bottom in terms of confidence and self-belief, thanks to a traumatic three years in his middle school – Mihoshi academy – and switched to Nishiura just to get away from it all. The team’s catcher, Abe Takaya, thinks otherwise and believes that Mihashi has the control and skill required, and with his lead, could take them all the way to Koshien.Guided by an enterprising coach and an innovative mentor, the team slowly gel as a unit and train hard to make a mark in the upcoming summer tournament."," Comedy, Sports", 2010, Completed," Ookiku Furikabutte The Summer Tournament Chapter, Big Windup! 2, Ookiku Furikabutte"
Oooku, ONA," In Edo period Japan (1603 to 1868), a strange new disease called the Redface Pox has begun to prey on the country's men. Within eighty years of the first outbreak, the male population has fallen to a quarter of the total female population. Women have taken on all the roles traditionally granted to men, even that of the Shogun. The men, precious providers of life, are carefully protected and the most beautiful of the men are sent to serve in the Shogun's Inner Chambers.", Drama, 2023, Upcoming, 大奥 ; Ōoku
Ooya-san wa Shishunki!, Winter 2016 Anime," The story follows a boy who has gained an independent life. After moving into his rented apartment, he meets his landlord. The landlord has the physique of a little girl, and she does the cooking and housework while attending middle school with her friends."," Comedy, Slice of Life", 2016, Completed, 大家さんは思春期！
Ooyukiumi no Kaina, Winter 2023 Anime," A world blanketed in an endless and ever-growing ocean of snow. The people eke out a living, either huddled around the roots of enormous trees dotting the surface, or high in the canopy, which spreads over the planet's atmosphere.A chance meeting between Kaina, a youth from the canopy, and Liliha, a young woman from the surface, sets off a chain of events that will change the fate of the world.", Fantasy, 2023, Completed, Kaina of the Great Snow Sea; 大雪海のカイナ
Opus.COLORs, Spring 2023 Anime," What color is the world in which you live?""Perception Art"" has been around in the art world for about ten years. It has now completely permeated the world and is a vibrant part of people's lives. Kazuya Yamanashi, the son of Mr. and Mrs. Yamanashi—famous ""artists"" and the creators of Perception Art, recently enrolled in the prestigious art institution Eisen High School with his childhood friend Jun Tsuzuki, dreaming of becoming a Perception Artist himself.Kazuya also had another motive"," School, Sci-Fi, Visual Arts", 2023, Ongoing, Opus.COLORs (オーパスカラーズ)
Orange, Summer 2016 Anime," One morning, Naho Takamiya receives a letter in the mail claiming to be from herself 10 years in the future. The letter reveals a series of events that are supposed to take place that day. At first, Naho thinks it's just a prank; but when the letter mentions a transfer student named Kakeru Naruse, who really ends up transferring into her class later that day, she is forced to believe in its contents.  As Naho continues to read the letter, her future self mentions several regrets, urging Naho to take the right decisions now. Somehow these regrets all seem to be connected to Kakeru, and with the burden of the knowledge that the boy wouldn't be with her and her friends in the future, will Naho be able to make the perfect choices that will alter what seems to be fate?"," Drama, Romance, School, Sci-Fi, Shoujo", 2016, Completed, オレンジ
Orange (Dub), Fall 2014 Anime," One day, Naho Takamiya receives a letter written to herself from ten years in the future. As Naho reads on, the letter recites the exact events of the day, including the transfer of a new student into her class named Kakeru Naruse.The Naho from ten years later repeatedly states that she has many regrets, and she wants to fix these by making sure the Naho from the past can make the right decisions—especially regarding Kakeru. What's more shocking is that she discovers that ten years later, Kakeru will no longer be with them. Future Naho asks her to watch over him closely."," Drama, Romance, School, Sci-Fi, Shoujo", 2016, Completed, オレンジ
Orange, Movie," The film will be narrated from the viewpoint of Suwa, as he continues to support Kakeru and Naho's relationship. It will also feature an original story written by the series' original creator Ichigo Takano, which takes place after the events in the manga and TV anime. The tagline in the key visual reads, ""Since that day, I've always wanted to show those two this future—.""v"," Drama, Romance, School, Sci-Fi, Shoujo", 2016, Completed,
Orbital Era, Movie," Orbital Era is set in the near-future on a space colony under construction. The film features a coming-of-age action-adventure story following the lives of young boys surviving in this peculiar environment and society as they are tossed around by fate. ""The reality found in mankind's future"" will be depicted through their perspective.The story will take place over four seasons in the space colony. The characters relationships will unfold over these seasons. Otomo noted that the film is set in the future, but instead of being rooted in science fiction, the story will skew more toward fantasy."," Adventure, Sci-Fi", 0, Upcoming,
Ore dake Haireru Kakushi Dungeon, Winter 2021 Anime," Noir is the son of a minor noble with very little to his name other than a job offer—which is canceled before he can even start his first day. He does possess one rare trait, though"," Action, Adventure, Ecchi, Fantasy, Harem", 2021, Completed," The Hidden Dungeon Only I Can Enter, Special training in the Secret Dungeon, 俺だけ入れる隠しダンジョン"
Ore dake Haireru Kakushi Dungeon (Dub), Winter 2021 Anime," Noir is the son of a minor noble with very little to his name other than a job offer—which is canceled before he can even start his first day. He does possess one rare trait, though"," Action, Adventure, Ecchi, Fantasy, Harem", 2021, Completed," The Hidden Dungeon Only I Can Enter, Special training in the Secret Dungeon, 俺だけ入れる隠しダンジョン"
Ore dake Level Up na Ken, TV Series," Ten years ago, ""the Gate"" appeared and connected the real world with the realm of magic and monsters. To combat these vile beasts, ordinary people received superhuman powers and became known as ""Hunters."" Twenty-year-old Sung Jin-Woo is one such Hunter, but he is known as the ""World's Weakest,"" owing to his pathetic power compared to even a measly E-Rank. Still, he hunts monsters tirelessly in low-rank Gates to pay for his mother's medical bills.However, this miserable lifestyle changes when Jin-Woo—believing himself to be the only one left to die in a mission gone terribly wrong—awakens in a hospital three days later to find a mysterious screen floating in front of him. This ""Quest Log"" demands that Jin-Woo completes an unrealistic and intense training program, or face an appropriate penalty. Initially reluctant to comply because of the quest's rigor, Jin-Woo soon finds that it may just transform him into one of the world's most fearsome Hunters."," Action, Adventure, Fantasy", 2023, Upcoming," Solo Leveling; Na Honjaman Level Up, I Level Up Alone, 나 혼자만 레벨업 ; 俺だけレベルアップな件"
"Ore ga Ojousama Gakkou ni ""Shomin Sample"" Toshite Gets♥Sareta Ken", Fall 2015 Anime," In a hidden school surrounded by mountains, young ladies of good families are taught everything a high class lady needs to know. They are also completely cut off from the outside world, keeping them sheltered and innocent; however, a problem has come up recently—more and more graduates are failing to cope with the modern world after graduation. To deal with this problem, they've decided to kidnap a male commoner student, and enroll him as a student. They hope that this will be a gentle way to introduce the girls to the outside world.Kagurazaka Kimito is chosen for this dubious honor, mostly because he seems utterly average; however, the school leaders also seem to have concluded he's a homosexual with a muscle fetish. When Kimito hears that the alternative may be castration (to protect the girls' purity), he eagerly plays along with this misconception. Now he'll just have to survive the attention of many high class young ladies that are completely out of touch with the world!"," Comedy, Ecchi, Harem, Romance, School", 2015, Completed," Shomin Sample, 俺がお嬢様学校に『庶民サンプル』としてゲッツされた件"
Ore ga Suki nano wa Imouto dakedo Imouto ja Nai, Fall 2018 Anime," Suzuka Nagami is a beautiful third-year middle school student who has excellent grades and is the student council president. She wrote a novel about a little sister who dotes on her older brother, and the the novel wins a light novel award. After they discuss the matter, Yuu is the one who debuts as a proxy light novel author instead of Suzuka, under the pen name Chikai Towano."," Comedy, Romance", 2018, Completed, 俺が好きなのは妹だけど妹じゃない
Ore Monogatari!!, Spring 2015 Anime, Gouda Takeo is a freshman in high school. (Both estimates) Weight," Comedy, Romance, Shoujo", 2015, Completed," My Love Story!!, 俺物語!!"
Ore Monogatari!! (Dub), TV Series," With his muscular build and tall stature, Takeo Gouda is not exactly your average high school freshman. However, behind his intimidating appearance hides a heart of gold, and he is considered a hero by the boys for his courage and chivalry. Unfortunately, these traits do not help much with his love life. As if his looks are not enough to scare the opposite sex away, Takeo's cool and handsome best friend and constant companion Makoto Sunakawa easily steals the hearts of the female students—including every girl Takeo has ever liked.When Takeo gallantly saves cute and angelic Rinko Yamato from being molested, he falls in love with her instantly, but suspects that she might be interested in Sunakawa. With his own love for Yamato continuing to bloom, Takeo unselfishly decides to act as her cupid, even as he yearns for his own love story."," Comedy, Romance, Shoujo", 2015, Completed," My Love Story!!, 俺物語!!"
Ore no Imouto ga Konnani Kawaii Wake ga Nai Specials, ONA," The true end arc of Ore no Imouto. These four episodes branch out after the 11th episode of the main TV series and present an alternative version to the end of the TV series. These episodes contrast with the good end arc of the TV series, which was an original ending written for the anime, and instead closely follows the original story from the light novels."," Comedy, Slice of Life", 2011, Completed," OreImo Specials, 俺の妹がこんなに可愛いわけがない"
Ore no Imouto ga Konnani Kawaii Wake ga Nai., Special," Short specials featuring chibi versions of OreImo characters, included on the first limited editions of the OreImo Season 2 BD/DVD volumes.", Comedy, 2013, Completed," Ore no Imouto ga Konnani Kawaii Wake ga Nai. Short Anime Specials, OreImo Season 2 Short Anime Specials, 俺の妹がこんなに可愛いわけがない。SDキャラによるショートムービー"
"Ore no Nounai Sentakushi ga, Gakuen Love Comedy wo Zenryoku de Jama Shiteiru OVA", TV Series, Unaired TV episode bundled with the light novel's volume eight.," Comedy, Romance, School", 2014, Completed," NouCome OVA, 俺の脳内選択肢が、学園ラブコメを全力で邪魔している OAD"
Ore wa Teppei, TV Series," Teppei, brought up by his father in the mountains, is an energetic boy who is as tough as weeds and acts as free as a bird. His life changes completely when he enrolls in high school, the first school he has ever attended. Despite his eccentric behavior and being a constant source of troubles, he is soon recognized for his talent in sports—especially in Kendo (the Japanese swordplay art)—and becomes the school's hero."," Action, Shounen, Sports", 1977, Completed," My Name Is Teppei, おれは鉄兵"
Ore wo Suki nano wa Omae dake ka yo, Fall 2019 Anime," Kisaragi Amatsuyu is invited out alone by the cool beauty upperclassman Cosmos and his childhood friend Himawari. Expecting to hear their confessions, he triumphantly goes to meet each of them in turn. But Cosmos and Himawari both instead confess to Amatsuyu that they like his friend. Amatsuyu fights this lonely battle, but there is another girl who is looking at him. She is a gloomy girl with glasses and braids. Amatsuyu finds that he hates her, because she's always turning her sharp tongue only on him and finding enjoyment in his troubles. But it turns out that she's the only one who actually does like him."," Comedy, Romance, School", 2019, Completed," Oresuki, 俺を好きなのはお前だけかよ"
Ore wo Suki nano wa Omae dake ka yo, OVA," The original video anime episode will serve as the final chapter to the television series, focusing on the rivalry between the ""background character"" Amatsuyu Kisaragi (Jouro) and Yasuo Hazuki (Hose), ""the protagonist."""," Comedy, Romance, School", 2020, Completed," 俺を好きなのはお前だけかよ ～俺たちのゲームセット～ , Ore wo Suki nano wa Omae dake ka yo Kanketsu-hen"
Ore-sama Kingdom, TV Series," The story centers on Nonoha Nonohara, a young manga artist who just enrolled in a new school. She finds herself surrounded by a group of three “super-cute” guys."," Romance, Shoujo", 2010, Completed, オレ様キングダム
Ore-tachi ni Tsubasa wa Nai, TV Series," It’s winter in the big city of Yanagihara, and young people will meet and fall in love. Takashi is a boy who plans to escape to another world, but is held back by thoughts of his younger sister Kobato and girlfriend Asuka. Shusuke is a poor part-timer who has to work with student-author Hiyoko in spite of their initial dislike for each other. The antisocial Hayato makes his living as a handyman until he is visited by a girl name Naru."," Comedy, Drama, Ecchi, Harem, Psychological, Romance", 2011, Completed, Oretachi ni Tsubasa wa Nai
"Ore, Tsushima", Summer 2021 Anime," The manga is centered around an older woman who is often mistaken as a man and called ""Ojii-chan'' by her cats and Tsushima, a strange cat who appears in her garden one day."," Comedy, Seinen, Slice of Life", 2021, Ongoing," I, Tsushima, 俺、つしま"
"Ore, Tsushima (ONA)", ONA,, Comedy, 2021, Completed," I, Tsushima, 俺、つしま"
"Ore, Twintail ni Narimasu. (Dub)", TV Series, Twintails," Action, Comedy, Fantasy, Romance, School, Shounen", 2014, Completed," Gonna be the Twin-Tail!!,Ore, Twin tails ni Narimasu.,俺、ツインテールになります。"
"Ore, Twintails ni Narimasu.", Fall 2014 Anime," Mitsuka Souji is a first year high school student who greatly loves the ""twintails"" hairstyle. One day a beautiful girl, Thuearle, who comes from another world suddenly appeared in front of him and gave him the power to transform into the twintails warrior TailRed. Now Souji, with the help of his childhood friend Tsube Aika who can becomes the twintails warrior TailBlue, must fight in order to protect the peace on earth."," Action, Comedy, Fantasy, Romance, School, Shounen", 2014, Completed," Gonna be the Twin-Tail!!, 俺、ツインテールになります"
Oreca Battle, Spring 2014 Anime," The anime adaptation revolves around a young boy named Faiya Orega who loves Oreca competitions. One day, he is granted the power to summon real Oreca monsters due to the mysterious powers of the treasure chest Pandora. To protect the peace of the Oreca world, Faiya must fight the demon king who threatens the land.", Game, 2014, Completed, オレカバトル
Oreimo, TV Series," For several years, Kyousuke’s relationship with his younger sister Kirino has been cold, to the point that they only share greetings. But one day, Kyousuke finds a moe anime DVD fallen in their entry hall. His interest piqued, he looks for the owner, only to realize it belongs to Kirino. He’s shocked, but more surprises lie just ahead…"," Comedy, Seinen, Slice of Life", 2010, Completed," Ore no Imouto ga Konnani Kawaii Wake ga Nai, 俺の妹がこんなに可愛いわけがない"
OreImo 2, TV Series," Kyousuke Kousaka, a normal seventeen-year-old high school student, hasn’t gotten along with his younger sister, Kirino, in years. For longer than he can remember, Kirino has ignored his comings and goings and looked at him with spurning eyes. It seemed as if the relationship between Kyousuke and his sister, now fourteen, would continue this way for…", Comedy, 2010, Completed," Ore no Imouto ga Konnani Kawaii Wake ga Nai., 俺の妹がこんなに可愛いわけがない。"
Orenchi no Furo Jijou, TV Series," Tatsumi is a high school boy who lives by himself. However, a devastatingly handsome merman named Wakasa moves into the bathtub in Tatsumi's home. Wakasa is a bit self-centered but cute, while Tatsumi is cool but a busybody."," Comedy, Fantasy, Shoujo", 2014, Completed, オレん家のフロ事情
OreShura, TV Series," Eita enters high school aiming for the National University School of Medicine. Because of his parents’ divorce—and his goal—he shuns anything to do with romance or love. One day, Masuzu, the school beauty with the silver hair who has just returned to the country, enters his life in a most unexpected way. Chiwa, his childhood friend since elementary school, will not let this go without a fight."," Comedy, Harem, Romance, School", 2013, Completed," Ore no Kanojo to Osananajimi ga Shuraba Sugiru, 俺の彼女と幼なじみが修羅場すぎる"
Oretachi ni Tsubasa wa Nai, OVA," An OVA bundled with the non-adult version of the OreTsuba PC game. The OVA has more fan service than the TV series (what they call, ""nakedness plus 90%"")."," Drama, Ecchi, Fantasy, Harem, Romance", 2011, Completed," Ore-tachi ni Tsubasa wa Nai OVA, 俺たちに翼はない 肌色率九割増!?"
Oretachi ni Tsubasa wa Nai, OVA," An OVA bundled with the non-adult version of the OreTsuba PC game. The OVA has more fan service than the TV series (what they call, ""nakedness plus 90%"")."," Drama, Ecchi, Fantasy, Harem, Romance", 2011, Completed," Ore-tachi ni Tsubasa wa Nai OVA, 俺たちに翼はない 肌色率九割増!?"
Oretachi ni Tsubasa wa Nai, TV Series," Haneda Takashi has a secret he cannot speak of. To leave his dull school-life, he was supposed to have escaped to another world. However, he is reeled in by certain ties on his heart. One of these is Kobato, his awkward younger sister. The other is Watarai Asuka, his negligent girlfriend.Chitose Shuusuke is a poor freeloader. He passes his days working at various part-time jobs. One day, he has a disastrous first encounter with Tamaizumi Hiyoko. The next time they meet, Shuusuke discovers that they are fellow employees at his part-time job.Narita Hayato sees himself as a ""hard-boiled"" person. Back-breaking jobs are nothing to him. Hayato shuns normal human contact, but, during the nights, he would get together with delinquents and other denizens of the night. One such night, he meets the cheerful and oblivious Otori Naru.The relationships with these girls will greatly affect these 3 young men. But what, exactly, is the relationship these young men have with each other?"," Comedy, Drama, Ecchi, Romance", 2011, Completed, 俺たちに翼はない -under the innocent sky.
Orient, Winter 2022 Anime," Five years ago, Musashi made a promise with his friend Kojirou Kanemaki that once they grew up, they would become samurai, form a league, and go on demon-slaying quests. But since then, things have changed. With demons now being praised and worshipped by society, the samurai are shunned and disgraced.Afraid of revealing his dream of becoming a samurai, Musashi blends into the town's dogma by becoming a miner while secretly polishing his swordsmanship. Meanwhile, despite being a direct descendant of a samurai, Kojirou gives up on his promise to his old friend. However, after saving Musashi from a near-death experience, his perspective shifts. Although still conflicted, Kojirou embarks on a journey with Musashi in the hopes of figuring out his true feelings.Fighting against all odds, the duo dives headfirst into the unknown world of beast-slaying, not knowing what life has in store for them. Now astride iron horses, the fifteen-year-old heroes plan to restore the tarnished reputation of the samurai and purge the world of demons."," Action, Fantasy", 2022, Completed, オリエント
Orient (Dub), TV Series," Freed from the rule of samurai 150 years ago, the people of Hinomoto live peaceful lives and revere their liberators—demons whose true forms remain elusive—as gods. Fated to mine rocks for the demons to feast on, Musashi knows the grim truth"," Action, Adventure, Demons, Fantasy, Historical, Samurai, Shounen", 2022, Completed, オリエント
Orient, Summer 2022 Anime," Second cour of Orient, adapting the Awajishima Gekitou-hen (The Battle of Awaji Island arc)."," Action, Fantasy", 2022, Completed, Orient Part 2; オリエント 淡路島激闘編
