name,Type,Plot Summary,Genre,Released,Status,Other name
Tales of Crestoria, Special," Short animated TV special depicting the prologue of the main story of TALES OF CRESTORIA, showing Kanata and Misella setting off on their journey."," Adventure, Fantasy, Magic", 2020, Completed, Tales of Crestoria
Tales of Eternia, TV Series," In order to prevent the catastrophe called the Grand Fall, Rid Hershel and his companions Farah, Keel and Meredy have obtained the three Greater Spirits (“Craymels” in the game version) of Inferia. En route to Mount Farlos, Rid is kidnapped by the bounty hunter Marone Blucarno, and the party is compelled to head to Belcarnu, an archipelago far from the major cities of Inferia. A series of adventures forces them to remain on the islands, where a more immediate threat to Inferia sleeps."," Adventure, Comedy, Fantasy, Romance, Shounen", 2001, Completed, テイルズ オブ エターニア THE ANIMATION
Tales of Gekijou, Special, Tales of Gekijou is the pre-order bonus for Tales of the Heroes, Comedy, 2012, Completed, Tales of the Heroes
Tales of HR, ONA, No synopsis information has been added to this title. Help improve our database by adding," Comedy, Parody, School", 2018, Completed," Tales of Homeroom, ているず おぶ HR"
Tales of Luminaria, ONA," Long ago, this land was home to beasts the size of mountains that have now become petrified. Mana overflowed from their remains, drawing people who sought its power, and civilizations sprang up. People came to revere these mana-producing creatures, which they named 'Primordial Beasts'. They built their lives around them. Thus began the worship of the Primordial Beasts.Time flowed ever onward, to the present day... War erupts between the Jerle Federation, an alliance of countries who worship the Primordial Beasts, and the Gildllan Empire, which has enjoyed explosive development thanks to advanced technology. The fires of war burn ever brighter.The special animated feature will tell an important juncture in the story of Luminaria, congealing and bringing to life the game's theme of ""confronting antagonistic ideas of justice""!", Fantasy, 2022, Completed, TALES OF LUMINARIA The Fateful Crossroad
Tales of Luminaria, ONA," Long ago, this land was home to beasts the size of mountains that have now become petrified. Mana overflowed from their remains, drawing people who sought its power, and civilizations sprang up. People came to revere these mana-producing creatures, which they named 'Primordial Beasts'. They built their lives around them. Thus began the worship of the Primordial Beasts.Time flowed ever onward, to the present day... War erupts between the Jerle Federation, an alliance of countries who worship the Primordial Beasts, and the Gildllan Empire, which has enjoyed explosive development thanks to advanced technology. The fires of war burn ever brighter.The special animated feature will tell an important juncture in the story of Luminaria, congealing and bringing to life the game's theme of ""confronting antagonistic ideas of justice""!", Fantasy, 2022, Completed,
Tales of Phantasia , TV Series," Cless Alvein, a young swordsman from the town of Totus, along with his friend Mint Adnade, a healer with the talent of Mana, are sent back in time to defeat Dhaos, a sorcerer imprisoned by their parents decades ago. Along with the help of the archer Chester Barklight, the summoner Klarth F. Lester and the half-elf Arche Klaine, they seek to right the wrongs of Dhaos and return peace to the land. Based on the 1995 Super Famicom Game by NAMCO, “Tales of Phantasia.”"," Adventure, Fantasy, Shounen", 2004, Completed, テイルズ オブ ファンタジア THE ANIMATION
Tales of Phantasia The Animation (Dub), TV Series," Tragedy strikes the lives of Cless Alvein, a young swordsman, and Chester Barklight, a young archer, as they return to their village of Totus to find it razed to the ground by the mysterious Black Knight. To take over the world, the Black Knight seeks to claim the power of the Demon King, Dhaos—sealed away by the ancestors of Cless and a young cleric named Mint Adnade. Dhaos's reawakening signals not only the end of the Black Knight, but potentially the world. Cless and Mint must now journey a century into the past to rally allies capable of vanquishing the Demon King for once and for all.Tales of Phantasia The Animation follows Cless and Mint's journey through time to long ago, where they forge an alliance with the half-elf sorceress Arche Klaine and the summoner Klarth F. Lester. Together, they strive to defeat Dhaos and his army in saving the past as well as the years to come."," Adventure, Fantasy, Shounen", 2004, Completed, テイルズ オブ ファンタジア THE ANIMATION
Tales of Puppet, ONA," A puppet parody of the Tales of franchise, filled with gags and help explain the popular RPG to newcomers."," Comedy, Fantasy, Parody", 2018, Completed, TALES OF パペット
Tales of Symphonia, OVA," Based on the same-name Game Cube and Play Station game, “Tales of Symphonia”. Two worlds exist, both unaware of the existance of the other. In order for one world to flourish, the other will have to perish. On the perishing world, a Choosen one is send on a journey to restore that world’s mana by awakening the Spirits and becoming an angel. Colette Brunel, the Choosen of Sylvarant, sets out on her journey accompanied by her best friends Lloyd Irving and Genis Sage. As they travel further they meet more friends and even more enemies, while they learn more and more about the truth behind the World Regeneration."," Action, Adventure, Fantasy, Magic, Martial Arts, Shounen", 2010, Completed, Tales of Symphonia The Animation
Tales of Symphonia, Special," Based on the same-name Game Cube and Play Station game, “Tales of Symphonia”. Two worlds exist, both unaware of the existance of the other. In order for one world to flourish, the other will have to perish. On the perishing world, a Choosen one is send on a journey to restore that world’s mana by awakening the Spirits and becoming an angel. Colette Brunel, the Choosen of Sylvarant, sets out on her journey accompanied by her best friends Lloyd Irving and Genis Sage. As they travel further they meet more friends and even more enemies, while they learn more and more about the truth behind the World Regeneration."," Action, Adventure, Fantasy, Magic, Martial Arts, Shounen", 2011, Completed, テイルズ オブ シンフォニア THE ANIMATION 世界統合編
Tales of Symphonia, OVA," Two worlds exist, both unaware of the existance of the other. In order for one world to flourish, the other will have to perish. On the perishing world, a Choosen one is send on a journey to restore that world’s mana by awakening the Spirits and becoming an angel. Colette Brunel, the Choosen of Sylvarant, sets out on her journey accompanied by her best friends Lloyd Irving and Genis Sage. As they travel further they meet more friends and even more enemies, while they learn more and more about the truth behind the World Regeneration."," Action, Adventure, Fantasy, Magic, Martial Arts, Shounen", 2010, Completed, Tales of Symphonia The Animation
Tales of Symphonia, OVA, The third and final OVA series concluding the story of Tales of Symphonia," Action, Adventure, Fantasy, Magic, Martial Arts, Shounen", 2011, Completed, Tales of Symphonia The Animation
Tales of the Abyss , TV Series," Luke fon Fabre, the spoiled son of a noble from the kingdom of Kimlasca-Lavaldear, has been confined inside his father’s mansion ever since he was kidnapped seven years ago by a rival country, the Malkuth Empire. Now Luke’s memory of the life he led before is missing, and a strange voice, which only he can hear, has been calling out to him ever since.One day while training with his mentor, Van Grants, a strange woman called Tear breaks into the mansion with the sole intent of taking Van’s life. During the struggle Luke is transported far from home, along with Tear, and now that Luke has finally gained the freedom he’s been dreaming of, what awaits him in the outside world will shatter everything he’s ever known about himself."," Adventure, Drama, Fantasy", 2008, Completed, テイルズ オブ ジ アビス
Tales of Vesperia, Movie," A long time has passed since the end of a massive war between humans and monsters. A new type of energy named aer was discovered. When crystallized, this substance became the energy source for blastia, an ancient civilization's technology that provided a wide array of essential abilities for humanity. Despite it's manipulation, mankind still has little knowledge of what exactly is aer. On a mission to eradicate a horde of monsters near the town of Shizotania, a group of knights comes across a strange surge of aer.Yuri Lowell and Flynn Scifo are two new members fresh out of the academy of this knight division. Both are childhood friends who went separate ways, but ended up meeting each other once again while enlisting to serve the Empire."," Action, Adventure, Fantasy, Magic, Military", 2009, Completed, テイルズ オブ ヴェスペリア
Tales of Vesperia, Movie," Ten years after the Great War against the demon-beasts, the empire rules over the world and prosperity relies on the massive use of aer.Yuri Lowell and Flynn Scifo are two young men who have just enrolled the ranks of the prestigious Imperial Knights. One day, they are sent to the town of Ceazontania, where abnormal aer activity has reportedly caused the proliferation of horribly mutated beasts, with serious threat for the whole region.Meanwhile, the Knights Supreme Commander Alexei Denoia and the naive Princess Estellise are involved in a behind-the-curtains struggle for power in the capital. The situation in Ceazontania deteriorates as the garrison of Imperial Knights finds that they cannot expect any immediate support from the capital.Then, Niren Fedrok, commander of the Imperial Knights in Ceazontania, takes an unexpected decision that is going to change Yuri and Flynn's destiny forever.What are the secrets behind the extraordinary events that are happening around Yuri and Flynn? Will they be able to defend the innocent people of Ceazontania and stay true to their beliefs?"," Action, Adventure, Fantasy, Magic, Military", 2009, Completed," Tales of Vesperia ~The First Strike~, テイルズ オブ ヴェスペリア"
Tales of Zestiria the X, Summer 2016 Anime," Sorey is a human youth who grew up among the seraphim, spiritual beings not visible to humans. Sorey believes in the folklore that says ""long ago, every human was able to see the seraphim"" and dreams of unraveling the ancient mystery to make the world a place where people and seraphim can live together in peace.One day, Sorey visits the human capital for the very first time. He becomes embroiled in an incident during which he pulls out a holy sword embedded in a rock and ends up becoming a Shepherd, one who casts away calamity from the world. He begins to realize the gravity of his mission, and his dream of coexistence between mankind and the seraphim becomes more intense—And thus, the Shepherd embarks on an amazing journey with his companions."," Adventure, Fantasy", 2016, Completed, テイルズ オブ ゼスティリア ザ クロス
Tales of Zestiria the X (2017), Winter 2017 Anime, The second season of Tales of Zestiria the X.," Action, Adventure, Fantasy", 2017, Completed," Tales of Zestiria The Cross (2017), テイルズ オブ ゼスティリア ザ クロス (2017)"
Tales of Zestiria the X (Dub), Summer 2016 Anime," Sorey is a human youth who grew up among the seraphim, spiritual beings not visible to humans. Sorey believes in the folklore that says ""long ago, every human was able to see the seraphim"" and dreams of unraveling the ancient mystery to make the world a place where people and seraphim can live together in peace.One day, Sorey visits the human capital for the very first time. He becomes embroiled in an incident during which he pulls out a holy sword embedded in a rock and ends up becoming a Shepherd, one who casts away calamity from the world. He begins to realize the gravity of his mission, and his dream of coexistence between mankind and the seraphim becomes more intense—And thus, the Shepherd embarks on an amazing journey with his companions."," Adventure, Fantasy", 2016, Completed, テイルズ オブ ゼスティリア ザ クロス
Tales of Zestiria the X 2nd Season (Dub), Winter 2017 Anime, The second season of Tales of Zestiria the X.," Action, Adventure, Fantasy", 2017, Completed, Tales of Zestiria The Cross Second Season
Tales of Zestiria, Special, TV anime special of Bandai Namco Games' Tales of Zestiria role-playing game., Fantasy, 2014, Completed, Tales of Zestiria
Tales of Zestiria, Special, TV anime special of Bandai Namco Games' Tales of Zestiria role-playing game., Fantasy, 2014, Completed, Tales of Zestiria
Tamako Love Story, Movie, Everybody loves somebody.," Comedy, Romance, Slice of Life", 2014, Completed, たまこラブストーリー
Tamako Love Story (Dub), Movie," As she edges toward the end of her high school life, the energetic but generally clueless third-year Tamako Kitashirakawa has only one major concern"," Comedy, Romance, Slice of Life", 2014, Completed," Tamako Market Movie, たまこラブストーリー"
Tamako Market , TV Series," Tamako knows just about everything there is to know about mochi, the traditional Japanese dessert treats. When she’s not attending her first year of high school, she even invents new flavors and varieties for Tama-ya, her family’s mochi shop. School and growing up, on the other hand, are some things that she’s still trying to find the right recipe for. But with the help of her best friends Kanna and Midori, two girls whose parents run businesses in the same shopping district, Tamako’s determined to make the best of things.It’s complicated though, especially when it comes to emotions and her relationship with her best boy friend Mochizo, whose family runs a rival mochi shop. And lately, Kanna’s been feeling a little odd about her feelings towards Tamako as well. And what’s with up with that strange bird fluttering around, the one that speaks fluent Japanese? It’s all very mysterious and overwhelming, but at least Tamako always has one thing she can count on"," Comedy, Slice of Life", 2013, Completed, たまこまーけっと
Tamako Market (Dub), TV Series," Inside the Usagiyama Shopping District lies an eccentric but close-knit community of business owners. Tamako Kitashirakawa, a clumsy though adorable teenage girl, belongs to a family of mochi bakers who own a quaint shop called Tama-ya. One day, Tamako stumbles upon a talking bird that presents himself as royalty from a distant land. Dera Mochimazzi, as he calls himself, states that he’s seeking a bride for his country’s prince. Intent on his mission, Dera follows Tamako home and develops an addiction to mochi, becoming painfully overweight and subsequently unable to fly back to his homeland; thus, he takes up residence with Tamako's family and becomes the community’s beloved mascot.Meanwhile, Tamako's friend, Mochizou Ooji, continues to hide his true feelings for her. Their fathers are fierce mochi rivals, but will it be enough to drive a wedge between Tamako and Mochizou? And just what will happen to Dera's task of finding his prince’s destined bride?"," Comedy, Slice of Life", 2013, Completed, たまこまーけっと
Tamako Market, Special," Tamako knows just about everything there is to know about mochi, the traditional Japanese dessert treats. When she’s not attending her first year of high school, she even invents new flavors and varieties for Tama-ya, her family’s mochi shop. School and growing up, on the other hand, are some things that she’s still trying to find the right recipe for. But with the help of her best friends Kanna and Midori, two girls whose parents run businesses in the same shopping district, Tamako’s determined to make the best of things.It’s complicated though, especially when it comes to emotions and her relationship with her best boy friend Mochizo, whose family runs a rival mochi shop. And lately, Kanna’s been feeling a little odd about her feelings towards Tamako as well. And what’s with up with that strange bird fluttering around, the one that speaks fluent Japanese? It’s all very mysterious and overwhelming, but at least Tamako always has one thing she can count on", Comedy, 2013, Completed," Tamako Market Specials, たまこまーけっと ぺったんこアニメ"
Tamako Market, Special," Tamako knows just about everything there is to know about mochi, the traditional Japanese dessert treats. When she’s not attending her first year of high school, she even invents new flavors and varieties for Tama-ya, her family’s mochi shop. School and growing up, on the other hand, are some things that she’s still trying to find the right recipe for. But with the help of her best friends Kanna and Midori, two girls whose parents run businesses in the same shopping district, Tamako’s determined to make the best of things.It’s complicated though, especially when it comes to emotions and her relationship with her best boy friend Mochizo, whose family runs a rival mochi shop. And lately, Kanna’s been feeling a little odd about her feelings towards Tamako as well. And what’s with up with that strange bird fluttering around, the one that speaks fluent Japanese? It’s all very mysterious and overwhelming, but at least Tamako always has one thing she can count on", Comedy, 2013, Completed," Tamako Market Specials, たまこまーけっと ぺったんこアニメ"
Tamala 2010, Movie," It's the year 2010 on the planet of cats, where lies Meguro City, a megalopolis entirely controlled by the super-corporation Catty & Co. The nefarious influence of this corporate empire extends malignantly across the feline galaxy. Tamala, a carefree, one-year-old kitten, decides to flee this cruel reality and boards her spaceship in search of her planet of origin."," Comedy, Dementia, Psychological, Sci-Fi", 2002, Completed, タマラ 2010 ア パンク キャット イン スペース
Tamayomi, Spring 2020 Anime," In her Junior High years, the pitcher Yomi Takeda was not able to get very far in a cross-school baseball tournament. Since the catcher on her team wasn't at her level, she couldn't use her signature move, the ""Magic Throw,"" and eventually regretted not being able to use it. After Junior High, she decided to stop playing baseball and went to Shin Koshigaya High School, a school without a baseball club.There, she found her long lost childhood friend, Tamaki Yamazaki, who used to play catchball with her when they were kids. Tamaki also played baseball during her Junior High years as a catcher, and could even catch Yomi's ""Magic Throw!""Their promise with each other during their childhood could now be fulfilled! Walking together on the road of baseball once again...The story of the girls who love baseball will begin!"," School, Sports", 2020, Completed," 球詠, TAMAYOMI"
Tamayomi (Dub), Spring 2020 Anime," Yomi Takeda and Tamaki Yamazaki have loved baseball since they were kids. They used to play catch together whenever possible, and in doing so, Yomi discovered her talent for throwing the ball in a way that seemed like magic. The girls promised to keep playing baseball even when they are older and were separated soon after. In the years that followed, Tamaki went on to become a skilled catcher, but Yomi did not get very far despite her throwing prowess.Deciding to quit her passion, Yomi starts her first year at Shin Koshigaya High School. Try as she might to avoid anything related to baseball, she meets the twins Yoshino and Ibuki Kawaguchi, both of whom are enthusiasts of the sport. Moreover, she stumbles upon Tamaki, and just like old times, they decide to play catch—reigniting Yomi’s desire to pitch.Reunited, Yomi and Tamaki set out to fulfill their childhood promise. Alongside Yoshino and Ibuki, they strive to revive their school’s baseball team which has been on hiatus. More members join until their group is complete, and now the new goal of Shin Koshigaya's girls' baseball team is nothing less than winning the national championships."," School, Sports", 2020, Completed, TAMAYOMI
Tamayura, OVA," A ""healing story"" OVA from director Satou Junichi, the director of Aria and Umi Monogatari. The story takes place in Seto Inland Sea and is about a girl who likes taking pictures."," Comedy, Drama, Slice of Life", 2010, Completed, たまゆら
Tamayura Sotsugyou Shashin Part 1 - Kizashi, Movie, The first movie of a four-part finale of Tamayura.," Comedy, School, Slice of Life", 2015, Completed, たまゆら～卒業写真～ 第1部 芽-きざし-
Tamayura, TV Series," As a little girl, Fuu Sawatari’s father taught her to love photography. They took pictures everywhere they went. But after he passed away, seeing those photographs only served as a reminder of her loss, so she locked them away to be forgotten. Years later, her brother Kou finds their father’s picture album, and as he flips through its pages, the pictures remind Fuu of all the happy memories of her father that she will carry with her forever.Now, as the shy Fuu enters her first year of high school, she once again takes up her father’s old camera, determined to take wonderful pictures that will bring joy and happiness to others."," Comedy, Drama, Slice of Life", 2011, Completed, たまゆら～hitotose～
Tamayura, Special, Extra episode in the 7th Blu-ray and DVD volumes.," Comedy, Drama, Slice of Life", 2012, Completed, たまゆら～hitotose～ 第5.5話「あったかい風の想い出、なので」
Tamayura, TV Series, The second season of Tamayura," Comedy, Slice of Life", 2013, Completed, たまゆら ～もあぐれっしぶ～
Tamayura, Special, OVA (episode 8.5) of Tamayura," Comedy, Slice of Life", 2014, Completed, Tamayura
Tamayura, Movie, The second movie of a four-part finale of Tamayura.," Comedy, Slice of Life", 2015, Completed, たまゆら～卒業写真～ 第2部 響-ひびき-
Tamayura, Movie, The third movie of a four-part finale of Tamayura.," Comedy, Drama, Slice of Life", 2015, Completed, たまゆら～卒業写真～ 第3部 憧-あこがれ-
Tamayura, Movie, The final movie of a four-part finale of Tamayura.," Comedy, Drama, Slice of Life", 2016, Completed, たまゆら～卒業写真～ 第4部 朝-あした-
Taming The Possessive Girl, ONA,," Comedy, Drama, Romance", 2019, Completed,
Tanaka-kun wa Itsumo Kedaruge, Spring 2016 Anime," Sighing, leaning on his elbows, sleepy eyes. Tanaka-kun is a boy that basically doesn't try but isn't disliked. This is a laid-back youth comedy about Tanaka-kun and the quiet Oota who can't leave him alone."," Comedy, School, Slice of Life", 2016, Completed," Tanaka-kun is Always Listless, 田中くんはいつもけだるげ"
Tanaka-kun wa Itsumo Kedaruge (Dub), TV Series," For high school student Tanaka, the act of being listless is a way of life. Known for his inattentiveness and ability to fall asleep anywhere, Tanaka prays that each day will be as uneventful as the last, seeking to preserve his lazy lifestyle however he can by avoiding situations that require him to exert himself. Along with his dependable friend Oota who helps him with tasks he is unable to accomplish, the lethargic teenager constantly deals with events that prevent him from experiencing the quiet and peaceful days he longs for."," Comedy, School, Slice of Life", 2016, Completed," Tanaka-kun is Always Listless, 田中くんはいつもけだるげ"
Tanaka-kun wa Kyou mo Kedaruge, TV Series, A series of shorts featuring super-deformed characters from the the show Tanaka-kun wa Itsumo Kedaruge.," Comedy, School", 2016, Completed," Tanaka is Listless Today Too, 田中くんは今日もけだるげ"
Tanjou, OVA, Aki Itou is a normal highschool girl doing normal things," Romance, Slice of Life, Supernatural", 1994, Completed, Birth
Tanken Driland , TV Series," Due to the influence of someone who visited her town when she was a child, Princess Mikoto of Elua decides to become a hunter and search for treasure all over the land of Driland. She sets out on her journey with her personal assistant Wallens, but they are soon joined by Pollon, a hunter who dreams of being a hero, and Paan, a wandering knight. As they continue their exploration they begin to sense great danger drawing near."," Adventure, Fantasy", 2012, Completed, 探検ドリランド
Tanken Driland, TV Series," Due to the influence of someone who visited her town when she was a child, Princess Mikoto of Elua decides to become a hunter and search for treasure all over the land of Driland. She sets out on her journey with her personal assistant Wallens, but they are soon joined by Pollon, a hunter who dreams of being a hero, and Paan, a wandering knight. As they continue their exploration they begin to sense great danger drawing near."," Adventure, Fantasy", 2013, Completed, 探検ドリランド-1000年の真宝（まほう）-
