name,Type,Plot Summary,Genre,Released,Status,Other name
ACCA, Winter 2017 Anime," The kingdom of Dowa, which is subdivided into 13 states, is celebrating its monarch's 99th birthday. These 13 states have many agencies that are controlled by the giant organization known as ACCA. Within ACCA, Jean Otis is the second-in-command of the inspection agency. His agency has ten people placed in each of the 13 states, with a central office in the capital city. They keep track of all the activities of ACCA across the kingdom, and keep data on each state's ACCA office flowing toward the central office. Jean also often has business trips from the capital to the other districts to check on the situation and personnel there."," Drama, Police", 2017, Completed, ACCA 13区監察課
ACCA, OVA," Set in the capital city of Badon one year after the events of the TV anime, Jean and the rest of the ACCA department are preparing for the one-year anniversary of the establishment of the new order. For the characters — caught between rumors of unrest, unchanging days, new crossroads, gazes remembered in memories, and days of new beginnings — time once again begins to move forward."," Drama, Fantasy, Mystery, Police, Seinen", 2020, Completed," ACCA13区監察課 Regards, ACCA"
ACCA, Winter 2017 Anime," The kingdom of Dowa, which is subdivided into 13 states, is celebrating its monarch's 99th birthday. These 13 states have many agencies that are controlled by the giant organization known as ACCA. Within ACCA, Jean Otus is the second-in-command of the inspection agency. His agency has ten people placed in each of the 13 states, with a central office in the capital city. They keep track of all the activities of ACCA across the kingdom, and keep data on each state's ACCA office flowing toward the central office. Jean also often has business trips from the capital to the other districts to check on the situation and personnel there.(Source"," Drama, Fantasy, Police, Seinen", 2017, Completed, ACCA
Accel World, TV Series," One autumn day in 2046, Haruyuki has an encounter with Kuroyukihime, the prettiest girl in his school. For the middle school boy who is often bullied, the meeting changes his life. Through a mysterious piece of software from her, Haruyuki learns of the existence of the virtual Accel World. In that moment, the lowest of the “school caste” becomes “Burst Linker”, a knight defending a princess."," Action, Romance, School, Sci-Fi, Shounen", 2012, Completed," Accelerated World, アクセル・ワールド"
Accel World (Dub), TV Series," The year is 2046. Haruyuki Arita is a young boy who finds himself on the lowest social rungs of his school. Ashamed of his miserable life, Haruyuki can only cope by indulging in virtual games. But that all changes when Kuroyukihime, the most popular girl in school, introduces him to a mysterious program called Brain Burst and a virtual reality called the Accel World."," Action, Game, Romance, School, Sci-Fi, Shounen", 2012, Completed," Accelerated World, アクセル・ワールド"
Accel World EX, TV Series," One autumn day in 2046, Haruyuki has an encounter with Kuroyukihime, the prettiest girl in his school. For the middle school boy who is often bullied, the meeting changes his life. Through a mysterious piece of software from her, Haruyuki learns of the existence of the virtual Accel World. In that moment, the lowest of the “school caste” becomes “Burst Linker”, a knight defending a princess."," Action, Romance, School, Sci-Fi, Shounen", 2012, Completed, Accel World
Accel World EX (Dub), OVA," OVA bundled with the Accel World simulation and action games. The Blu-ray OVA discs came with the PS3 limited edition versions and the DVD with the PSP limited edition versions.The project was split into two PSP and PS3 titles, and one episode was released with each game"," Action, Game, Romance, School, Sci-Fi", 0, Completed, Accel World
Accel World Specials, TV Series," One autumn day in 2046, Haruyuki has an encounter with Kuroyukihime, the prettiest girl in his school. For the middle school boy who is often bullied, the meeting changes his life. Through a mysterious piece of software from her, Haruyuki learns of the existence of the virtual Accel World. In that moment, the lowest of the “school caste” becomes “Burst Linker”, a knight defending a princess."," Comedy, School, Sci-Fi, Shounen", 2012, Completed," Accelerated World Specials, あくちぇる・わーるど。"
Accel World, Movie," In 2046, many aspects of life are carried out on a virtual network. No matter how advanced the time becomes, however, bullying never disappears. Haruyuki is one of the bullied students. However, one day he is contacted by Kuroyukihime, the most famous person in the school. ""Wouldn't you like to 'accelerate' and go further ahead, boy?"" Haruyuki is introduced to the ""Accel World"" and decides to fight as Kuroyukihime's knight."," Action, Game, Romance, School, Sci-Fi", 2016, Completed, アクセル・ワールド INFINITE∞BURST（インフィニット・バースト）
Accel World, Movie," In 2046, many aspects of life are carried out on a virtual network. No matter how advanced the time becomes, however, bullying never disappears. Haruyuki is one of the bullied students. However, one day he is contacted by Kuroyukihime, the most famous person in the school. ""Wouldn't you like to 'accelerate' and go further ahead, boy?"" Haruyuki is introduced to the ""Accel World"" and decides to fight as Kuroyukihime's knight."," Action, Game, Romance, School, Sci-Fi", 2016, Completed, アクセル・ワールド
Acchi Kocchi, TV Series," Acchi Kocchi follows the misadventures, screw ups, and idiocy of 5 schoolmates"," Comedy, Romance, School, Slice of Life", 2012, Completed," Place to Place, あっちこっち"
Acchi Kocchi Youchien, Special, One-minute long Acchi Kocchi specials that aired at the end of each eps. It was released on the BD/DVD discs of the series as clean ver. later., Comedy, 2012, Completed," Acchi Kocchi Kindergarten, Acchi Kocchi Specials, あっちこっち 幼稚園"
Acchi Kocchi, Special,,,,,
Ace wo Nerae!, TV Series," On her first day at Nishi High School, 15-year-old Hiromi Oka is inspired by top player Reika ""Ochoufujin"" Ryuuzaki to take up tennis. Shortly after joining the school's tennis club, she encounters Jin Munakata, the club's new coach. Munakata puts everyone under rigorous training that even puts Ochoufujin to shame. Despite the hardships, Hiromi's determination prompts the coach to select her as part of the club's main players. Because of this, Hiromi must endure the peer pressure from her seniors to become an ace tennis player."," Drama, Romance, School, Shoujo, Sports", 1973, Completed," Ace o Nerae, Aim for the Ace!, エースをねらえ!"
Ace wo Nerae! (1979), Movie," High school freshman Hiromi joins the tennis club because of her admiration for Ryuzaki. Ryuzaki is a senior, who's the best tennis player on the team and also nicknamed ""Ochoufujin"", (""Madame Butterfly""), because of her elegance on the tennis court. However, the new coach, Jin Munakata, wants the inexperienced Hiromi to play in a forthcoming tournament.Due to this, Hiromi considers quitting tennis for good but, in the depth of her soul, she soon realizes that she loves tennis after all. She returns to the club and, under Munakata's coaching, her talent starts to bloom.In the end, Hiromi develops a strong emotional bond with her coach, not knowing that Munakata is risking his life because of a chronic illness."," Drama, Romance, School, Shoujo, Sports", 1979, Completed," Aim for the Ace! (1979), Ace o Nerae"
Ace wo Nerae! 2, OVA, Three years has passed since the events of the first series. Hiromi continued training with her coach and became Japan's junior champion. Their common profits have also contributed to the coach being chosen as the first trainer of the Japanese Selection of Tennis and is arranged to head a trip with the youngest members of the team to USA. The relation between Hiromi and its trainer is narrower at personal level but it exceeds the teacher-student bond with great difficulty.," Drama, Shoujo", 1988, Completed," Ace wo Nerae! OVA 1, Aim for the Ace! 2, エースをねらえ！２"
Ace wo Nerae!, ONA, Hiromi continues developing her tennis and shows the results while undergoing an emotional change into an adult.," Action, Drama, Sports", 1989, Completed," Ace O Nerae! OVA 2, Aim for the Ace"
Acro Trip, TV Series," Chizuko Date is an otaku girl who lives in a city in Niigata Prefecture. Chizuko is obsessed with Berry Blossom, the magical girl who protects the city. However, Chroma — the leader of the local evil organization Fossa Magna — is inept and weak, so hardly anyone else cares about Berry Blossom and Chroma's frequent battles anymore. Chizuko vows to shine a light on the magical girl's exploits — and this fervent desire takes this seemingly shy middle school girl down a dark path filled with strange folks...", Comedy, 2024, Upcoming, アクロトリップ
Action Heroine Cheer Fruits, Summer 2017 Anime," The ""local heroine fighter"" of a certain city became popular and a national star. Because of this, ""local heroines"" debuted in various other places, and their action live events became a hit trend nationally. In Hinano City, high school girl Misaki Shirogane and other girls become local heroines (at the urging of Misaki's aunt, the prefectural governor) and vow to produce action live events."," Comedy, School, Slice of Life", 2017, Completed, アクションヒロイン チアフルーツ
Active Raid, Summer 2016 Anime," Set in a part of Tokyo that has descended into a quagmire, the story follows Unit 8 of the 5th Special Public Security Section's 3rd Mobile Assault Division, popularly called ""The Eighth,"" who don powered armor ""Willwear"" exoskeletons to counter the rise in crime."," Mecha, Police, Sci-Fi", 2016, Completed, Active Raid
Active Raid, Winter 2016 Anime," Set in a part of Tokyo that has descended into a quagmire, the story follows Unit 8 of the 5th Special Public Security Section's 3rd Mobile Assault Division, popularly called ""The Eighth,"" who don powered armor ""Willwear"" exoskeletons to counter the rise in crime."," Mecha, Police, Sci-Fi", 2016, Completed, Active Raid
Actors, Fall 2019 Anime," Private Tenshou Gakuen is the seventh of ten school districts circled within a 130-meter tall wall with restricted entry and egress aside from officials. The academy is fully autonomous by the government but to strive for independence, the school allows students to engage in club activities after school, which comes with a strangely unique system. Each club is ranked according to its overall accumulated points gathered from various club activities and school events. Points can also be received by winning at the school's periodic Tenshou Gakuen Singing Contest, where many students compete. The members in the clubs work hard to win the contest for their goal."," Music, School", 2019, Completed, ACTORS -Songs Connection-
Actors, Fall 2019 Anime," Private Tenshou Gakuen is the seventh of ten school districts circled within a 130-meter tall wall with restricted entry and egress aside from officials. The academy is fully autonomous by the government but to strive for independence, the school allows students to engage in club activities after school, which comes with a strangely unique system. Each club is ranked according to its overall accumulated points gathered from various club activities and school events. Points can also be received by winning at the school's periodic Tenshou Gakuen Singing Contest, where many students compete. The members in the clubs work hard to win the contest for their goal."," Music, School", 2019, Completed, ACTORS -Songs Connection-
AD Police, OVA," The year is 2027 in MegaTokyo, six years before the Knight Sabers will make their debut. Boomers (artificial humans) are still a relatively new advancement, and the implementation and integration of boomers into society is still a bit buggy -- sometimes fatally so. Whenever a boomer incident occurs, though, there is the Advanced Police, a special force trained to deal with boomer crimes.Leon McNichol is a rookie in the AD Police, and is just starting to become exposed to the horrors and tragedies one finds every day in MegaTokyo. He and his veteran partner, Gina Marceau, slowly learn about the ever-fading line that separates man from machine."," Adventure, Dementia, Mecha, Mystery, Police, Psychological, Sci-Fi, Thriller", 1990, Completed," AD Police Files, A.D. Police, ADポリス"
Adachi to Shimamura, Fall 2020 Anime," The second floor of the gym―this was where we always met. It was class time, but of course, there weren't any classes going on in a place like this.This was where Shimamura and I became friends. We hung out here―talking about TV shows and cooking, playing some ping pong... This is where we fostered our friendship.Keeping my head propped against the wall, I let out a small sigh.What was this feeling? Yesterday, I'd dreamt of me and Shimamura kissing.Not that I'm like that. I'm sure Shimamura isn't either. It's not even something worth repeating myself about, but really, it's not like that.It's just that when she hears the word ""friend,"" I want her to think of me first. That's all."," Romance, School, Shoujo Ai, Slice of Life", 2020, Completed," Adachi and Shimamura, Adashima, 安達としまむら"
Adachi to Shimamura (Dub), Fall 2020 Anime," Somewhere in the school at noon, one might hear the sound of two girls playing table tennis together as they wait for time to pass by.As if by fate, two students—Sakura Adachi and Hougetsu Shimamura—stumble upon each other on the second floor of the school gymnasium. As they gradually foster a budding friendship, their feelings for one another only become more ambiguous. Growing closer by the day, the two must learn to navigate their contrasting personalities as well as determine the depth of their affection for each other.The nature of this relationship gradually shifts when one of them starts to develop feelings beyond the boundaries of a platonic relationship. Even so, Adachi and Shimamura must realize if forming a bond stronger than friendship will bring them closer or tear them apart."," Romance, School, Shoujo Ai, Slice of Life", 2020, Completed," Adachi and Shimamura, Adashima, 安達としまむら"
Adachi to Shimamura Mini Anime, ONA, Short episodes with super-deformed characters posted on the official Twitter account., Comedy, 2020, Completed, 安達としまむら ミニアニメ
Addiction to wife doting, ONA," The vicious stepmother and the green tea sister committed evil one after another, but they were rescued by him unexpectedly, and strongly asked for marriage. From then on, she became the wife of the living king of Kyoto, Lu Zeyuan, which made her parents and the scum-man's ex anxious. A sweet love affair also unfolded from this..."," Action, Romance", 2021, Completed, Pampered Mr. Lu’s wife and fateful meeting
Adieu Galaxy Express 999 (Dub), Movie," Two years after the events in Galaxy Express 999, Earth has become a battleground. Tetsuro, older and fighting the Machine People, rejoins Maetel aboard the GE999."," Adventure, Drama, Sci-Fi, Space", 1981, Completed, Sayonara Ginga Tetsudou 999
Adversities, ONA,," Action, Adventure, Romance", 2023, Completed, 劫难重重
Africa no Salaryman (TV), Fall 2019 Anime," The comedy follows a lion, toucan, and lizard as they live the lives of office workers in a capitalist society in Japan, while also dealing with their unique situations as animals living beyond the savanna and the food chain."," Comedy, Slice of Life", 2019, Completed," Africa Salaryman, アフリカのサラリーマン (TV)"
Africa no Salaryman (TV) (Dub), TV Series," The comedy follows a lion, toucan, and lizard as they live the lives of office workers in a capitalist society in Japan, while also dealing with their unique situations as animals living beyond the savanna and the food chain."," Comedy, Slice of Life", 2019, Completed," Africa Salaryman, Businessman in Africa (TV), African Office Worker (TV), アフリカのサラリーマン (TV)"
Afro Samurai, TV Series," his father in front of him when he was just a boy, a three-armed gunman who is the lord of the dark swordsman’s road and the current No. 1."," Action, Samurai", 2007, Completed, アフロサムライ
Afro Samurai (Dub), Movie," After watching his father die in a duel against an unbeatable villian known only as 'Justice,' young Afro fixes his life on the study of swords and revenge. The tale of Afro Samurai is one of bloody hardship and pain. Along his solitary path of revenge for his murdered father, he sheds no tears & knows no love. Forever chased by powerful enemies in a lawless technology-speckled dystopia, he evades bullets and blade to reach his final prey"," Action, Samurai", 2007, Completed, アフロサムライ
Afro Samurai, Movie," Takashi Okazaki said in the new season Afro ""loses his way, gets tired of all the killing"" and he ""wakes up to his destiny, which is to be the world's number one warrior.""Produced by Japanese studio GONZO in association/partnership with GDH K.K. and based on the original art and story telling of manga artist Takashi Okazaki. Funimation is also collaborating on the production."," Action, Samurai", 2009, Completed, アフロサムライ Resurrection
Afro-Ken, OVA," Afro Ken is a Japanese character created by the San-X company, which creates other anime-style characters such as Kogepan. He is a dog with a rainbow-coloured afro. He is innocent and blameless and always in a good mood. Afro Ken is always willing to try new things. Afro Ken is attracted to objects that look like he does. His hair changes to look like these things as he gets close to them.There is an Afro Ken Family Tree with other dog characters who have outrageous names, such as Techno Ken, Funky Ken, Lord Ken, Super Afro Ken, and Normal Ken. Unlike the others, Normal Ken does not have wild hair."," Comedy, Kids", 2001, Completed, アフロ犬
After School, ONA, Part of a new cross media project titled Megaton-kyuu Musashi by game developer Level-5., School, 0, Upcoming, アフタースクール
Against the Sky Supreme, ONA," Tan Yun is the young master of the Tan family, a small noble family in Wang Yue Town, but the reincarnation of the Honmong Supreme needs to be stimulated by life and death to awaken, so Tan Yun has been bullied and despised scum for 16 years at first. During the wedding, Tan Yun saw his fiancée cheating on him with the young master of the Situ family and was beaten up, and when he was about to die, he finally awakened to the memories of the Supreme God"," Martial Arts, Super Power", 2021, Ongoing, 逆天至尊
Agatha Christie no Meitantei Poirot to Marple, TV Series," Young Mabel West is the daughter of mystery writer Raymond West, who wants her to lead a normal life. Rebelling against this, Mabel wants to be a great detective, and sets out for London to become assistant to none other than Hercule Poirot, the great Belgian detective who resides there. She finally wins the reluctant approval of her father, and embarks on an exciting life of mystery and suspense—his only demand being that she occasionally spend some time with her great-aunt, Jane Marple, in the small village of St. Mary Mead."," Historical, Mystery", 2004, Completed," Agatha Christie's Great Detectives Poirot and Marple, アガサ・クリスティーの名探偵ポワロとマープル"
Age of Gunslingers Ⅲ, ONA," Focusing on this new type of armament, various forces have fought fiercely and have set up colleges to cultivate special agents. With the breakthrough and application of the experiment and the coercion from the mysterious race, the world gradually fell into the mire of war. After the war ended, the mysterious race disappeared, and the agents and the gun gods became unproven urban legends. The special agents “Deep Ocean” and “Wild Snake” relocated their bases to the seafloor and underground, respectively, without disturbing each other. However, in a scene of peace, the crisis is perilous."," Action, Adventure, Romance, Sci-Fi", 2019, Completed, Qiang Shen Ji
Agent Aika, TV Series," Aike, one of people who are hired to search the valuable information or artifacts for remnants of sunken Tokyo. An earthquake set in  the not-too-distant future, has pushed Tokyo under the waves and many people are making a living as “salvagers”....Aike, one of people who are hired to search the valuable information or artifacts for remnants of sunken Tokyo. An earthquake set in  the not-too-distant future, has pushed Tokyo under the waves and many people are making a living as “salvagers”. She teamed up with her employer’s daughter and armed with a magical golden bustier, she searches the ocean for profit and adventure."," Action, Adventure, Comedy, Ecchi, Sci-Fi", 1997, Completed, AIKa
Aggressive Retsuko, TV Series," The show centers on Retsuko, a 25-year old red panda who works in her dream company's accounting department. But it turns out that she is forced to keep doing more and more impossible tasks by her superiors and co-workers. She doesn't talk back to them, but she still has to let off steam, so she ends up going to karaoke by herself and singing death metal."," Comedy, Music", 2016, Completed, アグレッシブ烈子
Aggressive Retsuko (2018), ONA, Some offices have stereotypical dynamics," Comedy, Slice of Life", 2018, Completed," Aggretsuko, アグレッシブ烈子"
Aggressive Retsuko (ONA) (Dub), ONA, Some offices have stereotypical dynamics," Comedy, Slice of Life", 2018, Completed," Aggretsuko, アグレッシブ烈子"
Aggressive Retsuko (ONA) 2nd Season, ONA, No synopsis information has been added to this title. Help improve our database by adding a synopsis here.," Comedy, Slice of Life", 2019, Completed," Aggretsuko 2nd Season, アグレッシブ烈子第2期"
Aggressive Retsuko (ONA) 2nd Season (Dub), ONA," Red panda Retsuko continues to work at her cyclic office job, with the occasional stress-venting via death metal karaoke on the side. With the company of her newfound friends Gori and Washimi, life is more enjoyable than ever before. But some new shake-ups to her status quo threaten to add more stress to her life. At the office, new employee Anai seems like a fine addition to the company. Yet when Retsuko is placed in charge of his training, she finds that beneath his steadfast dedication, he may pose a threat to the stability of the workplace. Meanwhile, at home, Retsuko's mother pays an abrupt visit, fully intent on having her daughter finally settle down and find a man. With this in mind, she sets Retsuko up for various marriage appointments, much to her chagrin.Now, Retsuko finds all the more reasons to head to the karaoke bar and unleash her furious diatribes. However, knowing that this will not truly solve her problems, she decides to make a more spontaneous choice to avoid her issues. And so, Retsuko finds herself set upon another self-reflecting journey, coming to learn more about herself and love, with the ever cathartic support of death metal karaoke."," Comedy, Slice of Life", 2019, Completed, アグレッシブ烈子第2期
Aggressive Retsuko (ONA) 3rd Season, ONA, Third Season of Aggressive Retsuko.," Comedy, Slice of Life", 2020, Completed," Aggretsuko 3rd Season, アグレッシブ烈子第3期"
Aggressive Retsuko (ONA) 3rd Season (Dub), ONA, Third Season of Aggressive Retsuko.," Comedy, Slice of Life", 2020, Completed," Aggretsuko 3rd Season, アグレッシブ烈子第3期"
Aggressive Retsuko (ONA) 4th Season, ONA, Fourth season of Aggressive Retsuko.," Comedy, Slice of Life", 2021, Completed," Aggretsuko 4th Season, アグレッシブ烈子第4期"
Aggressive Retsuko (ONA) 4th Season (Dub), ONA, Fourth season of Aggressive Retsuko," Comedy, Slice of Life", 2021, Completed, アグレッシブ烈子第4期
Aggressive Retsuko (ONA) 5th Season, ONA, Fifth season of Aggressive Retsuko., Comedy, 2023, Completed," Aggretsuko (ONA) 5th Season, グレッシブ烈子"
Aggressive Retsuko (ONA) 5th Season (Dub), ONA, Fifth season of Aggressive Retsuko., Comedy, 2023, Completed," Aggretsuko (ONA) 5th Season, グレッシブ烈子"
Aggressive Retsuko, OVA, Aggretsuko Specials.," Comedy, Slice of Life", 2018, Completed, アグレッシブ烈子
Aguu, Summer 2018 Anime, The series is about a missing genius whose mysterious disappearance becomes a shady secret among the successful members of society.," Action, Drama, Supernatural", 2018, Completed, Aguu
Ah! My Goddess, TV Series," Morisato Keiichi is a down on his luck college student. Although possessing a diligent and generous nature, he had the misfortune of being born under an unlucky star. As a result, the current state of his life is somewhat unenviable. All that is about to change, however, as Heaven has taken notice of his plight. A goddess, Belldandy, is despatched to Earth to grant Keiichi one wish.One wish, be it unlimited power, wealth, or his fondest desire. And his wish? ‘I wish that a goddess like you will stay with me forever.’"," Action, Adventure, Comedy, Ecchi, Sci-Fi", 2005, Completed," Aa! Megami-sama! (TV), ああっ女神さまっ"
Ah! My Goddess - Flights of Fancy (Dub), TV Series," One year after goddess Belldandy emerged from Keiichi Morisato's mirror and promised to stay with him forever, a new threat to their happiness emerges, one that could end the contract between Belldandy and Keiichi."," Comedy, Magic, Romance, Supernatural", 2006, Completed, Ah! My Goddess
