name,Type,Plot Summary,Genre,Released,Status,Other name
Spoon Oba-san, TV Series," An older woman wears a small spoon around her neck but every now and then, she shrinks to the size of a mouse because of the spoon. She sees the world then from a completely different perspective and has all kind of strange adventures together with Wendy, the mouse and many others."," Kids, Magic", 1983, Completed," Mrs. Pepperpot, Old-Lady Spoon, Spoon Obasan, スプーンおばさん"
Spoon Oba-san (Dub), TV Series," An older women wears a small spoon around her neck but every now and then, she shrinks to the size of a mouse because of the spoon. She sees the world then from a completely different perspective and has all kind of strange adventures together with Wendy, the mouse and many others."," Kids, Magic", 1983, Completed, スプーンおばさん
Spriggan, Movie," Arcam is a secret, worldwide organization investigating artefacts from a lost civilization. When three of their investigators go to Mt. Ararat, in Turkey, they discover what they believe is the wreck of Noah's Ark. Their joy is short-lived, and so are they — the relic projects a powerful, destructive energy which wipes out not only the team but three Pentagon satellites as well. Quickly, Arcam and the US military are battling for the Ark's secret. Arcam's trump card is their super-powered warrior agents, called Spriggans. One Spriggan, a high school student named Yu Ominae is dragged into the fray. He makes his way to Turkey to confront the Pentagon's platoons. Of course, the Americans have super-soldiers of their own, including the human tank Fat-Man and the vicious Little Boy. The bullets are soon flying en masse, in what has become a holy war for the future of the human species."," Adventure, Military, Sci-Fi, Shounen", 1998, Completed, スプリガン
Spriggan (Dub), Movie," Deep in the Ararat Mountains of Turkey, a secret organization known as ARCAM has found what is believed to be Noah's Ark. However, the U.S. Machine Corps., a rogue organization of the Pentagon, wants to take over the Ark as a means of global supremacy. Only a special ARCAM operative known as a Spriggan stands in their way. Japanese Spriggan Yu Ominae teams up with French Spriggan Jean-Jacques Mondo to combat members of the U.S. Machine Corps. led by Col. MacDougall—a genetically-enhanced boy with deadly psionic powers. However, they must act fast and stop MacDougall before he uses the Ark for his own agenda."," Adventure, Military, Sci-Fi, Shounen", 1998, Completed, Spriggan
Spriggan (ONA), ONA," Deep in the Ararat Mountains of Turkey, a secret organization known as ARCAM has found what is believed to be Noah's Ark. However, the U.S. Machine Corps., a rogue organization of the Pentagon, wants to take over the Ark as a means of global supremacy. Only a special ARCAM operative known as a Spriggan stands in their way. Japanese Spriggan Yu Ominae teams up with French Spriggan Jean-Jacques Mondo to combat members of the U.S. Machine Corps. led by Col. MacDougall—a genetically-enhanced boy with deadly psionic powers. However, they must act fast and stop MacDougall before he uses the Ark for his own agenda."," Action, Adventure, Military, Sci-Fi, Shounen", 2022, Completed, スプリガン
Spriggan (ONA) (Dub), ONA," Deep in the Ararat Mountains of Turkey, a secret organization known as ARCAM has found what is believed to be Noah's Ark. However, the U.S. Machine Corps., a rogue organization of the Pentagon, wants to take over the Ark as a means of global supremacy. Only a special ARCAM operative known as a Spriggan stands in their way. Japanese Spriggan Yu Ominae teams up with French Spriggan Jean-Jacques Mondo to combat members of the U.S. Machine Corps. led by Col. MacDougall—a genetically-enhanced boy with deadly psionic powers. However, they must act fast and stop MacDougall before he uses the Ark for his own agenda."," Action, Adventure, Military, Sci-Fi, Shounen", 2022, Completed, スプリガン
Sprite, OVA," Lately, shy Manami has been flirting outrageously and sparking vicious cat-fights! Afterwards, she remembers nothing. Can it be that another personality seethes beneath her own? A wild woman who’ll do anything to find trouble?"," Comedy, Ecchi, Romance, School", 1997, Completed," Manami & Nami Sprite, 真奈美＆ナミ スプライト"
Sprite, OVA," Lately, shy Manami has been flirting outrageously and sparking vicious cat-fights! Afterwards, she remembers nothing. Can it be that another personality seethes beneath her own? A wild woman who’ll do anything to find trouble?"," Comedy, Ecchi, Romance, School", 1997, Completed," Manami & Nami Sprite, 真奈美＆ナミ スプライト"
Spy Kyoushitsu, Winter 2023 Anime," After a gruesome war wreaked havoc on the general populace, the governments of the world turned to a more elusive tactic to further their agendas—a war fought in the shadows.Lily, a beautiful girl with white locks, is a student in one of the many institutions that train youths into becoming capable spies. Unfortunately, despite scoring well in the written exams, she only manages to barely pass her practicals. With no real world skills to speak of, her hopes of graduating are dismal—until she is offered an opportunity to join the mysterious team ""Tomoshibi"" and partake in an Impassable Mission.Excited by the prospect of working with the elite, Lily enthusiastically accepts. However, she is struck dumb when she arrives at Kagerou Palace and the true purpose of Tomoshibi and its hopeless situation comes into light. Joined by other problematic female spies along with a mysterious young man spearheading the operation, Lily realizes that this is not the ideal escapade she had pictured."," Action, Comedy, Harem, Mystery, Romance", 2023, Completed, Spy Room; Spy Classroom; スパイ教室
Spy x Family, Spring 2022 Anime," For the agent known as ""Twilight,"" no order is too tall if it is for the sake of peace. Operating as Westalis' master spy, Twilight works tirelessly to prevent extremists from sparking a war with neighboring country Ostania. For his latest mission, he must investigate Ostanian politician Donovan Desmond by infiltrating his son's school"," Action, Childcare, Comedy, Shounen", 2022, Completed, SPY×FAMILY
Spy x Family (Dub), Spring 2022 Anime," For the agent known as ""Twilight,"" no order is too tall if it is for the sake of peace. Operating as Westalis' master spy, Twilight works tirelessly to prevent extremists from sparking a war with neighboring country Ostania. For his latest mission, he must investigate Ostanian politician Donovan Desmond by infiltrating his son's school"," Action, Comedy, Shounen", 2022, Completed, SPY×FAMILY
Spy x Family Part 2, Fall 2022 Anime, The second part of Spy x Family.," Action, Childcare, Comedy, Shounen", 2022, Completed, SPY×FAMILY
Spy x Family Part 2 (Dub), Fall 2022 Anime, The second part of Spy x Family.," Action, Childcare, Comedy, Shounen", 2022, Completed, SPY×FAMILY
Spy x Family Season 2, TV Series, Second season of Spy x Family.," Action, Comedy", 2023, Upcoming, SPY×FAMILY Season 2
SSSS.Dynazenon, Spring 2021 Anime, SSSS.DYNAZENON is an upcoming 2020 animated series that is scheduled to be the continuation from SSSS.Gridman," Action, Mecha, Sci-Fi", 2021, Completed, SSSS.DYNAZENON
SSSS.Dynazenon (Dub), Spring 2021 Anime, SSSS.DYNAZENON is an upcoming 2020 animated series that is scheduled to be the continuation from SSSS.Gridman," Action, Mecha, Sci-Fi", 2021, Completed,
SSSS.Gridman, Fall 2018 Anime," Yuta Hibiki awakens with amnesia and the ability see things that others cannot. He first encounters a Gridman in the reflection of his friend Rikka Takarada's computer and it tells him to ""Remember his calling,"" but Yuta doesn't understand what this means. Later, in the distance, he sees an extremely large monster but it doesn't move. It's only when Yuta gets to school that the two sightings make sense"," Action, Mecha, Sci-Fi", 2018, Completed,
SSSS.Gridman (Dub), Fall 2018 Anime, An original anime title that was revealed by Studio Trigger at Anime Expo.," Action, Mecha, Sci-Fi", 2018, Completed,
Stand By Me Doraemon, Movie," Doraemon is a robotic cat that lives in the 22nd century, and is known as a caretaker who helps others with his futuristic gadgets. One day he is approached by Sewashi Nobi, the great-great-grandson of Nobi Nobita. Sewashi demands of Doraemon to go back to the past and make Nobita happy in order to prevent a disastrous and bleak future. Doraemon is not excited about this idea, but Sewashi installs a program into Doraemon and eventually sends him back to the past.Nobita Nobi is an elementary school boy who is very lazy, unlucky and a scaredy-cat. He gets bullied by everyone and does not excel in any school subject. When he meets Doraemon for the first time, the two of them start off on the wrong foot; however, they soon become great friends. Doraemon cannot go home to the 22nd century unless he turns Nobita into a boy who can stand on his own and be happy."," Comedy, Kids, Sci-Fi, Shounen", 2014, Completed," Stand By Me Doraemon, STAND BY ME ドラえもん"
Stand By Me Doraemon (Dub), Movie," obita Nobi is an elementary student who hates studying, is bad at sports, and does everything half-heartedly. He is a pushover, unlucky, and fearful of many things. His personality makes him a failure in life, even affecting his progeny. This causes his great-great-grandchild, Sewashi, to take control of the situation.Sewashi travels back in time from the 22nd century to the 20th century to meet Nobita, who is shocked to see him appear out of his drawer alongside a blue robotic cat. The robotic cat calls himself Doraemon, who claims to have been pressured by Sewashi to assist Nobita, with their ultimate goal being to provide Nobita happiness. Frustrated after seeing Nobita's hopeless state, Doraemon decides to go back to the future. However, Sewashi activates a program within Doraemon that prevents him from doing so.Forced to stay, Doraemon helps Nobita using futuristic gadgets through his four-dimensional pocket—a bag containing anything inside it. Can Doraemon bring Nobita happiness and return to the future?"," Comedy, Kids, Sci-Fi, Seinen", 2014, Completed, STAND BY ME ドラえもん
Stand By Me Doraemon 2, Movie," After reminiscing about his late grandmother, Nobita Nobi wishes to see her again and asks Doraemon to return them to the past. Following the wholesome reunion of the two, Nobita's grandmother confesses that she hopes to meet his future bride. Nobita accepts her request out of filial love and quickly scrambles into the time machine as he and Doraemon journey forward in time.However, when the duo warps to Nobita's wedding day, they discover that the future Nobita is missing from the ceremony! Determined to set things right, Doraemon and Nobita embark on a mission to search for Nobita's future self and encourage him to discover the happiness he deserves."," Comedy, Kids, Sci-Fi, Seinen", 2020, Completed, STAND BY ME ドラえもん ２
Stand By Me Doraemon 2 (Dub), Movie," After reminiscing about his late grandmother, Nobita Nobi wishes to see her again and asks Doraemon to return them to the past. Following the wholesome reunion of the two, Nobita's grandmother confesses that she hopes to meet his future bride. Nobita accepts her request out of filial love and quickly scrambles into the time machine as he and Doraemon journey forward in time.However, when the duo warps to Nobita's wedding day, they discover that the future Nobita is missing from the ceremony! Determined to set things right, Doraemon and Nobita embark on a mission to search for Nobita's future self and encourage him to discover the happiness he deserves."," Comedy, Kids, Sci-Fi, Seinen", 2020, Completed, STAND BY ME ドラえもん ２
Stand My Heroes, Fall 2019 Anime," The heroine is a new officer works under the Narcotics Control Department of the Ministry of Health, a.k.a Matori. Narcotic medicines don't work on her, and the story begins with her just entering the department and starting work with other officers."," Josei, Mystery, Romance", 2019, Completed, スタンドマイヒーローズ PIECE OF TRUTH
Stand My Heroes, Fall 2019 Anime," The heroine is a new officer works under the Narcotics Control Department of the Ministry of Health, a.k.a Matori. Narcotic medicines don't work on her, and the story begins with her just entering the department and starting work with other officers."," Josei, Mystery, Romance", 2019, Completed, スタンドマイヒーローズ PIECE OF TRUTH
Stand My Heroes, OVA," The OVA will be based on the Narumi Seo character map story event that was featured in the smartphone game in April 2018. Seo, who has a unique memory disorder, will appear alongside other heroes of the Seo Research Laboratory in the OVA."," Mystery, Romance", 2023, Upcoming, Stand My Heroes OVA ; スタンドマイヒーローズ
Star Chronicles, TV Series," The series, both the anime and novels, are notable for the fact that Morioka created for them an entire language, Baronh (and an accompanying alphabet, Ath), which the Abh speak, read, and write. Almost all written text in the anime is in Baronh, with occasional text in other (invented) languages; at least one planet is shown to have adopted Ath to write their own language (although this is not a plot point, and easily missed)"," Action, Military, Romance, Sci-Fi, Space", 2000, Completed," Seikai no Senki, Banner of the Stars, 星界の戦旗"
Star Driver, TV Series," In Southern Japan, there lies the verdant Minamijuuji Island. One night, a youth by the name of Tsunashi Takuto arrives on one of the island's beaches. This youth, who had swam to the island from the mainland, subsequently enters Minamijuuji Academy's High School Division.Possessing a positive and forward-looking attitude, he easily develops relationships with Agemaki Wako, Shindou Sugata, and various other people he meets at the Academy.However, Minamijuuji Academy hides a big secret. Beneath it, 20 humanoid constructs lie dormant.In this land that lies under a blue sky and surrounded by blue seas, a story of love, dreams and friendship begins."," Action, Mecha, Shounen", 2010, Completed, Star Driver
Star Driver The Movie, Movie, A rearrangement of the Star Driver," Action, Mecha, Shounen", 2013, Completed, STAR DRIVER 輝きのタクト
Star Dust, OVA, A misguided sci-fi tale of ecological police keeping space free from pollution in 2061.," Sci-Fi, Space", 1992, Completed, スター・ダスト
Star Fox Zero, Movie," Andross, an ape exiled from the Lylad Planetary System by General Pepper seeks revenge by attacking the planet Corneria and its innocence, kidnapping Pepper in the process. Meanwhile, it's another usual day for Team Star Fox, a gang of space mercenaries"," Action, Sci-Fi, Space", 0, Completed, スターフォックス ゼロ ザ・バトル・ビギンズ
Star Ocean EX, TV Series," In an endless sea of stars, at the edge of the universe, a single fateful encounter is about to take place. For the gods have set forth on a quest to destroy the universe. And a deadly meteorite, which they hurled into the vastness of space, has collided with an unsuspecting planet, Expel - putting the wheels of fate into motion. Now, two people are about to cross paths, and their meeting will force them to endure both the gods and their devilish advisors"," Adventure, Fantasy, Sci-Fi, Shounen", 2001, Completed, スターオーシャンEX
Star Ocean EX (Dub), TV Series," Claude C. Kenni, a crewmember on the spaceship Calnus and son of the commander of the ship, is transported to Expel, a backwards planet with swords and magic. He teams up with Rena Lanford, who thinks he is the legendary Warrior of Light, and other characters to investigate the Sorcery Globe, a meteorite that has been causing problems all over the world."," Adventure, Fantasy, Sci-Fi, Shounen", 2001, Completed, スターオーシャンEX
Star Wars, Movie," After the Republic's victory on Christophsis, Anakin and his new apprentice, Ahsoka Tano, must rescue the kidnapped son of Jabba the Hutt. Political intrigue complicates their mission."," Action, Adventure, Fantasy, Sci-Fi", 2008, Completed,
Star Wars, TV Series," The Grand Army of the Republic, led by Yoda, Mace Windu, Obi-Wan Kenobi, Anakin Skywalker and other Jedi Knights, fights the New Droid Army of the Separatists."," Action, Adventure", 2008, Completed,
Star Wars, TV Series," The Grand Army of the Republic, led by Yoda, Mace Windu, Obi-Wan Kenobi, Anakin Skywalker and other Jedi Knights, fights the New Droid Army of the Separatists."," Action, Adventure", 2008, Completed,
Star Wars, TV Series," The Grand Army of the Republic, led by Yoda, Mace Windu, Obi-Wan Kenobi, Anakin Skywalker and other Jedi Knights, fights the New Droid Army of the Separatists."," Action, Adventure", 2008, Completed,
Star Wars, TV Series," The Grand Army of the Republic, led by Yoda, Mace Windu, Obi-Wan Kenobi, Anakin Skywalker and other Jedi Knights, fights the New Droid Army of the Separatists."," Action, Adventure", 2007, Completed,
