name,Type,Plot Summary,Genre,Released,Status,Other name
C – The Money of Soul and Possibility Control, TV Series," The Japanese government was rescued from the brink of financial collapse by the Sovereign Wealth Fund. For its citizens, however, life has not improved, and unemployment, crime, suicide, and despair are rampant. Kimimaro, raised by his maternal grandmother after the disappearance of his father and the death of his mother, is a scholarship student w… more The Japanese government was rescued from the brink of financial collapse by the Sovereign Wealth Fund. For its citizens, however, life has not improved, and unemployment, crime, suicide, and despair are rampant.Kimimaro, raised by his maternal grandmother after the disappearance of his father and the death of his mother, is a scholarship student whose only dream is to avoid all this and live a stable life. One day, however, he meets a man who offers him a large sum of money if he’ll agree to pay it back. From then on his fate is radically altered as he’s drawn into a mysterious realm known as “The Financial District.”"," Action, Mystery, Super Power, Thriller", 2011, Completed," 「C」 THE MONEY OF SOUL AND POSSIBILITY CONTROL, C"
C Danchi, Fall 2022 Anime," ""Housing Complex C"" centers around Kimi, who lives in a small, low-cost housing complex located in the seaside town of Kurosaki. Trouble seems to follow her wherever she goes, and horrific incidents begin to occur. Is an ancient evil stalking the residents of Housing Complex C?", Horror, 2022, Completed, Housing Complex C; C団地
C Danchi (Dub), Fall 2022 Anime," ""Housing Complex C"" centers around Kimi, who lives in a small, low-cost housing complex located in the seaside town of Kurosaki. Trouble seems to follow her wherever she goes, and horrific incidents begin to occur. Is an ancient evil stalking the residents of Housing Complex C?", Horror, 2022, Completed," Housing Complex C, C団地"
C, TV Series," The Japanese government was rescued from the brink of financial collapse by the Sovereign Wealth Fund. For its citizens, however, life has not improved and unemployment, crime, suicide, and despair are rampant. Kimimaro, raised by his maternal aunt after the disappearance of his father and the death of his mother, is a scholarship student whose only dream is to live a stable, ordinary life. One day he meets a man who offers him a large sum of money if he will allow his ""future"" to be held as collateral. From then on his fate is radically altered as he's drawn into a mysterious realm known as the Financial District, where he must compete in weekly tournaments called ""deals"" in order to keep his money and avoid losing his future."," Action, Mystery, Super Power, Thriller", 2011, Completed, 「C」 THE MONEY OF SOUL AND POSSIBILITY CONTROL
C3 Cube x Cursed x Curious, TV Series," Haruaki Yachi is a high school student living alone in an old solitary home. When he wakes to a suspicious sound in his kitchen, he finds… a naked rice thief. The woman calls herself “Fear” and claims to be a cursed tool who has come Yachi’s home to remove her curse. Since he’s affected by the curse, Fear ends up moving in with Haruaki, and that’… more Haruaki Yachi is a high school student living alone in an old solitary home. When he wakes to a suspicious sound in his kitchen, he finds… a naked rice thief. The woman calls herself “Fear” and claims to be a cursed tool who has come Yachi’s home to remove her curse.Since he’s affected by the curse, Fear ends up moving in with Haruaki, and that’s where the story begins. A wide variety of organizations are out to worship, study, or even destroy this cursed tool, however–, so it’s up to Haruaki and his neighbors Konoha and Kuroe, to fight them and defend Fear, who is no slouch herself. Lots of action (and some occasional fan service) ensues!"," Action, Comedy, Ecchi, School, Shounen, Supernatural", 2012, Completed," C³, シーキューブ"
C3 Cube x Cursed x Curious OVA, TV Series," Haruaki Yachi is a high school student living alone in an old solitary home. When he wakes to a suspicious sound in his kitchen, he finds… a naked rice thief. The woman calls herself “Fear” and claims to be a cursed tool who has come Yachi’s home to remove her curse. Since he’s affected by the curse, Fear ends up moving in with Haruaki, and that’… more Haruaki Yachi is a high school student living alone in an old solitary home. When he wakes to a suspicious sound in his kitchen, he finds… a naked rice thief. The woman calls herself “Fear” and claims to be a cursed tool who has come Yachi’s home to remove her curse. Since he’s affected by the curse, Fear ends up moving in with Haruaki, and that’s where the story begins.A wide variety of organizations are out to worship, study, or even destroy this cursed tool, however–, so it’s up to Haruaki and his neighbors Konoha and Kuroe, to fight them and defend Fear, who is no slouch herself. Lots of action (and some occasional fan service) ensues!"," Action, Comedy, Ecchi, School, Shounen, Supernatural", 2012, Completed,
California Crisis OVA, Movie," Noera is heading to work after drinking all night with a friend when he meets Marcia, a young biker heading towards Los Angeles. They abruptly get involved in a car chase and Marcia ends up retrieving a locked metal box from one of the pursued vehicles. Within it, a dark sphere. Many people want the orb at any cost forcing Noera and Marcia to desperately run away while trying to figure out what exactly is the strange object they are carrying."," Action, Adventure, Comedy", 1986, Completed, California Crisis
Caligula, Spring 2018 Anime," Mobius is a perfect digital world for the imagined benefit of humanity by μ, a virtual idol program that attained sentience and self-awareness. Only humans who are suffering in the real world and strongly relate to μ's songs are lured into Mobius. Once they enter, people often forget that the real world exists. Regardless of age or gender, they are turned into students and forced to experience school life over and over, which μ considers ""the most radiant time in a person's life."""," Action, Sci-Fi", 2018, Completed, カリギュラ
Call Me Tonight, OVA," 5.29Ranked #10216Popularity #5602Members 7,398OVAAICAdd to List(7) GoodEpisodes"," Comedy, Horror, Romance, Sci-Fi", 1986, Completed," Pink Noise, コール・ミー・トゥナイト"
Campione!, TV Series," Campion is anime about Kusanagi Godo is a 16-year-old high school boy and Erica Brandelli is a 16-year-old Italian girl. They fight together to defeat Verethragna.Campion is anime about Kusanagi Godo is a 16-year-old high school boy and Erica Brandelli is a 16-year-old Italian girl. They fight together to defeat Verethragna.When was just 15 years old, Godo killed the god “Verethragna” and get the title of “Campione (god killer)”.Erica is a “Great Knight” of the magic society “Bronze Black Cross”.After getting  title of “Campione”, Godo have to in battles against other Campiones and uncontrollable gods."," Comedy, Ecchi, Fantasy, Harem, Magic, Romance", 2012, Completed, Campione!
Campione! (Dub), TV Series," Some people suddenly find religion, but for 16-year-old Kusanagi GoDo, it's that REALLY old time religion that's found him! As the result of defeating the God of War in mortal combat, GoDo's stuck with the unwanted position of Campione!, or God Slayer, whose duty is to fight Herectical Gods whenever they try to muscle in on the local turf. Not only is this likely to make GoDo roadkill on the Highway to Heaven, it's also a job that comes with a lot of other problems. Like how to deal with the fact that his ""enhanced status"" is attracting a bevy of overly-worshippy female followers. After all, they're just there to aid him in his demi-godly duties, right? So why is it that their leader, the demonically manipulative sword-mistress Erica Brandelli, seems to have such a devilish interest in encouraging some VERY unorthodox activities?"," Action, Comedy, Ecchi, Fantasy, Harem, Magic, Romance, Shounen", 2012, Completed, Campione!
Can Ci Pin, ONA, No synopsis information has been added to this title. Help improve our database by adding a synopsis here.," Action, Sci-Fi", 2021, Completed," The Defective, 残次品·放逐星空"
CANAAN, TV Series," The modern-day story centers on a present-day story about a detective, a young man, a virus researcher, a, and a cat mascot character who are brought together in the Tokyo neighborhood of Shibuya by bizarre events with worldwide implications."," Action, Seinen", 2009, Completed, カナン
Canaan (Dub), TV Series," Oosawa Maria is a Japanese photographer currently working in Shanghai, China. Along with her partner Mino, she searches for potential newsworthy stories throughout the city. When strange events occur at a local festival, Maria and Mino immediately investigate. Quickly, the two are immersed in a battle between unknown masked men and a strange, white-haired woman. Just when Maria is about to be caught in the crossfire, an old friend by the name of Canaan appears and helps Maria escape. But a sinister plot over a deadly virus soon develops, and Canaan learns she must confront her past if she wants any chance at stopping the perpetrator and saving her friends."," Action, Seinen", 2009, Completed, カナン
Canary, OVA," Mika Katagiri wants her band to perform at the upcoming local festival. However, complications arise. Their keyboardist, Jun, refuses to play, and their stage has been cancelled. Refusing to give up, Mika and her band strive to find a way to play at the festival, using any means necessary."," Fantasy, Music, Romance, School", 2002, Completed, カナリア
Candidate For Goddess, TV Series," In the future humankind has expanded and colonized other planets. Then an alien species, Victim, attacks the human colonies leaving only one planet, Zion. In an effort to stop Victim from destroying the last planet a training school, GOA, is set up to gather boys from the Zion colonies and train them to become pilots of the Ingrids AKA The Goddesse… more In the future humankind has expanded and colonized other planets. Then an alien species, Victim, attacks the human colonies leaving only one planet, Zion. In an effort to stop Victim from destroying the last planet a training school, GOA, is set up to gather boys from the Zion colonies and train them to become pilots of the Ingrids AKA The Goddesses, five fighting robots that protect Zion. The boys must possess a rare blood type, EO , as well as a special ability, or EX.Zero (Candidate 88) has just arrived in GOA when he falls into the cockpit of the Ingrid Eeva-Leena. Since the synch between pilot and Ingrid are very sensitive everyone believes the Goddess will kill Zero in an attempt to synch. Just before Zero passes out he makes a full synch with the Goddess. Before he can find out more about the incident, his pilot training begins."," Action, Mecha, Military, Sci-Fi, Space", 2000, Completed," Megami Kouhosei, 女神候補生"
Candidate For Goddess OVA, TV Series," In the future humankind has expanded and colonized other planets. Then an alien species, Victim, attacks the human colonies leaving only one planet, Zion. In an effort to stop Victim from destroying the last planet a training school, GOA, is set up to gather boys from the Zion colonies and train them to become pilots of the Ingrids AKA The Goddesse… more In the future humankind has expanded and colonized other planets. Then an alien species, Victim, attacks the human colonies leaving only one planet, Zion. In an effort to stop Victim from destroying the last planet a training school, GOA, is set up to gather boys from the Zion colonies and train them to become pilots of the Ingrids AKA The Goddesses, five fighting robots that protect Zion. The boys must possess a rare blood type, EO , as well as a special ability, or EX. Zero (Candidate 88) has just arrived in GOA when he falls into the cockpit of the Ingrid Eeva-Leena.Since the synch between pilot and Ingrid are very sensitive everyone believes the Goddess will kill Zero in an attempt to synch. Just before Zero passes out he makes a full synch with the Goddess. Before he can find out more about the incident, his pilot training begins."," Action, Mecha, Military, Sci-Fi, Space", 2002, Completed," Megami Kouhosei Special Curriculum, 女神候補生 スペシャルカリキュラム"
Candy Boy, TV Series," Yukino and Kanade Sakurai live together as high school students enjoying their daily life; until one day Sakuya Kamiyama confess her love for Kanade to Yukino, asking for her support. This makes Yukino to release her true feelings for her sister."," Romance, School, Shounen Ai", 2008, Completed, Candy Boy
Candy Boy Ex01 Special, TV Series," Yukino and Kanade Sakurai live together as high school students enjoying their daily life; until one day Sakuya Kamiyama confess her love for Kanade to Yukino, asking for her support. This makes Yukino to release her true feelings for her sister."," School, Shounen Ai, Slice of Life", 2008, Completed, Candy☆Boy
Candy Candy, TV Series," This story is about a girl, Candy, who is a orphan. She is a nice and optimistic girl and she has a warm heart. When she was a child, she lived in an orphanage called Pony's Home. She had a good friend called Annie. And she met the ""Prince of the Hill"" who is a important person in her life, on the hill behind the orphanage.She was adopted by the Leagan's family. What's awaiting her are the bad-hearted Neil and his sister, Eliza. One day, in the rose garden, she met a boy, who is identical to the ""Prince of the Hill"" who she had met in her childhood. The boy is called Anthony. Thereafter, a fantastic story that she has never expected begins."," Drama, Shoujo, Slice of Life", 1976, Completed, キャンディ・キャンディ
Cang Lan Jue, ONA, No synopsis information has been added to this title. Help improve our database by adding a synopsis," Fantasy, Romance", 2022, Completed,"  苍兰诀, Love Between Fairy and Devil"
Cang Lan Jue Part 2, ONA, No synopsis information has been added to this title. Help improve our database by adding a synopsis\," Comedy, Fantasy, Historical, Romance", 2022, Completed," Love Between Fairy and Devil Part 2, 苍兰诀 下部"
Cannon Busters, ONA," Explore the fantastic land of Gearbolt as we follow a motley crew of travelers on an unforgettable journey to reunite 2 best friends. S.A.M. is a high-end, friendship robot determined to reunite with her best friend Kelby, the missing heir to her Kingdom under siege. Casey Turnbuckle is an out-dated, spunky grease-monkey repair robot, looking for an upgrade. Philly the Kid is a wanted, immortal fugitive just looking for a chance to shake them. Along for the ride is the greatest swordsman never known and an oversized Cadillac Eldorado that transforms into a sentient, giant robot. On their own, they're a lost cause. Together, they're the hippest group of travelers in action-fantasy."," Action, Adventure, Fantasy", 2019, Completed,
Cannon Busters (Dub), ONA," Explore the fantastic land of Gearbolt as we follow a motley crew of travelers on an unforgettable journey to reunite 2 best friends. S.A.M. is a high-end, friendship robot determined to reunite with her best friend Kelby, the missing heir to her Kingdom under siege. Casey Turnbuckle is an out-dated, spunky grease-monkey repair robot, looking for an upgrade. Philly the Kid is a wanted, immortal fugitive just looking for a chance to shake them. Along for the ride is the greatest swordsman never known and an oversized Cadillac Eldorado that transforms into a sentient, giant robot. On their own, they're a lost cause. Together, they're the hippest group of travelers in action-fantasy."," Action, Adventure, Fantasy", 2019, Completed,
Canvas 2, TV Series," Kamikura Hiroki is an art student at the local school Nadesico Achedemy (High School and colledge level) that tends to be an arts teacher in the future. He is also the advisor to the high school arts society where his cousin, Housen Ellse attends. While Ellse is a painter like Hiroki, Hiroki seems to have given up on his dreams and no longer paints… more Kamikura Hiroki is an art student at the local school Nadesico Achedemy (High School and colledge level) that tends to be an arts teacher in the future. He is also the advisor to the high school arts society where his cousin, Housen Ellse attends.While Ellse is a painter like Hiroki, Hiroki seems to have given up on his dreams and no longer paints. There appears to be some mysterious trauma in the past for both of them that have changed them. Meanwhile, the high school hires a new PE teacher, Kikyo Kiri. On the first day, she bumps into Hiroki and is stunned. Here is the boy she confessed to and he refused her."," Comedy, Drama, Romance, Slice of Life", 2005, Completed, Canvas 2
Cap Kakumei Bottleman, ONA," The anime centers around a boy named Kouta Kouka (Kouka Kouta in Japanese name order, an apparent wordplay on Coca-Cola). Kouta strives to be the world's best Bottle King at the Bottle Battles in the virtual Drink World. He comes across his Bottleman partner Colamaru and then wages battles with various rivals."," Action, Game, Kids", 2020, Completed, キャップ革命ボトルマン
Cap Kakumei Bottleman (Dub), ONA," The anime centers around a boy named Kouta Kouka (Kouka Kouta in Japanese name order, an apparent wordplay on Coca-Cola). Kouta strives to be the world's best Bottle King at the Bottle Battles in the virtual Drink World. He comes across his Bottleman partner Colamaru and then wages battles with various rivals."," Action, Game, Kids", 2020, Completed, キャップ革命ボトルマン
Cap Kakumei Bottleman DX, Spring 2022 Anime, Second season of Cap Kakumei Bottleman.," Action, Game, Kids", 2022, Completed," Cap Revolution Bottleman DX, キャップ革命 ボトルマンDX"
Cap Kakumei Bottleman DX Side Story, Special,, Comedy, 2022, Ongoing," Cap Revolution Bottleman DX Side Story, キャップ革命 ボトルマンDX"
Capeta, TV Series," Taira Kappeita, or Capeta, was a 4th grader boy. He had lost his mother when he had been very little. Although he pretended to be tough in front of his father, actually he felt lonely. One day, his father brought junk parts home from his workplace and made a racing cart. Soon, they went to a circuit to drive the cart. However, Capeta found that its… more Taira Kappeita, or Capeta, was a 4th grader boy. He had lost his mother when he had been very little. Although he pretended to be tough in front of his father, actually he felt lonely. One day, his father brought junk parts home from his workplace and made a racing cart.Soon, they went to a circuit to drive the cart. However, Capeta found that its frame was bent and it could hardly run straight. But, with his technique he managed the cart. Furthermore, he followed soon after the fast cart and he could nearly leave it behind. The driver in the cart was Minamoto Naomoi, the champion of the East Japan Junior Cart. Looking at their chase, Naomi’s mother, Minamoto Nanako, advised Capeta to take part in the official race."," Cars, Shounen, Sports", 2005, Completed, カペタ
Capricorn, OVA," n the blink of an eye, high school student Taku Shimamura finds himself transported to the bizarre world of Slaffleaze, where intelligent creatures govern and the ruling class, led by the villainous Zolba, is plotting the invasion of the world they know as Capricorn, the Earth. Joining together with the oppressed Slaffleaze peasants, Taku must find a way to stop Zolba`s dark forces before the way to the unsuspecting Earth is opened. In order to do so, he must first gain the love and trust of the last of the Yappie, the ancestral guardians of Slaffeaze. This is a task that will take more than a little courage and daring, for the last Yappie is not just a cute young female, she`s also a dragon."," Adventure, Comedy, Fantasy, Sci-Fi, Shounen", 1991, Completed, カプリコン
Captain Earth, Spring 2014 Anime," An original mecha anime by the team that made Star Driver. One night right before summer vacation, Daichi Manatsu, a second-year in high school, sees a weird round rainbow floating in the sky above Seed Island (Shuushi/Tane Island) and ventures there alone. He has seen this rainbow before. With the memories of his father's mysterious death and an encounter of a mysterious boy and girl, Daiji arrives on the island while the alarm of a building labeled ""Earth Engine"" is going off. Someone asks him ""Are you a captain?"" just as robotic intruders from Uranus called ""Kiltgang"" arrive. The battle around the shining stars is about to begin."," Action, Mecha, Sci-Fi", 2014, Completed, キャプテン・アース
Captain Future, TV Series," Curtis Newton, aka Captain Future, is an orphan. His parents died in their artificial satellite while he was an infant. His father was a scientist, who has abandoned earth for the satellite to dedicate his life for science along with his aging friend the genius Dr Simon Wright. Wright senses his death, and decides to implant his brain in a mechanical container. They both manufactured a superior robot and an android. Captain future dedicated his life to fight evil along with his three men, the brain, android, and robot."," Action, Adventure, Sci-Fi, Shounen", 1978, Completed,
Captain Harlock (2013), Movie," A CGI remake of the original Captain Harlock series.Captain Harlock rebelled against the Allied Forces and has been plundering space ships for one hundred years. Why did he rebel? How does he survive for one hundred years? With awe and fear of the legendary captain, the Allied Forces issues an order to assassinate Harlock."," Action, Drama, Sci-Fi, Space", 2013, Completed," Space Pirate Captain Harlock, キャプテンハーロック"
Captain Tsubasa, TV Series," Captain Tsubasa is the passionate story of an elementary school student whose thoughts and dreams revolve almost entirely around the love of soccer. 11-year-old Tsubasa Oozora started playing soccer at a very young age, and while it was mostly just a recreational sport for his friends, for him, it developed into something of an obsession.In order to pursue his dream to the best of his elementary school abilities, Tsubasa moves with his mother to Nankatsu city, which is well-known for its excellent elementary school soccer teams. But although he was easily the best in his old town, Nankatsu has a lot more competition, and he will need all of his skill and talent in order to stand out from this new crowd.He encounters not only rivals, but also new friends like the pretty girl Sanae Nakazawa and the talented goalkeeper, Genzo Wakabayashi, who shares the same passion as Tsubasa, and will prove to be a treasured friend in helping him push towards his dreams. Representing Japan in the FIFA World Cup is Tsubasa’s ultimate dream, but it will take a lot more than talent to reach it."," Action, Shounen, Sports", 1983, Completed," Flash Kicker, キャプテン翼"
Captain Tsubasa – Saikyou no Teki! Holland Youth, TV Series," The last Captain Tsubasa movie is about the match between Japan and Holland. After the Japanese team lost two games against this apparently supreme opponent, their confidence is at its lowest point and even Hyuga, having a hurt leg, is desperate. Thus the management tries everything to convince Wakabayashi (living in Germany) and Tsubasa (living in Brazil) to come to Holland and to help them, but both deny. Only in the second half of the third game Tsubasa appears and joins the team, giving them back their confidence and strength. With Tsubasa Ozora as their captain again, the last game ends 11"," Action, Shounen, Sports", 1995, Completed, キャプテン翼　「最強の敵！オランダユース」
Captain Tsubasa (2018), Spring 2018 Anime," Captain Tsubasa is the passionate story of an elementary school student whose thoughts and dreams revolve almost entirely around the love of soccer. 11-year-old Tsubasa Oozora started playing football at a very young age, and while it was mostly just a recreational sport for his friends, for him, it developed into something of an obsession. In order to pursue his dream to the best of his elementary school abilities, Tsubasa moves with his mother to Nankatsu city, which is well-known for its excellent elementary school soccer teams. But although he was easily the best in his old town, Nankatsu has a lot more competition, and he will need all of his skill and talent in order to stand out from this new crowd.He encounters not only rivals, but also new friends like the pretty girl Sanae Nakazawa and the talented goalkeeper, Genzo Wakabayashi, who shares the same passion as Tsubasa, and will prove to be a treasured friend in helping him push towards his dreams. Representing Japan in the FIFA World Cup is Tsubasa’s ultimate dream, but it will take a lot more than talent to reach it."," Action, Shounen, Sports", 2018, Completed, キャプテン翼
