name,Type,Plot Summary,Genre,Released,Status,Other name
Tsurezure Children (Dub), Summer 2017 Anime," A series depicting various scenarios of young love. These stories range from a boy, crippled by his absolute lack of confidence in himself, cannot even accept the fact that the girl of his dreams actually asked him out on a date, to the near-psychotic girl that pours her own blood into her homemade chocolate in order to win his heart."," Comedy, Romance, School, Shounen", 2017, Completed," Tsure*Dure Children, Tsuredure Children, 徒然チルドレン"
Tsurikichi Sanpei, TV Series," Mihira Sanpei talks with a Tohou accent and is a down-to-earth boy with a cheerful and optimistic personality. However, when it comes to fishing, he becomes very serious and is a youth who enjoys fishing more than anything else. The village where he lives in is a natural environment which provides different kinds of fishing challenges. Despite his lack of experience, Sanpei has a first-rate sense with regards to fishing and decides to maxmise his potential by entering into different fishing contests. As he faces various challenges, he learns to solve difficult problems and learn from his mistakes to the extent that he is able to fish anything out of the waters. Along the way, he encounters all kinds of rivals and companions who increase his experience points and help him in his growth."," Adventure, Sports", 1980, Completed,"  Tsurikichi Sampei, Sanpei the Fisherman, Fishing Otaku Sanpei, 釣りキチ三平"
Tsuritama, TV Series," In Enoshima, Yuki is a high school student who’s never been good at making real friends thanks to his abnormally poor communication skills. Haru is the self-styled alien who decides to teach Yuki to fish.Natsuki is an irritable born-and-raised local. Akira is the mysterious Indian who watches them all from a distance. These four meet, fish, and find big adventures on their little island."," Comedy, Ecchi, Slice of Life", 2012, Completed, Tsuritama; つり球
Tsuritama (Dub), TV Series," You can't catch fish if you don't go fishing, and you can't make friends if you don't at least try.Which is how relationship-challenged student Yuki finds himself on a fishing trip to a tiny island with three other boys he barely knows. Well, two other boys and Haru, who claims that he's an alien. Not that constantly stewing Natsuki or mysterious Akira are any more likely as prospects for good companionship.But there's something about fishing that makes it unlike any other pastime, and maybe that quiet sense of companionship and hopeful expectation is just what Yuki needs to start charting the unfamiliar waters of personal connections. Or maybe it will turn out that Haru's right and they're going to have to save the entire planet.There are lots of different kinds of fish stories, from the ""ones that got away"" to the ""best catches ever,"" but whichever way the currents of life take them, for four young men, this trip may turn out to be the biggest whopper ever!"," Comedy, Sci-Fi, Slice of Life, Sports", 2012, Completed, Tsuritama; つり球
Tsurune Movie, Movie, Movie adaptation of Tsurune, Sports, 2022, Upcoming, Gekijōban Tsurune
Tsurune, Fall 2018 Anime," The story follows Minato Narumiya. Minato played Japanese archery in middle school, but after a certain incident, he ran away from the sport. In high school, Minato meets new friends, and together as part of their school's archery club they aim to win the prefectural tournament."," Drama, School, Sports", 2018, Completed, ツルネ ―風舞高校弓道部―
Tsurune, Special, Unaired episode pre-screened at the event and later included with the 5th Blu-ray/DVD release.," Drama, School, Sports", 2019, Completed,
Tsurune, Special, Unaired episode pre-screened at the event and later included with the 5th Blu-ray/DVD release.," Drama, School, Sports", 2019, Completed,
Tsurune, Fall 2018 Anime," The story follows Minato Narumiya. Minato played Japanese archery in middle school, but after a certain incident, he ran away from the sport. In high school, Minato meets new friends, and together as part of their school's archery club they aim to win the prefectural tournament."," Drama, School, Sports", 2018, Completed, ツルネ ―風舞高校弓道部―
Tsurune, Winter 2023 Anime," Protagonist Minato Narumiya has reignited his passion for kyudo, the Japanese martial art of archery. Along with his friends in the school kyudo club, he returns for an all-new second season and feature-length film of Kyoto Animation's beloved Tsurune."," School, Sports", 2023, Completed," Tsurune 2nd Season, Tsurune - The Linking Shot -, ツルネ ―つながりの一射―"
Tsuujou Kougeki ga Zentai Kougeki de Ni-kai Kougeki no Okaasan wa Suki Desu ka?, Summer 2019 Anime," Just when Masato thought that a random survey conducted in school was over, he got involved in a secret Government scheme. As he was carried along with the flow, he ended up in a Game world! As if that wasn't enough, shockingly, his mother was there as well! It was a little different from a typical transported to another world setting, but after some bickering,""Mom wants go on an adventure together with Maa-kun. Can mom become Maa-kun's companion?""With that, Masato and Mamako began their adventure as a mother and son pair. They met Porta, a cute traveling merchant, and Wise, a regrettable philosopher. Along with their new party members, Masato and co. start on their journey."," Adventure, Comedy, Fantasy", 2019, Completed," Do You Like Your Mom? Her Normal Attack is Two Attacks at Full Power, Okaasan online, 通常攻撃が全体攻撃で二回攻撃のお母さんは好きですか？"
Tsuujou Kougeki ga Zentai Kougeki de Ni-kai Kougeki no Okaasan wa Suki Desu ka? OVA, OVA, Okaasan online OVA.," Action, Comedy, Fantasy", 2020, Completed," Do You Like Your Mom? Her Normal Attack is Two Attacks at Full Power OVA, Okaasan online OVA, 通常攻撃が全体攻撃で二回攻撃のお母さんは好きですか？OVA"
Tsuyokiss, TV Series," Sunao Konoe starts her first day at a new school and is surprised to find that there is no theater club. So, she decides to make one of her own.But between a childhood friend showing up, the crazy student body, and the arrogant student council president blocking her at every turn, it seems that actually creating the club is going to be more difficult than she thought.comedy, romance, slice of life"," Comedy, Romance, School, Slice of Life", 2006, Completed, つよきす
Tsuyokute New Saga, TV Series," After a fierce battle, Magic swordsman Kyle finally killed the Demon Lord after being seriously injured in the battle. Kyle on the verge of death approaches a relic which was in possession of the Demon Lord and it sends him to the past. After recovering from the initial shock, he decides to use this opportunity to avoid making the same mistakes of the past and become stronger."," Adventure, Fantasy", 2023, Upcoming, New Saga ; 強くてニューサーガ
Tsuyoshi Shikkari Shinasai, TV Series," Tsuyoshi Ikawa lives at home with his popular and beautiful sisters. Despite their qualities, his sisters and his mother are horrible at household chores, including cooking, so all these duties are taken over by Tsuyoshi while his father is away due to being temporarily transferred to another city for work."," Comedy, Drama, Romance, School, Shounen, Slice of Life", 1992, Completed," Hang in There, Tsuyoshi, Get a Grip, Tsuyoshi, ツヨシしっかりしなさい"
Tuanzimen de Shiming, ONA, No synopsis information has been added to this title. Help improve our database by adding a synopsis, Iyashikei, 2022, Completed, 团子们的使命
Tunshi Xingkong, ONA, No promotional video has been added to this title. Help improve our database by adding a promotional video here., Sci-Fi, 2020, Completed," Swallowed Star, 吞噬星空"
Tunshi Xingkong 2nd Season, ONA, No synopsis information has been added to this title. Help improve our database by adding a," Action, Adventure, Sci-Fi", 2021, Ongoing," 吞噬星空 第二季, Swallowed Star 2"
Turkey!, TV Series,, Slice of Life, 0, Upcoming,
Turn A Gundam, TV Series," It is the Correct Century, two millenniums after a devastating conflict which left the world broken. Earth is now mostly uninhabitable, and thus a remnant of humanity has resided on the Moon while the Earth and its few survivors recover. For years, the ""Moonrace,"" people of the Moon, have continued to check if Earth is fit for resettlement.A boy named Rolan Cehack and two others are sent down to Earth for a reconnaissance mission. Rolan ends up spending a year on the planet working for the Heim Family, aristocrats living in a Victorian-like society. This family, like others of similar wealthy status, celebrates one's coming of age with a ceremony involving a giant stone statue known as the ""White Doll.""To Rolan's surprise, the Moonrace suddenly touches down on Earth with the intent of taking it by force. During the attack, the White Doll is broken apart, revealing a mobile suit called the ""Turn A Gundam"" inside. With Rolan in its cockpit, the Turn A causes a standoff between the forces of Earth and Moon. The young pilot, along with the people of both sides, must keep the peace and avoid another all-out, catastrophic war."," Action, Adventure, Drama, Mecha, Military, Romance, Sci-Fi, Space", 1999, Completed," ∀ Gundam, Mobile Suit Gundam Turn A, ∀ガンダム"
Turn A Gundam I Movie, Movie, A movie retelling of the first half of the Turn A Gundam series.," Action, Drama, Mecha, Military, Sci-Fi, Space", 2002, Completed, ∀ Gundam I
Turn A Gundam II Movie, Movie, The movie retelling of the final half of the Turn A Gundam series.," Action, Drama, Mecha, Military, Sci-Fi, Space", 2002, Completed, ∀ Gundam II
Turning Girls, ONA, The story is about girls who face a battle against the turning point of their lives.," Comedy, Slice of Life", 2013, Completed, ターニングガールズ
Turning Mecard, Winter 2015 Anime," A Korean/Japanese co-production created by Bakugan and Dragon Ball Super contributor Atsushi Maekawa.Turning Mecard stars Jason, a grade-schooler who meets a Mecanimal, a transforming minicar from the alternate world of Triforce, named Evan. Jason and Evan are both searching for missing family members, and team up to help each other. Together, they meet more Mecanimals as they battle across dimensions and learn important lessons along the way."," Adventure, Cars, Game, Kids, Mecha", 2015, Completed," Turning Mecard, 터닝메카드"
Turning Mecard (Dub), Winter 2015 Anime," A Korean/Japanese co-production created by Bakugan and Dragon Ball Super contributor Atsushi Maekawa.Turning Mecard stars Jason, a grade-schooler who meets a Mecanimal, a transforming minicar from the alternate world of Triforce, named Evan. Jason and Evan are both searching for missing family members, and team up to help each other. Together, they meet more Mecanimals as they battle across dimensions and learn important lessons along the way."," Adventure, Cars, Game, Kids, Mecha", 2015, Completed," Turning Mecard, 터닝메카드"
Turning Mecard W, Spring 2016 Anime,," Adventure, Cars, Game, Kids, Mecha", 2016, Completed," Turning Mecard Wing, 터닝메카드 Wing, 터닝메카드 W"
Turning Mecard W Season 2, Spring 2017 Anime, No synopsis information has been added to this title. Help improve our database by adding a synopsis," Adventure, Cars, Game, Magic, Mecha", 2017, Completed," Turning Mecard Wing Season 2, 터닝메카드 Wing 시즌2, 터닝메카드 W 시즌2"
Turning Mecard W, Fall 2017 Anime," It follows the fan favorite character Vandyne as his hidden secrets are revealed. Unlike the Turning Mecard R reboot, which exclusively uses 3DCG visuals, this series is like the earlier entries and is animated with 2D and 3D visuals.The mini-series is part of a new promotional campaign from Sono Kong. The Korean toy manufacturer will launch four new mechanimals this month at retail."," Adventure, Cars, Game, Kids, Mecha", 2017, Completed, Turning Mecard W
TV Yarou Nanaana, TV Series, An adult comedy series about a film crew of banana men who work for a television station. In order to boost ratings they have to follow the absurd requests of the boss.," Adventure, Comedy", 2018, Completed," Wacky TV Na Na Na, テレビ野郎 ナナーナ"
TV Yarou Nanaana, Spring 2020 Anime, Third season of TV Yarou Nanaana.," Adventure, Comedy", 2020, Ongoing," TV Yarou Nanaana Season 3, Televi Yarou Nanana, TV Yarou Nana-na, テレビ野郎 ナナーナ 怪物クラーケンを追え!"
TV Yarou Nanaana, Spring 2019 Anime," After the TV station gets acquired by ""Nanazon Prime Video,"" departments that don't get high ratings will be restructured (aka fired). The shooting crew takes on a large-scale plan for their survival. The Banakawa Family was an extremely wealthy family in the Edo period but their gold was hidden somewhere in a cave (that even the surviving members of the Banakawa Family can't find). So the crew's program will feature them exploring the underground world in search of this hidden treasure that so far major TV station networks with big budgets could not find."," Adventure, Comedy", 2019, Completed," TV Yarou Nanaana Season 2, Televi Yarou Nanana, TV Yarou Nana-na, Wacky TV Nanana 2nd Season"
TWD Express Rolling Takeoff, Movie," Based on a manga by Hijiri Yuki, serialised in Comic Nora.Note"," Adventure, Sci-Fi", 1987, Completed, WD EXPRESS ローリングテイクオフ
Tweeny Witches (Dub), TV Series," Alice believes in magic. With all her heart, she believes that magic is possible and that it can be used for good deeds and fun games. But suddenly, she finds herself transported into another world, ruled by a mysterious elite of witches - and these witches don't seem to be in it for the fun. They're hard at work capturing sprites, the native magical beings of the world, and forcing them into slavery. Once Alice realizes that her new surroundings aren't just a dream, she sets out to change things."," Adventure, Comedy, Fantasy, Magic", 2004, Completed, Mahou Shoujo Tai Arusu; Mahou Shoujo Tai Alice; Mahou Shoujotai; Magic-Girl Squad - Alice; Magical Girl Squad Arusu; Tweeny Witches; 魔法少女隊アルス
Twin Angel, TV Series," Haruka Minazuki and Aoi Kannazuki are freshman high school students and best friends. During the day they help with school activities but at night they thwart enemies like Black Auction and other villains as Red Angel and Blue Angel, the Twin Angel team.", Magic, 2011, Completed, Kaitou Tenshi Twin Angel
Twinkle Heart OVA, OVA," Love, Heaven's greatest treasure went missing and to get it back, the Great God decides to send his two daughters Lemon and Cherry, as well as their governess Berry to find it. However, their search doesn't go so well, mainly because they decide they like it at planet Earth and prefer to work in a hamburger shop (Sic!).In the one-episode OVA, the girls end up searching for the Love treasure on an exotic planet, however they find magical living plushies instead, having to fight their way through them to recover ""Essence of Life,"" which an evil organisation wants to use for nefarious purposes.Read more at http"," Adventure, Comedy, Space", 1986, Completed, Twinkle Heart
Twinkle Nora Rock Me!, OVA," Based on a 1980 manga by Mikuriya Satomi, this adaptation differs considerably from the original. The story started in its prequel was completed with this second OVA."," Action, Sci-Fi", 1984, Completed, トゥインクル NORA(ノーラ) ロック・ミー!
Two Car, Fall 2017 Anime, Two Car follows high schoolers Yuri Miyata and Megumi Meguro as they battle six other rival pairs in the sport of motorcycle sidecar racing., Sports, 2017, Completed, つうかあ
Tytania, TV Series," The capital of the empire of Euria is attacked by the empire of Titania, a much more powerful enemy that controls a large part of the galaxy. The story follows a soldier who flees the Titania empire and seeks refuge with the rebellion force, that rose up since the battle."," Adventure, Military, Psychological, Romance, Sci-Fi, Space", 2008, Completed, タイタニア
