name,Type,Plot Summary,Genre,Released,Status,Other name
Gintama' (2015), Spring 2015 Anime, The Gintama event at Jump Festa 2015 announced on Sunday that a new television anime series has been green-lit. The new series will premiere on TV Tokyo and its affiliates in April 2015.," Action, Comedy, Historical, Parody, Samurai, Sci-Fi, Shounen", 2015, Completed, 銀魂°
Giovanni no Shima, Movie," In the aftermath of the most devastating conflict mankind had ever experienced, the tiny island of Shikotan became part of the Sakhalin Oblast... and on the unhealed border in this remote corner of the world, friendship among children from two different countries timidly blossomed, striving to overcome language barriers and the waves of history. Inspired by true events.On August 15th, they told us we had lost the war. At that time, we did not really understand. Then one day, everything changed. Many soldiers, wearing uniforms we had never seen before, arrived on the island. That was the day I met Tanya."," Drama, Historical", 2014, Completed," Giovanni's Island, ジョバンニの島"
Giovanni no Shima (Dub), Movie," In the aftermath of the most devastating conflict mankind had ever experienced, the tiny island of Shikotan became part of the Sakhalin Oblast... and on the unhealed border in this remote corner of the world, friendship among children from two different countries timidly blossomed, striving to overcome language barriers and the waves of history. Inspired by true events.On August 15th, they told us we had lost the war. At that time, we did not really understand. Then one day, everything changed. Many soldiers, wearing uniforms we had never seen before, arrived on the island. That was the day I met Tanya."," Drama, Historical", 2014, Completed, Giovanni's Island
Girigiri Warukunai Watame, ONA,, Comedy, 2022, Completed," Watame Did Borderline Nothing Wrong, ギリギリわるくないわため"
Girl Meets Girl (Dub), TV Series," Hazumu was a shy boy who enjoyed gardening, collecting herbs, and long walks in the mountains. One day he finally worked up the courage to confess his love to Yasuna, but she rejected him. Depressed, he wandered up Mt. Kashimayama, the place where they first met, to reconsider his feelings. After getting lost, he wished upon a shooting star and received a bizarre twist of fate. Now he is a she, and she stumbles headfirst back into social life and relationships only to find that the entire landscape has changed!"," Comedy, Drama, Romance, School, Shoujo Ai, Slice of Life", 2006, Completed, Kashimashi
Girlfriend (Kari), Fall 2014 Anime, A TV anime adaptation of the Girlfriend (Kari) a mobile game where players can have girlfriends through playing the game.," School, Slice of Life", 2014, Completed," Girl Friend Beta, ガールフレンド(仮)"
Girlfriend (Note), TV Series," One day, after the ending of World Dance Battle Royale, it has been unexpectedly decided that the nonet will work together with ""Ootori"" members from Ootoriutain High School to create a drama. The drama is an original story based on Cinderella with an arrangement. It has been decided that Momoko Asahina will play Cinderella and Miyabi Kunishiro the prince. Also, an unexpected role has been decided for Kokomi Shiina. A drama between a slightly different nonet and Ootori members has begun."," Music, School", 2016, Completed, Girl Friend Note
Girls & Panzer Movie Specials, Special, Specials included with the Blu-ray and DVD releases of Girls & Panzer Movie. Arisu War! (愛里寿・ウォー！) takes place after the events of the movie and Akiyama Yukari no Sensha Kouza (秋山優花里の戦車講座) are another two standard Yukari tank corner explanation videos.," Military, School", 2016, Completed, Girls und Panzer der Film
Girls & Panzer Specials (Dub), Special, Mini episodes bundled with Blu-rays and DVDs.," Military, School", 2012, Completed," Girls und Panzer Special, ガールズ&パンツァー"
Girls & Panzer, Special, Girls und Panzer specials with Yukari Akiyama explaining the background of tank units that appear in the series.," Military, School", 2012, Completed, Girls und Panzer
Girls & Panzer, OVA," After a brilliant victory over Saunders University High School, girls from Ooarai now have to face Italian-themed Anzio Girls High School in the second round of the 63rd National High School Sensha-Dou Tournament. The high-spirited girls from Anzio, led by the charismatic Chiyomi Anzai, advance toward the battle equipped with baffling tactics and a secret weapon.Ooarai will soon find out that what seemed to be a mere formality might take an unexpected and possibly disastrous turn. Whether they will win the match, or lose and doom their school to a closure, is still on a knife-edge."," Military, School, Sports", 2014, Completed, Girls & Panzer
Girls & Panzer, Movie," 7.95Ranked #622Popularity #2967Members 38,534MovieActasAdd to ListSelectEpisodes"," Military, School", 2017, Completed," Girls und Panzer das Finale – Part 1, ガールズ＆パンツァー 最終章』第1話"
Girls & Panzer, Movie, The second film in the six-part Girls & Panzer," Military, School", 2019, Completed," Girls und Panzer das Finale, 『ガールズ＆パンツァー 最終章』第2話"
Girls & Panzer, Movie," Despite having the upper hand, BC Freedom High School suffers a thorough defeat at the hands of Ooarai Girls Academy. Following their victory, the Ooarai girls decide to take a break before the next round. After discovering that Momo Kawashima is taking care of her family while studying for the university entrance exams, the rest of the Ooarai team become more determined to win the Winter Continuous Track Cup for the sake of Momo and her family.Meanwhile, the second round of the tournament has started, and Ooarai now has to face Chi-Ha-Tan Academy. Having learned from the first round to not underestimate their enemies, Ooarai slowly approaches their opponent on the thick jungle battlefield.Despite their best attempts to be cautious, Ooarai is immediately put in a difficult situation as Chi-Ha-Tan employs several new strategies devised by Haru Fukuda. Finding themselves between a rock and a hard place, Ooarai must claw their way out to claim another comeback victory and keep their championship hopes alive."," Military, School", 2019, Completed," Girls und Panzer das Finale – Part 2, 『ガールズ＆パンツァー 最終章』第2話"
Girls & Panzer, Movie, The third film in the six-part Girls & Panzer," Military, School", 2021, Completed," 『ガールズ＆パンツァー 最終章』第3話, Girls und Panzer das Finale – Part 3"
Girls & Panzer, Movie," The quarterfinal round of the Winter Continuous Track Cup is in full swing, and each school is going all out. What started as a furious back-and-forth firefight between Ooarai Girls Academy and Chi-Ha-Tan Academy has become a 12-hour jungle slugfest with neither team having the advantage and almost everyone running on fumes. In spite of this, Miho Nishizumi and her teammates continue to fight into the morning, hoping to land a decisive blow before their rivals.Meanwhile, Kuromorimine Girls Academy—now led by Erika Itsumi—is struggling in its match against Pravda High School. Taking Maho Nishizumi's words of advice to heart, Erika manages to break free of Kuromorimine's rigid, traditional tactics and turn the tide in her favor. At the same time, St. Gloriana Girls College faces off against Anzio High School, while Saunders University High School has a tough fixture with underdog Continuation High School and its mysterious sharpshooter, Jouko.With only four semifinal spots up for grabs, the members of each team must give their absolute best performance if they want to survive and successfully make it to the next round!"," Military, School", 2021, Completed," Girls und Panzer das Finale – Part 3, 『ガールズ＆パンツァー 最終章』第3話"
Girls & Panzer, Special, Specials included with Girls & Panzer," Comedy, Military, School", 2021, Completed," Girls und Panzer das Finale OVA, Girls & Panzer"
Girls & Panzer, Special, Specials included with Girls & Panzer," Comedy, Military, School", 2021, Completed, Girls & Panzer
Girls & Panzer, Movie, The fourth film in the six-part Girls & Panzer," Military, School", 0, Upcoming, Girls und Panzer das Finale Part 4 ; 『ガールズ＆パンツァー 最終章』第4話
Girls & Panzer, Special," Specials aired between episodes five and six and episodes ten and eleven, both recapitulation episodes."," Military, School", 2012, Completed," Girls und Panzer Recap, Girls und Panzer"
Girls & Panzer, Special, Special included with Girls & Panzer," Comedy, Military, School", 2020, Completed, Girls & Panzer
Girls Band Cry, TV Series,, Music, 0, Upcoming,
Girls Bravo, TV Series," Small for his age, Yukinari has been bullied and abused by girls all his life. Now in high school, he has developed a rare condition"," Comedy, Ecchi, Fantasy, Harem, Romance, School", 2004, Completed," GIRLSブラボー first season, GIRLSブラボー second season"
Girls Bravo, TV Series," Small for his age, Yukinari has been bullied and abused by girls all his life. Now in high school, he has developed a rare condition"," Comedy, Ecchi, Fantasy, Harem, Romance, School", 2004, Completed, GIRLSブラボー first season
Girls Bravo, TV Series," Small for his age, Yukinari has been bullied and abused by girls all his life. Now in high school, he has developed a rare condition"," Comedy, Ecchi, Fantasy, Harem, Romance, School", 2005, Completed, GIRLSブラボー second season
Girls und Panzer, TV Series, Plot Summary," Military, School", 2012, Completed," Girls & Panzer, ガールズ&パンツァー"
Girls und Panzer (Dub), TV Series," Imagine a world where humanity lives on enormous carrier ships. In Girls und Panzer, not only do these community ships support entire towns, they also host military-themed sports events that use tanks. Popular among high school girls, tankery, as the sport is known, claims to make young women strong, graceful, and popular with boys.Despite this, not every girl likes tankery. Miho Nishizumi comes from a long line of famous tankery practitioners, but a traumatic event drove her to abandon the sport. She even goes as far as to transfer to Oarai High School because it has no tankery team. Unfortunately, Miho joins the student body just as they're about to resurrect the sport. Because she's the only girl in the entire high school with prior tankery experience, the student council forces her to join the team. Can Miho's new friends and teammates help her overcome her traumatic past experiences and go on to win the national tankery championships?"," Military, School", 2012, Completed," Girls & Panzer, ガールズ&パンツァー"
Girls und Panzer das Finale, Movie," Rumor has it that Momo Kawashima, former student council member at Ooarai Girls Academy, is bound to repeat a year. Having failed her university entry exams, she is far from spending another year at Ooarai, but her plight is unenviable nevertheless.The only way for her to gain admission into a university is to be granted an athletic scholarship. With the Winter Continuous Track Cup rapidly approaching, Momo becomes the commander of Ooarai's tankery team, so as to demonstrate her sport skills and wipe away the stain on her honor.Their first opponent—French-themed BC Freedom High School—is split into two factions that are constantly at odds with each other. Despite this seemingly fortuitous match against a disorganized rival, Ooarai might soon find itself taking one step too far."," Military, School", 2017, Completed, Girls & Panzer
Girls und Panzer der Film, Movie," Sometime after the 63rd sensha-dou tournament, the Japanese Ministry of Education decides to move forward with its plan to decommission Ooarai Girls High School despite their recent triumph in the championship. In order to keep the school open, Miho and her team must win a match against a university sensha-dou team. For this difficult battle, Miho and the others count with the help of their friends from the other schools they previously faced, as well as assistance from new friends from the Chihatan Academy and Keizoku High School. Together, they will join forces to save Ooarai."," Military, School", 2015, Completed, ガールズ&パンツァー 劇場版
Girls und Panzer Specials , TV Series, Plot Summary," Military, School", 2012, Completed," Girls & Panzer OVAs, ガールズ&パンツァー"
Girls und Panzer, TV Series, The story is based on the battle against Anzio High School.," Military, School", 2014, Completed, ガールズ&パンツァー　これが本当のアンツィオ戦です！
Girly Air Force, Winter 2019 Anime," Mysterious flying creatures known as Zai suddenly appear, and in order to fight the creatures, mankind creates fighter aircraft called ""Daughters,"" as well as the automatic fighting mechanism ""Anima,"" which are shaped like human girls. The story centers on a young man named Kei Narutani, who yearns to fly in the sky, and an Anima considered to be humanity's trump card, a girl name Gripen."," Action, Sci-Fi", 2019, Completed, ガーリー・エアフォース
Given, Summer 2019 Anime," ""It's stuck deep inside me and I can't get it out of my head. Mafuyu's voice is an insane and dangerous weapon.""That day, Ritsuka Uenoyama started to feel that playing the guitar and playing basketball, both of which he liked very much, were becoming boring. He then encounters Mafuyu Sato, who's holding onto a broken guitar, and decides to fix it. The moment Uenoyama finishes fixing the guitar, Mafuyu becomes completely attached to him. However, after hearing Mafuyu sing it leaves a deep impression on him."," Drama, Music, Romance, Shounen Ai", 2019, Completed, ギヴン
Given (Dub), Summer 2019 Anime," Tightly clutching his Gibson guitar, Mafuyu Satou steps out of his dark apartment to begin another day of his high school life. While taking a nap in a quiet spot on the gymnasium staircase, he has a chance encounter with fellow student Ritsuka Uenoyama, who berates him for letting his guitar's strings rust and break. Noticing Uenoyama's knowledge of the instrument, Satou pleads for him to fix it and to teach him how to play. Uenoyama eventually agrees and invites him to sit in on a jam session with his two band mates"," Drama, Music, Romance, Shounen Ai, Slice of Life", 2019, Completed, ギヴン
Given Movie, Movie," While the TV anime focused on the band given's guitarist Ritsuka Uenoyama and his high school classmate Mafuyu Sato, the film centers on the love relationship among the band's bassist Haruki Nakayama, drummer Akihiko Kaji, and Akihiko's roommate and ex-boyfriend Ugetsu Murata."," Drama, Music, Romance, Shounen Ai, Slice of Life", 2020, Completed, 映画 ギヴン
Given, OVA," The OVA, bundled with the special edition version of the seventh manga volume, will tell an ""other side"" story centered on Mafuyu Satou and Ritsuka Uenoyama that wasn't featured in the Given movie."," Drama, Music, Romance, Shounen Ai, Slice of Life", 2021, Completed," Given OVA, Given OAD, ギヴン うらがわの存在"
GJ-bu, TV Series," TV anime adaptation of the GJ-bu moe light novel series, dubbed as the “first four-panel novel”, where each story is only four pages long with illustrations."," Comedy, School, Slice of Life", 2013, Completed, GJ部
[email protected], TV Series," It is the spring break immediately after Mao and the others graduate. It is the season of cherry blossoms, and the new school term will soon begin. One day, Kyouya is suddenly stuffed into a bag. When he is let out, the scenery he sees around him is that of New York—except the room looks exactly like the GJ Club's room."," Comedy, School, Slice of Life", 2014, Completed, GJ部@
GJ8man, ONA," Gorou Joe is a boy who lives a carefree life in the small historical town of Gujo Hachiman in Gifu prefecture. One day an old self-professed ""water fairy"" appears in front of Joe, and tells him to help people, and grants Joe the power to turn into ""GJ8 Man"" (a pun on Gujo Hachiman, as the number 8 is pronounced ""hachi"" in Japanese, and the ""hachi"" in ""Hachiman"" uses the kanji for the number 8)."," Comedy, Super Power", 2016, Completed, GJ8マン
Glamorous Heroes, Fall 2017 Anime,," Action, Sci-Fi", 2017, Completed, グラマラスヒーローズ
Glass Fleet, TV Series," The People’s Army led by Michel stands against Vetti’s newly founded empire. Upon seeing how strong the Glass Battleship is, Michel tries to get Cleo, the captain of the Glass Battleship, to help People’s Army overthrow Vetti’s empire. And together they fight against Vetti’s empire."," Adventure, Sci-Fi", 2007, Completed, Glass no Kantai
Glass Mask, TV Series," Kitajima Maya, a 13-year old girl with a talent for acting, was discovered by the reclusive actress Tsukikage. The story follows Maya's growing up, intense training, overcoming challenges, and evolving into the foremost actress of her generation (she is about 20 so far). Maya's greatest rival is Himekawa Ayumi, the beautiful daughter of a famous movie couple. They ultimately vied for the most sought-after role - the ""Crimson Goddess"". An equally important subplot Maya's relationship with the handsome and ruthless entertainment mogul Hayami Masumi, who secretly became her number one fan, but misunderstandings and bad-timing obstructed their romance..."," Drama, Romance, Shoujo", 1984, Completed," Glass no Kamen, ガラスの仮面"
Glass no Hana to Kowasu Sekai, Movie, A floating space without gravity where an infinite number of lights shine in different colors, Sci-Fi, 2016, Completed," Garakowa -Restore the World-, ガラスの花と壊す世界"
Glass no Kamen (2005), TV Series," Two Girls. One Dream. And the entire world for a stage.At 13 years old, Maya Kitajima seems destined to spend the rest of her life toiling in a crowded restaurant alongside her bitter and unstable mother. But when her incredible acting talent is discovered by the legendary diva Chigusa Tsukikage, Maya finds a new future filled with both golden opportunities and terrifying risks.For Ayumi Himekawa, success has always been assured, yet she longs to be recognized for her own talents and skills, not her famous parents' connections.For both, the ultimate prize is the role of The Crimson Goddess in the play of the same name, a part created by Chigusa. To achieve this goal, both Maya and Ayumi must seek out and conquer every acting challenge, pushing the limits of their talent and endurance to the utmost, until they are worthy of the part…But for one to win, the other must fail!"," Drama, Shoujo", 2005, Completed," Glass Mask, Glass Mask (2005), ガラスの仮面 (2005)"
Glass no Kantai, TV Series," The People's Army led by Michel stands against Vetti's newly founded empire. Upon seeing how strong the Glass Battleship is, Michel tries to get Cleo, the captain of the Glass Battleship, to help People's Army overthrow Vetti's empire. And together they fight against Vetti's empire."," Adventure, Sci-Fi", 2006, Completed, Glass Fleet
Glasslip, Summer 2014 Anime," On the other side of the glass, you can see tomorrow.Fukami Touko is a 17-year-old girl born in Fukui Prefecture. Her dream is to become a glass artisan"," Romance, Slice of Life, Supernatural", 2014, Completed, グラスリップ
Gleipnir, Spring 2020 Anime," What does one consider to be a monster? A horrible bloodsucking vampire? Frankenstein's creation? Shuichi Kagaya has a secret. Other than having great grades and being skilled at sports, he isn’t what one would call normal. In fact, Shuichi cannot even be considered human.One fateful morning, he woke up as a monster. With brute strength, an abnormally strong sense of smell, big fluffy paws, and the depression and self-hate that comes after losing one's humanity, his life was suddenly flipped upside down. Claire Aoki, the girl he had decided to save, now holds his secret over his head. Claire is a sadistic and utterly twisted girl, with no sense of empathy toward the lives of others. Before meeting Shuichi, she was in the search of monsters, hoping to find her monster sister. Despite becoming a monster, Shuichi naively continues to hold onto his human morals, but how long can one last in this insufferable way of living?"," Action, Ecchi, Mystery, Seinen, Supernatural", 2020, Completed, グレイプニル
Gleipnir (Dub), Summer 2020 Anime," Shuuichi Kagaya is what one would consider an average high school student, but sometimes, he turns into a monster. He doesn't know how or why he got his abilities, only that he would prefer no one knows about them. One night, he finds a building ablaze with a girl trapped inside. Deciding to save her, he transforms and carries her to safety, but accidentally drops his phone.The next day, the girl he saved—Claire Aoki—finds him and confronts him about his monster identity. She even goes so far as to push him off the school roof to prove her theory after Shuuichi denies her allegations. Desperate to save himself, he transforms, and Claire snaps a picture in order to blackmail him into telling her everything he knows about monsters, which, ironically, isn't much.As it turns out, Claire has a secret of her own"," Action, Ecchi, Mystery, Seinen, Supernatural", 2020, Completed, グレイプニル
Go-Q-Choji Ikkiman, TV Series," Ikkiman is super human alien, but he doesn't know it. He was raised in a farm by an old couple. When his girlfriend dumps him to become a star, Ikkiman swears to himself that he will become a super star even more famous then her so they can get back together, and so he leaves the farm for the city. There, he interrupts the match of the Battle-ball team ""Blue Planets,"" the battle-ball champions of the earth, and decides to join them with his superhuman discovered abilities. With the Blue planets, Ikkiman will play against alien enemy's for the title of champion and for the sake of the planet Earth."," Sci-Fi, Sports, Team Sports", 1986, Ongoing," Battle Ball, Battle Ball Boy Wonder Ikkiman, 剛Q超児イッキマン"
Go! Go! 575, Winter 2014 Anime," Go! Go! 575 adapts the Project 575 games for PlayStation Vita and iOS, which allow anyone to create songs using the traditional Japanese 5-7-5-syllable meter found in haiku and tanka poems.", Slice of Life, 2014, Completed, ゴ～！ゴ～！ご～しちご～
Go! Go! 575, Special, Go! Go! 575 Special," Music, Slice of Life", 2014, Completed, GO! GO! 575 「めいっぱいに、はじけてる？」
Go! Go! Ackman	, OVA," First released to public at 1994 V-Jump Festa, later it became a special video feature to be requested by V-Jump purchasers."," Action, Comedy, Demons, Supernatural", 1994, Completed, GO! GO! ACKMAN
Go! Go! Atom (Dub), Fall 2019 Anime," The eco-systems of planet Earth are endangered. Lucky for us, a super-powered robot boy is flying to rescue! astro in on a mission to help anyone anywhere in the world with a problem involving natural phenomena. Go little Astro Boy! GO!"," Action, Adventure, Drama, Kids, Mecha, Sci-Fi", 2019, Completed," Go Astro Boy Go!, GO!GO!アトム"
Go! Go! Vehicle Zoo, ONA,, Kids, 2023, Ongoing, ゴー！ゴー！びーくるずー
Go! Princess Precure, Winter 2015 Anime," Go! Princess PreCure is set in a boarding junior high school, named Noble Gakuen (Noble Academy). The protagonist Haruka Haruno is a 13-year-old first year student. Her big dream is to be a princess someday, because she has admired a princess in the picture book she has kept since her childhood. One day she transforms into Cure Flora with ""Dress Up Key"" which Prince Kanata of Hope Kingdom gave her as a good luck charm when she was little. Then she also finds other PreCure girls in her school, 14-year-old Minami Kaidou as Cure Mermaid and 13-year-old Kirara Amanogawa as Cure Twinkle. As the Princess PreCure team, with two fairies Pafu and Aroma, they decide to fight againstdark witch Disupia (or Despair) who hates all the dreams in the world and wants to turn them to despair."," Fantasy, Magic, Shoujo", 2015, Completed, Go! プリンセスプリキュア
Go! Princess Precure Movie, Movie," Part 1, Pumpkin Oukoku no Takaramono, will feature the four Precure girls from Go! Princess Precure trying to rescue a princess who is held captive.Part 2, Precure to Refi no Wonder Night!, is set in the Night Kingdom lost its daytime, the Precure team fight to take the daytime back alongside the princess Refi.Part 3, Cure Flora to Itazura Kagami, will be a dialogue-less story featuring Cure Flora and a mischievous ghost in a mirror."," Fantasy, Kids, Magic, Shoujo", 2015, Completed, 映画Go! プリンセスプリキュア Go! Go!! 豪華3本立て!!!
Goblin Slayer, Fall 2018 Anime," A young priestess has formed her first adventuring party, but almost immediately they find themselves in distress. It's the Goblin Slayer who comes to their rescue—a man who's dedicated his life to the extermination of all goblins, by any means necessary. And when rumors of his feats begin to circulate, there's no telling who might come calling next..."," Action, Fantasy", 2018, Completed, ゴブリンスレイヤー
Goblin Slayer (Dub), Fall 2018 Anime," A young priestess has formed her first adventuring party, but almost immediately they find themselves in distress. It's the Goblin Slayer who comes to their rescue—a man who's dedicated his life to the extermination of all goblins, by any means necessary. And when rumors of his feats begin to circulate, there's no telling who might come calling next..."," Action, Fantasy", 2018, Completed, ゴブリンスレイヤー
Goblin Slayer 2nd Season, TV Series, Second season of Goblin Slayer.," Action, Adventure, Fantasy", 2023, Upcoming, ゴブリンスレイヤー
