name,Type,Plot Summary,Genre,Released,Status,Other name
Piano no Mori, Movie,," Adventure, Comedy, Drama, Music, School, Seinen", 2007, Completed," The Perfect World of Kai, Piano Forest, ピアノの森 The Perfect World of Kai"
Piano no Mori (TV), Spring 2018 Anime," A tranquil tale about two boys from very different upbringings. On one hand you have Kai, born as the son of a prostitute, who's been playing the abandoned piano in the forest near his home ever since he was young. And on the other you have Syuhei, practically breast-fed by the piano as the son of a family of prestigious pianists. Yet it is their common bond with the piano that eventually intertwines their paths in life."," Adventure, Comedy, Drama, Music, School, Seinen", 2018, Completed," Piano Forest, The Perfect World of Kai, ピアノの森"
Piano no Mori (TV) (Dub), Spring 2018 Anime," A tranquil tale about two boys from very different upbringings. On one hand you have Kai, born as the son of a prostitute, who's been playing the abandoned piano in the forest near his home ever since he was young. And on the other you have Syuhei, practically breast-fed by the piano as the son of a family of prestigious pianists. Yet it is their common bond with the piano that eventually intertwines their paths in life."," Adventure, Comedy, Drama, Music, School, Seinen", 2018, Completed, ピアノの森
Piano no Mori (TV) 2nd Season, Winter 2019 Anime, Second season of Piano no Mori.," Comedy, Drama, Music, School, Seinen", 2019, Completed, ピアノの森 第2シリーズ
Piano no Mori (TV) 2nd Season (Dub), Winter 2019 Anime, Second season of Piano no Mori.," Comedy, Drama, Music, School, Seinen", 2019, Completed, ピアノの森 第2シリーズ
Pikaia!, Spring 2015 Anime, No synopsis has been added for this series yet.," Drama, Kids, Slice of Life", 2015, Completed, ピカイア！
Pikaia!!, Winter 2017 Anime, Second season of Pikaia!.," Drama, Kids, Slice of Life", 2017, Completed, ピカイア!!
Pikotarou no Lullaby Lullaby, Summer 2017 Anime," Piko-tarou will improvise the story of each three-minute episode using an illustration by the anime's director Takashi Taniguchi. He will tell each story in the style of a fairy tale and voice every character, including himself.", Comedy, 2017, Completed, ピコ太郎のララバイラーラバイ
Pikotarou no Lullaby Lullaby (Web), ONA," Pikotaro breaks new ground. Drawing inspiration from illustrations by director Taniguchi, he does the unthinkable", Comedy, 2017, Completed," Pikotaro's Lullaby La La By,ピコ太郎のララバイラーラバイ"
Pilot Candidate, TV Series,"  In the future humankind has expanded and colonized other planets. Then an alien species, Victim, attacks the human colonies leaving only one planet, Zion. In an effort to stop Victim from destroying the last planet a training school, GOA, is set up to gather boys from the Zion colonies and train them to become pilots of the Ingrids AKA The Goddesses, five fighting robots that protect Zion. The boys must possess a rare blood type, EO , as well as a special ability, or EX. Zero (Candidate 88) has just arrived in GOA when he falls into the cockpit of the Ingrid Eeva-Leena.Since the synch between pilot and Ingrid are very sensitive everyone believes the Goddess will kill Zero in an attempt to synch. Just before Zero passes out he makes a full synch with the Goddess. Before he can find out more about the incident, his pilot training begins."," Action, Mecha, Military, Sci-Fi, Space", 2000, Completed," Megami Kouhosei, 女神候補生"
Ping Pong Club (Dub), TV Series," Inaho Jr. High's Boys Ping Pong Club has only 6 members, the club minimum. Takeda is your average nice guy. Kinoshita is good looking and popular with girls. Unfortunately, the rest are branded as losers. Tanabe is too foreign, while Tanaka is petite and perverse. Maena and Izawa are truly deviant, and their crazed antics have earned the team some powerful enemies. In spite of their differences, the team needs to work together to retain their practice room and club status.(Source"," Comedy, Ecchi, School, Sports", 1995, Completed," Ike! Ina-chuu Takkyuubu, The Ping-Pong Club, Go! Ina Junior High Ping-Pong Club, 行け! 稲中卓球部"
Ping Pong The Animation, Spring 2014 Anime," The manga revolves around two longtime friends Smile and Peco who are both members of the ping pong club at their high school and are both very talented at the sport. However, Smile's quiet personality keeps him from being able to win against Peco. The club's teacher takes notice of Smile's talent and works to change his attitude toward the sport."," Seinen, Sports", 2014, Completed, ピンポン THE ANIMATION
Ping Pong The Animation (Dub), TV Series," ""The hero comes. The hero comes. The hero comes. Chant these words in your mind, and I'll surely come to you..."" This mantra is what Makoto Tsukimoto repeats as a source of motivation when he fights through the stress of not only grueling ping pong matches, but also in situations of his life. Makoto doesn't fight alone; he and his friend, Yukata Hoshino, nicknamed Smile and Peco respectively, are two boys who have grown up playing ping pong together nearly every day. Peco, brimming with confidence, aims to be the best table tennis player in the world; Smile, on the other hand, shows little ambition. Nevertheless, the two have always stuck together, with a bond built upon their mutual love for this sport.Every year, students from all across Japan gather for the inter-high table tennis competition to achieve national and international stardom. Through intense training and competition, only the very best persevere.From the avant-garde director of Tatami Galaxy, Masaaki Yuasa, Ping Pong The Animation serves a tale of ambition with its fair share of bumps along the way. Whatever the odds, Peco and Smile will face them together.[Written by MAL Rewrite]"," Psychological, Seinen, Sports", 2014, Completed, ピンポン THE ANIMATION
Pingu in the City, Fall 2017 Anime," Pingu and his family move from their small village to the big city; in which there are many people with many different occupations. The ever-curious Pingu tries to join them at their jobs, but his mischievous side gets the better of him and he ends up messing things up.", Kids, 2017, Completed, Pingu
Pingu in the City (2018), TV Series," Pingu continues his misadventures in the big city, now with even more different jobs for him to mess up as a result of his adorable clumsiness and affinity for mischief. Join him on his curious capers as he wreaks havoc across the city."," Comedy, Kids, Slice of Life", 2018, Completed," Pingu in the City, ピングー in ザ・シティ"
Pita Ten, TV Series,"  Kotaro is a child who has lost his mother, one day, he runs into the pinkhaired Misha, an apprentice angel. Together with Ten-chan and Koboshi, they get into all kinds of weird situations. Especially when they come across Shia-san, a demon apprentice, who is actually too kind to be able to be a demon."," Seinen, Sports", 2014, Completed, ぴたテン
PJ Berri no Mogumogu Munyamunya Season 2, TV Series, The second season of PJ Berri no Mogumogu Munyamunya. Its broadcast will be in the same timeslot as the re-airing of the original 2001 Parappa the Rapper anime on Fuji TV., Comedy, 2017, Completed," PJ Berri no Mogu Mogu Munya Munya Season 2, PJベリーのもぐもぐむにゃむにゃ シーズン２"
Planet Hulk (Dub), Movie," The Incredible Hulk, ejected from Earth in a spaceship, crash-lands on a planet ruled by a tyrant, who forces him to fight in a coliseum against other powerful creatures. The Hulk reluctantly befriends the combatants on his team."," Action, Adventure, Fantasy, Sci-Fi", 2010, Completed,
Planet With, Summer 2018 Anime,," Action, Mecha, Sci-Fi", 2018, Completed, プラネット・ウィズ
Planetarian, Summer 2016 Anime," It is thirty years after the failure of the Space Colonization Program. Humanity is nearly extinct. A perpetual and deadly Rain falls on the Earth. Men known as ""Junkers"" plunder goods and artifacts from the ruins of civilization. One such Junker sneaks alone into the most dangerous of all ruins—a ""Sarcophagus City."" In the center of this dead city, he discovers a pre-War planetarium. And as he enters he is greeted by Hoshino Yumemi, a companion robot. Without a single shred of doubt, she assumes he is the first customer she's had in 30 years. She attempts to show him the stars at once, but the planetarium projector is broken. Unable to make heads or tails of her conversation, he ends up agreeing to try and repair the projector...", Drama, 2016, Completed," Planetarian, Planetarian"
Planetarian, Summer 2016 Anime," It is thirty years after the failure of the Space Colonization Program. Humanity is nearly extinct. A perpetual and deadly Rain falls on the Earth. Men known as ""Junkers"" plunder goods and artifacts from the ruins of civilization. One such Junker sneaks alone into the most dangerous of all ruins—a ""Sarcophagus City."" In the center of this dead city, he discovers a pre-War planetarium. And as he enters he is greeted by Hoshino Yumemi, a companion robot. Without a single shred of doubt, she assumes he is the first customer she's had in 30 years. She attempts to show him the stars at once, but the planetarium projector is broken. Unable to make heads or tails of her conversation, he ends up agreeing to try and repair the projector...", Drama, 2016, Completed," Planetarian, Planetarian"
Planetarian, Movie," An adaptation of the visual-novel by Key, Planetarian"," Drama, Sci-Fi", 2016, Completed, planetarian～星の人～
Planetarian, OVA," The new OVA will feature the prequel short story ""Snow Globe,"" which debuted as part of a light novel volume that bundled with a limited-edition version of the original PC game."," Drama, Sci-Fi", 2021, Completed, planetarian ~雪圏球[スノーグローブ]~
Planetarium Uchuu Kyoudai, Movie," The anime's original story features Mutta and Hibito during one summer when they were children. During the summer when Mutta and Hibito made their promise to go to space, they met a young girl who also had a wish."," Comedy, Sci-Fi, Seinen, Slice of Life", 2012, Completed, プラネタリウム 宇宙兄弟 ～一点のひかり～
Planetes, TV Series," In 2075, space travel is no longer just a dream, but an everyday reality for mankind. Advancements in science and technology have led to the colonization of the moon, the commercialization of outer space, and the formation of large space corporations. Ai Tanabe, an upbeat woman whose interests lie in the cosmos, joins Technora Corporation as a member of their Debris Section, a department dedicated to the removal of dangerous space junk between the orbits of the Earth and Moon.However, Ai soon discovers how unappreciated her job is. As the laughingstock of Technora, the Debris Section is severely understaffed, poorly funded, and is forced to use a dilapidated spaceship nicknamed the ""Toy Box"" for debris retrieval. Undeterred, Ai perseveres and gradually becomes acquainted with the strange personalities that make up the Debris Section's staff, such as the bumbling but good-natured chief clerk Philippe Myers; the mysterious and tight-lipped temp worker Edelgard Rivera; and the hotheaded and passionate Hachirouta Hoshino, who longs for a spaceship to call his own.Planetes is an unconventional sci-fi series that portrays the vastness of space as a backdrop for the personal lives of ordinary people—people who may have been born on Earth, but whose hopes and dreams lie amongst the stars."," Drama, Romance, Sci-Fi, Seinen, Space", 2003, Completed, プラネテス
Planetes (Dub), TV Series," In 2075, space travel is no longer just a dream, but an everyday reality for mankind. Advancements in science and technology have led to the colonization of the moon, the commercialization of outer space, and the formation of large space corporations. Ai Tanabe, an upbeat woman whose interests lie in the cosmos, joins Technora Corporation as a member of their Debris Section, a department dedicated to the removal of dangerous space junk between the orbits of the Earth and Moon.However, Ai soon discovers how unappreciated her job is. As the laughingstock of Technora, the Debris Section is severely understaffed, poorly funded, and is forced to use a dilapidated spaceship nicknamed the ""Toy Box"" for debris retrieval. Undeterred, Ai perseveres and gradually becomes acquainted with the strange personalities that make up the Debris Section's staff, such as the bumbling but good-natured chief clerk Philippe Myers; the mysterious and tight-lipped temp worker Edelgard Rivera; and the hotheaded and passionate Hachirota Hoshino, who longs for a spaceship to call his own.Winner of the Seiun Award in 2005, Planetes is an unconventional sci-fi series that portrays the vastness of space as a backdrop for the personal lives of ordinary people—people who may have been born on Earth, but whose hopes and dreams lie amongst the stars.[Written by MAL Rewrite]"," Drama, Romance, Sci-Fi, Seinen, Space", 2003, Completed," ΠΛΑΝΗΤΕΣ, プラネテス"
Planzet, Movie," In 2047, an unknown, alien life-form descends upon the Earth, destroying all the major cities in one fell swoop. The survivors unite and build a Diffusor to stop the Februus, the invaders the military would later codename the FOS, and a temporary peace is achieved. Jump forward to 2053, the present. Planzet"," Action, Mecha, Sci-Fi", 2010, Completed, プランゼット
Planzet (Dub), Movie," In 2047, an unknown, alien life-form descends upon the Earth, destroying all the major cities in one fell swoop. The survivors unite and build a Diffusor to stop the Februus, the invaders the military would later codename the FOS, and a temporary peace is achieved. Jump forward to 2053, the present. PLANZET"," Action, Mecha, Sci-Fi", 2010, Completed, プランゼット
Plastic Little, Movie," The main character of Plastic Little is Tita Mu Koshigaya, Tita to her friends, a young woman who captains a ship, the Cha-Cha Maru, whose business is capturing exotic creatures in the sea of clouds of the planet Ietta, apparently a gas giant of some kind, and selling them to collectors and zoos. By chance, she saves Elysse Aldo Mordish, a young woman of her own age, from a rogue faction of Ietta's own military forces, led by the armored commander Guizel, who already killed Elysse's scientist father. As the military conducts a vicious chase for Elysse, it becomes apparent that she holds the key to a secret that could determine the fate of the entire planet's independence."," Action, Adventure, Comedy, Ecchi, Mecha, Military, Romance, Sci-Fi", 1994, Completed, Plastic Little
Plastic Little (Dub), Movie," Set on the planet Yietta, whose colonists make their living by exploiting the planet's unique liquid-gas oceans, Plastic Little begins as the Yietans are finally about to pay off their debts to the Galactic Federation. Unfortunately, there are those who would rather not let Yietta slip through their fingers...Enter Tita, 17 year old captain of the Cha Cha Maru. Together with her crew, Tita specializes in capturing Yietta's exotic life forms for intergalactic pet shops, but through plain bad luck she finds herself, instead, at the core of a sinister plot to take over Yietta! By rescuing 16 year old Elysse from the very clutches of the military, Tita puts the lives of both herself and her crew in mortal peril... but a girl's got to do what a girl's got to do!As the plotters mobilize their forces in a desperate bid to retrieve Elysse, whom they believe possesses a vital computer code, Tita must play a dangerous game of tag with an entire army of professional killers! It's Cat and Mouse on a planetwide scale, with one crucial difference"," Action, Adventure, Comedy, Ecchi, Military, Romance, Sci-Fi", 1994, Completed, Plastic Little
Plastic Memories, Spring 2015 Anime," This story takes place in a future not too far away when androids that look exactly like humans begin to spread across the world. The android production company SA Corp. produced Giftia, a new kind of android that has the most amount of emotion and human-like qualities out of any other model ever seen. However, due to problems in technology, the androids have a service life, and once they pass that, they... Well, it gets pretty bad. For this sake, SA Corp. creates a terminal service in order to retrieve Giftia that have gone past their service life. A new employee at the terminal service named Tsukasa Mizugaki forms a team with the Giftia Isla to retrieve the other androids, but...", Sci-Fi, 2015, Completed, プラスティック・メモリーズ
Plastic Nee-san, ONA," * Based on Kurii Cha's gag comedy manga.The lively, easily irritable Nee-san, a third-year high school girl, likes building plastic models and the wacky conversations she has with her fellow club members — the level-headed Makimaki and the usually cool, composed but at times quite violent Okappa."," Comedy, Ecchi", 2011, Completed, ＋チック姉さん
Plastic Neesan, ONA," Iroe Genma is a third-year high school student often referred to as ""Elder Sister"" despite her short height. This troublemaking teenager is the president of her school's Model Club, which is dedicated to building plastic models of various objects and structures, such as cars, boats, and even robots.Joined by her two underclassmen, the violent Hazuki ""Okappa"" Okamoto and the rational Makina ""Makimaki"" Sakamaki, the small group aims to carry out their club duties but are often sidetracked by a myriad of distractions. From battles between club members to lessons on how to confess to your crush, these three schoolgirls get caught up in all sorts of wacky, and downright outrageous situations!"," Comedy, School, Seinen", 2011, Completed," ＋チック姉さん, Plastic Nee-san"
Platinum End, Fall 2021 Anime," After the death of his parents, a young Mirai Kakehashi is left in the care of his abusive relatives. Since then, he has become gloomy and depressed, leading him to attempt suicide on the evening of his middle school graduation. Mirai, however, is saved by a pure white girl named Nasse who introduces herself as a guardian angel wishing to give him happiness—by granting him supernatural powers and a chance to become the new God.In order to earn the position, he must defeat 12 other ""God Candidates"" within 999 days. Soon, Mirai begins a struggle to survive as a terrifying battle royale erupts between himself and the candidates looking to obtain the most power in the world."," Drama, Psychological, Shounen, Supernatural", 2021, Completed, プラチナエンド ; Purachina Endo
Platinum End (Dub), Fall 2021 Anime," Ever since he lost his family in an explosion, Mirai Kakehashi has lived a life of pain and despair. Every day, he endures abuse at the hands of relatives who took him in. As his anguish steadily chips away at his will to live, he is eventually pushed to the brink. Prepared to throw it all away, he stands on the edge of a precipice and takes the leap. However, instead of falling to his death, he enters a trance where he meets a winged being who claims to be his guardian angel. Named Nasse, the angel offers him two priceless abilities and convinces him to go on living.When Mirai experiences the marvel of his new powers firsthand, he gets a taste of the freedom that was locked away from him for so long. Armed with Nasse's gifts, Mirai is flung into a showdown with 12 other individuals, one of which will be chosen to become the next God. In stark contrast to when he wanted to end his life, Mirai is now prepared to do whatever it takes to protect his bleak chance at happiness, lest it be wrenched from his grasp forever."," Drama, Psychological, Shounen, Supernatural", 2021, Completed, プラチナエンド
Platonic Chain, TV Series," In the near future, technology has made a few leaps and bounds, and videophones and constant wireless internet access are available to everyone. However, it would seen that the government has been careless and a skilled hacker was able to break into the national information archive. Using the data held there he creates the Platonic Chain website for people to discover information about themselves and their friends. Words start to spread quickly that there is a site that enables you to look up anything. Coincidentally, three young girls, Hitomi, Rika, and Kanae, are able to access the site."," Sci-Fi, Slice of Life", 2002, Completed, プラトニック・チェーン
Platonic Chain, Special," In the near future, technology has made a few leaps and bounds, and videophones and constant wireless internet access are available to everyone. However, it would seen that the government has been careless and a skilled hacker was able to break into the national information archive. Using the data held there he creates the Platonic Chain website for people to discover information about themselves and their friends. Words start to spread quickly that there is a site that enables you to look up anything. Coincidentally, three young girls, Hitomi, Rika, and Kanae, are able to access the site."," Sci-Fi, Slice of Life", 2003, Completed," Platonic Chain Special, プラトニック・チェーン"
Plawres Sanshirou, TV Series," Plawres is a wrestling game that the players make their robots, which are about 30 cm tall, fight in the ring. The main character, Sugata Sanshiro, is a plawres player. Using his plawrestler, Juohmaru, he beats strong rivals."," Adventure, Mecha, School, Sci-Fi, Shounen, Sports", 1983, Completed," Plastic Model Wrestling Sanshiro,  Jumaru, プラレス３四郎"
Please don't stop, ONA," Due to family benefit, she became his wife, but after the wedding, he said"," Comedy, Drama, Romance", 2020, Completed,
Please Save My Earth (Dub), OVA, Alice Sakaguchi once dreamt that she is another person living on the moon. The dream is so strange and so real that Alice can't stop thinking about it. She finds out that some of her classmates are having the same kind of dream. They soon discover that they had been seeing flashes of their past lives as a team of scientists on the moon. Alice and her friends then decide to find the other members and piece together what took place back then. Complications arise when they realize that everything that happened in their previous existence continue to haunt and affect their present lives.(Source," Drama, Sci-Fi, Shoujo", 1993, Completed," Boku no Chikyuu wo Mamotte, Bokutama, PSME, ぼくの地球を守って"
Plunderer, Winter 2020 Anime," In a post-apocalyptic world dominated by the so-called ""Numbers,"" each human will have their identity branded with their own ""Count,"" which could define any number related to their life. May it be one's walked distance or amount of compliments given to them by others, this Count could lead them to the abyss when it has dropped to zero.In the year 305 of the Alcian calendar, Hina has inherited a mission from her Mother, whose Count has depreciated to zero, to search for the Legendary Red Baron. In her adventure, she meets a half-masked swordsman named Licht who tries to hide his identity, as he is known as a degenerate for having an incredibly low Count."," Action, Ecchi, Fantasy, Shounen", 2020, Completed, プランダラ
Plunderer (Dub), Winter 2020 Anime," In a post-apocalyptic world dominated by the so-called ""Numbers,"" each human will have their identity branded with their own ""Count,"" which could define any number related to their life. May it be one's walked distance or amount of compliments given to them by others, this Count could lead them to the abyss when it has dropped to zero.In the year 305 of the Alcian calendar, Hina has inherited a mission from her Mother, whose Count has depreciated to zero, to search for the Legendary Red Baron. In her adventure, she meets a half-masked swordsman named Licht who tries to hide his identity, as he is known as a degenerate for having an incredibly low Count."," Action, Ecchi, Fantasy, Shounen", 2020, Completed, プランダラ
Pluto, ONA," Famous for his military service in the 39th Asian War, the legendary Swiss robot Montblanc is violently murdered. Humans and robots around the world mourn for the beloved celebrity. Montblanc's popularity only grew in the years following the war, thanks to his dedication to nature conservation and his loving personality.Once a fellow war veteran, robotic Europol detective Gesicht is sent to investigate Montblanc's tragic demise. In his pursuit, Gesicht uncovers evidence of a mysterious entity known only as ""Pluto."" He also learns of a conspiratorial plot to dismantle the eight specialized robots from around the world who participated in the war. Racing against time to save those who still remain, Gesicht grapples with his memory, morality, and a world full of hate, desperately attempting to defend the fragile coexistence of man and machine."," Action, Mystery, Sci-Fi, Suspense", 2023, Upcoming, プルートウ
Pokemon (2019), Fall 2019 Anime," The official YouTube channel for the Pokemon franchise announced on Sunday that the franchise is getting a new television anime series titled Pocket Monster. The title is the same title as the original 1997 Pokemon television anime series.The new series will feature all of the regions covered in the franchise so far, from the Kanto to the Galar region. The episode of Pokemon Sun & Moon that will air on September 29 will reveal more information about the new show."," Action, Adventure, Comedy, Fantasy, Kids", 2019, Completed," Pocket Monsters, ポケットモンスター"
