name,Type,Plot Summary,Genre,Released,Status,Other name
Shoujo☆Kageki Revue Starlight, Movie," At the performing arts division of Seisho Music Academy, the ever-evolving stage threads the lives of its students together as they tirelessly hone their craft. Yet, as the girls prepare for a new rendition of the previous year's performance, the carefree Karen Aijou begins to settle for a smaller role. However, her waning passion is reignited by the return of her childhood friend Hikari Kagura, whose sudden transfer to the academy triggers a flurry of changes in the class dynamics.Subsequently, Karen chances upon a secret battleground underneath the school, which houses a set of auditions that will crown its ultimate victor as ""Top Star."" As she dives headfirst into these enigmatic trials, Karen begins to learn about the tribulations that come with vying for the top. Even if fate wills them apart, Karen and Hikari must fight in hopes of fulfilling their childhood promise"," Music, School", 2020, Completed, 少女☆歌劇 レヴュースタァライト ロンド・ロンド・ロンド
Shoukoku no Altair, Summer 2017 Anime," Tughril Mahmut is a young pasha serving on the Divan of the Türkiye Stratocracy. The clouds of war are gathering over his country due to the threat of an aggressive Empire. With the Divan split between warmongers and the pacifists, Mahmut begins his quest to keep the peace at any cost. As he finds himself deeper and deeper in the politics of the ancient world, new enemies and allies surface. Who will prevail? What will Mahmut do if war proves to be inevitable?"," Adventure, Drama, Fantasy, Historical, Shounen", 2017, Completed, 将国のアルタイル
Shoukoushi Cedie, TV Series," After his father's sudden death, Ceddie moves to England as an heir to his grandfather, the Earl of Dorincourt. The Earl is a stubborn and selfish old man. Gradually, however, Ceddie's innocent love opens the Earl's heart and changes him into a caring and generous person. This is based on ""Little Lord Fauntleroy"" by F.H.Burnett."," Drama, Shoujo, Slice of Life", 1988, Completed," Little Lord Fauntleroy, Sekai Meisaku Gekijou, Little Prince Cedie, 小公子セディ"
Shoumetsu Toshi, Spring 2019 Anime," One day, a city suddenly disappears. Takuya, a professional by-the-contract courier and lone wolf, meets Yuki, the only survivor from the city's extinction. The two rely on a message from Yuki's father, who was heard to be missing, and head toward the disappeared city, Lost. However, unexpected obstacles strike before the pair, with the reality especially shocking for Yuki. Before them are the feelings of those left behind, a mysterious group manipulating in the shadows, and unveiling the hidden conspiracy. Takuya and Yuki, who both were initially strangers, would deepen their bond during the journey and unravel the mystery of the Lost city."," Action, Adventure, Drama, Fantasy, Mystery", 2019, Completed, 消滅都市
Shoumetsu Toshi (Dub), Spring 2019 Anime," One day, a city suddenly disappears. Takuya, a professional by-the-contract courier and lone wolf, meets Yuki, the only survivor from the city's extinction. The two rely on a message from Yuki's father, who was heard to be missing, and head toward the disappeared city, Lost. However, unexpected obstacles strike before the pair, with the reality especially shocking for Yuki. Before them are the feelings of those left behind, a mysterious group manipulating in the shadows, and unveiling the hidden conspiracy. Takuya and Yuki, who both were initially strangers, would deepen their bond during the journey and unravel the mystery of the Lost city."," Action, Adventure, Drama, Fantasy, Mystery", 2019, Completed, 消滅都市
Shounan Bakusouzoku, OVA," In Japan, the country that inspired the slogan ""Born to be Mild,"" the blood of young men still runs hot. In the old days they'd go off into the country and hack each other up with swords, but these days, what with school, that isn't very practical.So some of them do something very un-Japanese. They strap on a big bike, roar around annoying people, and pound anyone they consider dishonorable.Now meet Eguchi Yousuke, leader of a high-school Biker gang AND the school's handicrafts club. Which means he divides his time between fistfights and fancy needlework.And if you think he's weird, wait until you meet the rest of his gang..."," Action, Comedy, Shounen", 1986, Completed, 湘南爆走族
Shounen Ashibe, TV Series, Shounen Ashibe follows the daily life of first-grader Ashibe Ashiya and his spotted seal pet Goma-chan.," Comedy, Slice of Life", 2016, Completed, Young Ashibe
Shounen Ashibe, Spring 2017 Anime, Second season of Shounen Ashibe," Comedy, Slice of Life", 2017, Completed, Young Ashibe
Shounen Ashibe, Spring 2018 Anime, Third season of Shounen Ashibe," Comedy, Seinen, Slice of Life", 2018, Completed, 少年アシベ GO! GO! ゴマちゃん 3
Shounen Ashibe, Spring 2019 Anime, Fourth season of Shounen Ashibe," Comedy, Seinen, Slice of Life", 2019, Completed, 少年アシベ GO! GO! ゴマちゃん 4
Shounen Hollywood, Summer 2014 Anime," At a theater called Hollywood Tokyo in Harajuku, the members of the idol group Shounen Hollywood develop their talents with diligent work and studying."," Music, Shoujo, Slice of Life", 2014, Completed, 少年ハリウッド-HOLLY STAGE FOR 49-
Shounen Hollywood, Winter 2015 Anime, Second Season of Shounen Hollywood," Music, Shoujo, Slice of Life", 2015, Completed, 少年ハリウッド-HOLLY STAGE FOR 50-
Shounen Kenya, Movie," It is the year 1941. 11-year-old Murakami Wataru lives with his family, Japanese textile traders operating in British Kenya, when war breaks out between Japan and the Allies. Fleeing into the bush, young Wataru falls headlong into a series of fantastic adventures.", Adventure, 1984, Completed," Kenya Boy, 少年ケニヤ"
Shounen Maid, Spring 2016 Anime," Chihiro is left homeless with supposedly no relatives after his mom died. As he worries about what to do next, his uncle shows up and plans to take care of him...Or is it the other way around?"," Comedy, Shoujo, Slice of Life", 2016, Completed, 少年メイド
Shounen Maid (Dub), Spring 2016 Anime," Chihiro is left homeless with supposedly no relatives after his mom died. As he worries about what to do next, his uncle shows up and plans to take care of him...Or is it the other way around?"," Comedy, Shoujo, Slice of Life", 2016, Completed, 少年メイド
Shounen Ninja Kaze no Fujimaru, TV Series," Kidnapped and rescued by a Ninja, Fujimaru has mastered martial arts over the years. Now he sets off on a journey to find his mother and also locate an old tome containing secret martial arts techniques."," Action, Adventure, Samurai, Shounen", 1964, Completed," Samurai Kid, 少年忍者風のフジ丸"
Shounen Onmyouji, TV Series," Masahiro is the grandson of the great onmyouji, Abe no Seimei. However, he lost his sixth sense that enables him to see supernatural beings, which is very important for an onmyouji. Thus, he is left with no choice but to try and pick a different career. But one day, a strange mononoke appears, which he names Mokkun, who shows him his true potential powers after fighting a demon. With the assistance of Mokkun, his quest to become the greatest onmyouji begins."," Action, Demons, Fantasy, Historical, Magic, Shoujo, Supernatural", 2006, Completed," Shonen Onmyoji, 少年陰陽師"
Shounen Onmyouji (Dub), TV Series," Masahiro is the grandson of the great onmyouji, Abe no Seimei. However, he lost his sixth sense that enables him to see supernatural beings, which is very important for an onmyouji. Thus, he is left with no choice but to try and pick a different career. But one day, a strange mononoke appears, which he names Mokkun, who shows him his true potential powers after fighting a demon. With the assistance of Mokkun, his quest to become the greatest onmyouji begins."," Action, Demons, Magic, Supernatural", 2006, Completed, 少年陰陽師
Shounen Sarutobi Sasuke (Dub), Movie," ""Magic Boy"" was the first ever Japanese animation to be released theatrically in North America.Sasuke, a boy vexed by an evil witch, studies magic and uses his powers to defeat her."," Adventure, Fantasy", 1959, Completed," The Adventures of Little Samurai, 少年猿飛佐助"
Shouwa Ahozoushi Akanuke Ichiban!, TV Series," Koujirou moves to Tokyo from Japan's northernmost island of Hokkaido and insists on bringing his favorite horse, Hikarikin, with him. The alien king Rel arrives from planet Wedelun and gives him a belt that will allow him to transform into a Miracle Hero and to protect the world from alien menaces. He is more interested, however, in impressing the pretty Yuka, though his rival, Michinari, wants her for himself."," Comedy, Shoujo", 1985, Completed, 昭和アホ草紙あかぬけ一番！
Shouwa Genroku Rakugo Shinjuu, Winter 2016 Anime," When a certain man is released from prison, he knows exactly where he's heading first. After falling in love with a traditional comic storyteller's rendition of the story called ""Shinigami,"" he is determined to become his apprentice. The performer, Yakumo, has never taken an apprentice before, but to everyone's surprise, he accepts the eager ex-prisoner, nicknaming him ""Yotaro.""As Yotaro happily begins his new life, he meets others in Yakumo's life, including Yakumo's ward Konatsu. Konatsu was the daughter of a famous storyteller, and Yakumo took her in after her father's tragic death. Konatsu loved her father's storytelling, and would love to become a performer in her own right—but that path is not available for women."," Drama, Josei", 2016, Completed, 昭和元禄落語心中
Shouwa Genroku Rakugo Shinjuu, Winter 2017 Anime, The second season of Shouwa Genroku Rakugo Shinjuu.," Drama, Josei", 2017, Completed," Shouwa Genroku Rakugo Shinjuu 2nd Season, Showa and Genroku Era Lover's Suicide Through Rakugo 2nd Season, 昭和元禄落語心中～助六再び篇～"
Shouwa Genroku Rakugo Shinjuu, OVA," Bundled with the special editions of the manga's 7th and 8th volumes.When a certain man is released from prison, he knows exactly where he's heading first. After falling in love with a traditional comic storyteller's rendition of the story called ""Shinigami,"" he is determined to become his apprentice. The performer, Yakumo, has never taken an apprentice before, but to everyone's surprise, he accepts the eager ex-prisoner, nicknaming him ""Yotaro.""As Yotaro happily begins his new life, he meets others in Yakumo's life, including Yakumo's ward Konatsu. Konatsu was the daughter of a famous storyteller, and Yakumo took her in after her father's tragic death. Konatsu loved her father's storytelling, and would love to become a performer in her own right—but that path is not available for women."," Drama, Josei", 2015, Completed,  昭和元禄落語心中 与太郎放浪篇
Shouwa Monogatari, TV Series," The original story follows the human drama of the Yamazaki family in Tokyo in the Year Shouwa 39 (1964) — the year that the city hosted the Summer Olympics.The Yamazaki family lives in Tokyo. Its members are Yuuzou, the father, Kanoko, the mother, Yoshi, the grandmother, Taichi, eldest son and university student, Yuuko, eldest daughter and high-school student, and Kouhei, the youngest sibling and primary school student.Currently, the Yamazaki family is in a state of flux and discord. However, they are brought together by the activities and festivities surrounding the Tokyo Olympics."," Drama, Historical", 2011, Completed, 昭和物語 TV
Shouxi Yu Ling Shi	, ONA, No synopsis information has been added to this title. Help improve our database by adding a synopsis," Action, Fantasy", 2020, Completed," Chief Soul Manipulator, Chief Soul Master, 首席御灵师"
Shouxi Yu Ling Shi 2nd Season, ONA,," Action, Fantasy", 2021, Ongoing,
Show by Rock!!, Spring 2015 Anime," Metropolis of music, MIDICITY. A kitty girl wearing gothic lolita clothing named Cyan is scouted by Maple Arisugawa, the president of a music agency. From there, she meets Chuchu (a pun off of the sound that rabbits make) the honor student rabbit girl, a net geek dog girl named Retoree (from ""Retriever""), and an alien sheep (?) girl named Moa. Together, they form the band named ""Plasmagica,"" and aim for the top of the world. However, the path there is long and tough, and keeping in high spirits is important. By battling against other strange bands, Plasmagica slowly grows toward a top-grade band. In the end, they'll be a band that becomes the driving force of MIDICITY's music industry... Maybe? Gonna be a music millionaire!", Music, 2015, Completed, SHOW BY ROCK!!（ショウ・バイ・ロック!!）
Show By Rock!! (Dub), TV Series," Metropolis of music, MIDICITY. A kitty girl wearing gothic lolita clothing named Cyan is scouted by Maple Arisugawa, the president of a music agency. From there, she meets Chuchu (a pun off of the sound that rabbits make) the honor student rabbit girl, a net geek dog girl named Retoree (from ""Retriever""), and an alien sheep (?) girl named Moa. Together, they form the band named ""Plasmagica,"" and aim for the top of the world.However, the path there is long and tough, and keeping in high spirits is important. By battling against other strange bands, Plasmagica slowly grows toward a top-grade band. In the end, they'll be a band that becomes the driving force of MIDICITY's music industry... Maybe?Gonna be a music millionaire!", Music, 2015, Completed, SHOW BY ROCK!!（ショウ・バイ・ロック!!）
Show By Rock!! #, Fall 2016 Anime," Metropolis of music, MIDICITY. A kitty girl wearing gothic lolita clothing named Cyan is scouted by Maple Arisugawa, the president of a music agency. From there, she meets Chuchu (a pun off of the sound that rabbits make) the honor student rabbit girl, a net geek dog girl named Retoree (from ""Retriever""), and an alien sheep (?) girl named Moa. Together, they form the band named ""Plasmagica,"" and aim for the top of the world. However, the path there is long and tough, and keeping in high spirits is important. By battling against other strange bands, Plasmagica slowly grows toward a top-grade band. In the end, they'll be a band that becomes the driving force of MIDICITY's music industry... Maybe? Gonna be a music millionaire!"," Comedy, Music", 2016, Completed, Show By Rock!! 2
Show By Rock!! # (Dub), Fall 2016 Anime," Metropolis of music, MIDICITY. A kitty girl wearing gothic lolita clothing named Cyan is scouted by Maple Arisugawa, the president of a music agency. From there, she meets Chuchu (a pun off of the sound that rabbits make) the honor student rabbit girl, a net geek dog girl named Retoree (from ""Retriever""), and an alien sheep (?) girl named Moa. Together, they form the band named ""Plasmagica,"" and aim for the top of the world. However, the path there is long and tough, and keeping in high spirits is important. By battling against other strange bands, Plasmagica slowly grows toward a top-grade band. In the end, they'll be a band that becomes the driving force of MIDICITY's music industry... Maybe? Gonna be a music millionaire!"," Comedy, Music", 2016, Completed, Show By Rock!! 2
Show By Rock!! Mashumairesh!!, Winter 2020 Anime, New Show by Rock!! TV Series featuring the new band Mashumairesh!!.," Comedy, Music", 2020, Completed, SHOW BY ROCK!!ましゅまいれっしゅ!!
Show By Rock!! Mashumairesh!! (Dub), Winter 2020 Anime, New Show by Rock!! TV Series featuring the new band Mashumairesh!!.," Comedy, Music", 2020, Completed, SHOW BY ROCK!!ましゅまいれっしゅ!!
Show By Rock!! Short!!, Summer 2016 Anime," The official website for Sanrio's Show By Rock!! TV anime series announced on Sunday that the show is getting a sequel, as well as a new short anime. The Twitter account for the franchise stated that it would announce the ""broadcast information"" for each of the works at a later date. The website features a key visual with the tagline"," Comedy, Music", 2016, Completed, SHOW BY ROCK!! しょ～と!!
Show By Rock!! Short!! (Dub), Summer 2016 Anime," The official website for Sanrio's Show By Rock!! TV anime series announced on Sunday that the show is getting a sequel, as well as a new short anime. The Twitter account for the franchise stated that it would announce the ""broadcast information"" for each of the works at a later date. The website features a key visual with the tagline"," Comedy, Music", 2016, Completed, SHOW BY ROCK!! しょ～と!!
Show by Rock!! Stars!!, Winter 2021 Anime," ""All stars"" season of Show by Rock!! featuring all the bands from previous seasons."," Comedy, Music", 2021, Completed,
Show by Rock!! Stars!! (Dub), Winter 2021 Anime," ""All stars"" season of Show by Rock!! featuring all the bands from previous seasons."," Comedy, Music", 2021, Completed,
Showa Monogatari, TV Series," Dramatic story of the Yamazaki family during the year Showa 39 (1964), the year that Tokyo hosted the Summer Olympics."," Drama, Historical", 2011, Completed," Shouwa Monogatari, 昭和物語 TV"
Shu Ling Ji, ONA, No synopsis information has been added to this title. Help improve our database by adding a synopsis here., Martial Arts, 2019, Completed, 书灵记
Shu Ling Ji 2nd Season, ONA,, Martial Arts, 2020, Completed, 书灵记 第二季
Shuang Yue Zhi Cheng, ONA," In the year 2200, a new Cold War between two forces is set to end with a peace treaty. However, one side is hiding a dark secret, which results in numerous tragedies in the following months. In the wake of a crisis, a paramilitary team is founded to steal information at the center of the conflict."," Military, Sci-Fi", 2016, Completed," Twin Moons, 双月之城"
Shuangsheng Lingtan, ONA," Twin detectives Xiaotu and Xiaohu set up a business that specializes in dealing with supernatural occurrences. However, when they investigate what seems to be an ordinary “Supernatural” case, a series of bizarre events unfold. To that end, Xiaotu and Xiaohu conquer hardships with every step they take, to clear the hazy path towards the truth."," Mystery, Psychological", 2016, Completed," Twin Spirit Detectives, Twins Spirit Investigators, Tsuin Seishin Tantei,  双生灵探"
Shuffle Memories, TV Series, Plot Summary," Comedy, Drama, Ecchi, Fantasy, Harem, Magic, Romance, School, Seinen", 2007, Completed, シャッフル！メモリーズ
Shuffle!, TV Series, Plot Summary," Comedy, Drama, Ecchi, Fantasy, Harem, Magic, Romance, School, Seinen", 2005, Completed, SHUFFLE! (シャッフル!)
Shuffle! (Dub), TV Series," In present times, Gods and Demons coexist together with Humans after the door between each of these worlds had opened. Tsuchimi Rin is a normal young high school student attending Verbena Academy, spending his days living peacefully with his childhood friend Kaede. Unexpectedly, one day the King of Gods, the King of Demons and their families move into be Rin's next door neighbors. Apparently the daughter of the Gods, Sia, and the daughter of the demons, Nerine, are both deeply in love with Rin after having met him in the past. Along with his playful friendship with upperclassmen Asa and his encounter with the silent but cute Primula, Rin has much on his hands dealing with the affections of each of these girls. Based on the eroge by Navel."," Comedy, Drama, Fantasy, Harem, Magic, Romance, School, Seinen", 2005, Completed, SHUFFLE! (シャッフル!)
Shugo Chara Party!, TV Series," Amu meets a super-peppy transfer student at Seiyo Academy Elementary School named Hiiragi Rikka at school one day. Not only can she see Guardian Characters, but it seems she has some other, mysterious powers as well. When she sees the work that Amu and the other Guardians do at school, she's awestruck.Each 24-25 minute episode consists of a series of variety show style shorts (including Shugo Chara! Pucchi Puchi) totaling approx. 9-10 minutes, followed by the main 11-12 minute animation titled Shugo Chara!!! Dokki Doki which is the actual continuation of season 2 and comes with it's own opening animation. The remaining time is occupied by live action padding between each section and capped off with the opening/ending themes at the beginning and end of the episode."," Comedy, Magic, School, Shoujo", 2009, Completed, しゅごキャラ！パーティー！
Shugo Chara!, TV Series," Amu Hinamori is a student at Seiyo Elementary, where she has a reputation for being ""cool and spicy""; however, her real personality is that of an extremely shy and easily intimidated girl. One night Amu makes a wish that she would have the courage to be reborn as her ""would-be"" self. The next morning Amu finds three brightly colored eggs—red, blue, and green—in her bed. Each egg eventually hatches into a Guardian Character"," Comedy, Magic, School, Shoujo", 2008, Completed, しゅごキャラ！
Shugo Chara!! Doki, TV Series," Now Utau has left Easter and restarted her singing career, while Ikuto still remains at Easter. To replace Utau Easter hires a new character, Lulu. Lulu has the power to create question mark eggs, instead of x-eggs. Throughout this season we start to see all the love interests more so then in the first season. Tadase and Amu seem to be a couple now, but they have their problem, especially when Amu starts hiding Ikuto in her room. She lies to Tadase, her family and all the Guardians about it, which in the end causes more problems then she expected. Easter also has a new plan to control Ikuto. Using his violin Easter controls Ikuto so that he transforms into Death Rebel. The sound of his violin turns all the heart eggs with in distance into x-eggs. With a large amount of x-eggs gathered, the embryo will soon turn up."," Comedy, Magic, School, Shoujo", 2008, Completed, しゅごキャラ！！どきっ
Shukufuku no Campanella, TV Series," The story takes place in a trading city Ert’Aria. Leicester Maycraft is an item engineer belonging to an adventurer guild “Oasis”. One night, he is at a party with his friends to see a meteor stream on the rooftop of a chapel. One meteor grazes them and hits the steeple of the chapel.There he finds a secret room and a sleeping girl. The girl wakes up and says “You must be my father!”. The encounter with the mysterious girl brings an unexpected adventure to Leicester."," Adventure, Fantasy, Harem, Magic", 2010, Completed," Blessing of the Campanella, 祝福のカンパネラ"
Shukufuku no Campanella Episode OVA, OVA," The story takes place in a trading city Ert’Aria. Leicester Maycraft is an item engineer belonging to an adventurer guild “Oasis”. One night, he is at a party with his friends to see a meteor stream on the rooftop of a chapel. One meteor grazes them and hits the steeple of the chapel.There he finds a secret room and a sleeping girl. The girl wakes up and says “You must be my father!”. The encounter with the mysterious girl brings an unexpected adventure to Leicester."," Comedy, Ecchi, Fantasy", 2011, Completed, Shukufuku no Campanella
Shuo Feng, Movie,," Action, Adventure", 0, Upcoming, North Wind
Shura no Toki (Dub), TV Series," Legends tell of an invincible martial art known as Mutsu Enmei-Ryu, an unarmed style that allows the user to defeat any number of armed opponents using incredible speed and strength. This is the story of three generations of those who bear the name Mutsu, and their encounters and battles with the strongest fighters of their era."," Action, Historical, Martial Arts, Samurai, Shounen", 2004, Completed, Mutsu Enmei Ryuu Gaiden
Shura Sword Sovereign , ONA,, Action, 2021, Ongoing,
Shushan Qi Xian Lu, ONA," During the An Lushan Rebellion of the Tang Dynasty, monsters are everywhere and the people were destitute in the Central Plains. Li Haobai started from the Bashu and wanted to go to the front line to make a meritorious deed. On the way he was swallowed by the monster. By coincidence, Li Haobai and the guardian of the dragon’s veins merged with each other to obtain the power of the black dragon. And he has since been involved in the struggle of various forces."," Action, Adventure, Fantasy", 2021, Ongoing," 蜀山奇仙录, Legend of Shou"
Shuten Douji, OVA," As a baby Jiro was delivered to his foster parents by a massive oni, who said he would return for Jiro in 15 years. When the time comes Jiro must contend with enemy oni, dark cultists, and their minions while attempting to protect both his parents and girlfriend from their depredations. Ultimately he must embark on a journey through the past, future, and other dimensions to embrace his destiny as Shuten Doji reborn."," Demons, Horror, Sci-Fi, Shounen, Space, Supernatural", 1989, Completed," Shuten Doji - The Star Hand Kid, Shuten Doji, Star Demon, 手天童子"
Shuten Douji (Dub), OVA," As a baby Jiro was delivered to his foster parents by a massive oni, who said he would return for Jiro in 15 years. When the time comes Jiro must contend with enemy oni, dark cultists, and their minions while attempting to protect both his parents and girlfriend from their depredations. Ultimately he must embark on a journey through the past, future, and other dimensions to embrace his destiny as Shuten Doji reborn."," Demons, Historical, Horror, Sci-Fi, Shounen, Space, Supernatural", 1989, Completed," Shuten Doji - The Star Hand Kid, Shuten Doji, Star Demon, 手天童子"
