name,Type,Plot Summary,Genre,Released,Status,Other name
Slayers, OVA," In these three self-contained half-hour stories, Lina Inverse and her partner, Naga The Serpent, take on a variety of jobs for quick cash, food, and/or their own skins. The first episode, ""The Scary Chimera Plan,"" pits them against a lunatic magician who intends to use Lina to create a fearsome, spell-slinging monster. Then, in ""Jeffry's Knighthood,"" they're hired by an overprotective mother to see that her son - a young man barely capable of holding a sword - becomes a respected knight, by ""helping"" him fight off the marauding soldiers terrorizing the area. Finally, ""Mirror, Mirror"" puts the two in a race to hunt down and capture (for bounty, of course) a rogue sorceror who's found an ancient artifact that can create loyal duplicates of anything or anyone, including his enemies."," Adventure, Comedy, Fantasy, Magic, Shounen, Supernatural", 1996, Completed," Slayers Special, スレイヤーズすぺしゃる"
Slayers, Movie, Summary," Adventure, Comedy, Fantasy, Magic, Shounen", 1995, Completed, 劇場版スレイヤーズ
Slayers, Movie," In this prequel movie to the Slayers televison series, Lina Inverse travels to Mipross Island with her rival/traveling companion Naga the Serpent. While they originally came for the hot springs, they soon find them selves mixed up in a conspiracy involving a mazoku named Joyrock. Years ago, he killed all of the elves that inhabited the island and absorbed their power. They are soon joined by an old mage named Rowdy Gabriev, who was in love with one of the elves slaughtered and also wants to defeat Joyrock."," Adventure, Comedy, Fantasy, Magic, Shounen", 1995, Completed, 劇場版スレイヤーズ
"Slime Taoshite 300-nen, Shiranai Uchi ni Level Max ni Nattemashita", Spring 2021 Anime," Suddenly dying from overwork, salarywoman Azusa Aizawa finds herself before an angel, who allows her to reincarnate into a new world as an immortal witch, where she spends her days killing slimes for money on an otherwise eternal vacation. But even the minimal experience points from slimes will add up after hundreds of years, and Azusa discovers that she accidentally reached the maximum level! Fearing that her strong abilities will attract work and force her back to a life of overexertion, she decides to hide her strength in order to preserve her peaceful lifestyle.Despite her efforts, tales of the max level ""Witch of the Plateau"" spread across the land, and a proud dragon named Raika shows up looking to test their strength against her. Even though Azusa defeats and befriends Raika, problems arise as both friends and foes come looking for the secluded witch."," Comedy, Fantasy", 2021, Completed," I've Been Killing Slimes for 300 Years and Maxed Out My Level, Slime 300; スライム倒して300年、知らないうちにレベルMAXになってました"
"Slime Taoshite 300-nen, Shiranai Uchi ni Level Max ni Nattemashita (Dub)", TV Series," In role-playing games, slimes are usually the easiest monster to kill, and because of that, they yield few experience points. But what would happen if you live long enough to keep defeating them for 300 years?After many years of being a corporate slave, Azusa Aizawa abruptly passes away due to severe exhaustion. Seemingly headed for the afterlife, she meets a goddess who bestows her with immortality alongside a peaceful life in another world. There, Azusa enjoys her days tending to her farm, protecting the nearby village, and killing about 25 slimes per day—a routine that continues for at least three centuries.However, this rather monotonous cycle begins to change when Azusa suddenly finds out that she has reached level 99—the maximum possible level—from slimes alone. Despite desperately trying to hide this fact in fear of ending her slow life, rumors of her strength spread nevertheless. Soon enough, various people throughout the continent, like the dragon Laika and the elf Halkara, start to appear at her doorstep—some seeking a battle, others asking for her assistance. Meeting friends and acquaintances who soon become family, Azusa finds she can live a life far better with others than when she was alone."," Comedy, Fantasy, Slice of Life", 2021, Completed," I've Been Killing Slimes for 300 Years and Maxed Out My Level, スライム倒して300年、知らないうちにレベルMAXになってました"
"Slime Taoshite 300-nen, Shiranai Uchi ni Level Max ni Nattemashita 2nd Season", TV Series," Second season of Slime Taoshite 300-nen, Shiranai Uchi ni Level Max ni Nattemashita."," Comedy, Fantasy, Slice of Life", 0, Upcoming, I've Been Killing Slimes for 300 Years and Maxed Out My Level; スライム倒して300年、知らないうちにレベルMAXになってました
Slow Loop, Winter 2022 Anime," When Hiyori⁠—a young girl whose deceased father taught her the joys of fishing⁠—headed out to sea for some alone time, she never thought that she would encounter another girl there.After a while, this girl⁠—named Koharu⁠—and her end up fishing and cooking together, and they get to know each other a bit in the meantime. During their brief time together Koharu finds out that the reason Hiyori went out to sea that day was because she's hesitant towards meeting her new step family that same evening. But what a coincidence! Koharu is also meeting her new family tonight! ""No. It can't be a coincidence..."" Follow these two 'sisters' and their new life together!"," Slice of Life, Sports", 2022, Completed, スローループ
Slow Start, Winter 2018 Anime," Hana Ichinose is a normal 16-year-old high school student. However, there is something different about her"," Comedy, School, Slice of Life", 2018, Completed, スロウスタート
Slow Step, OVA," Based on the Adachi manga of the same name. The story revolves around a romantic triangle formed by the girl Minatsu Nakazato, a young student and softball player; Shu Akiba, a schoolmate; and Naoto Kadomatsu, an up-and-coming boxer. In reality the three-way relationship is more like three-and-a-half, considering that Naoto is in love with Maria... actually Minatsu herself, who'd once disguised herself to escape some evildoers."," Romance, School, Shoujo, Slice of Life, Sports", 1991, Completed, スローステップ
Smash Hit!, TV Series," Mitsuki Ikuta works for the Houchiku Corporation, making movies. To all who know her, she is perceived as being a very infantile woman, still wearing childish fashions.A fan of the detective movie genre, she suddenly finds herself chosen to be the main producer of a new film – but it’s a “hero movie” (a genre generally considered childish). Determined to succeed, regardless, she takes on the job."," Comedy, Ecchi", 2004, Completed," Hit wo Nerae!, ヒットをねらえ!"
Smile Precure!, TV Series," Once upon a time, there was a kingdom of fairy tales called “Märchenland”, where many fairy tale characters live together in joy. Suddenly, the evil emperor Pierrot made an invasion on Märchenland, sealing its Queen in the process.To revive the Queen, the symbol of happiness called Cure Decor, “the Queen’s scattered power of light of happiness”, is required. To collect the Cure Decor, a fairy named Candy searches for the Pretty Cures on Earth. There, Candy meets a girl, who decides to collect the Cure Decor. Now, will the world earn a “happy ending”?"," Fantasy, Kids, Magic, Shoujo", 2012, Completed," Glitter Force, スマイルプリキュア"
Smile Precure! (Dub), TV Series," Once upon a time, there was a kingdom of fairy tales called ""Märchenland,"" where many fairy tale characters live together in joy. Suddenly, the evil emperor Pierrot made an invasion on Märchenland, sealing its Queen in the process. To revive the Queen, the symbol of happiness called Cure Decor, ""the Queen's scattered power of light of happiness,"" is required. To collect the Cure Decor, a fairy named Candy searches for the Pretty Cures on Earth. There, Candy meets a girl, who decides to collect the Cure Decor. Now, will the world earn a ""happy ending""?"," Action, Fantasy, Magic, Shoujo", 2012, Completed," Glitter Force, Smile Pretty Cure!, スマイルプリキュア"
Smile Precure! Movie, Movie," The movie transports the Precure into a world inside a picture book, where they are guided by Niko, a mysterious inhabitant of the picture book world."," Fantasy, Kids, Magic, Shoujo", 2012, Completed, 映画 スマイルプリキュア! 絵本の中はみんなチグハグ!
"So What, You Are My Maid? ", ONA," Eight years ago, a homeless Sissy was rescued by Steven, and became a servant of the Qi family. Many years of companionship created undeniable bond between those two! Steven's mother getting in the way, Steven's many admirers, and the oldest son of the Ji family who can't stop his love for Sissy.... Will the truth from eight years ago come to light? After all these years, is it true love or just a game?", Romance, 2019, Completed,
Soba e, ONA," One rainy day, Osamu gets on his way back home. Then he finds out the umbrella that Sayu gave to him as a present is missing. The umbrella transforms into a girl, and starts moving around the city that gets rained on."," Fantasy, Music", 2019, Completed, そばへ
Softenni Specials, Special, Special episodes from the Blu-rays and DVDs.," Comedy, Ecchi", 2011, Completed, そふてにっ
Sofuteni, TV Series," The girls of the Hakuou Middle School soft tennis club are aiming for the national championship. Along the way, their journey will be full love, rivalry, fervor, and insanity."," Comedy, Ecchi, School, Sports", 2011, Completed," そふてにっ, Softenni, Softenni! the Animation"
Sol Bianca, OVA," Five female pirates pilot the Sol Bianca, a starship with a higher level of technology than any other known. With it, they seek out riches, such as the Gnosis, an legendary item of power, and pasha, the most valuable mineral in the galaxy.Along the way, they must consider a stowaway’s quest to save the one he loves, and seek revenge against those that have wronged them."," Adventure, Sci-Fi, Space", 1990, Completed, SOL BIANCA (ソル·ビアンカ)
Sol Bianca, OVA," Thousands of years into the future, mankind has colonized other planets across the galaxy and completely forgotten about Earth. On one part of the galaxy, the female space pirates and their colossal starship Sol Bianca get a surprise when a young girl named Mayo stows away on board the ship. The crew then embarks on a journey to Earth to find the whereabouts of Mayo's parents and discover the secrets of the lost planet."," Adventure, Mecha, Sci-Fi, Space", 1999, Completed, 太陽の船　ソルビアンカ
Sola, TV Series," Sola's story revolves around Yorito Morimiya, the main protagonist, who is a young boy attending high school. He loves taking pictures of the sky at any time of day and any time of the year. One day, Yorito decides to take a picture of the sunrise overlooking the bay, but is deterred when he meets a strange girl trying to force a vending machine that stole her money to give her what she tried to buy—a can of tomato juice. Yorito helps her with forcing the machine while attempting to strike up conversation with her, despite it being four in the morning. Yorito tells her why he is here, but by the time he has forced the can out of the machine, the girl has mysteriously vanished."," Drama, Romance, Slice of Life, Supernatural", 2007, Completed, Sky
Solty Rei, TV Series, Plot Summary," Action, Sci-Fi, Super Power", 2006, Completed, ソルティレイ
Solty Rei (Dub), TV Series," In a future-based disaster-ridden city with an enormous gap between the rich and the poor, it is hard to tell which humans are walking around with cybernetic body parts. This makes Roy Revant's job as a renegade bounty hunter/bodyguard-for-hire even more difficult. When a young girl with unbeliveable strength rescues him from a particularly dangerous criminal, Roy realizes that perhaps help can be found in the strangest of places. Joining together with a few others, they engage in a battle to find out the truth behind the giant conglomerates that are supposedly serving mankind and making life better.Solty, an android who has lost her memory, has escaped and is being hunted by the RUC Security Bureau. She encounters the bounty hunter Roy and he adopts her as his daughter after being hired as a bodygaurd for Miranda."," Action, Sci-Fi, Super Power", 2005, Completed, ソルティレイ
Somali to Mori no Kamisama, Winter 2020 Anime," The world is ruled by spirits, goblins, and all manner of strange creatures. Human beings are persecuted, to the very point of extinction. One day, a golem and a lone human girl meet.This is a record of the pair, one a member of a ruined race, the other a watchman of the forest. It tells of their travels together and of the bond between father and daughter."," Adventure, Fantasy, Slice of Life", 2020, Completed," Somali and the Forest Spirit, ソマリと森の神様"
Somali to Mori no Kamisama (Dub), Winter 2020 Anime," The world is ruled by spirits, goblins, and all manner of strange creatures. Human beings are persecuted, to the very point of extinction. One day, a golem and a lone human girl meet.This is a record of the pair, one a member of a ruined race, the other a watchman of the forest. It tells of their travels together and of the bond between father and daughter."," Adventure, Fantasy, Slice of Life", 2020, Completed," Somali and the Forest Spirit, ソマリと森の神様"
Someday`s Dreamers, TV Series, Plot Summary," Drama, Magic, Slice of Life", 2008, Completed, Mahoutsukai ni Taisetsu na Koto
Someone Else's BL Cartoon, ONA," Seunghee may seem like a regular high school boy, but he’s got a few secrets"," Comedy, Drama, Romance, School, Slice of Life", 2018, Completed, Nam-ui BL Manhwa
SoniAni, TV Series," Super Sonico is a clutzy, adorable, and well-endowed 18-year old girl. She's a complete sucker for anything cute, especially stray cats, all of which she giddily adopts. However, though Sonico should be enjoying a carefree and simple lifestyle as a young college student, her life is really anything but easy"," Music, Slice of Life", 2014, Completed, Soni-Ani
Sonic the Hedgehog (Dub), OVA," When Dr. Eggman (Robotnik in the US version) holds the president and his daughter hostage, Sonic must comply to the evil scientist's demand of going to Eggmanland to stop Black Eggman and deactivate the city's generator before it reaches critical mass. Little does Sonic know that it's a trap to activate Hyper Metal Sonic, a robot counterpart built by Eggman to destroy our hero."," Adventure, Comedy, Sci-Fi, Shounen", 1996, Completed, ソニック★ザ★ヘッジホッグ
Sonic X, TV Series," Back on Sonic's home planet, Eggman has collected all 7 of the Chaos Emeralds, and is about to have absolute power when Sonic interferes, causing an explosion that sends everyone from their world to Earth. Sonic and his friends team up with 12 year old Christopher Thorndyke to collect all the Chaos Emeralds and defeat the evil Dr. Eggman."," Adventure, Comedy, Kids, Sci-Fi, Shounen", 2003, Completed,  ソニック X
Sonic X (Dub), TV Series," Back on Sonic's home planet, Eggman has collected all 7 of the Chaos Emeralds, and is about to have absolute power when Sonic interferes, causing an explosion that sends everyone from their world to Earth. Sonic and his friends team up with 12 year old Christopher Thorndyke to collect all the Chaos Emeralds and defeat the evil Dr. Eggman."," Action, Comedy, Kids, Mecha, Sci-Fi, Shounen", 2003, Completed, ソニック X
Sonic★the★Hedgehog, OVA," When Dr. Eggman (Robotnik in the US version) holds the president and his daughter hostage, Sonic must comply to the evil scientist's demand of going to Eggmanland to stop Black Eggman and deactivate the city's generator before it reaches critical mass. Little does Sonic know that it's a trap to activate Hyper Metal Sonic, a robot counterpart built by Eggman to destroy our hero."," Adventure, Comedy, Sci-Fi, Shounen", 1996, Completed, Sonic the Hedgehog
Sonny Boy, Summer 2021 Anime," Empty classrooms, boring days. It was supposed to be a normal summer vacation just like any other. Suddenly, the school begins to drift through another dimension, and 36 boys and girls are left there, awakening to their supernatural abilities. Amidst the whirlpool of questions that come to mind one after another, survival in a supernatural world begins."," Sci-Fi, Super Power", 2021, Completed,
Sonny Boy (Dub), Summer 2021 Anime," Empty classrooms, boring days. It was supposed to be a normal summer vacation just like any other. Suddenly, the school begins to drift through another dimension, and 36 boys and girls are left there, awakening to their supernatural abilities. Amidst the whirlpool of questions that come to mind one after another, survival in a supernatural world begins."," Sci-Fi, Super Power", 2021, Completed,
Sono Bisque Doll wa Koi wo Suru, Winter 2022 Anime," Traumatized by a childhood incident with a friend who took exception to his love of traditional dolls, doll-artisan hopeful Wakana Gojou passes his days as a loner, finding solace in the home ec room at his high school. To Wakana, people like beautiful Marin Kitagawa, a trendy girl who's always surrounded by a throng of friends, is practically an alien from another world. But when cheerful Marin—never one to be shy—spots Wakana sewing away one day after school, she barges in with the aim of roping her quiet classmate into her secret hobby"," Comedy, Romance, School, Slice of Life", 2022, Completed," My Dress-Up Darling, Sono Kisekae Ningyou wa Koi wo Suru, その着せ替え人形は恋をする"
Sono Bisque Doll wa Koi wo Suru (Dub), TV Series," Traumatized by a childhood incident with a friend who took exception to his love of traditional dolls, doll-artisan hopeful Wakana Gojou passes his days as a loner, finding solace in the home ec room at his high school. To Wakana, people like beautiful Marin Kitagawa, a trendy girl who's always surrounded by a throng of friends, is practically an alien from another world. But when cheerful Marin—never one to be shy—spots Wakana sewing away one day after school, she barges in with the aim of roping her quiet classmate into her secret hobby"," Romance, School, Seinen, Slice of Life", 2022, Completed," My Dress-Up Darling, その着せ替え人形は恋をする"
Sono Hanabira ni Kuchizuke wo, ONA," Short picture episodes with Risa and Miya from ""Sono Hanabira ni Kuchizuke wo"" visual novel series."," Comedy, Romance, School, Shoujo Ai, Slice of Life", 2012, Completed, A Kiss For The Petals
"Sono Toki, Kanojo wa.", Fall 2018 Anime," The anime will take place in Fukuoka, and will follow the love lives of four female protagonists as high school students, college students, and as working adults."," Drama, Romance", 2018, Completed," At That Time, She.,その時、カノジョは。"
Sora Kake Girl, TV Series," In the year 311 of the orbital calendar, humanity has migrated to countless colony clusters in space. Akiha Shishido encounters a malevolent artificial intelligence, Leopard, who has been installed on a colony.She is joined by Inter-Colony-Police officer Itsuki Kannagi, taciturn young girl Honoka Kawai and a robot-potato, Imoko “Imo-chan” Shishido."," Adventure, Comedy, Sci-Fi, Space", 2009, Completed," Sora wo Kakeru Shoujo, The Girl Who Leapt Through Space, 宇宙をかける少女"
Sora no Aosa wo Shiru Hito yo, Movie," High school student Aoi Aioi lives with her elder sister, Akane, after a tragic accident took their parents away 13 years ago. Because Akane has since been taking care of her single-handedly, Aoi wants to move to Tokyo after her graduation to relieve her sister's burden and pursue a musical career, inspired by Akane's ex-boyfriend Shinnosuke ""Shinno"" Kanamuro. Shinno was part of a band until he left for Tokyo to become a professional bassist after the sisters' parents passed away, and he was never to be seen again.One afternoon, while Aoi practices her guitar in a guest house, she gets startled by the 18-year-old version of Shinno from 13 years ago! As if by coincidence, the current 31-year-old Shinno also returns to the town, but he has changed drastically. There are now two Shinno's in existence, but why is the Shinno from the past present?Sora no Aosa wo Shiru Hito yo revolves around these four individuals as they confront their inner feelings toward each other and make decisions that will affect their lives from here on out.", Drama, 2019, Completed," The Person Who Knows How Blue the Sky Is, Her Blue Sky, 空の青さを知る人よ"
Sora No Manimani, TV Series," In the story, Saku ?yagi is a quiet bookworm who moves back to his former hometown as a high school freshman. He meets his childhood friend, Mihoshi Akeno , although a traumatic incident long ago had left their friendship in an awkward state.Despite this, Mihoshi brings Saku into the astronomy club she founded, and this sets the stage for the slapstick romantic comedy that"," Comedy, Romance, School, Slice of Life", 2009, Completed," At The Mercy of The Sky, 宙のまにまに"
Sora no Method, Fall 2014 Anime," The story begins one winter day when the wish of a few girls was realized with a miracle, changing the landscape of a town. ""In the skies above this town, a disc is always there."""," Fantasy, School, Shounen, Slice of Life", 2014, Completed," Celestial Method, 天体のメソッド"
Sora no Method, Special, Original short anime bundled with the seventh Blu-ray and DVD volume of Sora no Method.," Drama, Fantasy, School, Shounen, Slice of Life", 2015, Completed, Celestial Method
Sora no Method, ONA, The official website of Sora no Method (Celestial Method) announced a new episode for the anime series. The episode will feature a new character.," Comedy, Fantasy, School, Slice of Life", 2019, Completed, 天体のメソッド もうひとつの願い
Sora no Otoshimono, TV Series," omoki Sakurai often encounters a strange girl in his dreams asking for his help, but he can’t remember her face when he wakes up.When an Unidentified Mysterious Animal (U.M.A.) falls out of the sky, his life of pacifism suddenly becomes complicated. The animal turns out to be an angel, Ikaros."," Comedy, Ecchi, Harem, Romance, Sci-Fi, Shounen, Supernatural", 2009, Completed," Heaven's Lost Property, そらのおとしもの"
Sora no Otoshimono (Dub), TV Series," Sakurai Tomoki has been having the same strange dream since he was a child and would wake up in tears. Sugata, an upperclassman at his school, believes the dream to be of the new continent. Later that night, while waiting under the cherry trees for Sugata and his childhood friend, an angel called Ikaros comes flying down and his peaceful life changes from then on."," Comedy, Ecchi, Harem, Romance, Sci-Fi, Shounen, Supernatural", 2009, Completed," Heaven's Lost Property, そらのおとしもの"
Sora no Otoshimono Final, Movie, The second movie of Sora no Otoshimono.," Comedy, Ecchi, Harem, Sci-Fi, Shounen, Supernatural", 2014, Completed, そらのおとしものＦｉｎａｌ永遠の私の鳥籠［エターナルマイマスター］
Sora no Otoshimono Final, Movie, The second movie of Sora no Otoshimono that concludes the anime series.," Comedy, Ecchi, Harem, Sci-Fi, Shounen, Supernatural", 2014, Completed, Sora no Otoshimono Final
Sora no Otoshimono Final, Movie, Sora no Otoshimono Final," Comedy, Ecchi, Harem, Sci-Fi, Shounen, Supernatural", 2014, Completed, Sora no Otoshimono Final
Sora no Otoshimono Forte, TV Series," The story follows Tomoki Sakurai, a pacifist middle school boy. A strange girl appears in his dream to ask for his help, but he cannot remember her face when he wakes up.His life is more complicated when an unidentified mysterious animal falls from the skies, which turns out to be an angel called Ikaros. Sequel to Sora No Otoshimono."," Comedy, Ecchi, Harem, Romance, Sci-Fi, Shounen, Supernatural", 2010, Completed, Heaven's Lost Property
Sora no Otoshimono, TV Series," Sakurai Tomoki has settled into his life with the two angeloids, Ikaros and Nymph, and is enjoying himself immensely. However, he keeps having weird dreams and asks all of his friends to help him investigate the cause.Nymph conjures up a device that enables people, but not angeloids, to enter other people's dreams. The device malfunctions at first but eventually they get to what was supposed to be Tomoki's dream but discover that something is very wrong with it.Later, a meteor comes crashing down from the skies at the site of the large cherry blossom tree where Tomoki first discovered Ikaros. An extremely well endowed blonde angeloid with a huge sword emerges from the meteor and sets off in search of Tomoki!"," Comedy, Ecchi, Harem, Romance, Sci-Fi, Shounen, Supernatural", 2010, Completed, Heaven's Lost Property
Sora no Otoshimono, Movie," Sakurai Tomoki goes on a trip to a hot spring, and is soon up to his usual perverted antics. In addition, he is about to receive his first love confession! However, his desire to pass his days peacefully is challenged once again by another Angeloid. Compared with the hostile Angeloids he had encountered in the past, this new Type Zeta Angeloid is by far the most powerful!"," Comedy, Drama, Ecchi, Harem, Romance, Sci-Fi, Shounen, Supernatural", 2011, Completed, Heaven's Lost Property the Movie
Sora no Otoshimono, Movie," Movie adaptation of the Sora no Otoshimono manga, based on Kazane Hiyori's arc."," Comedy, Drama, Ecchi, Harem, Romance, Sci-Fi, Shounen, Supernatural", 2011, Completed, Heaven's Lost Property the Movie
