name,Type,Plot Summary,Genre,Released,Status,Other name
Captain Tsubasa (2018) (Dub), TV Series," Captain Tsubasa is the passionate story of an elementary school student whose thoughts and dreams revolve almost entirely around the love of soccer. 11-year-old Tsubasa Oozora started playing football at a very young age, and while it was mostly just a recreational sport for his friends, for him, it developed into something of an obsession.In order to pursue his dream to the best of his elementary school abilities, Tsubasa moves with his mother to Nankatsu city, which is well-known for its excellent elementary school soccer teams. But although he was easily the best in his old town, Nankatsu has a lot more competition, and he will need all of his skill and talent in order to stand out from this new crowd.He encounters not only rivals, but also new friends like the pretty girl Sanae Nakazawa and the talented goalkeeper, Genzo Wakabayashi, who shares the same passion as Tsubasa, and will prove to be a treasured friend in helping him push towards his dreams. Representing Japan in the FIFA World Cup is Tsubasa’s ultimate dream, but it will take a lot more than talent to reach it."," Action, Shounen, Sports", 2018, Completed, キャプテン翼
Captain Tsubasa J, TV Series," The first 33 episodes are a summary of the previous series. In the first new episodes a new character, Shingo Aoi, (playing in Italy) is introduced. After that the world cup begins, this time with extraordinary, new countries like Sweden, Thailand or Uzbekistan. Unfortunately the Anime ends in the middle of the world cup after the match Japan-Uzbekistan."," Action, Shounen, Sports", 1994, Completed, キャプテン翼Ｊ
Captain Tsubasa, Movie," The second movie is about the return match between the All Europe Soccer Team and Japan. At the beginning Hyuga denies to join the team due to his 3. defeat against Nankatsu. He practices hard with Kyra to perfect his Tiger Shot. Misaki can't come and Wakabayashi isn't allowed to play for he normally plays for a German team.With those lacks and Schneider's (the European's captain) improved skills, Tsubasa and the Japanese team have grave problems. Despite the new rules, Schneider finally want's to beat his rival Wakabayashi with his new ""illusion shot"", thus he injures Wakashimazu and Murisaki (the second and third goal keeper) with brutal face shots until Wakabayashi is finally allowed to play. In the course of the match Hyuga manages to perfect his Tiger Shot and joins the team. With those legendary players united and Hyugas new power they manage to defeat their opponent 4"," Action, Shounen, Sports", 1985, Completed, キャプテン翼　危うし！全日本Ｊｒ．
Captain Tsubasa, TV Series," The firt 36 episodes are remade summaries of the first three series (Captain Tsubasa, Shin CT and CT J)"," Action, Shounen, Sports", 2001, Completed, キャプテン翼 (2001)
Card Captor Sakura Movie 2, Movie," For this year's Nadeshiko Festival, Sakura Kinomoto's elementary school class is presenting a play. She will portray a princess who struggles to respond to the love confession of the neighboring country's prince. Sakura empathizes with her character all too well, since she herself still owes an answer to the boy who confessed his love for her four months ago.When cousins Shaoran and Meiling Li return from Hong Kong to pay a surprise visit to their friends in Japan, Sakura receives further encouragement to finally declare her feelings. However, she is repeatedly distracted by a presence reminiscent of a Clow Card as well as unexplained disappearances around town.Eventually, Sakura learns of another of Clow Reed's creations—the ""Nothing""—which was formerly sealed away beneath the magician's old house. It has power equal to all 52 cards Sakura possesses, and furthermore, it wants to take those cards away from her! Objects, space, and people disappear from Tomoeda with each card that is stolen. Sakura sets out to capture the Nothing so everything will return to normal, but what must she sacrifice in the process?"," Comedy, Drama, Fantasy, Romance, Shoujo", 2000, Completed, Cardcaptor Sakura Movie 2
Card Wang, TV Series," Mix Masters is a Korea-Japan co-produced anime series, also known by the name Mix Master"," Adventure, Fantasy, Game, Shounen", 2005, Completed, Mix Master
CardCaptor Sakura, TV Series," Sakura Kinomoto was an ordinary 4th grader until the day she opened a strange book and let dozens of powerful magic cards loose on the world. Keroberos, the Guardian of the Clow Cards, informs Sakura that it is now her responsibility to find and capture the freed cards. However, much to the reluctant Sakura’s dismay, things aren’t going to be easy… more Sakura Kinomoto was an ordinary 4th grader until the day she opened a strange book and let dozens of powerful magic cards loose on the world. Keroberos, the Guardian of the Clow Cards, informs Sakura that it is now her responsibility to find and capture the freed cards. However, much to the reluctant Sakura’s dismay, things aren’t going to be easy for her; simply saying magic words and waving her wand around isn’t good enough. Each card is a living, thinking, extremely powerful being.She’ll have to learn to cope with her new responsibilities, as well as ordinary troubles involving love, school, family, and friends. With the support of her friend Tomoyo and a young boy with powers of his own, she must learn how to use her newly awakened magical abilities to collect each card and prevent the disaster that will befall the world if she doesn’t."," Adventure, Comedy, Drama, Romance, School, Shoujo", 1998, Completed, カードキャプターさくら
Cardcaptor Sakura (Dub), TV Series," One day, Kinomoto Sakura, a 4th grader stumbles upon the mysterious book of Clow. Upon opening it and reading the name of The Windy aloud, Sakura scatters the cards to the winds. Sakura is elected and appointed by Keroberos, Guardian of the Cards to capture the remaining cards. With her friend Tomoyo and rival Syaoran, Sakura begins an adventure that will forever change her."," Adventure, Comedy, Drama, Fantasy, Magic, Romance, School, Shoujo", 1998, Completed, カードキャプターさくら
Cardcaptor Sakura The Movie (Dub), Movie," During an after-school shopping trip, Sakura Kinomoto decides to participate in the Tomoeda Shopping District's year-end lottery, with the grand prize being a round trip to Hong Kong. Surprisingly, she draws the winning ball. Alongside her best friend Tomoyo Daidouji, her older brother Touya, her crush Yukito Tsukishiro, and Keroberos, Sakura heads off to Hong Kong.However, vacation for the Cardcaptor will get cut short. Little does Sakura know, the trip may be connected to her recent, prophetic dreams featuring a mysterious woman and Clow Reed himself, creator of the Clow Cards."," Comedy, Drama, Fantasy, Shoujo", 1999, Completed, 劇場版 カードキャプターさくら
Cardcaptor Sakura, Winter 2018 Anime," The January issue of Kodansha's Nakayoshi magazine revealed on December 1 that CLAMP's Cardcaptor Sakura Clear Card-hen sequel manga is getting a television anime series adaptation in January 2018.Fourteen-year-old Sakura starts junior high school along her friends, including Syaoran, who had just returned to Tomoeda. After having a dream with a mysterious cloaked figure, all of Sakura's cards turn blank and are rendered powerless, thus she starts her quest to find out what is wrong. In doing so, Sakura and her allies discover and capture new transparent cards using a new key."," Adventure, Comedy, Fantasy, Magic, Romance, Shoujo", 2018, Completed, カードキャプターさくら クリアカード編
Cardcaptor Sakura, Winter 2018 Anime," Fourteen-year-old Sakura starts junior high school along her friends, including Syaoran, who had just returned to Tomoeda. After having a dream with a mysterious cloaked figure, all of Sakura's cards turn blank and are rendered powerless, thus she starts her quest to find out what is wrong. In doing so, Sakura and her allies discover and capture new transparent cards using a new key.(Source"," Adventure, Comedy, Fantasy, Magic, Romance, Shoujo", 2018, Completed, Cardcaptor Sakura
Cardcaptor Sakura, TV Series," Fourteen-year-old Sakura starts junior high school along her friends, including Syaoran, who had just returned to Tomoeda. After having a dream with a mysterious cloaked figure, all of Sakura's cards turn blank and are rendered powerless, thus she starts her quest to find out what is wrong. In doing so, Sakura and her allies discover and capture new transparent cards using a new key."," Adventure, Comedy, Fantasy, Magic, Romance, Shoujo", 2018, Completed, Cardcaptor Sakura
Cardcaptor Sakura, OVA," After the conclusion of the Sakura Card Arc, life is going back to normal. There are no more mysteries, no more disturbances of evil, no more tests of strength. Everyone is moving on with their lives and Sakura feels a sadness in her heart. Even through the goodbyes, Sakura perseveres to keep everyone and a special someone, dear to her heart."," Fantasy, Romance, Shoujo", 2017, Completed, カードキャプターさくら クリアカード編 プロローグ さくらとふたつのくま
CardCaptor Sakura, Movie," Kinomoto Sakura, a Card Captor, wins a game of chance and is awarded a trip to Hong Kong, along with her best friend Tomoyo and her rival, Li Syaoran.It turns out that the ancient rival of Clow Reed, the creator of the mysterious and powerful Clow Cards, summoned them, and she's out for revenge. A battle ensues, and secrets are revealed about Clow Reed's shady past and Sakura's connection to him."," Comedy, Fantasy, Magic, Shoujo", 1999, Completed, 劇場版 カードキャプターさくら
Cardcaptor Sakura, Movie," Sakura and her classmates in grade 6-2, are all very busy preparing a play for the Nadesico festival. Even though it's summer holidays, daily rehearsals are keeping everyone very busy. During this time, Sakura unexpectedly runs into Syaoran and Meilin who have suddenly come to visit from Hong Kong.While Syaoran has already expressed his feelings to Sakura, Sakura hasn't had a chance to tell Syaoran her true feelings. Sakura determines to tell Syaoran her true feelings but things always go wrong whenever she tries.Best friend, Tomoyo suggests that she, Syaoran, Meilin and Sakura all go to the new amusement park. Just as Sakura thought she could tell Syaoran her true feelings, both she and Syaoran sense a strangely familiar aura; the aura of the original Clow cards. But all the Clow cards have since been sealed and turned into Sakura cards! Yet, one by one the Sakura cards start to disappear."," Adventure, Comedy, Drama, Magic, Romance, School", 1998, Completed, Cardcaptor Sakura Movie 2
Cardfight!! Vanguard, TV Series," game that was given to him when he was little. That card is the reason why he begins to engage in Card Fights, something that changes his life drastically. The name of the card game is “Vanguard.” The game takes place in a different planet called “Klay,” and due to a never before seen play system, it becomes popular throughout the world. Aichi, immediately attracted by Vanguard, meets friends such as Togura Misaki and Katsuragi Kamui, along with other rivals.Through friendly rivalry with them, Aichi begins to enjoy a fulfilling life. Aichi, however, has a goal"," Action, Adventure, Demons, Game, Shounen", 2011, Completed, カードファイト!! ヴァンガード
Cardfight!! Vanguard (2018), Spring 2018 Anime, New Cardfight!! Vanguard.," Action, Game, Shounen", 2018, Completed, カードファイト!! ヴァンガード (2018)
Cardfight!! Vanguard (2018) (Dub), TV Series,," Action, Shounen", 2018, Completed, カードファイト!! ヴァンガード (2018)
Cardfight!! Vanguard (Dub), TV Series," Cardfight!! Vanguard features a world where the game Cardfight!! Vanguard is becoming the latest craze among trading card games, becoming a part of everyday life for people all over the world. The game is not limited to Earth alone; battles between the creatures used by the players take place on another planet called Cray.The story begins with Aichi Sendou, a timid middle schooler whose meek attitude often leaves him a target for bullies. Aichi was given a very rare card, ""Blaster Blade"", when he was very young. It's his one treasure that gives him hope. That is, until it gets taken from him. Although Aichi has never played Cardfight!! Vanguard before, he challenges the thief to a game in order to win the ""Blaster Blade"" back. This high-stakes game quickly draws Aichi into the world of Vanguard battles, which will test and change his worth as both a player and a person."," Action, Adventure, Demons, Game, Shounen", 2011, Completed, カードファイト!! ヴァンガード
Cardfight!! Vanguard G, Fall 2014 Anime," Taking place after a three-year time skip, the series will follow Shindou Kurono, Kiba Shion, and Anjou Tokoha as the new protagonists of G.Kurono uses the never-before-seen clan Gear Chronicle, which brings together the destinies of these three toward an ""impossible future, an impossible self signifying 'Generation.'"""," Action, Game, Shounen", 2014, Completed, カードファイト!! ヴァンガードG
Cardfight!! Vanguard G (Dub), Fall 2014 Anime," Taking place after a three-year time skip, the series will follow Shindou Kurono, Kiba Shion, and Anjou Tokoha as the new protagonists of G.Kurono uses the never-before-seen clan Gear Chronicle, which brings together the destinies of these three toward an ""impossible future, an impossible self signifying 'Generation.'"""," Action, Game, Shounen", 2014, Completed, カードファイト!! ヴァンガードG
Cardfight!! Vanguard G, Fall 2015 Anime, Second season of Cardfight!! Vanguard G series.," Action, Game, Shounen", 2015, Completed, カードファイト!! ヴァンガードG　ギアースクライシス編
Cardfight!! Vanguard G, Fall 2015 Anime, Second season of Cardfight!! Vanguard G series.," Action, Game, Shounen", 2015, Completed, カードファイト!! ヴァンガードG　ギアースクライシス編
Cardfight!! Vanguard G, Fall 2016 Anime, Fourth season of Cardfight!! Vanguard G series.," Action, Game, Shounen", 2016, Completed, CARDFIGHT!! ヴァンガードG NEXT
Cardfight!! Vanguard G, Fall 2016 Anime, Third season of Cardfight!! Vanguard G series.," Action, Game, Shounen", 2016, Completed," Cardfight!! Vanguard G NEXT, CARDFIGHT!! ヴァンガードG NEXT"
Cardfight!! Vanguard G, Spring 2016 Anime, Third season of Cardfight!! Vanguard G series.," Action, Game, Shounen", 2016, Completed, カードファイト!! ヴァンガードG ストライドゲート編
Cardfight!! Vanguard G, TV Series, The second half of the second season of Cardfight!! Vanguard G series.," Action, Game, Shounen", 2016, Completed," カードファイト!! ヴァンガードG ストライドゲート編, Cardfight!! Vanguard G Stride Gate-hen, Cardfight!! Vanguard G Stride Gate"
Cardfight!! Vanguard G, Fall 2017 Anime, Fourth season of Cardfight!! Vanguard G series.," Action, Game, Shounen", 2017, Completed, CARDFIGHT!! ヴァンガードG Z
Cardfight!! Vanguard G, Fall 2017 Anime, Fourth season of Cardfight!! Vanguard G series.," Action, Game, Shounen", 2017, Completed," Cardfight!! Vanguard G Z, CARDFIGHT!! ヴァンガードG Z"
Cardfight!! Vanguard Gaiden, Spring 2020 Anime," The series will explore an alternate universe to the main series, and will focus on Kouji Ibuki, an antagonist in the Cardfight!! Vanguard Movie"," Action, Adventure, Demons, Game", 2020, Completed, カードファイト!! ヴァンガード外伝 イフ-if-
Cardfight!! Vanguard, TV Series," Several days after the mortal battle against Link Joker which embroils the whole world, the world has returned to peace. But Kai Toshiki faces a surprising situation. Sendou Aichi, the hero who saved the world from the invasion of Link Joker, has suddenly disappeared. In addition, everyone's memory about Aichi is lost...Almost all hints have been lost, and Kai starts to search Aichi with ""Blaster Blade"" and the deck of Royal Paladin, the only existing hint and the proof of their bonds. Kai is approached by fighters who call themselves ""Quatre Knights"". The four---Gaillard, Neve, Ratie and Sarah---are fighters with world-class power in vanguard fights. They control mysterious power and urge Kai to give up searching Aichi. What is their purpose...!? And what is their relationship with Aichi...!? Kai, with the new power ""Legion"" in his hand, fights to take Aichi back. Now, the war has begun!"," Action, Adventure, Demons, Game, Shounen", 2014, Completed, カードファイト!! ヴァンガード レギオンメイト編
Cardfight!! Vanguard, Spring 2021 Anime," Yu-yu is a boy living in Kanazawa, Kaga Province. He is 15 years old and in his third year of junior high school. He has the ability to sense the feelings of others, but he is troubled by the fact that he cannot say no when asked.One day, Yu-yu could no longer stand going along with his sister's hobby, so he ran away from home. The one who saves him is Megumi Okura. Megumi invites Yu-yu to a nighttime amusement park called ""Wonder Hill"" where her friends hang out. At the amusement park, Yu-yu meets Megumi, Zakusa Ishikame, and Tomari Seto, members of ""Team Blackout,"" a group that meets to play Vanguard every night.Tonight, a serious fight for the team's flag will take place. Blackout's leader, Danji Momoyama, and the mysterious and powerful fighter, Touya Ebata. As Yu-yu stares at them, the card fight is soon eroded into a world of images.This is how Yu-yu encounters Vanguard, a world he has never seen before, and is drawn in by its powerful allure- making new friends along the way."," Action, Game", 2021, Completed, カードファイト!! ヴァンガード overDress
Cardfight!! Vanguard, Spring 2021 Anime," Yu-yu is a boy living in Kanazawa, Kaga Province. He is 15 years old and in his third year of junior high school. He has the ability to sense the feelings of others, but he is troubled by the fact that he cannot say no when asked.One day, Yu-yu could no longer stand going along with his sister's hobby, so he ran away from home. The one who saves him is Megumi Okura. Megumi invites Yu-yu to a nighttime amusement park called ""Wonder Hill"" where her friends hang out. At the amusement park, Yu-yu meets Megumi, Zakusa Ishikame, and Tomari Seto, members of ""Team Blackout,"" a group that meets to play Vanguard every night.Tonight, a serious fight for the team's flag will take place. Blackout's leader, Danji Momoyama, and the mysterious and powerful fighter, Touya Ebata. As Yu-yu stares at them, the card fight is soon eroded into a world of images.This is how Yu-yu encounters Vanguard, a world he has never seen before, and is drawn in by its powerful allure- making new friends along the way."," Action, Game", 2021, Completed, カードファイト!! ヴァンガード overDress
Cardfight!! Vanguard, Fall 2021 Anime, Second season of Cardfight!! Vanguard," Comedy, Game", 2021, Completed, カードファイト!! ヴァンガード overDress
Cardfight!! Vanguard, TV Series," After the sudden departure of a valuable friend, the future of Team Blackout is now uncertain. Yu-yu Kondou and Megumi Ookura feel frustrated for failing to prevent the inevitable, while the heavily involved Touya Ebata is trying his best to atone for past mistakes that led to this misfortune. But whatever they decide to do next, the members of Team Blackout know that they will always find their way back together through their precious card game, Cardfight Vanguard."," Comedy, Game", 2021, Completed, カードファイト!! ヴァンガード overDress
Cardfight!! Vanguard, Summer 2022 Anime, Third season of Cardfight!! Vanguard, Strategy Game, 2022, Completed, カードファイト!! ヴァンガード will+Dress ; Cardfight!! Vanguard
Cardfight!! Vanguard, TV Series," Four months after the battle at Nagoya Castle, Yu-yu and friends received an invitation to a tournament.That ""Deluxe"" tournament aims to determine the strongest fighter, bringing together both ""Front Fighters"" who are active in official tournaments, and hidden powerhouse ""Counter Fighters"" like ""Blackout"" that compete against each other for flags.The existing characters from overDress will be competing with new characters from will+Dress such as Raika, Michiru, and Urara, to become the strongest of them all!", Comedy, 2022, Completed, カードファイト!! ヴァンガード will+Dress
Cardfight!! Vanguard, Winter 2023 Anime, Second season of Cardfight!! Vanguard," Action, Adventure, Strategy Game", 2022, Ongoing, Cardfight!! Vanguard
Cardfight!! Vanguard, Winter 2023 Anime, Second season of Cardfight!! Vanguard, Action, 2023, Ongoing, Cardfight!! Vanguard
Cardfight!! Vanguard, Spring 2019 Anime," The main protagonist Sendou Aichi, is a timid and mundane third-year middle school boy. The thing that supported Aichi's heart, was the ""Blaster Blade"" card that he received as a child. It's an important rare card from ""Vanguard"", a card game with the imaginary world of ""Planet Cray"" as its stage. From the day he reunited with the person who gave him that card ""Toshiki Kai"", Aichi's everyday life began to change."," Action, Game, Shounen", 2019, Completed, CARDFIGHT!! Vanguard 続・高校生編
Cardfight!! Vanguard, Spring 2019 Anime, No synopsis information has been added to this title. Help improve our database by adding a synopsis here.," Action, Game, Shounen", 2019, Ongoing,  CARDFIGHT!! Vanguard 続・高校生編
Carnival Phantasm, TV Series," This anime is based on Takenashi Eri’s Take Moon manga and commemorates Type-Moon’s 10th anniversary. Various characters from Type-Moon’s works such as Kara no Kyoukai, Fate/Stay Night, and Tsukihime are featured in this."," Comedy, Parody, Supernatural", 2011, Completed, カーニバル・ファンタズム
Carnival Phantasm – HibiChika Special, TV Series," This anime is based on Takenashi Eri’s Take Moon manga and commemorates Type-Moon’s 10th anniversary. Various characters from Type-Moon’s works such as Kara no Kyoukai, Fate/Stay Night, and Tsukihime are featured in this."," Comedy, Supernatural", 2012, Completed, カーニバル・ファンタズム ひびちかスペシャル
Carnival Phantasm EX Season, Movie," A DVD-only episode bundled with the special edition Take Moon volume. Caren Ortensia attempts to control the world using money with varying degrees of success, Phantas-Moon receives a movie adaption of her T.V. show, and Shiki is involved in a love plot that spans years."," Comedy, Supernatural", 2011, Completed, カーニバル・ファンタズム　EX Season
Carnival Phantasm, Movie," A special feature based on a real-time run of the Fate/Hollow Ataraxia Visual Novel's mini-game, Illya's Castle. The key characters' voice actor/actress' participate in live commentary for the duration of the game."," Comedy, Parody", 2011, Completed, カーニバル・ファンタズム
Carole & Tuesday, Spring 2019 Anime, Fifty years have passed since mankind began migrating to the new frontier," Drama, Music, Romance, Sci-Fi", 2019, Completed, キャロル&チューズデイ
Carole & Tuesday (Dub), Spring 2019 Anime, Fifty years have passed since mankind began migrating to the new frontier," Drama, Music, Romance, Sci-Fi", 2019, Completed, キャロル&チューズデイ
Carole & Tuesday Mini Series, ONA, Short flash animation series of Carole & Tuesday released on the official YouTube and Twitter channels., Comedy, 2019, Completed, きゃろる＆ちゅーずでい
Carried by the Wind Tsukikage Ran, TV Series," In the Edo or Tokugawa period (1600-1868),Ran,a female wandering samurai whose skill with the katana is only matched by her taste for sake (rice wine),is joined by a chinese martial artist who calls herself Lady Meow of the Iron Cat Fist.Together,these two women face antagonists of all kinds.[!] Report this episodeGenre"," Adventure, Comedy, Historical, Martial Arts, Shounen", 2000, Completed," Kazemakase Tsukikage Ran, Wind-borne Moon-lit Ran, The Samurai Girl, 風まかせ月影蘭"
Casshern Sins , TV Series," After decades since the original anime series, the cybernetic warrior returns in this franchise reboot, Casshern Sins. In a world where the powerful robot leader known as Braiking Boss rule over humanity with an iron fist, a mysterious girl named Luna is summoned by the people for salvation. To retaliate against this potential threat, Braiking send… more After decades since the original anime series, the cybernetic warrior returns in this franchise reboot, Casshern Sins. In a world where the powerful robot leader known as Braiking Boss rule over humanity with an iron fist, a mysterious girl named Luna is summoned by the people for salvation. To retaliate against this potential threat, Braiking sends 3 of his most powerful cyborgs, Casshern, Dio and Reda to dispose of her. Casshern manages to kill Luna, plunging the world into a slow descent of annhilation.Hundreds of years later, humanity is almost extinct. Robots constantly replace their body parts, fearing the corrosion of rust"," Action, Adventure, Sci-Fi", 2008, Completed, キャシャーン SINS
