name,Type,Plot Summary,Genre,Released,Status,Other name
Juuni Kokuki (Dub), TV Series," Nakajima Youko is your average somewhat timid high school student. One day, a strange man named Keiki appears before her, swearing allegiance. Before she could properly register what was happening, demon-like creatures attack Youko and her friends, after which they are pulled into a different world. A world unlike what she has ever known. Separated from Keiki, Youko and her friends must do whatever they can if they wish to survive in this new world."," Action, Adventure, Fantasy, Magic, Supernatural", 2002, Completed," The Twelve Kingdoms, 十二国記"
Juuni Senshi Bakuretsu Eto Ranger, TV Series," The Eto Rangers ride in Space-Time Transmitting Machine Kirinda to repair the Novel Worlds of Mugen. The Eto Rangers themselves are anthropomorphic animals, each representing one of the 12 Chinese zodiac animals (and The Twelve Branches in Buddhism). In Japan they are known as the Eto animals. The Novel Worlds are stories created by the human imagination, such as old folk tales as well as newer books. These living worlds play out repeatedly, and are necessary for the good of humanity. Princess Aura rules Mugen, which is an island continent hanging over an ocean from the skybound Novel Pole. The Great God Goal gives her power, but she may never leave the small palace island area. Their nemesis is the forgotten Spirit of Cats, Nyanma (real name, Chocolat), who was excluded from the choice of 12 protectors by being disqualified from the race (in actual legend there are many versions of this story). She seeks her revenge by distorting Novel Worlds with Jarei Monsters.When a Jarei Monster goes to a Novel World they alter the story, turning it into a different version, sometimes a parody of itself. Bakumaru, the Spirit of Mice, must use the Genmakyou mirror to reveal (""Jarei Shouran!"") the evil spirit once enough clues lead to its identity. Often the Eto Rangers must play out some of the story to find out who or what it is, sometimes even taking on the role of one of the characters in the tale. After defeating the creature, Kirinda is called when Bakumaru holds up his hand with one of Aura's 12 gems on it and calls out ""Daikourin Kirinda!"" Kirinda descends from a dimensional slit and purifies the evil spirit with a beam weapon, calling out ""Jouka!"" (Purification)."," Action, Comedy, Fantasy", 1995, Completed," 12 Senshi Bakuretsu Eto Ranger, 十二戦支　爆烈エトレンジャー"
Juuni Taisen, Fall 2017 Anime," 12 warriors who are burdened with the names of the 12 Chinese Zodiac members fight with each other's lives and pride at stake, all to grant just one wish.", Action, 2017, Completed, Juni Taisen
Juuni Taisen (Dub), Fall 2017 Anime," 12 warriors who are burdened with the names of the 12 Chinese Zodiac members fight with each other's lives and pride at stake, all to grant just one wish.(Source", Action, 2017, Completed, Juni Taisen
Juuou Mujin no Fafnir, Winter 2015 Anime," With the sudden appearance of the monsters that came to be called Dragons, the world had completely changed. Before long, within the human race supernatural girls with the power of the dragons, called ""D,"" were born. The secret existence of the only male ""D,"" the boy Mononobe Yuu, was forcefully thrown into the school where the girls of ""D"" gathered—Midgar, where he saw the naked body of one of the students, Iris. Furthermore, meeting his long-lost sister Mitsuki, Yuu seems to have been enrolled into this school...?! ""When there's really no other choice, Iris, I will—kill you."" ""Can I really... believe you?"" The curtains open as the ""one and only story"" about the boy who was supposed to become the strongest assassin and the incompetent girl unfolds—! Unlimited School Battle Action!"," Fantasy, Romance, School", 2015, Completed," Unlimited Fafnir, 銃皇無尽のファフニール"
Juuousei, TV Series," Chimera, a planet of beasts, is a prison planet for brutal criminals. Thor and Rai are twins, sons of an executive, brought up without wanting for anything. However, their father is murdered, and his murderers send the twins to Chimera. On this unforgiving world they will have to become beasts themselves just to survive."," Action, Adventure, Drama, Mystery, Sci-Fi, Shoujo", 2006, Completed, Jyu-Oh-Sei
Juusen Battle Monsuno, TV Series," Chase Suno and his friends, Jinja and Bren, are on a search for Chase's father, Jeredy Suno. However, they soon become involved in something else upon reaching their father's lab and becoming involved with an organism known as Monsuno. Chase, choosing to side with his father's work, denies S.T.O.R.M. access to the Monsuno and escapes.They are now on the run from the military organization, S.T.O.R.M., while still looking for Chase's father. However, a mysterious organization also has his eyes set on Chase and the group's Monsuno."," Action, Adventure", 2012, Completed, Monsuno
Juusen Battle Monsuno (Dub), TV Series," Chase Suno and his friends, Jinja and Bren, are on a search for Chase's father, Jeredy Suno. However, they soon become involved in something else upon reaching their father's lab and becoming involved with an organism known as Monsuno. Chase, choosing to side with his father's work, denies S.T.O.R.M. access to the Monsuno and escapes. They are now on the run from the military organization, S.T.O.R.M., while still looking for Chase's father. However, a mysterious organization also has his eyes set on Chase and the group's Monsuno."," Action, Adventure", 2012, Completed, Monsuno
Juusen Battle Monsuno Season 2 (Dub), TV Series," Chase Suno and his friends, Jinja and Bren, are on a search for Chase's father, Jeredy Suno. However, they soon become involved in something else upon reaching their father's lab and becoming involved with an organism known as Monsuno. Chase, choosing to side with his father's work, denies S.T.O.R.M. access to the Monsuno and escapes. They are now on the run from the military organization, S.T.O.R.M., while still looking for Chase's father. However, a mysterious organization also has his eyes set on Chase and the group's Monsuno."," Action, Adventure", 2012, Completed, Monsuno
Juusen Battle Monsuno Season 3 (Dub), TV Series," Chase Suno and his friends, Jinja and Bren, are on a search for Chase's father, Jeredy Suno. However, they soon become involved in something else upon reaching their father's lab and becoming involved with an organism known as Monsuno. Chase, choosing to side with his father's work, denies S.T.O.R.M. access to the Monsuno and escapes. They are now on the run from the military organization, S.T.O.R.M., while still looking for Chase's father. However, a mysterious organization also has his eyes set on Chase and the group's Monsuno."," Action, Adventure", 2012, Completed, Monsuno
Juusenki L-Gaim, TV Series," In the year 3990, the immortal Oldna Poseidal rules Pentagona, a war-torn solar system of five planets. Daba Myroad is a survivor of the Yaman Clan, just one of numerous native societies nearly wiped out by the tyrant. Living on the remote planet Koam with his friend Mirao Kyao, Daba possesses L-Gaim, a humanoid mecha known commonly as a ""Heavy Metal"" and the last known relic of the Yaman Clan. The pair befriend Fanneria Amu, an aspiring actress, and Lilith Fau, the last surviving fairy in Pentagona while on the run from a band of thieves attempting to steal L-Gaim.Daba promises to fulfill the dying wish of one of the thieves hunting him—an honorable act that leads him to the powerful merchant Amandara Kamandara. With their mission in sight, the ragtag group will face powerful adversaries and become entangled in a rebellion against Poseidal's reign."," Action, Adventure, Drama, Mecha, Sci-Fi, Shounen, Space", 1984, Completed," Heavy Metal L-Gaim, 重戦機エルガイム"
Juusenki L-Gaim I, OVA," A recap OVA that portrays the first half of the series Heavy Metal L-Gaim. After the credits, there is a short clip animated for the OVA entitled ""Lady Gavlet"", which is intended to be comic relief."," Action, Adventure, Drama, Mecha, Sci-Fi, Shounen, Space", 1986, Completed," 重戦機エルガイムI ペンタゴナ ウインドゥ+レディ ギャブレー, Heavy Metal L-Gaim I"
Juusenki L-Gaim II, OVA," A recap OVA that portrays the second half of the series Heavy Metal L-Gaim. After the credits, there is a short clip animated for the OVA entitled ""Pentagona Dolls"", which is intended to be comic relief."," Action, Adventure, Drama, Mecha, Sci-Fi, Shounen, Space", 1987, Completed," 重戦機エルガイムII フェアウェル マイ ラブリー+ペンタゴナ ドールズ, Heavy Metal L-Gaim II"
Juusenki L-Gaim III, OVA," A side story taking place somewhere before the second half of the series, prior to Daba acquiring the L-Gaim Mk-II. Daba's comrade Leccee is captured by Poseidal's forces, and Daba and his rebels attempt to save her."," Action, Sci-Fi, Shounen", 1987, Completed," 重戦機エルガイムⅢ フルメタル ソルジャー, Heavy Metal L-Gaim OVA, Heavy Metal L-Gaim III"
Juusenshi Gulkeeva, TV Series," The world we live in is called Earthside in this story. There are the other worlds called Nosfertia, Heavenstia, and Eternalia. When Darknoids from Nosfertia begun invasion to Earthside, Heavenstia sent 3 Animanoids (beast-humans) to prevent it. The lead character Touya had believed that he was a mere human but found he was actually a being of Eternalia. With the help of 3 Animanoids, Touya fights to defend Earthside."," Action, Fantasy, Mecha, Super Power", 1995, Completed," Beast Warriors Gulkeeva, Wild Knights Gulkeeva, Jusenshi Gulkeeva, 獣戦士ガルキーバ"
Juushin Enbu, TV Series," Set in a time of chaos, seven heroes of the Stars, the Hokushintenkun, rise up to lead the people. Two of the seven, the Nitenshinson, the Hagun and the Tonrou, are never supposed to exist at the same time, but fate has decided otherwise. Taito, chosen as the Hagun, now must rise up to defeat the Tonrou, as the fate of the Stars destined it to be."," Action, Fantasy, Shounen", 2007, Completed, Juushin Enbu
Juushin Liger, TV Series," It is 199X A.D. In Kushiro, Hokkaido, three bodies of Dragonite appear. Possessing overwhelming destructive force, they attack the city. They also awaken the evil Jashin Drago from the holy seal he was trapped in. 200 years ago, Drago was trapped in the seal by a holy warrior with the tattooed mark of the Liger. Assuming that the warrior is dead, Drago and Empress Zara are free to conquer the Earth using their army of biomechanical beasts. Even the Japan Self-Defense Forces are no match for the Dragonites' awesome power. One of the people fleeing is the protagonist, a milquetoast 16 year old boy named Ken Taiga. Unbeknownst to the Dragonites, Ken realizes that he is the descendant of the Liger warrior! In a burst of anger, Ken's Liger birthmark appears, and he rises his palm into the air, shouting the henshin command, ""LIGER!!!"", which then covers him in demonic long-haired biomechanical armor. Ken transforms into Jushin Liger to fight the evil forces of the Dragonite!"," Action, Mecha, Sci-Fi", 1989, Completed," Bio Armor Ryger, Juushin Riger, Jushin Lyger, Beast God Liger, 獣神ライガー"
Juushinki Pandora, Spring 2018 Anime," The new series is set in a near-future world where the boundary between human being and AI is vague. A rapid biological evolution, similar to ""Cambrian Explosion,"" is caused by one incident. This incident turns into the genesis of a new jostle for supremacy, and the influence of the evolution goes beyond biological framework and spreads to various kinds of materials and technologies. The era of massive evolution involving diverse existences, such as human, machines, and biotechnologies, is coming. Characters fight an existential war in such a world."," Mecha, Sci-Fi", 2018, Completed," Last Hope, 重神機パンドーラ"
Juushinki Pandora (Dub), TV Series," The series is set in a near-future world where the boundary between human being and AI is vague. A rapid biological evolution, similar to ""Cambrian Explosion,"" is caused by one incident. This incident turns into the genesis of a new jostle for supremacy, and the influence of the evolution goes beyond biological framework and spreads to various kinds of materials and technologies. The era of massive evolution involving diverse existences, such as human, machines, and biotechnologies, is coming. Characters fight an existential war in such a world."," Mecha, Sci-Fi", 2018, Completed," Last Hope, 重神機パンドーラ"
Juusou Kikou Dancougar Nova, TV Series," In the 22nd century, there are no longer any world wide wars. Instead, small scale wars break out all over the Earth. Meanwhile, a large robot appears who protects the weak. It is called ""Dancougar Nova"". Some even call it God. However, no one knows the reason for its existence - not even its pilots. Then, another robot, beyond anyone's expectations, reveals itself as the true enemy and begins its attack on the Earth. Dancougar Nova retaliates against this enemy with a power that was kept secret until now. Will Dancougar Nova be able to save the Earth? The prelude to this explosive confrontation rings out.", Mecha, 2007, Completed," Kemono Soukikou Dancouga Nova, Juusoukikou Dancougar Nova, 獣装機攻ダンクーガノヴァ"
Jyu Oh Sei, TV Series," Thor and his twin brother, Rai, are cast off to a forsaken planet by unknown masked men after witnessing the suspicious death of their parents. Given only a beam knife and a smelly satchel, they wander together in search of civilization on the primarily plant based world. They soon discover the plants have the advantage. Only the strong survive; the ones who throw away their humanity and become the beasts humans once were."," Action, Adventure, Drama, Mystery, Sci-Fi, Shoujo", 2006, Completed, Jyu-Oh-Sei
Jyu Oh Sei (Dub), TV Series," Thor and his twin brother, Rai, are cast off to a forsaken planet by unknown masked men after witnessing the suspicious death of their parents. Given only a beam knife and a smelly satchel, they wander together in search of civilization on the primarily plant based world. They soon discover the plants have the advantage. Only the strong survive; the ones who throw away their humanity and become the beasts humans once were."," Action, Adventure, Drama, Military, Sci-Fi, Shoujo", 2006, Completed, Jyu-Oh-Sei
