name,Type,Plot Summary,Genre,Released,Status,Other name
Happy Birthday, Movie, After being abused by her mother physically and mentally Asuka gets taken in by her grandparents. Slowly she learns her own worth as a human being and overcomes many obstacles.," Drama, Iyashikei, Kids, Slice of Life", 1999, Completed," Re-Birthday, ハッピーバースデー 命かがやく瞬間"
Happy Happy Clover, TV Series, Happy Happy Clover recounts the everyday life of a bunny named Chima and the other animals in the Crescent Moon Forest.," Comedy, Fantasy, Kids, Shoujo", 2007, Completed, はぴはぴクローバー
Happy Kappy, TV Series," The story revolves around Kinoshita Suguri, a nine-year-old third-grade girl who loves animals and making fashion accessories. One day, while Suguri is out buying materials for accessories, she comes across an unusual rock. Thinking it would look cute on a bracelet, she goes to pick up the rock and discovers a creature named Kappy. Kappy happens to be the three-year-old prince of Kapimeshia."," Comedy, Fantasy, Shoujo", 2011, Completed," Happy Kappi, はっぴ〜カッピ"
Happy Lesson, TV Series," Hitotose Chitose was always alone and untrusting of people but when 5 female teachers appear and started living together with him in his family’s house as his mothers, things started to change and pick up, together with Hazuki-nee and Minazuki (his 2 sisters) everyday is a lesson"," Comedy, Harem, Romance, School", 2001, Completed, HAPPY☆LESSON
Happy Lesson (Dub), TV Series," Hitotose Chitose was always alone and untrusting of people but when 5 female teachers appear and started living together with him in his family's house as his mothers, things started to change and pick up, together with Hazuki-nee and Minazuki (his 2 sisters) everyday is a lesson."," Comedy, Drama, Harem, Romance, Slice of Life", 2002, Completed, HAPPY☆LESSON
Happy Lesson Advance, TV Series," Hitotose Chitose was always alone and untrusting of people but when 5 female teachers appear and started living together with him in his family’s house as his mothers, things started to change and pick up, together with Hazuki-nee and Minazuki (his 2 sisters) everyday is a lesson"," Comedy, Harem, Romance, Slice of Life", 2003, Completed, HAPPY☆LESSON ADVANCE
Happy Lesson the Final (OVA), TV Series," Hitotose Chitose was always alone and untrusting of people but when 5 female teachers appear and started living together with him in his family’s house as his mothers, things started to change and pick up, together with Hazuki-nee and Minazuki (his 2 sisters) everyday is a lesson"," Comedy, Harem, Romance, School", 2004, Completed, HAPPY☆LESSON THE FINAL
Happy Seven, TV Series," Amano Sakogami is a girl who has an unnatural amount of bad luck. One day, she stumbles into the clubroom of the Better Fortune Research Organization, which consists of a boy and seven other girls who secretly use the power of the luck deities to fight against the Magatsugami, monsters who can affect a person’s luck & well-being. Amano soon becomes the club’s manager, and joins the club in their fight against the Magatsugami and their controller, Kukitomoe."," Comedy, Fantasy", 2005, Completed, はっぴぃセブン ～ざ・テレビまんが～
Happy Sugar Life, Summer 2018 Anime," This is a shivering pure love psycho horror story of a girl named Satou Matsuzaka, who has someone she likes. She experiences a sweet feeling when she sleeps with her, and thought it must be love. Everything will be forgiven as long as she protects this feeling, even if she tricks, commits crimes, steals, or even kills, she thought."," Drama, Horror, Shounen", 2018, Completed, ハッピーシュガーライフ
Happy Sugar Life (Dub), TV Series," This is a shivering pure love psycho horror story of a girl named Satou Matsuzaka, who has someone she likes. She experiences a sweet feeling when she encounters her, and thought it must be love. Everything will be forgiven as long as she protects this feeling, even if she tricks, commits crimes, steals, or even kills, she thought."," Drama, Horror, Psychological, Shounen", 2018, Ongoing," White Sugar Garden, Black Salt Cage, ハッピーシュガーライフ"
Happy World! OVA, TV Series," SOomura Takeshi is one unlucky fellow. He has has this case of bad luck ever since he was little. One day, while on his normal runs with bad luck, he meets an Angel named Elle, and he finds out that his father wished the curse of bad luck upon him. Takeshi has the oppurtunity to pass on the curse, but accepts it to save a young girl. For his noble act, Elle becomes human and lives with Takeshi to protect him from the curse, which is something Takeshi isn’t particularly happy with."," Comedy, Ecchi, Fantasy, Romance", 2002, Completed, Happy World!
Happy☆Lesson (OVA), OVA," One guy. Five girls. One roof. It's a recycled idea, but it never gets old. Happy Lesson is a kinetic take on an old genre.  Chitose shares his house with five ladies. One might think the continued attention of this many girls would be a good thing, but too much attention can prove to be painful. Did I mention they're also instructors at his school (hence the title)? Not only is he the subject of their abuse at home, but at school as well. Even when things finally calm down at night, all the rooms are taken so Chitose must sleep on the couch."," Comedy, Harem, Romance, School", 2001, Completed,
Happy☆Lesson (OVA) (Dub), OVA," One guy. Five girls. One roof. It's a recycled idea, but it never gets old. Happy Lesson is a kinetic take on an old genre.  Chitose shares his house with five ladies. One might think the continued attention of this many girls would be a good thing, but too much attention can prove to be painful. Did I mention they're also instructors at his school (hence the title)? Not only is he the subject of their abuse at home, but at school as well. Even when things finally calm down at night, all the rooms are taken so Chitose must sleep on the couch."," Comedy, Harem, Romance, School", 2001, Completed,
Harbor Light Monogatari, OVA," A Cinderella story of sorts, Fashion Lala stars a little girl named Miho who doesn't get along with her family. Miho loves to design clothing, but her aunt and three cousins don't believe that such a young girl is capable and mock her designs. Meanwhile, a contest for the new ""Disco Queen"" is coming up, and Miho wants nothing more than to be able to design a dress for someone to wear to the competition, since she's too young to enter herself. With determination and a little bit of magic, Miho's dreams just might come true!", Shoujo, 1988, Completed," ハーバーライト物語 ファッションララより, Fancy Lala OVA"
Harbor Tale, Movie," In this mixed media stop motion / CG animation short Harbor Tale (ハーバーテイル), Yuuichi Itou anthropomorphises a red brick who has resided on the corner of a red brick building since the times when the clack of geta could be heard on the busy streets of Yokohama. The building is only a couple of blocks from the harbour and when the building was new the red brick recalls seeing a white sailboat coming into port."," Adventure, Fantasy", 2011, Completed, Harbor Tale
Hare Guu Deluxe, TV Series," Hale was a happy boy living out his days in the jungle with his mother, but then one day Guu showed up and became a member of their household. Throughout the series he faces many hardships as he tries to keep Guu out of trouble in the jungle.", Comedy, 2002, Completed," Jungle wa Itsumo Hare nochi Guu Deluxe, ジャングルはいつもハレのちグゥ　デラックス"
Hare Guu Final, TV Series," Hale was a happy boy living out his days in the jungle with his mother, but then one day Guu showed up and became a member of their household. Throughout the series he faces many hardships as he tries to keep Guu out of trouble in the jungle.", Comedy, 2003, Completed," Jungle wa Itsumo Hare nochi Guu Final, ジャングルはいつもハレのちグゥ　ＦＩＮＡＬ"
Hare Tokidoki Buta (TV), TV Series, Tokyo Pig is the wacky and crazy story of a young boy named Spencer and his magical pet pig named Sunny. This is the wierd adventures of these two wierdos.," Comedy, Parody", 1997, Completed," Tokyo Pig, はれときどきぶた,"
Hare+Guu, TV Series," Hale was a happy boy living out his days in the jungle with his mother, but then one day Guu showed up and became a member of their household. Throughout the series he faces many hardships as he tries to keep Guu out of trouble in the jungle.", Comedy, 2001, Completed," Jungle wa Itsumo Hare nochi Guu, ジャングルはいつもハレのちグゥ"
Hare+Guu (Dub), TV Series," Haré was a happy boy living out his days in the jungle with his mother, but then one day Guu showed up and became a member of their household. Throughout the series he faces many hardships as he tries to keep Guu out of trouble in the jungle."," Comedy, School, Slice of Life", 2001, Completed," Jungle wa Itsumo Hare nochi Guu, ジャングルはいつもハレのちグゥ"
Hare+Guu Deluxe (Dub), TV Series," After the events in the city, Haré and family come back to the Jungle. But it is never calm for Haré as he first must deal with an unstable substitute teacher, then with some big news"," Comedy, Slice of Life", 2002, Completed," Jungle wa Itsumo Hare nochi Guu Deluxe, ジャングルはいつもハレのちグゥ　デラックス"
Hareluya II Boy, TV Series," Hibino Hareluya is a delinquent teenager who is tough and loves to pack a punch. His father is none other than the almighty God who does not approve very well of his son's rebellious acts. Disappointed in Hareluya's lack of responsibility, his father sends him to Earth as a normal high school student, stripped of his powers. Posing as a local priest, God keeps an eye on his son's adventures as Haleluya rights wrongs around the school with two-fisted justice, Love tattooed across the knuckles of each hand."," Action, Comedy, Fantasy, School, Shounen", 1997, Completed," Hallelujah Boy, ハレルヤIIBOY"
Harlock The Mystery of Arcadia, Movie," The story on Arcadia's mystery, on which the 13th television episode was based."," Action, Adventure, Drama, Sci-Fi, Space", 1978, Completed, Uchuu Kaizoku Captain Herlock
Harmagedon (Dub), Movie," From the depths of space he is coming...Ancient beyond understanding, his power is immeasurable. He has destroyed half the universe and is on his way here. He is... Genma.Only two people are aware of the imminent catastrophe"," Action, Adventure, Comedy, Drama, Mecha, Sci-Fi, Shounen", 1983, Completed," Ghenma Wars, Great War with Genma"
Harmony, Movie," In the future, Utopia has finally been achieved thanks to medical nanotechnology and a powerful ethic of social welfare and mutual consideration. This perfect world isn't that perfect though, and three young girls stand up to totalitarian kindness and super-medicine by attempting suicide via starvation. It doesn't work, but one of the girls—Tuan Kirie—grows up to be a member of the World Health Organization. As a crisis threatens the harmony of the new world, Tuan rediscovers another member of her suicide pact, and together they must help save the planet...from itself."," Psychological, Sci-Fi", 2015, Completed,  ハーモニー
Harmony (Dub), Movie," In 2019, following an uprising in the USA and a subsequent global nuclear war, humanity was decimated by a catastrophe called ""The Maelström."" A half-century after this cataclysmic event—to preserve humankind—the World Health Organization (WHO) has progressively assimilated worldwide political power and completely redefined society"," Adult Cast, Psychological, Sci-Fi", 2015, Completed,
Haruchika, Winter 2016 Anime," Haruta and Chika are members of their high school wind instrument club that is on the verge of being shut down. The two are childhood friends, and they spend their days practicing hard while also trying to recruit new members. When a certain incident happens within their school, they work together to solve it."," Mystery, Romance, School, Slice of Life", 2016, Completed, Haruchika
Haruka Naru Toki no Naka de, Movie," One rainy day, Akane crosses path with a kind young man who tacitly offers to her his coat. On their second encounter, he confesses that he doesn't know who he is, his name or his past, but feels contented by just being with her. Besotted, Akane sets out to find his name, and to unravel his enigmatic connection with a famous cursed dance rumoured to kill anyone who attempts to perform it."," Adventure, Drama, Fantasy, Historical, Romance, Shoujo", 2006, Completed, 劇場版 遙かなる時空（とき）の中で 舞一夜（まいひとよ）
Harukana Receive, Summer 2018 Anime," The story takes place in Okinawa, where Haruka forms a beach volleyball pair with Kanata. Kanata, who couldn't handle the pressure put on her by her short height, had given up on beach volleyball already but is convinced by Haruka to step back on the sand once again and aim for the junior tournament."," Ecchi, Slice of Life, Sports", 2018, Completed, はるかなレシーブ
Harukana Receive (Dub), Summer 2018 Anime," The story takes place in Okinawa, where Haruka forms a beach volleyball pair with Kanata. Kanata, who couldn't handle the pressure put on her by her short height, had given up on beach volleyball already but is convinced by Haruka to step back on the sand once again and aim for the junior tournament."," Ecchi, Slice of Life, Sports", 2018, Completed, はるかなレシーブ
Harukanaru Toki no Naka de 2, OVA," Harukanaru Toki no Naka de 2 takes place 100 years after the original Harukanaru Toki no Naka de story. In the past that is, very little time has gone by in the future. Kyou, which resembles Kyoto in the Heian period, is in turmoil because of a power struggle going on between the emperor and the retired emperor, and the people of Kyou are falling into desperation, fearing the coming of the end of the world. Karin was walking with her friends when suddenly she is brought by the White Dragon to the land of Kyou. She was chosen as the new priestess of the White Dragon and she must fight against the evil with the help of her guardians while meantime, she keeps having visions of a mysterious man..."," Fantasy, Historical, Romance, Supernatural", 2003, Completed," In a Distant Time OVA 2, Haruka Naru Toki no Naka de 2"
Harukanaru Toki no Naka de 3, TV Series," The war between the Heike clan and the Genji clan continues. This time, Nozomi has to fight a powerful supernatural enemy and make a choice"," Adventure, Fantasy, Shoujo", 2010, Completed, 遙かなる時空の中で3 終わりなき運命
Harukanaru Toki no Naka de, TV Series," Akane Motomiya and her friends Tenma and Shimon are pulled by a demon into another world, where Akane becomes the Priestess of the Dragon God. The people of this world tell her that she is the only one who can stop the demons from taking over; meanwhile, the demons want to use her power for their own ends. Luckily, Akane has the Hachiyou, eight men with powers of their own who are sworn to protect the Dragon Priestess."," Demons, Fantasy, Historical, Magic, Shoujo, Supernatural", 2004, Completed, Haruka
Hashire! Shiroi Ookami, Movie, A boy named Lasset who lives on a farm in the rural northern US makes a perilous trek through the wilderness to a sanctuary 300 miles to the north to save the life of a gray wolf that he had raised from a puppy after an incident in which the wolf kills the family dog., Drama, 1990, Completed," White Fang, 走れ! 白いオオカミ"
Hashiri Tsuzukete Yokattatte., Fall 2018 Anime," Minato visits a recitation at an anime event with his friend. He is captivated by the voice actors' performances and decides to enroll in Suidoubashi Animation Academy. There, he meets Chikako, who used to live in the room he is moving into and who left a message in a USB drive. Minato, who aims to be a voice actor but is unable to put himself into the role, and Chikako, who lives with a past trauma, encourage one another and try to improve themselves. With the help of seniors such as Ryouta and Kei watching over them, they try to mature. As they stumble and worry, what lies ahead for them both?"," Drama, Slice of Life", 2018, Completed," I'm glad I could keep running., 走り続けてよかったって。"
Hataage! Kemono Michi, Fall 2019 Anime," Professional wrestler and animal lover Shibata Genzo is suddenly summoned to another world. Greeted by a princess, she requests to get rid of the evil beasts roaming in this world. Outraged that he was asked to kill monsters, Genzo German suplexes the princess. Unable to get back to Earth, he decides to live a peaceful life and manage a ""monster"" pet shop."," Comedy, Fantasy, Shounen", 2019, Completed, Kemono Michi
Hataage! Kemono Michi (Dub), Fall 2019 Anime," Professional wrestler and animal lover Shibata Genzo is suddenly summoned to another world. Greeted by a princess, she requests to get rid of the evil beasts roaming in this world. Outraged that he was asked to kill monsters, Genzo German suplexes the princess. Unable to get back to Earth, he decides to live a peaceful life and manage a ""monster"" pet shop."," Comedy, Fantasy, Shounen", 2019, Completed, Kemono Michi
Hataraki Man, TV Series," Hiroko Matsukata is a woman who works for a magazine company. She puts all she has into her work, and is known as a strong, straight-forward working girl, who can at will turn herself into Hataraki man (working man) mode. Despite Hiroko's success at work, her life lacks romance. Even though a hard worker, she'd leave early anytime to go on a date. Too bad her boyfriend is even bigger a workaholic than Hiroko."," Comedy, Drama, Romance, Seinen, Slice of Life", 2006, Completed," Working Man, 働きマン"
Hataraku Maou-sama!, TV Series, Devil King Sadao is only one step away from conquering the world when he is beaten by Hero Emilia and forced to drift to the other world," Comedy, Demons, Fantasy, Martial Arts, Romance, Shounen", 2013, Completed," The Devil is a Part-Timer!, はたらく魔王さま!"
Hataraku Maou-sama! (Dub), TV Series," Striking fear into the hearts of mortals, the Demon Lord Satan begins to conquer the land of Ente Isla with his vast demon armies. However, while embarking on this brutal quest to take over the continent, his efforts are foiled by the hero Emilia, forcing Satan to make his swift retreat through a dimensional portal only to land in the human world. Along with his loyal general Alsiel, the demon finds himself stranded in modern-day Tokyo and vows to return and complete his subjugation of Ente Isla—that is, if they can find a way back!Powerless in a world without magic, Satan assumes the guise of a human named Sadao Maou and begins working at MgRonald's—a local fast-food restaurant—to make ends meet. He soon realizes that his goal of conquering Ente Isla is just not enough as he grows determined to climb the corporate ladder and become the ruler of Earth, one satisfied customer at a time!Whether it's part-time work, household chores, or simply trying to pay the rent on time, Hataraku Maou-sama! presents a hilarious view of the most mundane aspects of everyday life, all through the eyes of a hapless demon lord."," Comedy, Demons, Fantasy, Romance, Supernatural", 2013, Completed," The Devil is a Part-Timer!, はたらく魔王さま!"
Hataraku Maou-sama!!, Summer 2022 Anime, Second season of Hataraku Maou-sama!," Comedy, Demons, Fantasy, Romance, Supernatural", 2022, Completed, The Devil is a Part-Timer! Season 2; はたらく魔王さま！; Hataraku Maou-sama! 2nd Season
Hataraku Maou-sama!! 2 (Dub), Summer 2022 Anime, Second season of Hataraku Maou-sama!," Comedy, Fantasy, Mythology, Romance, Supernatural", 2022, Completed," The Devil is a Part-Timer! Season 2, はたらく魔王さま！！"
Hataraku Onii-san!, Winter 2018 Anime," The story centers around the cheerful calico Tapio Chatorazawa and the pessimistic Russian blue Kuehiko Roshihara. The two study in the same college, and also work together on various odd jobs."," Comedy, Slice of Life", 2018, Completed, 働くお兄さん!
Hataraku Onii-san! No 2!, Summer 2018 Anime, Sequel of Hataraku Onii-san!.," Comedy, Slice of Life", 2018, Completed, Working Buddies! No 2!
Hataraku Saibou (Dub), Summer 2018 Anime," Inside the human body, roughly 37.2 trillion cells work energetically 24 hours a day and 365 days a year. Fresh out of training, the cheerful and somewhat airheaded Red Blood Cell AE3803 is ready to take on the ever-so-important task of transporting oxygen. As usual, White Blood Cell U-1146 is hard at work patrolling and eliminating foreign bacteria seeking to make the body their new lair. Elsewhere, little platelets are lining up for a new construction project.Dealing with wounds and allergies, getting lost on the way to the lungs, and bickering with similar cell types, the daily lives of cells are always hectic as they work together to keep the body healthy!"," Comedy, Shounen", 2018, Completed," Cells at Work!, はたらく細胞"
Hataraku Saibou (TV), Summer 2018 Anime," This is a story about you. A tale about the inside of your body... According to a new study, the human body consists of approximately 37 trillion cells. These cells are hard at work every day within a world that is your body. From the oxygen-carrying red blood cells to the bacteria-fighting white blood cells, get to know the unsung heroes and the drama that unfolds inside of you! It's the oddly relatable and interesting story that is the life of cells!"," Comedy, Shounen", 2018, Completed," Cells At Work, はたらく細胞"
Hataraku Saibou Black (TV), Winter 2021 Anime," Alcohol, smoking, and stress—in the body subjected to these irritants, the cells responsible for maintaining life seem to fight a war that never ends. Due to a severe shortage of workers, Red Blood Cell AA2153 has to quickly learn to deliver oxygen and collect carbon dioxide, even in dangerous conditions. Meanwhile, White Blood Cell U-1196 has to do her part by dealing with germs and viruses during life-threatening situations. In the midst of these crises, they have to work together to keep the body healthy, despite not knowing if their sacrifices will be worthwhile.Hataraku Saibou Black takes a different approach by showing the grittier side of the jobs our cells perform."," Action, Seinen", 2021, Completed," Cells at Work! Code Black, はたらく細胞BLACK"
Hataraku Saibou Black (TV) (Dub), Winter 2021 Anime," Alcohol, smoking, and stress—in the body subjected to these irritants, the cells responsible for maintaining life seem to fight a war that never ends. Due to a severe shortage of workers, Red Blood Cell AA2153 has to quickly learn to deliver oxygen and collect carbon dioxide, even in dangerous conditions. Meanwhile, White Blood Cell U-1196 has to do her part by dealing with germs and viruses during life-threatening situations. In the midst of these crises, they have to work together to keep the body healthy, despite not knowing if their sacrifices will be worthwhile.Hataraku Saibou Black takes a different approach by showing the grittier side of the jobs our cells perform."," Action, Seinen", 2021, Completed," Cells at Work! Code Black, はたらく細胞BLACK"
Hataraku Saibou Specials, Special, DVD/BD specials of Hataraku Saibou included on disc volume 3-7. All episodes feature super deformed chibi versions of the characters. There is also some 4th wall breaking with them speaking to you the viewer (such as the quiz game show in ep 1 or the parody of the long running Japanese talk show Tetsuko's Room in ep 2).," Comedy, Parody, Shounen", 2018, Completed," Hataraku Petit Quiz, Macrophage no Oheya, Killer T Saibou no Kunren, Shireikan no Yuuutsu, Hataraku Oshigoto, Cells at Work! Specials, はたらく細胞"
Hataraku Saibou, Special," A mysterious cell wearing a stylish hat appears before the regular cells, who are bored with just the same (cell division) work over and over again, every day. This mysterious cell lures the regular cells into a mischievous scheme against White Blood Cell and Killer T Cell. The regular cells enjoy working out their everyday, pent-up frustration. But, just who exactly is this cell wearing a stylish hat?"," Comedy, Shounen", 2018, Completed," Cells at Work Special, 風邪症候群"
Hataraku Saibou, ONA, Hataraku Saibou special collaboration episode with Otsuka Pharmaceutical's Pocari Sweat about hyperthermia. Released on Otsuka Pharmaceutical's YouTube Channel., Comedy, 2019, Completed,
Hataraku Saibou!!, Winter 2021 Anime, Second season of Hataraku Saibou.," Comedy, Shounen", 2021, Completed," Cells at Work! 2nd Season, はたらく細胞!!"
Hataraku Saibou!! (Dub), TV Series," The cells of the human body never rest for too long; there's always something new to do and learn every day. At least, that's what Hakkekkyuu U-1146 feels as he rushes to and fro, searching for any pathogens that could cause harm to the body. Despite his dangerous line of work, it's all worth it to protect the happy smiles of Sekkekkyuu AE3803, the platelet crew, his fellow neutrophils, and the other cells he meets along the way.In his latest pathogen-hunting adventures, Hakkekkyuu U-1146 discovers how important cells can sometimes make mistakes, and that not all bacteria are actually bad. Everybody has their bad days, but everything eventually works out when their comrades have their backs. In the end, it's just another normal day for these hardworking cells!"," Comedy, Shounen", 2021, Completed," Cells at Work!!, はたらく細胞!!"
