name,Type,Plot Summary,Genre,Released,Status,Other name
Hatena☆Illusion, Winter 2020 Anime," Ever since watching a magic show held by him and his wife Maeve, Makoto Shiranui has always admired Mamoru Hoshisato—a world-class magician, as well as friend of his parents—and came to Tokyo to become his apprentice. Kana, nicknamed Hatena, is the couple's daughter and his childhood friend. As the hustle and bustle activities in Tokyo catches Makoto off guard such as burglaries by a beautiful thief, he depends on Hatena's comforting side. When he came to Hoshisato's now-haunted mansion to reunite with his childhood friend, he is greeted by the family's butler and maid, Jeeves and Emma along with Hatena, only to discover that they are not as compatible anymore."," Comedy, Ecchi, Romance, Supernatural", 2020, Completed, はてな☆イリュージョン
Hatena☆Illusion (Dub), Winter 2020 Anime," Ever since watching a magic show held by him and his wife Maeve, Makoto Shiranui has always admired Mamoru Hoshisato—a world-class magician, as well as friend of his parents—and came to Tokyo to become his apprentice. Kana, nicknamed Hatena, is the couple's daughter and his childhood friend. As the hustle and bustle activities in Tokyo catches Makoto off guard such as burglaries by a beautiful thief, he depends on Hatena's comforting side. When he came to Hoshisato's now-haunted mansion to reunite with his childhood friend, he is greeted by the family's butler and maid, Jeeves and Emma along with Hatena, only to discover that they are not as compatible anymore."," Comedy, Ecchi, Romance, Supernatural", 2020, Completed, はてな☆イリュージョン
Hatenkou Yuugi, TV Series," A young girl named Rahzel is booted out of her house one day by her father with the instructions to ’see the world.’ And so her journey begins, However, she won’t be doing it alone … for she befriends a stoic young man named Alzeido seeking revenge for his father’s murder. Alzeido and Rahzel are like oil and water … but even still, they feel strangely drawn to one another.This could be either the result of an underlying attraction — or their shared powers with magic. And so, the two reluctant allies travel from town to town, using their powers to help the helpless, while discovering their own respective places in the world"," Adventure, Comedy, Drama, Fantasy, Romance", 2008, Completed, 破天荒遊戯
Hatsukoi Limited, TV Series," A series of short stories depicting the complicated love lives of eight middle school and high school girls, their classmates and relatives. These stories later intertwine to form a main story involving most of the cast."," Comedy, Romance, School, Shounen", 2009, Completed, 初恋限定。
Hatsukoi Monster, Summer 2016 Anime," Nikaido Kaho is a daughter of a rich family and her whole life everyone's been nice to her. When moving to her new high school dormitory, she almost gets hit by a truck but is saved by a boy. It's love at first sight for Kaho but when asking him his name, he tells her she's weird. Kaho is shocked since it's the first time anyone's ever said mean things to her. Soon enough, she finds out that the boy who saved her lives in the same dormitory and so she bravely confesses her love. The boy says his name is Kanade and agrees to go out with her. Unfortunately, the following day Kaho finds out that her first boyfriend is a 5th grader."," Comedy, Romance, School, Shoujo", 2016, Completed," First Love Monster, 初恋モンスター"
Hatsukoi Monster (Dub), Summer 2016 Anime," Nikaido Kaho is a daughter of a rich family and her whole life everyone's been nice to her. When moving to her new high school dormitory, she almost gets hit by a truck but is saved by a boy. It's love at first sight for Kaho but when asking him his name, he tells her she's weird. Kaho is shocked since it's the first time anyone's ever said mean things to her. Soon enough, she finds out that the boy who saved her lives in the same dormitory and so she bravely confesses her love. The boy says his name is Kanade and agrees to go out with her. Unfortunately, the following day Kaho finds out that her first boyfriend is a 5th grader."," Comedy, Romance, School, Shoujo", 2016, Completed," First Love Monster, 初恋モンスター"
Hatsumei Boy Kanipan, TV Series, The story revolves around Kanipan aiming to be the best inventor and his adventures while trying to accomplish this.," Adventure, Comedy, Mecha, Sci-Fi", 1998, Completed," Inventor Boy Kanipan, Gadget Boy Kanipan, 発明BOYカニパン"
Haunted Junction, TV Series," Meet Haruto Hojo, an ordinary high school student with an unusual problem. He's got ghosts and spirits running amuck at school! Appointed President of the Saints Club, Haruto, Mutsuki, and Kazuo are charged with the task of investigating strange phenomena on campus and improve the quality of life for the school spirits that roam the halls. But how can three students handle the likes of Hanako, the sultry bathroom spirit, a Kosak-dancing skeleton, a fish monster living in the school's pool, Red Mantle, Nino-kun, and the rest of the Saito school spirits?"," Comedy, Fantasy, School", 1997, Completed, HAUNTEDじゃんくしょん
Hayate No Gotoku , TV Series," Abandoned by his parents and given a monumentally large debt as a Christmas present, 16-year old Ayasaki Hayate is at the lowest point of his life. Desperately trying alter his hapless fate, he decides to kidnap someone to hold for a ransom. Due to an ill choice of words, the girl he tries to kidnap misunderstands the action as a confession of love. His plan is totally crushed when he gives his real name out. Realizing his wrongdoing, Hayate proceeds to rescue the girl from the yakuza, who had instead kidnapped her. The girl, as a token of thanks, offers Hayate a job as her butler. Hayate, overwhelmed by her kindness, vows to protect her even at the cost of his life. 16-year-old Hayate is really down on his luck.His unemployed parents are good-for-nothings who waste the money they have on gambling. One day, his parents have racked up a huge gambling debt that they had to sell Hayate to the yakuza for the value of his organs. In a desperate attempt to avoid that fate, Hayate decides to become a “bad guy” and kidnap someone to be held for ransom, but his efforts to do so are mistaken as a confession of love by the girl he targets."," Action, Comedy, Harem, Parody, Romance", 2007, Completed," Hayate the Combat Butler, ハヤテのごとく！"
Hayate No Gotoku S2, TV Series," Abandoned by his parents and given a monumentally large debt as a Christmas present, 16-year old Ayasaki Hayate is at the lowest point of his life. Desperately trying alter his hapless fate, he decides to kidnap someone to hold for a ransom. Due to an ill choice of words, the girl he tries to kidnap misunderstands the action as a confession of love. His plan is totally crushed when he gives his real name out. Realizing his wrongdoing, Hayate proceeds to rescue the girl from the yakuza, who had instead kidnapped her. The girl, as a token of thanks, offers Hayate a job as her butler. Hayate, overwhelmed by her kindness, vows to protect her even at the cost of his life. 16-year-old Hayate is really down on his luck.His unemployed parents are good-for-nothings who waste the money they have on gambling. One day, his parents have racked up a huge gambling debt that they had to sell Hayate to the yakuza for the value of his organs. In a desperate attempt to avoid that fate, Hayate decides to become a “bad guy” and kidnap someone to be held for ransom, but his efforts to do so are mistaken as a confession of love by the girl he targets."," Action, Comedy, Harem, Parody, Romance", 2009, Completed," Hayate the Combat Butler!!, ハヤテのごとく!!"
Hayate no Gotoku S2 Special, TV Series," Abandoned by his parents and given a monumentally large debt as a Christmas present, 16-year old Ayasaki Hayate is at the lowest point of his life. Desperately trying alter his hapless fate, he decides to kidnap someone to hold for a ransom. Due to an ill choice of words, the girl he tries to kidnap misunderstands the action as a confession of love. His plan is totally crushed when he gives his real name out. Realizing his wrongdoing, Hayate proceeds to rescue the girl from the yakuza, who had instead kidnapped her. The girl, as a token of thanks, offers Hayate a job as her butler. Hayate, overwhelmed by her kindness, vows to protect her even at the cost of his life. 16-year-old Hayate is really down on his luck.His unemployed parents are good-for-nothings who waste the money they have on gambling. One day, his parents have racked up a huge gambling debt that they had to sell Hayate to the yakuza for the value of his organs. In a desperate attempt to avoid that fate, Hayate decides to become a “bad guy” and kidnap someone to be held for ransom, but his efforts to do so are mistaken as a confession of love by the girl he targets."," Action, Comedy, Harem, Parody, Romance", 2009, Completed, ハヤテのごとく!!
Hayate no Gotoku! (Dub), TV Series," According to Murphy's Law, ""anything that can go wrong, will go wrong,"" and truer words cannot describe the unfortunate life of the hard-working Hayate Ayasaki. Abandoned by his parents after accumulating a debt of over one hundred fifty million yen, he is sold off to the yakuza, initiating his swift getaway from a future he does not want. On that fateful night, he runs into Nagi Sanzenin, a young girl whom he decides to try and kidnap to pay for his family's massive debt.Unfortunately, due to his kind-hearted nature and a string of misunderstandings, Nagi believes Hayate to be confessing his love to her. After saving her from real kidnappers, Hayate is hired as Nagi's personal butler, upon which she is revealed to be a member of one of the wealthiest families in Japan.Highly skilled but cursed with the world's worst luck, Hayate gets straight to work serving his employer all the while trying to deal with the many misfortunes that befall him. From taking care of a mansion to fending off dangerous foes, and even unintentionally wooing the hearts of the women around him, Hayate is in over his head in the butler comedy Hayate no Gotoku!"," Action, Comedy, Harem, Parody, Romance", 2007, Completed," Hayate the Combat Butler, ハヤテのごとく！"
Hayate no Gotoku! Can't Take My Eyes Off You, TV Series," Taking place one month after the events that occurred in the movie Heaven is a Place on Earth. Living at the Sanzenin Mansion once again, Nagi returns to her old ways of life, until she receives word from American authorities informing her that she has a week to pick up her late father's belongings that was indefinitely delayed due to various circumstances. After receiving news of her father whom she doesn't remember, Nagi then meets a mysterious girl (with a hidden agenda) claiming to be Nagi's little sister.The series tells a new story that is original to the anime and not directly based on the manga. The main author of the original series Kenjiro Hata personally created the original concept for the story of this anime."," Comedy, Harem, Parody, Shounen", 2012, Completed, Hayate the Combat Butler
Hayate no Gotoku! Can't Take My Eyes Off You (Dub), TV Series," Taking place one month after the events that occurred in the movie Heaven is a Place on Earth. Living at the Sanzenin Mansion once again, Nagi returns to her old ways of life, until she receives word from American authorities informing her that she has a week to pick up her late father's belongings that was indefinitely delayed due to various circumstances. After receiving news of her father whom she doesn't remember, Nagi then meets a mysterious girl (with a hidden agenda) claiming to be Nagi's little sister.The series tells a new story that is original to the anime and not directly based on the manga. The main author of the original series Kenjiro Hata personally created the original concept for the story of this anime."," Comedy, Harem, Parody, Shounen", 2012, Completed," Hayate no Gotoku! Can't Take My Eyes Off You, ハヤテのごとく! CAN'T TAKE MY EYES OFF YOU"
Hayate no Gotoku! Cuties, TV Series," Abandoned by his parents and given a monumentally large debt as a Christmas present, 16-year old Ayasaki Hayate is at the lowest point of his life. Desperately trying alter his hapless fate, he decides to kidnap someone to hold for a ransom. Due to an ill choice of words, the girl he tries to kidnap misunderstands the action as a confession of love. His plan is totally crushed when he gives his real name out. Realizing his wrongdoing, Hayate proceeds to rescue the girl from the yakuza, who had instead kidnapped her. The girl, as a token of thanks, offers Hayate a job as her butler. Hayate, overwhelmed by her kindness, vows to protect her even at the cost of his life. 16-year-old Hayate is really down on his luck.His unemployed parents are good-for-nothings who waste the money they have on gambling. One day, his parents have racked up a huge gambling debt that they had to sell Hayate to the yakuza for the value of his organs. In a desperate attempt to avoid that fate, Hayate decides to become a “bad guy” and kidnap someone to be held for ransom, but his efforts to do so are mistaken as a confession of love by the girl he targets."," Comedy, Harem, Parody, Romance, Shounen", 2013, Completed," Hayate the Combat Butler! Cuties, ハヤテのごとく！ Cuties"
Hayate no Gotoku! Cuties (Dub), TV Series," Taking place after the events that occurred in Hayate no Gotoku! Can't Take My Eyes off You. Hayate, Nagi and Maria return to their daily lives at the Sanzenin Mansion and the Violet Mansion."," Comedy, Harem, Parody, Romance, Shounen", 2013, Completed," Hayate the Combat Butler! Cuties, Hayate no Gotoku! (2013), ハヤテのごとく！ Cuties"
Hayate no Gotoku! Movie, Movie," At the end of the summer vacation, Hayate, Nagi, and company take a trip to the countryside; a place with no games, no anime, and no mobile signal."," Comedy, Harem, Parody", 2011, Completed," Hayate the Combat Butler! Movie, 劇場版 ハヤテのごとく! HEAVEN IS A PLACE ON EARTH"
Hayate no Gotoku! OVA, TV Series," According to the upcoming issue of Shounen Sunday, Hayate no Gotoku! will receive a new OVA series as part of the manga's 10th anniversary project. One episode each will be bundled with volumes 41 to 43 of the manga for a total of 3 episodes. Volume 40 will be released on March 18th."," Comedy, Harem, Parody, Romance, Shounen", 2014, Completed, ハヤテのごとく！
Hayate no Gotoku!! Season 2 (Dub), TV Series," Hayate Ayasaki's misfortune continues to hand him the short end of the stick. Now settled into his routine at the Sanzenins' mansion and Hakuou Academy, the butler continues to work as hard as ever in caring for his young mistress Nagi while studying the school's grueling curriculum—all on top of trying his best to survive the multitude of troubles that life relentlessly pushes onto him.The unintentional chick magnet's life is far from quiet, forced to deal not only with Nagi's yet unnoticed infatuation with him, but also the evergrowing string of accidentally seduced girls—most notably, the exceptionally plain Ayumu Nishizawa, a friend of his before he became a butler, and the diligent Hinagiku Katsura, Hakuou's student council president. While one struggles to gain his affection and the other desperately tries to deny her own, both the girls are going to make the boy's life a little more complicated than it already is."," Action, Comedy, Harem, Parody, Romance", 2009, Completed," Hayate the Combat Butler!!, ハヤテのごとく!!"
Hazamatsuri, Special, Hazamatsuri is a student-produced independent animation from 2014 about a festival on the threshold between the human world and the spirit world. It was directed by Yoshie EZAKI (江崎好絵)., Fantasy, 2014, Completed," A Festival Between Worlds, はざまつり"
He is My Master, TV Series," Yoshitaka Nakabayashi, a 14-year-old millionaire who got this huge inheritance after his parents died in an accident, found himself needed to be taken care of and tried to hire live-in maids to do the job. Two runaway girls, Izumi Sawatari and her younger sister Mitsuki, stumped into Nakabayashi’s mansion and got hired by Yoshitaka immediately, for Yoshitaka is not only a rich boy but also a pervert with uniform fetishes, who wants to be addressed as goshujin-sama (master). Having nowhere else to settle down along with Mitsuki’s pet alligator Pochi, Izumi accepted the job reluctantly."," Adventure, Drama, Slice of Life", 2005, Completed," Kore ga Watashi no Goshujinsama, これが私の御主人様"
He Wei Dao x Hui Yeda Xiaojie Xiangyao Wo Gaobai, ONA, Cup noodle ads featuring Kaguya-sama's characters.," Comedy, Romance, School", 2020, Completed, Nissin x Kaguya-sama wa Kokurasetai
Healer Girl, Spring 2022 Anime," The story will follow four girls who seek to use their songs to heal and soothe the people of their world. The tagline reads, ""Kindhearted, powerful songs heal the world. These are beautiful miracles sung by humanity.""", Music, 2022, Completed, ヒーラー・ガール
Healin' Good♡Precure, Winter 2020 Anime, New Precure series.," Action, Fantasy, Magic, Shoujo", 2020, Completed, ヒーリングっど♡プリキュア
Healin' Good♡Precure Movie, Movie, No synopsis information has been added to this title. Help improve our database by adding a synopsis here.," Action, Fantasy, Magic, Shoujo", 2021, Completed, 映画ヒーリングっど♥プリキュア　ゆめのまちでキュン！っとGoGo！大変身！！
Heart Cocktail Again, OVA, An OVA produced to celebrate the 20th anniversary of Watase Seizou's Heart Cocktail manga., Romance, 2003, Completed, ハートカクテルアゲイン
Heart no Kuni no Alice, Movie," The girly but bloody otome game re-imagining of Lewis Carroll's classic fantasy novel Alice's Adventures in Wonderland with bishounen characters and added romance.A parody of Alice's Adventures in Wonderland where Alice is smart and non-doormatlike.In this story, Alice is not all what she seems. She is practical, strong, yet darkly cynical. Instead of the tradition story, Alice is kidnapped unwillingly by a mysterious (yet somewhat bishie-looking) man with bunny ears into a place call Heartland. Stuck in Heartland due to a trick by the mysterious bunny eared man, she meets the residents of this world. Along the way, Alice meets Blood, handsome mafia leader; Ace, the psycho yet charming knight and more... What should Alice do in such a world!?"," Fantasy, Harem, Romance, Shoujo", 2011, Completed, 劇場版ハートの国のアリス～Wonderful Wonder World～
Heartcatch Precure! , TV Series," Tsubomi Hanasaki is a 2nd year middle school student who loves flowers and plants. One day, she dreams of a mysterious flowering tree that wilted, causing the sprites to disappear. When she transfers to Myodou Academy[note 1], the sprites that she saw in that dream appeared before her. The sprites begged Tsubomi to become Pretty Cure to protect the Great Tree, but she refuses. However, a sudden attack from a mysterious enemy came, and the Heart Seed of her new classmate, Erika Kurumi, is stolen. To save Erika’s heart, she had no choice but to become a Pretty Cure and fight."," Fantasy, Kids, Magic, Shoujo", 2010, Completed, ハートキャッチプリキュア!
Heartcatch Precure! Movie, Movie," Sakura Kurumi, Erika's mother, is preparing for a fashion show in Paris. The girls of the school's fashion club are going to model there, including some high school students. While in Paris, they meet a mysterious boy named Oliver. However, Baron Salamander of the Desert Apostles appears, and the girls transform into Pretty Cures to defend Paris."," Fantasy, Kids, Magic, Shoujo", 2010, Completed, 映画 ハートキャッチプリキュア！花の都でファッションショー・・・ですか！？
Heat Guy J, TV Series," In the city of Judoh, Claire Leonelli has inherited leadership of the Mafia group “Vampire” following the death of his father. To keep Claire’s and other criminal activities in check, the city’s Bureau of Urban Safety has Special Services Division operative Daisuke Aurora and the super android codenamed “J” (whose identity is apparently kept in secrecy, as androids are banned in the city). With both of them around, crime now has little room to breathe in Judoh."," Action, Adventure, Mecha, Police, Sci-Fi, Shounen", 2002, Completed, ヒートガイジェイ
Heat Guy J (Dub), TV Series," In the city of Judoh, Claire Leonelli has inherited leadership of the Mafia group ""Vampire"" following the death of his father. To keep Claire's and other criminal activities in check, the city's Bureau of Urban Safety has Special Services Division operative Daisuke Aurora and the super android codenamed ""J"" (whose identity is apparently kept in secrecy, as androids are banned in the city). With both of them around, crime now has little room to breathe in Judoh."," Action, Adventure, Mecha, Police, Sci-Fi", 2002, Completed, ヒートガイジェイ
