name,Type,Plot Summary,Genre,Released,Status,Other name
Goblin Slayer, Movie,," Action, Adventure, Fantasy", 2019, Completed, ゴブリンスレイヤー -GOBLIN'S CROWN-
Goblin Slayer, Movie, No synopsis information has been added to this title. Help improve our database by adding a synopsis here.," Action, Adventure, Fantasy", 2020, Completed, ゴブリンスレイヤー -GOBLIN'S CROWN-
Gochuumon wa Usagi Desu ka? Bloom, Fall 2020 Anime, Third season of Gochuumon wa Usagi Desu ka.," Comedy, Slice of Life", 2020, Completed," Gochuumon wa Usagi desu ka? 3, GochiUsa 3, Is the order a rabbit? Bloom, ご注文はうさぎですか? BLOOM"
Gochuumon wa Usagi Desu ka??, Fall 2015 Anime, Second season of Gochuumon wa Usagi Desu ka?," Comedy, Slice of Life", 2015, Completed," Is the order a rabbit??, ご注文はうさぎですか??"
Gochuumon wa Usagi desu ka??, Movie, Gochuumon wa Usagi desu ka?? movie.," Comedy, Slice of Life", 2017, Completed," Is the order a rabbit?? Dear My Sister, ご注文はうさぎですか?? ～Dear My Sister～"
Gochuumon wa Usagi Desuka ?, Spring 2014 Anime," Cocoa arrives at the cafe Rabbit House one day, excited for rabbits. She actually all but lives in that cafe. She meets lots of different girls there, including a tiny and cool girl named Chino, a tough and soldier-esque girl named Lize, a spacey and quintessentially Japanese girl named Chiyo, and the ordinary but dignified Sharo."," Comedy, Slice of Life", 2014, Completed," Is the order a rabbit?, ご注文はうさぎですか？"
Gochuumon wa Usagi Desuka??, OVA, Sequel of Gochuumon wa Usagi Desu ka?? Movie.," Comedy, Slice of Life", 2019, Completed," Is the Order a Rabbit?? OVA, ご注文はうさぎですか?? ~Sing For You~"
God Eater, Summer 2015 Anime," Set in Japan in the year 2071 where the world has been mostly destroyed by mysterious monsters known as the Aragami. An organization known as Fenrir was made to exterminate Aragami using weapons called God Arcs which is made from the cells of an Aragami. Those who specialize in exterminating Aragami are known as God Eaters. Originally God Eaters had one type in which their God Arcs can only keep gun form or blade form, however a new type has been discovered that can switch between gun and blade form. Since then, they have been classified new-types and the previous as old-types."," Action, Demons, Fantasy, Military, Supernatural", 2015, Completed, GOD EATER
God Eater (Dub), Summer 2015 Anime," The year is 2071. Humanity has been pushed to the brink of extinction following the emergence of man-eating monsters called ""Aragami"" that boast an immunity to conventional weaponry. They ravaged the land, consuming almost everything in their path and leaving nothing in their wake. To combat them, an organization named Fenrir was formed as a last-ditch effort to save humanity through the use of ""God Eaters""—special humans infused with Oracle cells, allowing them to wield the God Arc, the only known weapon capable of killing an Aragami. One such God Eater is Lenka Utsugi, a New-Type whose God Arc takes the form of both blade and gun.Now, as one of Fenrir's greatest weapons, Lenka must master his God Arc if he is to fulfill his desire of wiping out the Aragami once and for all. The monsters continue to be born en masse while the remnants of humanity struggle to survive the night. Only God Eaters stand between the Aragami and complete and total annihilation of the human race."," Action, Fantasy, Military, Sci-Fi", 2015, Completed,
God Mars, Movie," Marg was deprived his little brother, Mars, by Zure, and lost his parents. Therefore, he was living alone on the planet, Gishin. He became a member of guerrilla to riot against the dictator Zure, and he fell in love with Ruru, the daughter of the leader, Ura. However, the organization was destroyed. He was trapped by Zure, and he was brainwashed to become a soldier. Then, his long cherished wish that he would meet his brother again was realized... as a duel with him."," Mecha, Sci-Fi, Shounen", 1988, Completed, Rokushin Gattai GodMars
God Mazinger, TV Series," The story is set in modern times, but the twist to the story is that Mazinger is an ancient weapon of the gods, left on earth to battle the evil space gods who have returned to take over the universe."," Action, Fantasy, Mecha", 1984, Completed, ゴッドマジンガー
God Of War, ONA," Hundred years ago, a generation of God of War Ye Qingyun was born, crushing the sons of various great figures, making the enemy frightened by the wind, but unexpectedly betrayed by his lover Luo Ling, brother wolf thirteen, and falling into the Devil Abyss! A hundred years later, all walks of life entered the golden age, and wicked characters emerged wildly! Ye Qingyun was reborn as a waste disciple of the Ye Family, a small family in the Eight Desolate Continent! Fate is reversed and fate is changed! In this life, I will not only crush the genius, but also kill all those who bear me! A ruthless sword, a dragon slaying knife, kill everything, unify the gods, dominate all things!"," Action, Adventure, Fantasy, Martial Arts", 2022, Ongoing," Heaven Defying God of War, God of War Against the Sky, 逆天战神, 전신귀환"
God Wu Tianzun, ONA,," Action, Fantasy, Martial Arts", 2020, Completed," The Legend of Sky Lord, Shen Wu Tianzun, 神武天尊"
Godannar, TV Series," Her father passed away very early and her mother lives and works in a crowded Chinese restaurant. Kitajima Maya, a 13-year old girl, has to carry the burden of making ends meet as she fights against her ill fate. However, she is able to overcome the trials and tribulations in her life with her passion and enthusiasm. She happens to encounter the reclusive actress Tsukikage who decides to train and mould her into the foremost actress of her generation."," Comedy, Ecchi, Mecha, Romance, Sci-Fi", 2003, Completed," Shinkon Gattai Godannar!!, Marriage of God & Soul Godannar!!, 神魂合体ゴーダンナー！！"
Godzilla 1, Movie," Twenty thousand years after the fall of humanity, Earth succumbed to legions of ravenous creatures who now freely roam the planet. Far away in the depths of space, the last surviving members of humanity float aimlessly in the same ship they escaped Earth with so many years ago. With the spacecraft running dangerously low on resources, the survivors’ leading council must decide on their path forward"," Action, Adventure, Sci-Fi", 2017, Completed, Godzilla
Godzilla 2, Movie," By the advent of the 21st century, much of humanity was dead, having been trampled over by a new master, Godzilla. A select few among mankind took to the stars in a spacefaring vessel called the Aratrum in search of ""the promised land,"" the planet Tau-e that could sustain human life. But the migration plan fails, and the remnants of the human race decide to return to Earth. But the distortions in space-time and the distance traveled means that mankind is returning to a completely changed Earth some 20,000 years later. The returnees, led by hero Haruo, prepare to take the fight to Godzilla based on a strategy that has been 20 years in the making. Carried out with the help of two alien species, the Exif and the Bilusaludo, the humans succeed in defeating Godzilla in a costly battle to the death.But the victory is short-lived. Rising from the depths of the planet is a new breed of monster, dubbed ""Godzilla Earth."" Evolving for 20,000 years, the creature stands 300 meters high, weighs over 100,000 tons and wields such overwhelmingly destructive power that Haruo and company have no choice but to run for their lives.Coming to Haruo's rescue, however, is Miana, a member of an aboriginal tribe called the Houtua. They are the first humanoid people the returnees have encountered. Could they descend from humans? ""Our tribal god was destroyed by Godzilla. All that we have left are these eggs. Anyone who has tried to fight or resist him has been drowned in fire,"" the tribespeople say to Haruo, who responds with"," Action, Adventure, Sci-Fi", 2018, Completed, Godzilla
Godzilla 3, Movie," A door opens, and a golden seal shatters a star.It is the early 21st century. Mankind has lost the battle for planet Earth to Godzilla, and has taken to the stars in search of a new home. But the search ends in vain, forcing them and their alien allies back to Earth. But 20,000 years have passed in their absence, and the Earth is a wholly different place.The planet's flora and fauna now embody and serve Godzilla. Earth is a monster's planet, ruled by the largest Godzilla ever at 300 meters in height. Godzilla Earth.Human protagonist, Captain Haruo, yearns to defeat Godzilla and retake the planet for mankind. There, he meets aboriginal descendants of the human race, the Houtua tribe. The Houtua twin sisters, Maina and Miana, lead him to the skeletal remains of Mecha-Godzilla, an old anti-Godzilla weapon, which to everyone's surprise is still alive in the form of self-generating nanometal. Taken from the Mecha-Godzilla carcass, the nanometals have gradually been rebuilding a ""Mecha-Godzilla City,"" a potential weapon capable of destroying Godzilla Earth.As the strategy develops, a rift forms between the humans and the Bilusaludo, one of several alien races that had joined the humans on their exodus from Earth. Their leader, Galu-gu, believes that the secret to defeating Godzilla lies in the use of superhuman powers – namely, the nanometal integration – but Haruo resists, fearing that in defeating monsters, they must not become monsters themselves. Haruo ultimately uses his means for defeating Godzilla Earth to destroy the Mecha-Godzilla city so as to prevent nanometal assimilation, killing Galu-gu. However, his childhood friend, Yuuko, has been absorbed by the nanometal integration and has fallen into a brain dead coma.The human race, once again, is lost. Metphies, commander of the priestly alien race, Exif, marvels at the miraculous survival of Haruo, he begins to attract a following. The Exif has secretly harbored this outcome as their ""ultimate goal."" Miana and Maina issue warnings against Metphies, while Haruo begins to question mankind's next move.With no means for defeating Godzilla Earth, mankind watches as King Ghidorah, clad in a golden light, descends on the planet. The earth shakes once again with as war moves to a higher dimension.What is Godzilla exactly? Does mankind stand a chance? Is there a future vision in Haruo's eyes? Find out in the finale."," Action, Adventure, Sci-Fi", 2018, Completed," GODZILLA 星を喰う者, Godzilla"
Godzilla 3, Movie," A door opens, and a golden seal shatters a star.It is the early 21st century. Mankind has lost the battle for planet Earth to Godzilla, and has taken to the stars in search of a new home. But the search ends in vain, forcing them and their alien allies back to Earth. But 20,000 years have passed in their absence, and the Earth is a wholly different place.The planet's flora and fauna now embody and serve Godzilla. Earth is a monster's planet, ruled by the largest Godzilla ever at 300 meters in height. Godzilla Earth.Human protagonist, Captain Haruo, yearns to defeat Godzilla and retake the planet for mankind. There, he meets aboriginal descendants of the human race, the Houtua tribe. The Houtua twin sisters, Maina and Miana, lead him to the skeletal remains of Mecha-Godzilla, an old anti-Godzilla weapon, which to everyone's surprise is still alive in the form of self-generating nanometal. Taken from the Mecha-Godzilla carcass, the nanometals have gradually been rebuilding a ""Mecha-Godzilla City,"" a potential weapon capable of destroying Godzilla Earth.As the strategy develops, a rift forms between the humans and the Bilusaludo, one of several alien races that had joined the humans on their exodus from Earth. Their leader, Galu-gu, believes that the secret to defeating Godzilla lies in the use of superhuman powers – namely, the nanometal integration – but Haruo resists, fearing that in defeating monsters, they must not become monsters themselves. Haruo ultimately uses his means for defeating Godzilla Earth to destroy the Mecha-Godzilla city so as to prevent nanometal assimilation, killing Galu-gu. However, his childhood friend, Yuuko, has been absorbed by the nanometal integration and has fallen into a brain dead coma.The human race, once again, is lost. Metphies, commander of the priestly alien race, Exif, marvels at the miraculous survival of Haruo, he begins to attract a following. The Exif has secretly harbored this outcome as their ""ultimate goal."" Miana and Maina issue warnings against Metphies, while Haruo begins to question mankind's next move.With no means for defeating Godzilla Earth, mankind watches as King Ghidorah, clad in a golden light, descends on the planet. The earth shakes once again with as war moves to a higher dimension.What is Godzilla exactly? Does mankind stand a chance? Is there a future vision in Haruo's eyes? Find out in the finale."," Action, Adventure, Sci-Fi", 2018, Completed, Godzilla
Godzilla Singular Point, Spring 2021 Anime," This series features an original story, which depicts the young geniuses Mei Kamino, a female researcher, and Yun Arikawa, a male engineer, as they take on an unprecedented threat with their companions. When danger comes up from the depths, only young geniuses Mei, Yun, and their team can face the threat in Godzilla Singular Point!", Action, 2021, Completed, Godzilla
Godzilla Singular Point (Dub), Spring 2021 Anime," This series features an original story, which depicts the young geniuses Mei Kamino, a female researcher, and Yun Arikawa, a male engineer, as they take on an unprecedented threat with their companions. When danger comes up from the depths, only young geniuses Mei, Yun, and their team can face the threat in Godzilla Singular Point!"," Action, Mecha, Mystery, Sci-Fi", 2021, Completed, Godzilla
Godzilla, Movie," The last summer of the 20th Century. That day, the human beings learn that they are not the only ruler of the planet Earth.The appearance of the giant living creatures “Kaiju's” and the ultimate existence that destroys all monsters"," Action, Adventure, Fantasy, Sci-Fi", 2017, Completed," GODZILLA -怪獣惑星-, Godzilla"
