name,Type,Plot Summary,Genre,Released,Status,Other name
Souten no Ken Re, Spring 2018 Anime," It is just before WWII, Kasumi Kenshiro hides as a quiet, absent-minded professor teaching literature at a small women's college in Tokyo. Once the 62nd Grand Master of Hokuto Shinken, ""God Fist of the North Star,"" and known has Yan Wang, or ""the King of Death,"" who preserved the peace in the ""City of Devils."" A fighter of thugs and drug dealers, Kasumi seeks anonymity and a quiet life until the death of his lover, and former brothers, forces him to return to Shanghai to fulfill his destiny and avenge the deaths of his associates."," Action, Historical, Martial Arts", 2018, Completed," Souten no Ken 2, Fist of the Blue Sky"
Souten no Ken, Fall 2018 Anime, The second cour of Souten no Ken," Action, Historical, Martial Arts", 2018, Completed, Fist of the Blue Sky
Space Adventure Cobra, Movie," Cobra, a notorious space pirate, is enlisted by bounty hunter Jane to rescue her sister from the strange being known as Crystal Boy, but then finds himself drawn into a complex struggle over the fate of a mysterious wandering planet."," Action, Adult Cast, Adventure, Sci-Fi, Space", 1982, Completed, Space Adventure Cobra
Space Adventure Cobra (Dub), Movie," Cobra, a notorious space pirate, is enlisted by bounty hunter Jane to rescue her sister from the strange being known as Crystal Boy, but then finds himself drawn into a complex struggle over the fate of a mysterious wandering planet."," Action, Adventure, Sci-Fi, Space", 1982, Completed, SPACE ADVENTURE コブラ
Space Battleship Yamato (Dub), TV Series," In the distant future, the war between the human race and the Gamilon has taken its toll on the planet Earth. Constant bombardment of radioactive asteroids has rendered the planet's atmosphere uninhabitable. As a means of relief aid, Queen Starsha of the planet Iscandar offers the Earth Forces a device that can completely neutralize the radiation off the planet. For this task, the space battleship Yamato is launched from the remains of its World War II ancestor on a 148,000 light-year journey. However, the crew of the Yamato has only one Earth year to travel to Iscandar and back, or the human race will come to an end."," Action, Adventure, Drama, Military, Sci-Fi, Space", 1974, Completed, Star Blazers
Space Battleship Yamato 2 (Dub), TV Series," A year has passed since the Star Force returned to save the Earth but another danger now approaches from deep space. A gigantic White Comet hurtles toward our galaxy, obliterating everything in its path. But it is no ordinary comet—it is the deadly Comet Empire, conqueror of worlds... and Earth is the next target! Against orders, the Star Force blasts off to investigate, but even if they can get past the flagship Andromeda, they don't yet know the true nature of their new enemy!"," Action, Adventure, Drama, Military, Sci-Fi, Space", 1978, Completed, Star Blazers
Space Battleship Yamato 3 (Dub), TV Series," A stray missile from a confrontation between the Galman empire and the Bolar Federation crashes into the sun, turning it into a time bomb of radiation. The Star Force once again sets off into space, this time on a quest to look for a new world for the human race."," Action, Adventure, Drama, Military, Sci-Fi, Space", 1980, Completed," Uchuu Senkan Yamato III, Star Blazers"
Space Bug, Summer 2018 Anime,," Adventure, Space", 2018, Completed, スペースバグ
Space Cobra, TV Series," Meek salaryman Johnson discovers that he is in fact the notorious (and reportedly dead) space pirate Cobra, with a new face and altered memories. Embedded in his left arm is Cobra's unique Psychogun, a famous weapon powered by his own will. Having recovered his past, his partner-in-crime Armaroid Lady, and his spaceship, he journeys across the galaxy seeking adventure.On his travels he will hunt for the galaxy's ultimate weapon, rob museums, break into and out of maximum-security prison, infiltrate a drug ring in the brutal and deadly sport of Rugball, engineer a coup on an alien world, confront the Pirate Guild's most fearsome leaders, and do much else besides—smoking cigars, chasing women and cracking jokes all the while.This, the 1982–83 Cobra TV anime, adapts the Cobra manga from the beginning, covering the first three major stories and building to a grand conclusion with some shorter one-off tales interspersed along the way. (The 1982 Cobra film has only a loose connection to the TV series—though it involved the same director and some of the same animators.)"," Action, Adventure, Sci-Fi, Space", 1982, Completed," Space Adventure Cobra, スペースコブラ"
Space Cobra Pilot (Dub), Special, Pilot episode for the TV series.," Action, Adventure, Sci-Fi, Space", 1981, Completed, スペースコブラ
Space Dandy , Winter 2014 Anime," Space Dandy is a dandy in space! This dreamy adventurer with a to-die-for pompadour travels across the galaxy in search of aliens no one has ever laid eyes on. Each new species he discovers earns him a hefty reward, but this dandy has to be quick on his feet because it's first come, first served! Accompanied by his sidekicks, a rundown robot named QT and Meow the cat-looking space alien, Dandy bravely explores unknown worlds inhabited by a variety of aliens. Join the best dressed alien hunter in all of space and time as he embarks on an adventure that ends at the edge of the universe!"," Comedy, Sci-Fi, Space", 2014, Completed," スペース☆ダンディ, Space☆Dandy"
Space Dandy 2, Summer 2014 Anime, 2nd season of Space Dandy.," Comedy, Sci-Fi, Space", 2014, Completed," Space☆Dandy 2nd Season, スペース☆ダンディ 第2シリーズ"
Space Pirate Captain Harlock, TV Series," The year is 2977. Mankind has become complacent and stagnant. All work is done by machines, while humans spend all their time on entertainment. But when a mysterious invader from the stars catches Earth unawares, only the legendary space pirate Captain Harlock and the crew of the Arcadia have the will to stand against them."," Action, Adventure, Drama, Sci-Fi, Seinen, Space", 1978, Completed," Uchuu Kaizoku Captain Herlock, 宇宙海賊・キャプテンハーロック"
Space Pirate Captain Harlock 2013, Movie," A CGI remake of the original Captain Harlock series.Captain Harlock rebelled against the Allied Forces and has been plundering space ships for one hundred years. Why did he rebelled? How does he survive for one hundred years? With awe and fear to the legendary captain, the Allied Forces issues an order to assassinate Harlock."," Action, Drama, Sci-Fi, Space", 2013, Completed, キャプテンハーロック
Space Pirate Captain Herlock, OVA," On an archaelogical mission to the end of the known universe, Professor Daiba unwitting unleashes an ancient horror from its confines. Five years later the malevolent alien force sets in motion a plan which reunites the various crewmembers of the Arcadia to sail the stars once more as well as bring Tadashi Daiba to meet Harlock for the first time (again)."," Action, Adventure, Drama, Sci-Fi, Seinen, Space", 2002, Completed, Space Pirate Captain Herlock
Space Pirate Captain Herlock, OVA," On an archaelogical mission to the end of the known universe, Professor Daiba unwitting unleashes an ancient horror from its confines. Five years later the malevolent alien force sets in motion a plan which reunites the various crewmembers of the Arcadia to sail the stars once more as well as bring Tadashi Daiba to meet Harlock for the first time (again)."," Action, Adventure, Drama, Sci-Fi, Seinen, Space", 2002, Completed, Space Pirate Captain Herlock
Space Runaway Ideon Movie 1, Movie," Humanity's pursuit of knowledge leads them to the planet Solo, where they find mysterious remains of a long dead alien civilisation, including the three-part super-robot Ideon, and a powerful warship. Using these, the earthlings sent to investigate the ruins defend themselves in their constant battles against powerful aliens called the Buff Clan, who are in pursuit of Id, the mysterious energy that powers the Ideon.",, 0, Completed,
Space Runaway Ideon Movie 2, Movie, The Solo Ship and its crew continue their intense battle with the Buff Clan leading to a final battle that will determine the fate of all life in the universe.," Drama, Mecha, Sci-Fi, Space", 1982, Completed, Densetsu Kyojin Ideon
Space Thunder Kids, Movie, Three children pilots fight against the Dark Empire on their mission to destroy the universe.," Action, Mecha, Sci-Fi", 1991, Completed,
Space☆Dandy (Dub), TV Series," Space Dandy is a dandy in space! This dreamy adventurer with a to-die-for pompadour travels across the galaxy in search of aliens no one has ever laid eyes on. Each new species he discovers earns him a hefty reward, but this dandy has to be quick on his feet because it's first come, first served! Accompanied by his sidekicks, a rundown robot named QT and Meow the cat-looking space alien, Dandy bravely explores unknown worlds inhabited by a variety of aliens. Join the best dressed alien hunter in all of space and time as he embarks on an adventure that ends at the edge of the universe!"," Comedy, Sci-Fi, Space", 2014, Completed," Space Dandy, スペース☆ダンディ"
Space☆Dandy 2nd Season (Dub), TV Series," Second season of Space Dandy.Space Dandy is a dandy guy, in space! This dreamy adventurer with a to-die-for pompadour travels across the galaxy in search of aliens no one has ever laid eyes on. Each new species he discovers earns him a hefty reward, but this dandy has to be quick on his feet because it's first come, first served! Accompanied by his sidekicks, a rundown robot named QT and Meow the cat-looking space alien, Dandy bravely explores unknown worlds inhabited by a variety of aliens. Join the best dressed alien hunter in all of space and time as he embarks on an adventure that ends at the edge of the universe!"," Comedy, Sci-Fi, Space", 2014, Completed," Space Dandy 2, Space Dandy 2nd Season, スペース☆ダンディ 第2シリーズ"
Sparrow`s Hotel, TV Series," Satou Sayuri takes on the job as the new front desk worker at the Sparrow's Hotel — the closest hotel to Heaven. Her special features include an outgoing cheerful personality, her busty chest, and her assassination skills. She easily takes down people who cause trouble in the business hotel, but she is in fact very unskilled when talking to the male hotel manager, Shiokawa — who is actually Shiokawa Tamaki's older brother — and often bites her tongue.", Comedy, 2013, Completed, スパロウズホテル
Spawn, TV Series," Ken Kurosawa is a clever hitman and karate fighter from Los Angeles. His one and only reason to fight is to take care of his sick little sister, Mariko. But then Ken is murdered with a bomb-car. His last wish is to be with his sister in her birthday and take care of her forever.Seven years later, Ken is back on Earth, but now as a Hellspawn. Now, he most survive using his new powers from Hell against the new threats surrounding him, his old friendships and his little sister Mariko, who is now turning into a famous actress",, 0, Completed,
Special A, TV Series," When Hikari was little, she and her father liked to watch pro wrestling, and she became very good at it. She was the pride of her family until one day she was introduced to Kei, the son of her father's friend. He instantly defeated her in wrestling, and started what would become Hikari's major ambition to one day beat him. To do this she enrolled in Kei's school, an ultra-elite school that costs her father a lot of money.This unusual school created classes according to grades, and the top seven students become members of the Special A. They have their own building, and can optionally attend class. Hikari is usually the only one who does so, since she desperately wants to beat Kei with test scores. The members of the Special A have been close friends since their first year."," Comedy, Romance, School, Shoujo", 2008, Completed," Special A (S.A), スペシャル・エー"
Special A (Dub), TV Series," Hikari Hanazono has always been second to Kei Takishima. When they were six years old, their pro-wrestling loving fathers introduced them to each other. Assuming that she was the best in wrestling, young Hikari challenged Kei to a wrestling match only to be thoroughly defeated by him.Ever since that fateful incident, Hikari swore to beat Kei in school grades, sporting events - anything. To do this, she has enrolled in the same school as Kei since elementary. Now she attends Hakusenkan, an ultra elite school, that costs her carpenter father a lot of money.Hikari and Kei are the top two students in the school, with Kei holding firmly to that number one position. While Hikari considers Kei to be a rival and important friend, she is completely unaware that Kei loves her. The story primarily focuses on Hikari and her constant attempts to defeat her one and only rival, Kei, and how she finds love in their rivalry."," Comedy, Romance, School, Shoujo", 2008, Completed," Special A (S.A), スペシャル・エー"
Special Kid Factory, TV Series," The suspense sci-fi anime takes place in a future where unbeknownst to the people of Earth, there wages an interstellar war spanning the entire universe. Alien arms dealers control our world from behind the scenes, using it as a supersoldier factory where ""special kids"" with unique abilities are abducted to fight in wars on the other side of the universe. When one ""special kid"" escapes captivity and journeys back to earth, a seemingly ordinary boy discovers he is a body double for the family all while being drawn unarmed into the heart of a space war."," Mystery, Sci-Fi", 0, Upcoming, スペシャルキッド・ファクトリー
Speed Grapher, TV Series," Ten years after the Bubble War, the dichotomy between the rich and the poor in the world becomes more prominent and Japan is no exception. The rich seek to satisfy their desires and derive pleasure for themselves, and Tokyo has materialized into such a city as a result. Saiga, once a war photographer, works for Hibara Ginza in the capitalist state of Tokyo. He infiltrates the Roppongi Club, a secretive base located in the red light district of the city, to collect information about them. However, he was caught in the process and brought forward to a girl called Kagura who was in the midst of a ritual. His contact with Kagura awakens his special ability"," Action, Mystery, Super Power", 2005, Completed, スピードグラファー
Speed Grapher (Dub), TV Series," Ten years after the Bubble War, the dichotomy between the rich and the poor in the world becomes more prominent and Japan is no exception. The rich seek to satisfy their desires and derive pleasure for themselves, and Tokyo has materialized into such a city as a result. Saiga, once a war photographer, works for Hibara Ginza in the capitalist state of Tokyo. He infiltrates the Roppongi Club, a secretive base located in the red light district of the city, to collect information about them. However, he was caught in the process and brought forward to a girl called Kagura who was in the midst of a ritual. His contact with Kagura awakens his special ability"," Action, Mystery, Super Power", 2005, Completed, スピードグラファー
Spice and Wolf, TV Series," Kraft Lawrence (Spice) is a travelling medieval merchant, who finds a 600-year-old pagan harvest deity named Holo (Wolf) in his wagon one night. She begins travelling with him, and her wisdom helps increase his profits. But her true nature draws unwanted attention from the church..."," Adventure, Fantasy, Romance", 2008, Completed, 狼と香辛料
Spice and Wolf (Dub), TV Series," The peddler Lawrence Craft travels through the world selling all kinds of things. After visiting a village he discovers a sleeping girl under the hay in his cart. She has wolf ears and a tail. The wolf girl explains that she has been called a ""God"" but her name really is Holo and nothing else. Lawrence teases the girl a little, but after hearing more of her story is moved and decides to accompany her further north. On their travels the two have all sorts of adventures & often get into trouble but slowly the bond between them grows stronger."," Adventure, Fantasy, Romance", 2008, Completed, 狼と香辛料
Spice and Wolf 2, TV Series," Following Kraft Lawrence (Spice) an experienced travelling merchant and his sharp-tongued 600-year-old pagan deity companion Holo (Wolf) on their journey to return to Yoitsu, Holo's home in the north. A tender relationship has blossomed between the characters, as they make deals, travel between cities, encounter religious fanatics, overcoming the daily toils of a travelling merchant."," Adventure, Fantasy, Romance", 2009, Completed," Ookami to Koushinryou II, 狼と香辛料II"
Spice and Wolf 2 Special, Special," Following Kraft Lawrence (Spice) an experienced travelling merchant and his sharp-tongued 600-year-old pagan deity companion Holo (Wolf) on their journey to return to Yoitsu, Holo's home in the north. A tender relationship has blossomed between the characters, as they make deals, travel between cities, encounter religious fanatics, overcoming the daily toils of a travelling merchant."," Adventure, Fantasy, Romance", 2009, Completed," Ookami to Koushinryou II Specials, 狼と香辛料II"
Spice and Wolf II (Dub), TV Series," Kraft Lawrence, an experienced traveling merchant, and his sharp tongued wolf goddess companion, Holo, continue on their journey to return to Holo's home in the north called Yoitsu. A tender relationship blossoms between the two as they make deals and travel between cities."," Adventure, Fantasy, Romance", 2009, Completed," Ookami to Koushinryou II, 狼と香辛料II"
Spider Riders, TV Series," In this Earth, there exists unknown underground world, the Inner World. In the world, there are braves who fight with large spiders, and they are called Spider Riders.According to his grandfather's diary, a boy, Hunter Steel is traveling around. Meanwhile he happens to enter the Inner World from a pyramid. There, the war between the insect squad that aims at conquest of the Inner World and Spider Riders continues.Oracle, the fairly of the Inner World, summons Hunter because he thinks Hunter will be the messiah of the world. However, the powers of Oracle are sealed by Mantid who is the rule of the Insecter. For the peace of the Inner World, he has to find four sealed keys of Oracle to retrieve Oracle's power.Hunter asks Spider Shadow, which is a big spider chosen by Oracle, to become a member of Spider Riders to fight against enemies."," Action, Adventure, Mecha", 2006, Completed, Spider Riders
Spider Riders (Dub), TV Series," In this Earth, there exists unknown underground world, the Inner World. In the world, there are braves who fight with large spiders, and they are called “Spider Riders”.According to his grandfather’s diary, a boy, Hunter Steel is traveling around. Meanwhile he happens to enter the Inner World from a pyramid. There, the war between the insect squad that aims at conquest of the Inner World and Spider Riders continues.Oracle, the fairly of the Inner World, summons Hunter because he thinks Hunter will be the messiah of the world. However, the powers of Oracle are sealed by Mantid who is the rule of the Insecter. For the peace of the Inner World, he has to find four sealed keys of Oracle to retrieve Oracle’s power.Hunter asks Spider Shadow, which is a big spider chosen by Oracle, to become a member of Spider Riders to fight against enemies."," Action, Adventure, Mecha", 2006, Completed, Spider Riders
Spider Riders, TV Series, Second season of Spider Riders.," Action, Adventure, Mecha", 2007, Completed, Spider Riders
Spiral Zone (Dub), TV Series," Spiral Zone is a 1987 American science-fiction animated series produced by Atlantic/Kushner-Locke. Based in part from a toy line made by Japanese company Bandai, the series focused on an international group of soldiers fighting to free the world from a scientist who controls much of the Earth's surface. It only ran for one season, with a total count of 65 episodes."," Action, Mecha, Military", 1987, Completed,
Spiral, TV Series," Narumi Ayumu lives in the shadow of his older brother's disappearance two years earlier. Now residing with his brother's wife, police detective Narumi Madoka, Ayumu is constantly preoccupied by the last words his brother spoke"," Comedy, Drama, Mystery", 2002, Completed, Spiral
Spiral, TV Series," Ayumu Narumi's older brother Kiyotaka, a renowned detective and piano player, disappears all of a sudden. The only clue Narumi has, are the Blade Children. Two years later a row of murders and incidents begin, relating to the Blade Children. Together with school journalist, Hiyono Yuizaki, Narumi tries to figure out their destiny."," Drama, Mystery, Shounen", 2002, Completed, Spiral
Spirit of Wonder, Movie," Sometime during the late 19th century, a young Asian girl has made a place for herself in a seaside town as the owner and operator of the Tenkai restaurant and boarding house..Yet ""Miss China,"" as the locals call her, is in the dumps. She's got a Mad Scientist named Breckenridge living upstairs who is chronically late with the rent, and she's pining for Jim, a handsome watchmaker's apprentice whom she mistakenly believes is pursuing the local flower girl.But this isn't our world. It is a world that has the Spirit of Wonder, where every so often, just occasionally mind you, amazing things happen. The Mad Scientist actually has come up with an incredible invention, and Jim has an unbelievable plan to use it to give Miss China the most beautiful ring in all the World."," Romance, Sci-Fi, Seinen", 1992, Completed," China-san no Yutsu ~ The Spirit of Wonder, Spirit of Wonder"
Spirited Away, Movie," Spirited Away is a fantasy adventure with a ten year-old girl, which starts in everyday Japan but goes somewhere very different. For young Chihiro and her family, a mysterious tunnel and haunted town lead to the Land of Spirits, inhabited by gods and monsters and ruled by the greedy witch Yu-baba. Chihiro's parents are transformed into pigs; to rescue them, she must surrender her name and serve in this world. Luckily she finds friends and allies, including the handsome but mysterious boy Haku. Initially sulky and listless, Chihiro (or Sen, as she's now called) finds inner strengths and establishes an identity in this strange world. But can she win back her name and return home?"," Adventure, Drama, Romance, Supernatural", 2001, Completed," Sen to Chihiro no Kamikakushi, 千と千尋の神隠し"
Spirited Away (Dub), Movie," Stubborn, spoiled, and naïve, 10-year-old Chihiro Ogino is less than pleased when she and her parents discover an abandoned amusement park on the way to their new house. Cautiously venturing inside, she realizes that there is more to this place than meets the eye, as strange things begin to happen once dusk falls. Ghostly apparitions and food that turns her parents into pigs are just the start—Chihiro has unwittingly crossed over into the spirit world. Now trapped, she must summon the courage to live and work amongst spirits, with the help of the enigmatic Haku and the cast of unique characters she meets along the way.Vivid and intriguing, Sen to Chihiro no Kamikakushi tells the story of Chihiro's journey through an unfamiliar world as she strives to save her parents and return home."," Adventure, Drama, Supernatural", 2001, Completed," Sen to Chihiro no Kamikakushi, 千と千尋の神隠し"
Spiritpact, Winter 2017 Anime," Heir of an old famous family of exorcist, Keika You is stricken by poverty after losing his parents. He struggles as a street fortune teller and computer recovery part timer to earn money. One night in a junkyard, he meets the mysterious yet charismatic exorcist, Ki Tanmoku, fighting an evil spirit. This encounter is the beginning of a fated story for Keika You. Unfortunately for him, he was actually hit by a car and became a ghost. That was when the handsome exorcist Ki appeared and asked Keika to make a ""pact"" with him to fight evil spirits together. Here starts the friendship of our heroes!"," Action, Shounen Ai, Supernatural", 2017, Completed, Spirit Pact
Spiritpact S2, TV Series," Heir of an old famous family of Exorcist, You Keika is stricken by poverty after losing his parents and he had to struggle as a street fortune teller and as a computer recovery part timer to earn money. One night in a junkyard, he met the mysterious yet charismatic Exorcist, Tanmoku Ki who was fighting an evil spirit. This encounter was the beginning of a fated story for You Keika. Unfortunately for him, he was hit by a car and became a ghost. That's where, the handsome exorcist Tanmoku Ki appeared and asked You Keika to make “a pact” with him to fight Evil Spirits together. Here starts the friendship of our heroes!"," Action, Comedy, Magic, Shounen Ai, Supernatural", 0, Completed, Spirit Pact
Splendid Rebirth, ONA," In the past life, a bitch framed her, and the beloved came close to her just for money. Even grandfather and brother were murdered by them so that all her family wealth fell into the hands of others. This life, her husband comes from a rich and powerful family, indifferent, noble and unattainable. However, it happened that he falls for her and never changes his heart from that on.", Romance, 2020, Completed,
