name,Type,Plot Summary,Genre,Released,Status,Other name
Pokemon (2019) (Dub), Fall 2019 Anime," On a new day in the Kanto region, Satoshi gets invited by Professor Yukinari Ookido over to Professor Sakuragi's lab-opening ceremony in Vermillion City. During the ceremonial speech, Professor Sakuragi receives an alert of a possibly rare Pokémon appearing in Vermillion City's harbor, leading Satoshi and the other trainers to rush to the area in hopes of finding the mysterious Pokémon. At the harbor, they find Lugia—a Legendary Pokémon—engaged in combat with other trainers.Noticing the other trainers' tactics, Satoshi has his partner, Pikachu, strike Lugia with a Thunderbolt attack. Unfazed, Lugia flees, but not before Satoshi determinedly leaps onto its back. To Satoshi's surprise, he meets another boy, Gou, who leapt onto Lugia's back as well. The two ride on Lugia's back as it brings them along on a bizarre adventure across the seas. As it lets the two back on the ground, Satoshi and Gou bid their farewells to Lugia and return to Sakuragi Institute.Impressed by Gou's findings and Satoshi's insight taken during their encounter, Sakuragi requests for the duo to be his new research partners. And so the duo's journey begins, traveling across multiple regions to meet many new Pokémon—including ones that have the ability to Gigantamax!"," Action, Adventure, Comedy, Fantasy, Kids", 2019, Ongoing," Pocket Monsters, Pokemon 2019, Pokémon, Pokemon Journeys, Pokémon Journeys"
Pokemon (2019), Special, A one-episode story depicting the encounter between the mysterious boy Haruto and Satoshi.," Action, Adventure, Comedy, Fantasy", 2022, Completed, Pocket Monsters
Pokemon (2019), Special, Special episodes of the Pocket Monsters anime distributed exclusively on Amazon Prime to promote the release of Pokémon LEGENDS," Adventure, Fantasy", 2019, Completed, Pokémon
Pokemon (2019), ONA, A 4-episode special web-series that was streamed exclusively on Amazon Prime Video to celebrate the release of the Nintendo Switch game Pokémon Legends," Action, Adventure, Comedy, Fantasy", 2022, Completed, ポケットモンスター 神とよばれし アルセウス
Pokemon (2019), Special, Recap TV Special that aired after episode 72 of Pokemon (2019).," Action, Adventure, Comedy, Fantasy, Kids", 2021, Completed, Pocket Monsters
Pokemon (Dub), TV Series," A young boy named Satoshi embarks on a journey to become a ""Pokemon Master"" with his first Pokemon, Pikachu. Joining him on his travels are Takeshi, a girl-obsessed Rock Pokemon Trainer, and Kasumi, a tomboyish Water Pokemon Trainer who may have a crush on him. Satoshi and Co. end up traveling through various regions, including Kanto, the Orange Islands, and Johto, and then enter the Pokemon League competitions there. Along the way, they run into many confrontations with Musashi, Kojirou, and Nyarth, a trio of Pokemon thieves who are apart of an evil organization called ""Team Rocket."" But every time Team Rocket tries to do their evil deeds, they fail thanks to Satoshi and his Pokemon."," Action, Adventure, Comedy, Fantasy, Kids", 2002, Completed," Pocket Monsters, Pokémon, ポケットモンスター"
Pokemon (Shinsaku Anime), Spring 2023 Anime," Follow Liko and Roy as they unravel the mysteries that surround them and encounter Friede, Captain Pikachu, Amethio, and others during their exciting adventures!"," Action, Adventure, Comedy, Fantasy, Kids", 2023, Ongoing," ポケットモンスター 新シリーズ , Pokémon Horizons"
Pokemon 3, Movie," Young Molly Hale is a 5-year old girl who has lost her father to the Unown, a strange group of Pokemon who can make a person's dreams real by using their Psychic energy. One day she accidently releases the Unown, and they begin to answer Molly's wishes; first by creating Entei, a legendary lion-like Pokemon who Molly then thinks is her father because he always pretended to be Entei when he played with her. Molly then feels lonely because she has no mother, so Entei decides to kidnap Ash's mother and forces her to become Molly's. Ash, Brock, and Misty must then try to save Ash's mom, Delia, and Molly; And in the process they must also try to find a way to stop the Unown from turning the town of Greenfield into a bizarre crystal wasteland."," Action, Adventure, Comedy, Drama, Fantasy, Kids", 2000, Completed, Pokemon 3
Pokemon 4Ever (Dub), Movie," 40 years ago, a Celebi was being attacked by a Pokemon Hunter. Luckily, a young boy named Sammy saved Celebi. Using its Time Traveling power, Celebi transported himself and Sammy 40 years into the future. There, Ash, Misty, and Brock assist Sammy to the healing lake in the forest so they can heal the wounded Celebi. Unfortunately an evil Team Rocket member, Viscious a.k.a. ""The Iron Masked Marauder"", tries to capture Celebi using his technology. As Ash and Co. try to get away from Viscious, they also run into Jessie, James, and Meowth, who also want to capture Celebi. Soon it becomes a race against time to get Celebi and Sammy back to the forest before Celebi is caught and is used to destroy the forest and themselves."," Action, Comedy, Drama, Magic, Shounen", 0, Completed, Pokemon
Pokemon Advanced Generation (Dub), TV Series," After participating in the Johto League, Ash decides to begin anew in yet another journey; this time by himself and Pikachu, in the land of Hoenn. Though he isn't alone for long, as 10-year-old May (whom dislikes Pokemon, but just wants to come along to see the world) travels with him after Pikachu destroys her bicycle. Ash also meets up with his old companion, Brock, and May's younger brother, Max. Together, they travel along in Hoenn, battling Gym Leaders, entering Contests, and other events on the way to the Hoenn League."," Action, Adventure, Comedy, Kids", 2002, Completed, Pokemon
Pokemon Best Wishes! Season 2 Special, TV Series," Satoshi, Iris & Dent continue their travels through the Isshu region. After successfully winning his 8th Gym Badge against Homika in Tachiwaki City, Shirona invites everyone to stay at her villa in East Isshu, where old friend Hikari is also staying, and participate in the Pokemon World Tournament Junior Cup before Satoshi participates in the Unova League. Team Rocket, meanwhile, initiate their final plan for the Isshu region-what is their purpose in their desire for the legendary Pokémon Meloetta?"," Adventure, Comedy, Fantasy, Kids, Shounen", 2013, Completed, Pokemon Best Wishes! Season 2
Pokemon Best Wishes! Season 2, Special, Iris vs Ibuki! The Road to Become a Dragon Master!! is the second spin off of the Best Wishes series of the Pokémon anime.," Adventure, Comedy, Fantasy, Kids, Shounen", 2014, Completed, Pokemon Best Wishes! Season 2
Pokemon Best Wishes! Season 2, Movie," The 16th Pokemon movie and the 3rd ""Best Wishes!"" movie."," Adventure, Comedy, Fantasy, Kids, Shounen", 2013, Completed, Gekijouban Pocket Monsters Best Wishes 2
Pokemon Chronicles (Dub), TV Series," Pokémon Chronicles is a TV series comprised of the English-dubbed versions of a number of Pokémon TV specials. Many of the episodes are from the Weekly Pokémon Broadcasting Station show in Japan, but it also contained The Legend of Thunder! and shorts from the Pikachu's Winter Vacation series. The series, in each episode, basically focuses on the lives of the many of the recurring/main characters Ash Ketchum met on his journey, like Sakura, Misty, her sisters, Casey, and Tracey. Ash only makes two appearances in the series in brief cameos.(Source"," Action, Comedy, Fantasy, Kids", 2002, Completed," Pokemon Housoukyoku, Pokémon Side Stories, Shuukan Pokemon Housoukyoku, Pokemon Hoso, ポケモン放送局"
Pokemon Crystal, Special," Kenta, a Pokemon master in the making, meets up with his childhood friend, Marina, at a Pokemon Center, to see how their skills have developed. Their battle is interrupted by a thunderstorm and the arrival of Bashou and Buson, two Roketto-Dan members using the Crystal System (which attracts Electric-type Pokemon). Their ultimate goal is to, under the guidance of Shiranui-hakase, bring Pokemon back to Sakaki. Kenta and Marina stumble upon this plan, and they try to stop it, but things get more difficult when the legendary Pokemon Raikou is captured."," Action, Adventure, Comedy, Fantasy, Kids", 2001, Completed," Pokemon Crystal - Raikou, The Legend of Thunder, ポケットモンスター クリスタル ～ライコウ 雷の伝説～"
Pokemon Daiundoukai, ONA," It's Pokémon Sports Day!Watch Pokémon compete in various games such as foot races, ball-tossing, tug of war, and jump rope!The accompaniment of a classical music medley makes the event more fun."," Kids, Music", 2020, Completed," Pokémon Sports Day, ポケモン大運動会"
Pokemon Diamond & Pearl (Dub), TV Series," After defeating Brandon and declining the offer to be a Frontier Brain, Ash sets off to travel through the far away land of Sinnoh. Once he gets there, he meets up with Hikari, a local trainer from the region, and they decide to travel together."," Action, Adventure, Comedy, Fantasy, Kids", 2006, Completed, Pokemon Season 10
Pokemon Evolutions, ONA, An animated series created to celebrate 25 years of the global entertainment franchise. Each episode will take fans on a journey through all the known regions of the Pokémon world.," Adventure, Fantasy, Kids", 2021, Completed, Pokémon Evolutions
Pokemon Evolutions (Dub), ONA, An animated series created to celebrate 25 years of the global entertainment franchise. Each episode will take fans on a journey through all the known regions of the Pokémon world.," Adventure, Fantasy, Kids", 2021, Completed, Pokémon Evolutions
Pokemon Fushigi no Dungeon, Special," A human wakes up one day to discover that he has become a Squirtle in a world filled with natural disasters, where he meets Charmander and Chikorita of Team Go-Getters, a Pokemon rescue team. Squirtle joins Team Go-Getters for the task of saving Pichu's Brother Pikachu from Skarmory, however Gengar and his Team Meanies decide to interfere."," Adventure, Fantasy", 2006, Completed, Pokemon Mystery Dungeon
Pokemon Fushigi no Dungeon, Special," In a world where Pokémon live and communicate with each other, there are mythical treasures known as the Time Gears that regulate the flow of time in their respective areas. If one is removed from its resting place, time will freeze in that area, so even evil Pokémon do not dare to steal them. But recently, anomalies in time have been appearing throughout the land, causing the appearance of Mystery Dungeons and violent Pokémon. Pokémon exploration teams have been formed to explore these Mystery Dungeons, arrest the violent Pokémon, and help maintain the peace.It turns out that the anomalies in time have not been caused by the recent disappearance of the Time Gears, but by Temporal Tower slowly falling apart and Dialga corrupting into Dark Dialga. The newly infamous thief Juptile had stolen the Time Gears in order to take them to Temporal Tower and stop its deterioration. The Pokémon exploration team Team Pokédans—which consists of Hikozaru and a once-human Pochama—must team up with Juptile to go to the Phantom Land where Temporal Tower is located. If the trio fails, Temporal Tower will completely collapse, leaving the whole world frozen in time forever..."," Action, Adventure, Kids", 2009, Completed, Pokemon Mystery Dungeon
Pokemon Fushigi no Dungeon, Special," In a world where only Pokémon live, one Hikozaru wishes to be part of Pukurin Guild—a large area where Exploration Teams gather and work. Intimidated by the apparent strength of the guild members and the guild's security, Hikozaru runs away, stumbling over an unconscious Pochama in the middle of his escape. The Pochama wakes up and is immediately shocked by both a talking Hikozaru as well as his own appearance—because Pochama knows that he is actually a human!With Pochama having no memories aside from previously being human (as well as countless questions about his new body), Hikozaru suggests that he ask the leader of Pukurin Guild for help. While Guildmaster Pukurin may not have answers about Pochama's transformation, he decides to make Pochama and Hikozaru an Exploration Team, which HIkozaru calls Pokédans. For their first mission, the duo must get a Gabite Scale by going to Labyrinth Cave with Kimawari!"," Adventure, Fantasy", 2007, Completed, Pokemon Mystery Dungeon
Pokemon Generations, ONA," Pokémon Generations revisits each generation of the Pokémon video game series to shed new light on some timeless moments. From the earliest days in the Kanto region to the splendor of the Kalos region, go behind the scenes and witness Pokémon history with new eyes!"," Action, Adventure, Fantasy, Game, Kids", 2016, Completed," Pokémon Generations, Pocket Monsters Generations, ポケモンジェネレーションズ"
Pokemon Heroes, Movie," Long ago, on an island called Altomare, there lived an old man and woman. One day, the couple found two small children lying on the shore, badly wounded. The couple took them in and took care of them, and the children quickly recovered. But then, the island was attacked by monsters. Within moments the island fell into the monsters' wrath. Next, before the old man and lady's eyes, the children who they had taken care of transformed into the Eon Pokemon, Latios and Latias. They called their family from the sky. They came, and carried a stone with them containing the power to force the monsters away. This gem was known as the ""Soul Dew."" Peace returned to the island; however, later in the present, a criminal duo—Zannâ and Rion—us seeking Latios and Latias in order to take control of the Soul Dew. Taking a short break in Altomare, Satoshi befriends Latias and is now dragged into the situation helping to save Altomare from becoming swallowed up by destruction again."," Adventure, Comedy, Drama, Fantasy, Kids", 2002, Completed, Pokemon
Pokemon Legends Arceus, ONA," The anime tells the story of a boy named Akio and his encounter with a Hisuian Zorua. When he was younger, Akio's father taught him that people and Pokémon cannot live together. But Akio's interactions with the Zorua might offer a different lesson."," Action, Adventure, Fantasy, Kids", 2022, Completed, Pokemon
Pokemon Legends Arceus, ONA," The anime tells the story of a boy named Akio and his encounter with a Hisuian Zorua. When he was younger, Akio's father taught him that people and Pokémon cannot live together. But Akio's interactions with the Zorua might offer a different lesson."," Action, Adventure, Fantasy, Kids", 2022, Completed, Pokemon
Pokemon Movie 06, Movie," Satoshi, Haruka, Takeshi, and Masato come upon the festival of the Wishing Star of Seven Nights. During their enjoyment, the legendary pokemon, Jirachi, decends from the heavens and befriends Masato. Jirachi, with the power to grant any wish, is sought after by many people wanting to claim its power. One man seeks to use its legendary power to revive an ancient pokemon known as Groudon, unaware of the dangers hidden within Jirachi's powers"," Adventure, Comedy, Drama, Fantasy, Kids", 2003, Completed," Pokemon Movie 6, Pokemon Advanced Generation"
Pokemon Movie 07, Movie," Satoshi and his friends travel to LaRousse, where they meet a boy named Tooi who is afraid of Pokemon due to an incident that happened four years earlier. Meanwhile, Deoxys, a Pokemon from space, has reappeared, putting a barrier around the city and kidnapping people. Rayquaza, a Pokemon that lives in the atmosphere, comes to fight it."," Action, Adventure, Comedy, Fantasy, Kids, Sci-Fi", 2004, Completed," Pokemon Movie 7, Pokemon"
Pokemon Movie 08, Movie," In the town of Lohta, a festival is thrown praising ""Aaron the Wave Leader Hero"" who, according to the legend passed down through the town's generations, stopped a war centuries ago by using the power of ""the Tree of the World's Origin."" Satoshi and Pikachu participate in a battle to decide this year's hero and after their victory, they are chosen as the ""Wave Leader Hero."" A grand dance party is held in the castle to celebrate the victor, but suddenly the phantom Pokemon Mew appears and takes Pikachu. Soon afterwards, the Wave Leader Pokemon ""Lucario"" is freed from his centuries-long seal and meets Satoshi. Satoshi must solve the various mysteries of where Pikachu is, what Mew's after, what the secret of the legend of the Wave Leader is and how it ties in with Lucario's hidden past as he makes his way to ""the Tree of the World's Origin"" with Lucario."," Action, Adventure, Drama, Fantasy, Kids", 2005, Completed," Pokemon Movie 8, Pokemon"
Pokemon Movie 1, Movie," The adventure explodes into action with the debut of Mewtwo, a bio-engineered Pokémon created from the DNA of Mew, the rarest of all Pokémon. Determined to prove its superiority, Mewtwo lures Ash, Pikachu and the others into a Pokémon match like none before. Mewtwo vs. Mew, Super-clones vs. Pokémon. It's the ultimate showdown... with the very future of the world at stake!"," Adventure, Comedy, Drama, Sci-Fi, Shounen", 1998, Completed, Pokemon
Pokemon Movie 10, Movie," Dialga rules time, and Palkia rules space, they lived in an alternate dimension so they decided to fight within their own reality, which would make it bad for the real world too. Dialga and Palkia appear before Ash and his friends and drag the city into their own world. If they destroy this city, they'll also destroy the whole world."," Adventure, Comedy, Shounen", 2007, Completed, Pokemon Diamond & Pearl
Pokemon Movie 11, Movie," After winding up in the middle of the battle between Giratina and Dialga, Shaymin somehow reached the place where Satoshi (Ash) and his friends are taking a break...But with the battle going on in the Torn World, also known as the Reverse World, they somehow got involved, leading to a more complicated case than they ever imagined..."," Action, Adventure, Shounen", 2008, Completed, Pokemon Diamond & Pearl
Pokemon Movie 12, Movie," Many millennia ago, a meteor from space threatened to destroy the world. As it happened, Arceus got badly injured while trying to stop it. After that Damos took over and the world was saved. Being thankful for the intervenience, Arceus promised to help make the desolate land of Michiina rich and prosperous, giving Damos the Jewel of Life.Arceus let Damos borrow 16 parts of his body to create the Jewel of Life which were to be returned to him on a specific date. When that didn't happen, the betrayed Arceus swore to judge the humans when he awakes again.Now, Satoshi, Hikari and Takeshi arrive in the riverside town of Michiina which is surrounded by nature's beauty. They decide to go into the ruins of Michiina which are at the summit of a large rock. There is a beautiful lake at its shores and Satoshi and friends are fascinated by it. Suddenly, waves begin to form and a tornado of water starts to wreak havoc.A descendant of Damos, a girl called Sheena, runs out from the ruins of Michiina. Sheena sees what's happening and summons Dialga, which manages to stop the tornado.Satoshi and his friends finally get to see the ruins and Kevin and Sheena tell the old legend of Michiina to them. Moments after they explain the legend, the fighting between Dialga, Palkia and Giratina becomes fierce and the ruins of Michiina are destroyed. Arceus is awoken..."," Adventure, Comedy", 2009, Completed, Pokemon Diamond & Pearl
Pokemon Movie 13, Movie," The Fury of Zoroark Has Been Unleashed!The Pokémon Baccer World Cup.It is the most anticipated event of the year, and as hundreds flock to Crown City to watch the exciting competition unfold, Ash, Pikachu, and his friends encounter a mysterious new Pokémon they have never seen before.But when the three Legendary Pokémon Raikou, Entei, and Suicune suddenly arrive and begin rampaging through the streets, it's up to Ash and his companions, along with their new Pokémon friend Zorua, to uncover the secret behind the immense and powerful forces at work.What strange and dangerous powers are afoot in Crown City? Why did Celebi suddenly return after vanishing for twenty years? And why is the mighty Zoroark unleashing its fury upon the town? The quest for these answers leads down an uncertain path filled with peril—can Ash and his companions find enough courage, strength, and friendship to unearth the mystery in time to save Crown City?"," Action, Adventure, Shounen", 2010, Completed, Pokemon Diamond & Pearl
Pokemon Movie 14, Movie, The stories of the two movies will be the same until Satoshi and Pikachu meet Victini but the legendary Pokemon will be either Zekrom or Reshiram.," Adventure, Comedy, Shounen", 2011, Completed, Pokemon Best Wishes!
Pokemon Movie 14, Movie, The stories of the two movies will be the same until Satoshi and Pikachu meet Victini but the legendary Pokemon will be either Zekrom or Reshiram.," Adventure, Comedy, Shounen", 2011, Completed, Pokemon Best Wishes!
Pokemon Movie 15, Movie," The 15th Pokemon movie and the 2nd 'Best Wishes!' movie. It will feature the legendary Pokemon Kyurem (appearing also in its new Black Kyurem and White Kyurem formes.) The Legendary Musketeer Pokemon-Cobalion, Terrakion and Virizion-will appear alongside their newly revealed 4th member, Keldeo."," Adventure, Comedy, Shounen", 2012, Completed, Pokemon Best Wishes! Season 2
Pokemon Movie 16 Special, Movie, A theatrical short film shown together with Gekijouban Pocket Monsters," Adventure, Comedy, Fantasy, Kids, Shounen", 2013, Completed, Pokemon
Pokemon Movie 16, Movie," The 16th Pokemon movie and the 3rd ""Best Wishes!"" movie."," Adventure, Comedy, Fantasy, Kids, Shounen", 2013, Completed, Pokemon Best Wishes! Season 2
Pokemon Movie 17 Special, Special," The story is set in Diamond Ore Country, of which Diancie is the princess.This is a country located deep underground, where the Pokémon Carbink live together in peace. The energy source of this country is a giant diamond called the Sacred Diamond, which can only be created by princess Diancie. However, the current princess doesn't yet possess the power to create such a diamond, and the current Sacred Diamond's power is soon going to run out, which would result in the end of the country. Diancie meets up with Ash and Pikachu, and set off together with them to search for the legendary Pokemon Xerneas, which possesses sacred power, but on the way, they find the cocoon where the Destruction Pokémon, Yveltal, who was said to have once destroyed life in Kalos, lies in wait."," Fantasy, Kids", 2014, Completed," Diancie, Princess of the Diamond Domain, 鉱国のプリンセス ディアンシー"
Pokemon Movie 17, Movie," The story is set in Diamond Ore Country, of which Diancie is the princess.This is a country located deep underground, where the Pokémon Carbink live together in peace. The energy source of this country is a giant diamond called the Sacred Diamond, which can only be created by princess Diancie.However, the current princess doesn't yet possess the power to create such a diamond, and the current Sacred Diamond's power is soon going to run out, which would result in the end of the country. Diancie meets up with Ash and Pikachu, and set off together with them to search for the legendary Pokemon Xerneas, which possesses sacred power, but on the way, they find the cocoon where the Destruction Pokémon, Yveltal, who was said to have once destroyed life in Kalos, lies in wait."," Fantasy, Kids", 2014, Completed, Pokemon XY
Pokemon Movie 18 Special, Movie," As with previous Pokémon films, a short will run alongside the main film, and the poster for the short features Pikachu, Meowth, and Dedenne. The title of the short will be revealed later."," Adventure, Fantasy, Kids", 2015, Completed, ポケモン・ザ・ムービーXY『ピカチュウとポケモンおんがくたい』
Pokemon Movie 18, Movie," EditSynopsisOne hundred years ago, Dahara City was beset by a terrible calamity brought on by a great power. The city was saved when a mysterious man sealed that power in the Prison Bottle, and became peaceful.In the present, Ash and his friends arrive in Dahara City, where they meet the mischievous Pokémon Hoopa as well as its human companion Mary. However, when Mary's elder brother Barza discovers the Prison Bottle in the desert and multiple Legendary Pokémon appear in the city, the battle of a century ago restarts, triggering a cataclysm that forces the appearance of even more Legendary Pokémon, drawing Arceus into the fray."," Adventure, Fantasy, Kids", 2015, Completed, Pokemon the Movie XY
Pokemon Movie 19, Movie," A mysterious force binds Ash to the Mythical Pokemon Volcanion when it falls from the sky. Volcanion can't get away, and Ash is dragged along as it continues on its mission. They arrive in a city of cogs and gears, where a corrupt minister has stolen the ultimate invention"," Adventure, Fantasy, Kids", 2016, Completed, ポケモン・ザ・ムービーXY＆Z「ボルケニオンと機巧（からくり）のマギアナ」
Pokemon Movie 19, Movie," A mysterious force binds Ash to the Mythical Pokémon Volcanion when it falls from the sky. Volcanion can't get away, and Ash is dragged along as it continues on its mission. They arrive in a city of cogs and gears, where a corrupt minister has stolen the ultimate invention"," Adventure, Fantasy, Kids", 2016, Completed, Pokemon the Movie XY&Z
Pokemon Movie 2, Movie," Ash Ketchum must put his skill to the test when he attempts to save the world from destruction. The Greedy Pokemon collector Lawrence III throws the universe into chaos after disrupting the balance of nature by capturing one of the Pokemon birds that rule the elements of fire, lightning and ice. Will Ash have what it takes to save the world?"," Adventure, Comedy, Drama, Shounen", 1999, Completed, Pokemon
