name,Type,Plot Summary,Genre,Released,Status,Other name
Ah! My Goddess - Flights of Fancy Specials (Dub), Special," When Keiichi found his grandpa's diary and saw a treasure map inside, Skuld and Urd started to feel a great urge to search it. With the company of his friends, Keiichi arrives to Honda Inn, the place indicated on the map. Once the party is inside, they meet Honda Chieko, who seems to share a certain promise with Keiichi. Apart from all that confusion, it's time for Keiichi to have enough courage to say the words 'I love you' to Belldandy."," Comedy, Magic, Romance, Supernatural", 2007, Completed, Ah! My Goddess
Ah! My Goddess OVA, TV Series," Morisato Keiichi is a down on his luck college student. Although possessing a diligent and generous nature, he had the misfortune of being born under an unlucky star. As a result, the current state of his life is somewhat unenviable. All that is about to change, however, as Heaven has taken notice of his plight.A goddess, Belldandy, is despatched to Earth to grant Keiichi one wish. One wish, be it unlimited power, wealth, or his fondest desire. And his wish? ‘I wish that a goddess like you will stay with me forever.’"," Comedy, Magic, Romance, Supernatural", 1993, Completed, ああっ女神さまっ
Ah! My Goddess The Movie, Movie," Trouble in Paradise! Belldandy's mentor, Celestin, was imprisoned for attempting to overthrow the Goddess system, but now he's back! Using a system virus, Celestin, corrupts the Goddess system and removes all of Belldandy's memories of Keiichi! Will Belldandy's love for Keiichi prove to be the key to ruining Celestin's plans, or will it be the final ingredient necessary to destroy our reality?!"," Comedy, Magic, Romance, Supernatural", 2000, Completed," Gekijouban Aa! Megamisama, Aa! Megami-sama!"
Ah! My Goddess, TV Series," Morisato Keiichi is a down on his luck college student. Although possessing a diligent and generous nature, he had the misfortune of being born under an unlucky star. As a result, the current state of his life is somewhat unenviable. All that is about to change, however, as Heaven has taken notice of his plight.A goddess, Belldandy, is despatched to Earth to grant Keiichi one wish. One wish, be it unlimited power, wealth, or his fondest desire. And his wish? ‘I wish that a goddess like you will stay with me forever.’"," Comedy, Magic, Romance, Seinen, Supernatural", 2006, Completed, Aa! Megami-sama!
Ah! My Goddess, TV Series," Morisato Keiichi is a down on his luck college student. Although possessing a diligent and generous nature, he had the misfortune of being born under an unlucky star. As a result, the current state of his life is somewhat unenviable. All that is about to change, however, as Heaven has taken notice of his plight.A goddess, Belldandy, is despatched to Earth to grant Keiichi one wish. One wish, be it unlimited power, wealth, or his fondest desire. And his wish? ‘I wish that a goddess like you will stay with me forever.’"," Comedy, Magic, Romance, Supernatural", 2011, Completed," Ah! My Goddess (2011), Oh! My Goddess (2011), Aa! Megami-sama!"
Ah! My Goddess, Movie," or centuries, a god named Celestin has been imprisoned on the moon for betraying the kingdom of Yggdrasil. Released by the fairy Morgan Le Fey, Celestin travels to Earth to reunite with his former pupil, the goddess Belldandy. Things go awry as Celestin erases Belldandy's memories of her boyfriend Keiichi and uses her as a catalyst to wreak havoc on Earth and Yggdrasil."," Comedy, Magic, Romance, Supernatural", 2000, Completed," Gekijouban Aa! Megamisama, Aa! Megami-sama!"
Aharen-san wa Hakarenai, Spring 2022 Anime," Reina Aharen, a small and cute student with a quiet voice, is quite bad at determining distance and personal space. Sometimes she's inches away from your face, and at other times, miles too far! The only one who tries to understand her antics is Raidou Matsuboshi, who is seated beside her in class. He has a menacing face, but in reality, he is a kind boy with an imagination that can run wild at times.Aharen-san wa Hakarenai follows the peculiar pair as their odd friendship starts to blossom when Raidou picks up Aharen's eraser for her. She misinterprets his gesture and now believes them to be best friends, showing how the simplest of things can prove to be the most complicated of challenges for them."," Comedy, School, Shounen", 2022, Completed," Aharen Is Indecipherable, 阿波連さんははかれない"
Aharen-san wa Hakarenai (Dub), Spring 2022 Anime," Reina Aharen, a small and cute student with a quiet voice, is quite bad at determining distance and personal space. Sometimes she's inches away from your face, and at other times, miles too far! The only one who tries to understand her antics is Raidou Matsuboshi, who is seated beside her in class. He has a menacing face, but in reality, he is a kind boy with an imagination that can run wild at times.Aharen-san wa Hakarenai follows the peculiar pair as their odd friendship starts to blossom when Raidou picks up Aharen's eraser for her. She misinterprets his gesture and now believes them to be best friends, showing how the simplest of things can prove to be the most complicated of challenges for them."," Comedy, School, Shounen", 2022, Completed," Aharen Is Indecipherable, 阿波連さんははかれない"
Ahiru no Sora, Fall 2019 Anime," A stout, weak, yet highly passionate Sora Kurumatani enters Kuzuryuu High School with hopes that he'll fulfill his mother's wishes to dominate his first high school tournament. However, the basketball club—turned den for delinquents—does anything but play basketball! Its club members, Momoharu Hanazono, a skilled blocker who can do power jumps but is horrible at shooting, and his twin brother Chiaki, a talented point guard, has also lost interest in the sport. With just one game overwhelmed with adrenaline rush and excitement, and Sora's pure love for the game, the youth's burning out spirit for basketball rekindles."," Drama, School, Shounen, Sports", 2019, Completed, あひるの空
Ahiru no Sora (Dub), Fall 2019 Anime," Lacking what is considered the most important asset in basketball, Sora Kurumatani has struggled with his short height since the inception of his love for the game. Despite missing this beneficial aspect, Sora's unwavering drive never allowed his small stature to dictate his ability to play, believing strongly in trying his hardest and persistently practicing to prove his capability.In hopes of satisfying his mother's wishes, Sora enters Kuzuryuu High School to become a member of the basketball club and compete wholeheartedly in tournaments. However, Sora is disappointed to find out that the boy's basketball team is nothing but a retreat for punks who have no interest in the sport. Sora also comes to learn that brothers Chiaki and Momoharu Hanazono—whom he becomes acquainted with—have also lost their once spirited motivation to play. Determined to revive the basketball team, Sora challenges the boys to a match against him, where his quick feet and swift movements overwhelm the group. Gradually affected by Sora's impressive skills, sheer effort, and tireless devotion to basketball, the boys unexpectedly find their burnt-out passion for the game rekindling once again."," Drama, School, Shounen, Sports", 2019, Completed, あひるの空
Aho Girl, Summer 2017 Anime," This 4-koma style manga features Yoshiko, a genuinely stupid girl (she can even manage to get all 0's on multiple choice tests). She hangs out at school with her childhood friend, who she claims to like, and he has to put up with all her ridiculous behavior!"," Comedy, Romance, School", 2017, Completed, アホガール
Ai City, Movie," It's sometime in the future and the story starts off with Kei and Ai running for their lives. Ai is a little girl who holds a terrible secret which could destroy the current world. The world is now populated by Headmeters, people who have psychic powers and their strength is shown on their forehead when they fight. However, Kei was an experimental subject and his strength never went above level 5 while other surpasses his ability effortlessly. While escaping, when in desperate moments, Kei could increase his ability to infinity when Ai is in trouble.The one who's after her have a deep secret, aided by a small dwarflike man living in a robotic suit. Eventually Ai is captured and Kei, a sherlock holmes detective and another Headmeter who was converted to the good side when Kei unleashed his horrible powers through Ai must go and rescue her.Together they must save Ai and the secret which she holds. What is the secret of Ai? Who is she?"," Action, Sci-Fi, Super Power", 1986, Completed," Love City, アイ・シティ"
Ai Mai Mi, TV Series," This film’s very interesting for person who love Japanese manga.Ai, Mai, Mii, and Ponoka-sempai are girls in manga club. They’re fighting evil invaders threatening Earth, facing off against rivals in tournaments, ...This film’s very interesting for person who love Japanese manga.Ai, Mai, Mii, and Ponoka-sempai are girls in manga club. They’re fighting evil invaders threatening Earth, facing off against rivals in tournaments, and dealing with other absurd situations when they are not drawing manga. A excited story’s about the four-panel manga “Ai Mai Mi”."," Comedy, Slice of Life", 2013, Completed," Choboraunyopomi Gekijou Ai Mai Mii, Ai Mai Mi, I My Me, ちょぼらうにょぽみ劇場 あいまいみー"
Ai Mai Mii, Summer 2014 Anime, Second season of Ai Mai Mii.," Comedy, Slice of Life", 2014, Completed, Choboraunyopomi Gekijou Dai Ni Maku Ai Mai Mii
Ai Mai Mii, TV Series, Unaired episode inluded with the Blu-ray/DVD release.," Comedy, Slice of Life", 2015, Completed, あいまいみー～妄想カタストロフ～
Ai Mai Mii, Winter 2017 Anime, Third season of Ai Mai Mii., Slice of Life, 2017, Completed, ちょぼらうにょぽみ劇場第三幕『あいまいみー～Surgical Friends～』
Ai Mai! Moe Can Change!, Movie, Ai Mai! Moe Can Change!," Comedy, Sci-Fi", 2012, Completed, あいまい! 萌えCanちぇんじ!
Ai Monogatari, OVA," An OVA based on the work of Kawaguchi Kaiji consisting of nine independent stories, each animated by a different director. With Beatles music involved, somewhere."," Drama, Romance", 1993, Completed," Kawaguchi Kaiji's 9 Love Stories, 愛物語 9 Love Stories"
Ai no Gakkou Cuore Monogatari, TV Series," Enrico Pocchini is a kind-hearted schoolboy with a strong sense of justice who lives in the Italian town of Torino. As a new term starts, he loses his beloved teacher, Miss Delacci, who is replaced by the stern Sr. Pelboni. Eventually, the boys in Enrico's class come to respect Sr. Pelboni, and learn about love, life and human kindness."," Drama, Historical, School, Slice of Life", 1981, Completed, 愛の学校 クオレ物語
AI no Idenshi, TV Series," This science fiction omnibus depicting a doctor who ""treats"" robot and humanoid problems takes place in the near future, when humanoids with artificial intelligence account for 10% of the population. The main character, Dr. Sudo Hikaru, also has the undercover name Moggadeet, under which he secretly takes on illegal medical procedures. For example, for a man who inadvertently infected his humanoid wife with a computer virus when illegally backing up her data, Sudo proposes an operation to rewrite her memory using backup data. Could an existence replaced by backup data truly be said to be the same as it was before?"," Drama, Sci-Fi, Suspense", 0, Upcoming, AIの遺電子
Ai no Kusabi (2012), OVA," The story is set in the future on the planet named Amoi which is controlled by a supercomputer named Jupiter. Among the mostly male human population, the light-haired elite class is allowed to temporarily keep the dark-haired ""mongrels"" as pets. One elite member, Iason, encounters a mongrel named Riki in the slums and decides to take him in. However, Iason keeps Riki longer than it is socially approved, and rumors abound about their possible relationship."," Boys Love, Drama, Erotica, Sci-Fi", 2012, Completed, 間の楔
Ai no Kusabi (2012) (Dub), OVA," The story is set in the future on the planet named Amoi which is controlled by a supercomputer named Jupiter. Among the mostly male human population, the light-haired elite class is allowed to temporarily keep the dark-haired ""mongrels"" as pets. One elite member, Iason, encounters a mongrel named Riki in the slums and decides to take him in. However, Iason keeps Riki longer than it is socially approved, and rumors abound about their possible relationship."," Boys Love, Drama, Erotica, Sci-Fi", 2012, Completed, 間の楔
Ai no Kusabi Ova, OVA," On planet Amoi, a great society has developed, creating a computerized city called Tanagura, ruled by supercomputer Jupiter. The populace is almost entirely male and is based on hair color; silver and/or blonds are the elitist, ending with dark/black haired as the bottom of society, often known as “mongrels”. Blondies keep “pets”, young boys kept for a few years, especially made for performing sexual actions for the Blondie’s voyeurism entertainment. Blondies aren’t suppose to keep pets for long or interact sexually with pets, but one blondie named Iason Mink has kept a pet named Rikki, for years and is rumored to sleep with him. Iason refuses to let go of Rikki, even with Jupiter’s disapproval. Rikki fights with his emotions and society problems, unable to decide what to do about his old friend/lover Gai (Guy) and their gang. Iason is obsessed with keeping Rikki, and Rikki doesn’t know what to do; fight against him or surrender to him."," Action, Drama, Romance, Sci-Fi, Yaoi", 1992, Completed," Love Wedge, The Space Between, Wedge of interval, Wedge of Love, 間の楔"
Ai no Utagoe wo Kikasete, Movie," Sing a Bit of Harmony tells the story of the beautiful and mysterious Shion who transfers to Keibu High School where she quickly becomes popular due to her open-hearted personality and exceptional athletic talent...but she turns out to be an AI in the testing phase!Shion's goal is to bring chronic loner Satomi ""happiness."" However, her strategy is something no human would expect"," Drama, Music, School, Sci-Fi", 2021, Completed," Sing a Bit of Harmony, アイの歌声を聴かせて"
Ai no Utagoe wo Kikasete (Dub), Movie," Sing a Bit of Harmony tells the story of the beautiful and mysterious Shion who transfers to Keibu High School where she quickly becomes popular due to her open-hearted personality and exceptional athletic talent...but she turns out to be an AI in the testing phase!Shion's goal is to bring chronic loner Satomi ""happiness."" However, her strategy is something no human would expect"," Drama, Music, School, Sci-Fi", 2021, Completed," アイの歌声を聴かせて, Sing a Bit of Harmony"
Ai no Wakakusa Monogatari, TV Series," Meg, faithful and gentle, Jo, independent and energetic, Beth, quiet and shy, Amy, amiable and precocious–the four sisters live vigorously and happily at home with their gentle mother while waiting for their father to return from the Civil War. Helping each other, they challenge their fates and grow up to become wonderful women."," Drama, Historical, Slice of Life", 1987, Completed," Tales of Little Women, 愛の若草物語"
Ai no Wakakusa Monogatari (Dub), TV Series," Meg, faithful and gentle, Jo, independent and energetic, Beth, quiet and shy, Amy, amiable and precocious–the four sisters live vigorously and happily at home with their gentle mother while waiting for their father to return from the Civil War. Helping each other, they challenge their fates and grow up to become wonderful women.EditBackground"," Drama, Historical, Slice of Life", 1987, Completed," Tales of Little Women, Sekai Meisaku Gekijou, 愛の若草物語"
Ai no Wakakusa Yama Monogatari, TV Series," The comic story of Shizuka, the eldest daughter, who lives at home, showing no signs of getting married; her mother, who is both annoyed with Shizuka, and at the same time concerned about her window of eligibility; her sister Ikumi, with whom she gets along, even though they fight; and her father, who feels henpecked in this all-female household.The strange incidents that happen with this family, which otherwise seems completely ordinary, will make you laugh out loud. The original manga is currently serialized in Takeshobo's Manga Club.The title is a pun on the long running Nippon Animation version of Little Women, ""Ai no Wakakusa Monogatari.""", Comedy, 1999, Completed," Little Women in Love, 愛の若草山物語"
Ai Shite Night, TV Series," Hashizo has lost both parents when still a baby. He live with his elder brother – Go Kato who is the lead singer of the emerging rock band “Bee Hive”. This is a newly borned stars.... Hashizo has lost both parents when still a baby. He live with his elder brother – Go Kato who is the lead singer of the emerging rock band “Bee Hive”. This is a newly borned stars.Yaeko Mitamura is an 18 year old girl working in her father’s Okonomiyaki restaurant.There’re many unexpected things happen between Hashizo, Go, and YaeKo which make A romantic story with love, jealousy and famous."," Comedy, Romance, Shoujo", 1983, Completed," Kiss Me, Licia, Ai Shite Knight, Love Me Night, Love in Rock'n Roll, Lucile, Aishite Knight, Rock'n Roll Kids, 愛してナイト"
Ai Shoujo Pollyanna Story, TV Series," Motherless since birth, Pollyanna was an ordinary happy-go-lucky girl, leaving peacefully with her father, the vicar. Then one day her life changes completely when her father dies and she has to live with her aunt whom she has never met before. In the beginning, she seems to be detested by her but as time passes, they develop a very strong bond."," Drama, Historical, Slice of Life", 1986, Completed," Sekai Meisaku Gekijou, Story of Pollyanna, Girl of Love, Ai Shoujo Pollyanna Monogatari, 愛少女ポリアンナ物語"
Ai Tenchi Muyou!, Fall 2014 Anime, The franchise is celebrating its 20th anniversary with this new project.," Comedy, Sci-Fi, Shounen", 2014, Completed," Tenchi Muyo! Love, 愛・天地無用!"
