name,Type,Plot Summary,Genre,Released,Status,Other name
T.P. Sakura, OVA, The project is a spinoff from Circus's D.C. Da Capo franchise and features the Yoshino Sakura character as a seemingly ordinary third grader with secret special powers., Action, 2011, Completed," T.P. Sakura ~Time Paladin Sakura~ Jikuu Boueisen,  T.P.さくら〜タイムパラディンさくら〜時空防衛戦"
T7S Longing for Summer Again and Again, Spring 2017 Anime," Animated music video for ""Harukaze ~You were here~"", bundled as a Blu-ray with the single ""t7s Longing for summer Again And Again ~Harukaze~"" from the Tokyo 7th Sisters rhythm game idol group 777☆SISTERS."," Music, School", 2017, Completed,
Ta Bu Dang Nuzhu Hen Duo Nian, ONA," Beiyi used a strategy to attack Baicheng, an important town in the northern border of Daqi Kingdom. Tang Yao, the guard of Baicheng, led his people to resist desperately, but they were outnumbered, and all sacrificed. Only the second daughter, Tang Ying, survived.What makes Tang Ying even more indignant is that his father sacrificed his life for the country, but in return he was charged with collaborating with the enemy. In order to take the place of her father, Tang Yingyi went to the capital, but found that things were not as simple as imagined.Is Yuan Lang, the second prince of the Daqi Kingdom who has been hostage for decades, related to Beiyi?Why is the woman pretending to be herself so strangely similar?What happened to the otherworldly person that Yao Niang from the movie department was talking about?There are also those strange and familiar memories that appeared nervously... There are too many mysteries waiting for Tang Ying to answer."," Action, Adventure, Historical", 2023, Ongoing," 她不当女主很多年, Since I Wasn't the Heroine"
Ta ga Tame no Alchemist, Movie,," Action, Adventure, Fantasy, Magic", 2019, Completed," For Whom the Alchemist Exists, Dare ga Tame no Alchemist, 劇場版誰ガ為のアルケミスト"
Tabi Machi Late Show, Winter 2016 Anime," Departures are moments that evoke both hope and melancholy. Tabi Machi Late Show examines how these ambivalent emotions continue to persist long beyond that singular moment of parting. Azuma reminisces about her mentor as she sees off her own student; Kumeno recalls her short, turbulent friendship with Koizumi; Yukari meets an old friend during the Lantern Festival; and Sakurada fondly remembers the numerous students she has met during her teaching career.Structured around a theme of goodbyes and journeys, Tabi Machi Late Show is composed of four intimate, slice-of-life vignettes that wistfully examine the lasting impressions people leave on one another.", Drama, 2016, Completed, 旅街レイトショー
Tabi wa ni, ONA," The anime's story centers on Akari (a quiet high schooler who has inherited a love of travel from her older sister, who took care of her in place of often absent parents) and Nagi (Akari's cheerful classmate who willingly jumps into any activity, and becomes interested in Akari due to her mysterious air), who travel throughout Japan.", Slice of Life, 2022, Upcoming, Tabi Hani; はに
Tabidachi, Movie, Movie based on the Ami series of the Cream Lemon franchise. This movie was co-aired with Project A-Ko movie.," Drama, Ecchi, Romance", 1986, Completed, Cream Lemon
Tabisuru Nuigurumi, Movie," After being rushed to a flight by her mother at the airport, a young girl loses her most prized possession, a plush toy named Daru. Awakened by the girl's tears, Daru sets forth on a grand adventure to find her, crossing continents, communicating with animals and statues alike, and even making a new caterpillar friend along the way. As time passes, will Daru ever be reunited with his beloved owner?"," Kids, Slice of Life", 2012, Completed, 旅するぬいぐるみ ~Traveling Daru~
Taboo Tattoo, Summer 2016 Anime," Seigi, a martial arts trained middle schooler, often feels driven to protect the weaker people around him. One day, he defends a homeless man against some punks, and the man gives him a strange tattoo on his palm in return. The tattoo is a secret weapon produced in the arms race between America and the Serinistan Kingdom.Seigi finds himself in over his head when a powerful girl, using the same secret weapon, violently pursues him in order to retrieve it. His skill at martial arts may not be enough to keep him alive, but will he be able to learn how to trigger the power of his tattoo in time?"," Action, Comedy, Martial Arts, Mystery, Super Power, Supernatural", 2016, Completed, タブー・タトゥー
Taboo Tattoo (Dub), TV Series," Seigi, a martial arts trained middle schooler, often feels driven to protect the weaker people around him. One day, he defends a homeless man against some punks, and the man gives him a strange tattoo on his palm in return. The tattoo is a secret weapon produced in the arms race between America and the Serinistan Kingdom.Seigi finds himself in over his head when a powerful girl, using the same secret weapon, violently pursues him in order to retrieve it. His skill at martial arts may not be enough to keep him alive, but will he be able to learn how to trigger the power of his tattoo in time?"," Action, Comedy, Martial Arts, Mystery, Seinen, Super Power, Supernatural", 2016, Completed," Taboo Tattoo, タブー・タトゥー"
Tachibanakan Triangle, Spring 2018 Anime," When Natsuno Hanabi went back to her hometown to study in high school, she thought that she will have a new wonderful life. But Tachibanakan, the dormitory she was going to live in, was not what she expected."," Comedy, Ecchi, Shoujo Ai", 2018, Completed," Love to Lie Angle, 立花館To Lieあんぐる"
Tactical Roar, TV Series, In the near future the world’s climate shifted creating in the Western Pacific a perpetual super cyclone," Comedy, Military, Romance, Sci-Fi", 2006, Completed, タクティカルロア
Tactical Roar OVA Special, TV Series, In the near future the world’s climate shifted creating in the Western Pacific a perpetual super cyclone," Action, Comedy, Ecchi, Military, Romance, Sci-Fi", 2006, Completed, タクティカルロア - マーキュリーズの休日
Tactics , TV Series," Kantarou has had the 6th sense to see demons for as long as he can remember, and has become friends with them, but also has the job of “yokai busting”. With his tengu and his kitsune, they solve mysteries, and help the yokai situation in Japan."," Comedy, Drama, Fantasy, Mystery, Shounen, Super Power", 2004, Completed, タクティクス
Tactics (Dub), TV Series," Ichinomiya Kantarou grew up with the ability to see demons, but was isolated and bullied by others who did not share the same gift. Instead, he became being friends with the demons, gaining a great attachment to their existence. One day, Kantarou was told about the strongest demon, the one known as the ogre-eating Tengu. Amazed by the news of his strength, Kantarou vowed to find this demon who was far stronger than any other, deciding to call him Haruka when he did so. Since this time, Kantarou searched far and wide for the ogre-eating Tengu with no luck, making his living by becoming a folklore writer and demon-buster. On a particular job, Kantarou had finally found news of a nearby shrine supposedly the place where the ogre-eating Tengu was sealed."," Comedy, Drama, Fantasy, Mystery, Super Power", 2004, Completed, タクティクス
Tada-kun wa Koi wo Shinai, Spring 2018 Anime," In the story, Mitsuyoshi Tada, a boy who has never known love, is taking pictures of the cherry blossoms in full bloom when he meets Teresa Wagner, a transfer student from Luxembourg. Upon arriving in Japan, she got lost, separated from her travel companion. Mitsuyoshi helps her and brings her to his grandfather's coffee shop."," Comedy, Romance", 2018, Completed," Tada Doesn't Fall in Love, 多田くんは恋をしない"
Tada-kun wa Koi wo Shinai (Dub), TV Series," In the story, Mitsuyoshi Tada, a boy who has never known love, is taking pictures of the cherry blossoms in full bloom when he meets Teresa Wagner, a transfer student from Luxembourg. Upon arriving in Japan, she got lost, separated from her travel companion. Mitsuyoshi helps her and brings her to his grandfather's coffee shop."," Comedy, Romance, Slice of Life", 2018, Completed," Tada Never Falls in Love, 多田くんは恋をしない"
Tadaima! Chibi Godzilla, ONA," The ""Chibi Godzilla"" project was launched to celebrate the 65th anniversary of Toho's Godzilla franchise."," Fantasy, Sci-Fi", 2020, Completed, ただいま！ちびゴジラ
Tadaima! Chibi Godzilla Season 2, ONA, Second season of Tadaima! Chibi Godzilla.," Horror, Slice of Life", 2020, Completed, ただいま！ちびゴジラ シーズン２
Tai Yi Xian Mo Lu Zhi Ling Fei Ji, ONA," Qingcheng Mountain was destroyed and Xuanmen (Profound Gate) suffered a great calamity. Qing Yu's Altar Master Xing Xiang Zi ordered Zhu Dian's reincarnation, Leng Shuangning, to go to Kunlun and fight the Demon Army. The magic power was in the air, and the hidden feeling was bewildering. As the two of them boarded Kunlun, Black Hand was planning something behind the scenes.."," Action, Drama, Fantasy, Historical, Martial Arts, Romance", 2016, Completed, Magical Legend 
Tai Yi Xian Mo Lu Zhi Ling Fei Ji IV, ONA, No synopsis information has been added to this title. Help improve our database by adding a synopsis here.," Adventure, Fantasy, Historical, Martial Arts", 2021, Completed, Magical Legend
Tai-Ari deshita., TV Series," A hot fighting game played at the girls' school!!Aya transferred into Kuromi Girls Academy a month ago with the goal of changing herself into a proper lady. After meeting the breathtaking Shirayuri, Aya is blown away by her elegance and posterity. Imagine her surprise when she finds Shirayuri after school playing... a fighting game?! And if that wasn't perplexing enough, she is challenged to a duel by the unladylike Shirayuri!", Comedy, 0, Upcoming, GGWP.
Taichi Senjimon (Dub), TV Series," After a strange and devastating attack on his home, a young boy named Rai is shocked to discover he's a secret descendent of the Tigeroids"," Action, Adventure, Fantasy, Magic", 2007, Completed," Tai Chi Chasers, 太極千字文"
Taifuu no Noruda, Movie," The film takes place on a certain isolated island, at a certain middle school, and on the eve of the culture festival. A boy quits baseball after playing his whole life and has a fight with his best friend. Then, they suddenly meet a mysterious, red-eyed girl named Noruda, and a huge typhoon hits the middle school."," Drama, School", 2015, Completed, 台風のノルダ
Taiko no Tatsujin, TV Series, A series of four minute claymation shows. Each episode shows the different antics of the various Taiko no Tatsujin characters., Game, 2005, Completed," Taiko Drum Master, 太鼓の達人"
Tailenders , Movie," Tomoe Shiro, a formidable racer with a very promising career, experiments a U-turn when a serious accident puts his life at stake. He recovers miraculously though when his heart is replaced with the engine of his own racing car. However, because of that very reason, race regulations demote him to the category of a mere mechanical part of the vehicle and is deprived from the right to participate as a pilot in regular races. Only in a far away colonial planet, along with a multitude of other charismatic pilots also vetoed from participating in regular competitions, will he be given the opportunity to race for his pride and the money of the prize. And so this exciting rally starts!!"," Action, Adventure, Cars, Sci-Fi", 2009, Completed, テイルエンダーズ
Taimadou Gakuen 35 Shiken Shoutai, Fall 2015 Anime," The 35th Test Platoon of Antimagic academy, they're one of squads enrolled at academy specializing in raising the witch hunters, whose job is to find, neutralize any magical threats!Unfortunately they're a group of failures nicknamed ""Small Fry Platoon,"" a platoon formed from bunch of self-centered people who can't cooperate and have personality problems.Will they manage to overcome their weaknesses and shine as the strongest platoon?"," Action, Ecchi, Fantasy, Harem, Military, Romance, Supernatural", 2015, Completed," AntiMagic Academy 35th Test Platoon, 対魔導学園35試験小隊"
Taishou Chicchai-san, Fall 2017 Anime," Hiiragi Kyouichirou is a boy who travels from his provincial town to Tokyo to attend university. He carries with him his family's sword to protect himself. When he arrives in Tokyo, he becomes swept up in a plot by the Imperial army."," Historical, Shounen Ai", 2017, Completed, 大正ちっちゃいさん
Taishou Otome Otogibanashi, Fall 2021 Anime," Tamahiko Shima is the youngest son of the powerful and wealthy Shima family. Blessed with great fortune since his childhood, he grew up wanting nothing but affection from his oftentimes distant family.After losing his mother and crippling his dominant arm in an accident, Tamahiko fell into deep despair and is cast aside by his own father for his handicap. Condemned to live isolated in the countryside where he would not bring shame to his family's name, he resigned himself to dying alone—until one day, a young girl named Yuzuki Tachibana appeared on his doorstep, proclaiming that Tamahiko's father sent her to be his bride.As she takes care of Tamahiko, Yuzuki brings a feeling of springtime into Tamahiko's dreary life, allowing him to gradually heal from the deep emotional scars of his youth. Their lives slowly intertwine as both Tamahiko and Yuzuki taste the fruits of their first love."," Comedy, Historical, Romance, Shounen, Slice of Life", 2021, Completed, 大正処女御伽話 ; タイシャウヲトメおとぎばなし ; Taishou Otome Otogi Banashi ; Taishō Otome Otogi Banashi ; Taishou Maiden Fairytale
Taishou Otome Otogibanashi (Dub), Fall 2021 Anime," Self-styled pessimist Tamahiko Shima lives alone in the mountains of Chiba after losing the use of his right hand in the same car accident that took his mother's life. Deemed incapable by his father and other wealthy relatives, he has been forced into exile; he experiences idle days of reading and sleepless nights of irrepressible angst. True to the Shimas' famous pride and determined not to disgrace his family, Tamahiko is resigned to his new duty—stay in the mountains and wait for death to put an end to his suffering.However, on one snowy night, Tamahiko's insomnia is interrupted by someone knocking at the door. He then meets the 14-year-old Yuzuki Tachibana, who announces that she has come to be his future wife! Suddenly, Tamahiko remembers his father promising to send him a bride to assist him with impediments to his daily life.Although she was sold as a bride to repay her family's debts, Yuzuki proves to be thoughtful, diligent, and dedicated to Tamahiko. Will the world-weary teenager prove insensitive to the rare breeze of kindness her presence brings to his monotonous existence?"," Comedy, Historical, Romance, Shounen, Slice of Life", 2021, Completed," Taishou Maiden Fairytale, 大正処女御伽話"
Taishou Yakyuu Musume, TV Series," The novels are set in 1925 when two 14-year-old Japanese high school girls named Koume and Sh?ko decide to start a baseball team in Japan where few baseball teams — male or female — exist at the time. First though, the two girls have no clue where to find nine players, how to use the equipment, and what even the rules are."," Comedy, Historical, School, Seinen, Sports", 2009, Completed," Taisho Baseball Girls, 大正野球娘。"
Taisou Zamurai, Fall 2020 Anime," Year 2002. Japan's gymnastics world was once strong. Former Japanese representative Shoutarou Aragaki (29), who devoted his time to gymnastics, was unable to perform as expected. Even so, after training on a daily basis, his coach Amakusa recommends Shoutarou to retire. However, the fate of the Aragaki family will change significantly due to a certain ""encounter.""", Sports, 2020, Completed," Taiso Samurai, 体操ザムライ"
Taisou Zamurai (Dub), Fall 2020 Anime," Year 2002. Japan's gymnastics world was once strong. Former Japanese representative Shoutarou Aragaki (29), who devoted his time to gymnastics, was unable to perform as expected. Even so, after training on a daily basis, his coach Amakusa recommends Shoutarou to retire. However, the fate of the Aragaki family will change significantly due to a certain ""encounter.""", Sports, 2020, Completed," Taiso Samurai,  体操ザムライ"
Taiyou no Kiba Dagram, TV Series," The story is centered around a small group of guerilla freedom fighters on a colonial planet named Deployer, who are known as the ""Deployer 7"", or ""Sun Fang"" team. In an unexpected coup, the elected Governor of Deployer becomes dictator and rules Deployer under martial law with the support of Earth's Federation. Fighting for independence from Earth's Federation influence, the freedom fighters begin a rebellion against the Federation's Combat Armors using a Combat Armor of their own"," Drama, Mecha, Military, Sci-Fi, Shounen", 1981, Completed," Fang of the Sun Dagram, Fang of the Sun Dougram, 太陽の牙ダグラム"
Taiyou no Mokushiroku, Special," On August 10 2002, the eruption of Mount Fuji, as well as a series of large-scale earthquakes tsunamis inflict tremendous damage to Japan, sending the country into a state of emergency. Furthermore, another massive earthquake hit Japan on August 15, splitting the country into two. While Japanese refugees were taken in by various countries, the Japanese government accepted aid from China and the United States, which eventually caused China to govern the North, and the USA to govern the South. 15 years later, the Japanese refugees residing in Taiwan and the Taiwanese citizens find themselves clashing with one another, due to job competition and the unimproving conditions of the Japanese refugees. Genichiro Ryu is a survivor of the catastrophic events that took place in Japan, but was raised in Taiwan by a couple who adopted him. He gets himself involved in the situation between the Taiwanese and the Japanese, hoping that the two parties will be able to coexist with one another."," Drama, Sci-Fi", 2006, Completed, 太陽の黙示録 A Spirit of the Sun
Taiyou No Yuusha Figh Bird, TV Series," An evil alien life form, Dryus, assaulted the Earth. The leader of Space Patrol, Fighbird, pursed Dryus to the Earth. Fighbird combined with an android that Dr. Amano was developing. Fighbird named Hidori Ryutaro and fight against Dryus to protect the peace of the Earth. At first look, he was a normal person, but because he was an alien, Fibird, his acts were a bit away from the normal persons'. Usually, he worked for Dr. Amano as an assistant. He looked uncouth always wearing while coat and glasses. However, once enemy appears, his personality changed dramatically."," Action, Mecha, Sci-Fi", 1991, Completed," Brave of the Sun Fighbird, Taiyou no Yuusha Fighbird, Brave Hero of the Sun, Firebird, Burning Brave Hero Firebird, Sun Brave Fyvard, The Brave Fighter of Sun Fighbird, Sun Guard, 太陽の勇者ファイバード"
Takamiya Nasuno Desu!, Spring 2015 Anime," A spin-off from Teekyuu which centers on the daily life of Nasuno Takamiya, the ""exceedingly airheaded"" school tennis club member in Teekyuu, and her friends."," Comedy, Shounen", 2015, Completed, 高宮なすのです！〜てーきゅうスピンオフ〜
Takamiya Nasuno Desu!, TV Series," A spin-off from Teekyuu which centers on the daily life of Nasuno Takamiya, the ""exceedingly airheaded"" school tennis club member in Teekyuu, and her friends."," Comedy, Shounen, Slice of Life", 2015, Completed, 高宮なすのです！〜てーきゅうスピンオフ〜
Takanashi Rikka Kai, Movie," Summary of the first season of the show, as seen from Rikka's perspective with new elements."," Comedy, Drama, Romance, School, Slice of Life", 2013, Completed," Love, Chunibyo & Other Delusions!"
Takanashi Rikka Kai, Special, Special episode included with the Blu-ray/DVD release of Chuunibyou demo Koi ga Shitai! Movie., Comedy, 2014, Completed, 映画中二病でも恋がしたい!Lite
Takano Kousaten, Special," The award-winning short, independent anime Takano Intersection is professional animator Mizuki Ito’s directorial debut. It was released on YouTube in September 2021.", Slice of Life, 2021, Completed," Takano Intersection, 高野交差点"
Takarajima, TV Series," Jim Hawkins is a young boy lead by progressive events to embark on a search journey for the legendary treasure of the once dreaded pirate, Captain Flint. On their way to Treasure Island, John Silver, Jim's best friend, take over command of the ship revealing his true self as the ruthless pirate who once was the right hand of Flint himself. Feeling betrayed, Jim now has to deal with his mixed feelings and face Silver who still consider himself and Jim as friends."," Adventure, Drama, Historical, Mystery", 1978, Completed," Treasure Island, 宝島"
Takate, TV Series," When his master dies, Gang Yong pledges to avenge his teacher at all costs. After training his martial arts skills in seclusion, Gang Yong sets off to hunt down the traitors and make them pay! But when he gets to town, he discovers they're... already dead? Well, what's he supposed to do now?!"," Action, Adventure", 0, Upcoming, 고수; The Master
Tako ni Natta Okaasan, Special," The second film in Shin-Ei's series of annual WWII themed anime television movies for children ""Sensou Douwa"" (war story)."," Drama, Historical", 2003, Completed," Sensou Douwa 2, A Mother Who Became a Kite, になったお母さん"
Takt Op. Destiny, Fall 2021 Anime," In the story of the anime, one day a black meteorite fell on the world, and the world completely changed. The meteorite produced grotesque monsters called D2, which started running rampant. D2 very quickly banned all music, which was the one thing able to overcome them. But there were some people who resisted the D2. They are young women who hold the power of music, the ""Musicart."" These young women hold ""scores"" that are able to defeat the monsters. And there are also people who lead these women, the Conductor.The anime takes place in America in the year 2047, which has fallen to ruin thanks to the D2. Takt, a Conductor, is partnered with a Musicart named Unmei. Takt yeans for music to be returned to the world, and Unmei wishes to destroy the D2. Their aim is to travel to New York."," Action, Fantasy, Music", 2021, Completed,
Takt Op. Destiny (Dub), Spring 2021 Anime," The United States of America has been in chaos ever since the emergence of D2s, an invasive species originating from a black meteorite that fell to Earth. A public decree banned citizens from playing any melodies, to prevent further casualties caused by the D2s' hatred for music—even now, in 2047, this prohibition is still in effect. Humanity's only form of defense against the D2s are Musicarts, young women representing pieces of classical music; and Conductors, the ones controlling them.Takt Asahina, an aloof piano prodigy, finds himself transformed into a Conductor following a spontaneous D2 attack. The same incident kills Anna Schneider's younger sister, Cosette, and brings Takt into contact with his Musicart, Destiny. Searching for a means of stabilizing the pact between themselves, Takt and Destiny—alongside Anna—embark on a perilous journey to the Symphonica Headquarters in New York City.Takt is in a hurry to reach the city so that he can play the piano again, even though his passion attracts the creatures he has come to despise. Meanwhile, Destiny's sense of duty drags the group into trouble along the way. With a D2-infested path and many more arduous obstacles ahead of them, will the trio make it to New York City in one piece?"," Action, Fantasy, Music", 2021, Completed,
Takunomi., Winter 2018 Anime," 20-year-old Michiru Amatsuki moved to Tokyo due to a change of career. She decided to live in a woman-only share house ""Stella House Haruno"" with people of different age and occupations. It's always fun when there's delicious alcohol and meal!!"," Comedy, Shounen, Slice of Life", 2018, Completed, たくのみ。
Takunomi. (Dub), TV Series," 20-year-old Michiru Amatsuki moved to Tokyo after a career change, and now finds herself living in a woman only share house, Stella House Haruno, with a few other women of varying age and occupation. Every night the girls settle down and have a drink or two (or more) as drama ensues."," Comedy, Slice of Life", 2018, Completed, Takunomi
Tales From Earthsea, Movie," It tells the story of Ged, the most powerful wizard in Earthsea, and his attempts to protect Prince Arren from the evil machinations of rival wizard Cob. Together with Therru, a young girl he rescues from slave takers, Arren must unite with Ged to defeat Cob and return balance to their world."," Adventure, Fantasy, Magic", 2006, Completed," Gedo Senki, ゲド戦記"
Tales from Earthsea (Dub), Movie," Something bizarre has come over the land. The kingdom is deteriorating. People are beginning to act strange... What's even more strange is that people are beginning to see dragons, which shouldn't enter the world of humans. Due to all these bizarre events, Ged, a wandering wizard, is investigating the cause. During his journey, he meets Prince Lebannen, a young distraught teenage boy. While Lebannen may look like a shy young teen, he has a severe dark side, which grants him strength, hatred, ruthlessness and has no mercy, especially when it comes to protecting Tehanu. For the witch Kumo this is a perfect opportunity. He can use the boy's ""fears"" against the very one who would help him, Ged."," Adventure, Fantasy, Magic", 2006, Completed," Gedo Senki, ゲド戦記"
