name,Type,Plot Summary,Genre,Released,Status,Other name
Pokemon Movie 20, Movie," The film's plot tells the story of how Satoshi and Pikachu came to know each other. Pikachu was not cooperative toward Satoshi, but Satoshi only wanted to be friends with Pikachu. On the day they set out from Masara Town, both of them saw a Houou flying and made a vow to someday go and meet it.(Source"," Action, Adventure, Comedy, Kids", 2017, Completed, Pokemon
Pokemon Movie 21, Movie, Ash and Pikachu embark on a new journey to Fula City where the yearly Wind Festival takes place. There they meet new trainers and friends in order to later help save the city along with the mythical pokemon Zeraora.," Action, Adventure, Comedy, Fantasy, Game, Kids", 2018, Completed, Pokémon the Movie
Pokemon Movie 21, Movie, Ash and Pikachu embark on a new journey to Fula City where the yearly Wind Festival takes place. There they meet new trainers and friends in order to later help save the city along with the mythical pokemon Zeraora.," Action, Adventure, Comedy, Fantasy, Game, Kids", 2018, Completed, Pokémon the Movie
Pokemon Movie 22, Movie, Pokemon's 22nd movie.," Action, Adventure, Comedy, Fantasy, Kids", 2019, Completed, Gekijouban Pocket Monsters
Pokemon Movie 22, Movie, Pokemon Movie 22.," Action, Adventure, Comedy, Fantasy, Kids", 2019, Completed," 劇場版 ポケットモンスター ミュウツーの逆襲evolution, Mewtwo Strikes Back Evolution"
Pokemon Movie 23, Movie," The new film's story is set in Okoya Forest, a Pokémon paradise protected by strict rules that forbid outsiders from setting foot inside. The film centers on Koko, a boy who was raised by Pokémon and also considers himself as one, treating the Mythical Pokémon Zarude as his father. Ash and Pikachu encounter Koko during an adventure. The film focuses on the theme of a ""human raised by Pokémon,"" instead of the previous films' focus of the ""bond between a human trainer and their Pokémon."," Action, Adventure, Comedy, Fantasy, Game, Kids", 2020, Completed, Pokémon the Movie
Pokemon Movie 23, Movie," The new film's story is set in Okoya Forest, a Pokémon paradise protected by strict rules that forbid outsiders from setting foot inside. The film centers on Koko, a boy who was raised by Pokémon and also considers himself as one, treating the Mythical Pokémon Zarude as his father. Ash and Pikachu encounter Koko during an adventure. The film focuses on the theme of a ""human raised by Pokémon,"" instead of the previous films' focus of the ""bond between a human trainer and their Pokémon."""," Action, Adventure, Comedy, Fantasy, Game, Kids", 2020, Completed, Pokémon the Movie
Pokemon Movie 3, Movie," Young Molly Hale is a 5-year old girl who has lost her father to the Unown, a strange group of Pokemon who can make a person's dreams real by using their Psychic energy. One day she accidently releases the Unown, and they begin to answer Molly's wishes; first by creating Entei, a legendary lion-like Pokemon who Molly then thinks is her father because he always pretended to be Entei when he played with her. Molly then feels lonely because she has no mother, so Entei decides to kidnap Ash's mother and forces her to become Molly's. Ash, Brock, and Misty must then try to save Ash's mom, Delia, and Molly; And in the process they must also try to find a way to stop the Unown from turning the town of Greenfield into a bizarre crystal wasteland."," Adventure, Comedy, Drama, Shounen", 2000, Completed, Pokemon
Pokemon Movie 4, Movie," Celebi is a mysterious Pokemon, that can travel through time. While escaping from a Pokemon Thief, he transcends through time accidentally bringing a boy named Yukinari with him 40 years into the future. Ash and the gang meet Yukinari and Celebi and heard his story about traveling through time, but even 40 years in the future, there are still some who wants Celebi for themself. The Team Rocket's most powerful Pokemon Hunter - The Masked Vicious wants to capture Celebi for himself and he succeeds into capture him onto the Dark Ball - a Pokeball that makes every Pokemon evil. With Celebi at his hands, Vicious wants to be the ruler of the world, it's up to Ash and the gang to stop him and make Celebi back to his original self."," Adventure, Comedy, Drama, Magic, Shounen", 2001, Completed, Pokemon
Pokemon Movie 5, Movie," Long ago, on an island called Altomare, there lived an old man and woman. One day, the couple found two small children lying on the shore, badly wounded. The couple took them in and took care of them, and the children quickly recovered. But then, the island was attacked by monsters. Within moments the island fell into the monsters' wrath. But then...Before the old man and lady's eyes, the children who they had taken care of transformed into the Eon Pokemon, Latios and Latias. They called their family from the sky. They came, and carried a stone with them containing the power to force the monsters away. This gem was known as the ""Soul Dew"". Peace returned to the island. However, later in the present, a criminal duo - Zanner and Lions - are seeking Latios and Latias in order to take control of the Soul Dew. Taking a short break in Altomare, Satoshi befriends Latias and is now dragged into the situation helping to save Altomare from becoming swallowed up by destruction again."," Adventure, Comedy, Drama, Shounen", 2002, Completed, Pokemon
Pokemon Movie 6, Movie," Satoshi, Haruka, Takeshi, and Masato come upon the festival of the Wishing Star of Seven Nights. During their enjoyment, the legendary pokemon, Jirachi, decends from the heavens and befriends Masato. Jirachi, with the power to grant any wish, is sought after by many people wanting to claim its power. One man seeks to use its legendary power to revive an ancient pokemon known as Groudon, unaware of the dangers hidden within Jirachi's powers."," Adventure, Comedy, Drama, Fantasy, Shounen", 2003, Completed," Pokemon Movie 06, Pokemon Advanced Generation"
Pokemon Movie 7, Movie," Satoshi and his friends travel to LaRousse, where they meet a boy named Tooi who is afraid of Pokemon due to an incident that happened four years earlier. Meanwhile, Deoxys, a Pokemon from space, has reappeared, putting a barrier around the city and kidnapping people. Rayquaza, a Pokemon that lives in the atmosphere, comes to fight it."," Adventure, Comedy, Shounen", 2004, Completed, Pokemon Advanced Generation
Pokemon Movie 8, Movie," In the town of Lohta, a festival is thrown praising ""Aaron the Wave Leader Hero"" who, according to the legend passed down through the town's generations, stopped a war centuries ago by using the power of ""the Tree of the World's Origin."" Satoshi and Pikachu participate in a battle to decide this year's hero and after their victory, they are chosen as the ""Wave Leader Hero."" A grand dance party is held in the castle to celebrate the victor, but suddenly the phantom Pokemon Mew appears and takes Pikachu. Soon afterwards, the Wave Leader Pokemon ""Lucario"" is freed from his centuries-long seal and meets Satoshi. Satoshi must solve the various mysteries of where Pikachu is, what Mew's after, what the secret of the legend of the Wave Leader is and how it ties in with Lucario's hidden past as he makes his way to ""the Tree of the World's Origin"" with Lucario.", Action, 2005, Completed, Pokemon Advanced Generation
Pokemon Movie 9, Movie," Constantly moving throughout the ocean the Temple of the Sea exists invisible to human eyes. It is here that the Sea Crown exists. Phantom the Pirate has captured the egg of a Manaphy, the only Pokémon able to locate the temple. However, his plans are ruined when Jack Walker, a Pokémon Ranger, interferes. Along the way, Ash Ketchum and his friends manage to get caught up in the adventure to return Manaphy to it's home. But along the way Manaphy and May form a special bond."," Adventure, Kids", 2006, Completed, Pokemon Advanced Generation
Pokemon Omega Ruby & Alpha Sapphire, ONA," The Pokemon Company streamed the ""Mega Special Animation"" short inspired by the upcoming Pokémon Omega Ruby and Pokémon Alpha Sapphire games on Sunday. The short features Pokémon undergoing the newly discovered Mega Evolution and Primal Reversion in the Hoenn region."," Action, Adventure, Fantasy, Kids, Shounen", 2014, Completed, ポケットモンスター オメガルビー・アルファサファイア』 メガスペシャルアニメーション
Pokemon Origins, TV Series, The anime will feature the player and rival characters from Nintendo’s original Pokémon Red and Pokémon Green (released as Pokémon Blue in North America) video games.," Adventure, Comedy, Shounen", 2013, Completed, Pokemon
Pokemon Season 01, TV Series," A young boy named Ash Ketchum embarks on a journey to become a “Pokemon Master” with his first Pokemon, Pikachu. Joining him on his travels are Brock, a girl-obsessed Rock Pokemon Trainer, and Misty, a tomboyishWater Pokemon Trainer who may have a crush on him. Ash and Co. end up traveling through various regions, including Kanto, the Orange Islands, and Johto, and then enter the Pokemon League competitions there. Along the way, they run into many confrontations with Jessie, James, and Meowth, a trio of Pokemon thieves who are apart of an evil organization called “Team Rocket”. But everytime Team Rocket try to do their evil deeds, they fail thanks to Ash and his Pokemon."," Adventure, Comedy, Shounen", 1997, Completed,
Pokemon Season 02, TV Series," A young boy named Ash Ketchum embarks on a journey to become a “Pokemon Master” with his first Pokemon, Pikachu. Joining him on his travels are Brock, a girl-obsessed Rock Pokemon Trainer, and Misty, a tomboyish Water Pokemon Trainer who may have a crush on him.Ash and Co. end up traveling through various regions, including Kanto, the Orange Islands, and Johto, and then enter the Pokemon League competitions there. Along the way, they run into many confrontations with Jessie, James, and Meowth, a trio of Pokemon thieves who are apart of an evil organization called “Team Rocket”. But everytime Team Rocket try to do their evil deeds, they fail thanks to Ash and his Pokemon."," Adventure, Kids", 2006, Completed,
Pokemon Season 03, TV Series," A young boy named Ash Ketchum embarks on a journey to become a “Pokemon Master” with his first Pokemon, Pikachu. Joining him on his travels are Brock, a girl-obsessed Rock Pokemon Trainer,and Misty, a tomboyish Water Pokemon Trainer who may have a crush on him. Ash and Co. end up traveling through various regions, including Kanto, the Orange Islands, and Johto, and then enter the Pokemon League competitions there. Along the way, they run into many confrontations with Jessie, James, and Meowth, a trio of Pokemon thieves who are apart of an evil organization called “Team Rocket”. But everytime Team Rocket try to do their evil deeds, they fail thanks to Ash and his Pokemon."," Fantasy, Kids", 1998, Completed,
Pokemon Season 04, TV Series," A young boy named Ash Ketchum embarks on a journey to become a “Pokemon Master” with his first Pokemon, Pikachu. Joining him on his travels are Brock, a girl-obsessed Rock Pokemon Trainer, and Misty, a tomboyish Water PokemonTrainer who may have a crush on him. Ash and Co. end up traveling through various regions, including Kanto, the Orange Islands, and Johto, and then enter the Pokemon League competitions there. Along the way, they run into many confrontations with Jessie, James, and Meowth, a trio of Pokemon thieves who are apart of an evil organization called “Team Rocket”. But everytime Team Rocket try to do their evil deeds, they fail thanks to Ash and his Pokemon."," Adventure, Comedy, Fantasy, Kids, Shounen", 2013, Completed,
Pokemon Season 05, TV Series," A young boy named Ash Ketchum embarks on a journey to become a “Pokemon Master” with his first Pokemon, Pikachu. Joining him on his travels are Brock, a girl-obsessed Rock Pokemon Trainer, and Misty, a tomboyish Water Pokemon Trainerwho may have a crush on him. Ash and Co. end up traveling through various regions, including Kanto, the Orange Islands, and Johto, and then enter the Pokemon League competitions there. Along the way, they run into many confrontations with Jessie, James, and Meowth, a trio of Pokemon thieves who are apart of an evil organization called “Team Rocket”. But everytime Team Rocket try to do their evil deeds, they fail thanks to Ash and his Pokemon."," Adventure, Comedy, Kids", 0, Completed,
Pokemon Season 06, TV Series," A young boy named Ash Ketchum embarks on a journey to become a “Pokemon Master” with his first Pokemon, Pikachu. Joining him on his travels are Brock, a girl-obsessed Rock Pokemon Trainer, and Misty, a tomboyish Water Pokemon Trainer who may have a crush on him. Ash and Co. end up traveling through various regions, including Kanto, the Orange Islands, and Johto, and then enter the Pokemon League competitions there. Along the way, they run into many confrontations with Jessie, James, and Meowth, a trio of Pokemon thieves who are apart of an evil organization called “Team Rocket”. But everytime Team Rocket try to do their evil deeds, they fail thanks to Ash and his Pokemon.",, 0, Completed,
Pokemon Season 07, TV Series," A young boy named Ash Ketchum embarks on a journey to become a “Pokemon Master” with his first Pokemon, Pikachu. Joining him on his travelsare Brock, a girl-obsessed Rock Pokemon Trainer, and Misty, a tomboyish Water Pokemon Trainer who may have a crush on him. Ash and Co. end up traveling through various regions, including Kanto, the Orange Islands, and Johto, and then enter the Pokemon League competitions there. Along the way, they run into many confrontations with Jessie, James, and Meowth, a trio of Pokemon thieves who are apart of an evil organization called “Team Rocket”. But everytime Team Rocket try to do their evil deeds, they fail thanks to Ash and his Pokemon.",, 0, Completed,
Pokemon Season 08, TV Series," A young boy named Ash Ketchum embarks on a journey to become a ""Pokemon Master"" with his first Pokemon, Pikachu. Joining him on histravels are Brock, a girl-obsessed Rock Pokemon Trainer, and Misty, a tomboyish Water Pokemon Trainer who may have a crush on him. Ash and Co. end up traveling through various regions, including Kanto, the Orange Islands, and Johto, and then enter the Pokemon League competitions there. Along the way, they run into many confrontations with Jessie, James, and Meowth, a trio of Pokemon thieves who are apart of an evil organization called ""Team Rocket"". But everytime Team Rocket try to do their evil deeds, they fail thanks to Ash and his Pokemon.",, 0, Completed,
Pokemon Season 09, TV Series," A young boy named Ash Ketchum embarks on a journey to become a “Pokemon Master” with his first Pokemon, Pikachu. Joining him on his travelsare Brock, a girl-obsessed Rock Pokemon Trainer, and Misty, a tomboyish Water Pokemon Trainer who may have a crush on him. Ash and Co. end up traveling through various regions, including Kanto, the Orange Islands, and Johto, and then enter the Pokemon League competitions there. Along the way, they run into many confrontations with Jessie, James, and Meowth, a trio of Pokemon thieves who are apart of an evil organization called “Team Rocket”. But everytime Team Rocket try to do their evil deeds, they fail thanks to Ash and his Pokemon.",, 0, Completed,
Pokemon Season 10, TV Series," Hikari is a 10 year old girl that wants to be a top coordinator just like her mother. She recieves the starting Pokemon – Pochama, after saving it from an Ariados’s attack.Meanwhile, after conquering the Battle Frontier and motivated by his old rival Shigeru, Satoshi sets off to the far away land of Shin’ou. Once there, he meets Hikari and is reunited by his old friend Takeshi. Hikari – aiming to be top coordinator, and Satoshi – aiming to be a Pokemon Master and battle in the Sinnoh League, venture in the land of Shin’ou…Meeting lots of new Pocket Monsters, “Pokemon” for short, along the way.",, 0, Completed,
Pokemon Season 11, TV Series," Hikari is a 10 year old girl that wants to be a top coordinator just like her mother. She recieves the starting Pokemon – Pochama, after saving it from an Ariados’s attack. Meanwhile, after conquering the Battle Frontierand motivated by his old rival Shigeru, Satoshi sets off to the far away land of Shin’ou. Once there, he meets Hikari and is reunited by his old friend Takeshi. Hikari – aiming to be top coordinator, and Satoshi – aiming to be a Pokemon Master and battle in the Sinnoh League, venture in the land of Shin’ou…Meeting lots of new Pocket Monsters, “Pokemon” for short, along the way.",, 0, Completed,
Pokemon Season 12, TV Series," Hikari is a 10 year old girl that wants to be a top coordinator just like her mother. She recieves the starting Pokemon – Pochama, after saving it from an Ariados’s attack. Meanwhile, after conqueringthe Battle Frontier and motivated by his old rival Shigeru, Satoshi sets off to the far away land of Shin’ou. Once there, he meets Hikari and is reunited by his old friend Takeshi. Hikari – aiming to be top coordinator, and Satoshi – aiming to be a Pokemon Master and battle in the Sinnoh League, venture in the land of Shin’ou…Meeting lots of new Pocket Monsters, “Pokemon” for short, along the way.",, 0, Completed,
Pokemon Season 13, TV Series,"  As Ash and his friends continue their journey to Sunyshore City, they are attacked by a wild Magnezone. As they reach a near-by town, they are informedby Officer Jenny that Magnezone and wild Metagross has suddenly appeared and is wreaking havoc throughout the town. As Pikachu and Pachirisu lead the Steel-types to the mountains using their Electric attacks, the group meets up with Katsuzou, a mountain guard. Then Katsuzou informs them that Magnezone and Metagross normally battle with each other on a regular basis to release the magnetism that builds up in their bodies, due to the strong magnetic forces emitted from the mountains. Recently, their “battle arena” (a deep crater) has become filled with water. Ash, Dawn, Brock, Officer Jenny and Katsuzou have to find out why the crater is full of water, and a way to drain it, so Magnezone and Metagross can battle in peace away from the city.",, 0, Completed,
Pokemon Season 14, TV Series, Pokémon,, 0, Completed,
Pokemon Season 15 BW Rival Destinies , TV Series," New foes, new friends, and dozens of never-before-seen Pokémon await Ash and Pikachu in Pokémon",, 0, Completed,
Pokemon Season 16 BW Adventures in Unova, TV Series," The season follows Ash as he continues his journey, venturing in the Unova region with his friends Iris and Cilan.",, 2013, Completed,
Pokemon Sun & Moon, Fall 2016 Anime," Satoshi and his Pikachu head off to a new region, Alola, wearing a new set of clothes. He receives a Z-Ring and becomes a student at a school."," Action, Game, Kids, School", 2016, Completed," Pocket Monsters Sun & Moon, Pokémon Sun & Moon, ポケットモンスター サン＆ムーン"
Pokemon Sun and Moon (Dub), TV Series," Satoshi and his Pikachu head off to a new region, Alola, wearing a new set of clothes. He receives a Z-Ring and becomes a student at a school."," Action, Game, Kids, School", 2016, Completed," Pokemon Sun And Moon, Pocket Monsters Sun & Moon, Pokémon Sun & Moon, ポケットモンスター サン＆ムーン"
Pokemon the Movie, Movie, One of the two Pokemon Best Wishes movies that will premiere simultaneously on July 16th. The two titles are," Adventure, Comedy, Drama, Fantasy, Kids", 2011, Completed, Pokemon Best Wishes!
Pokemon the Movie, Movie," The 15th Pokemon movie and the 2nd 'Best Wishes!' movie. It will feature the legendary Pokemon Kyurem (appearing also in its new Black Kyurem and White Kyurem formes.) The Legendary Musketeer Pokemon-Cobalion, Terrakion and Virizion-will appear alongside their newly revealed 4th member, Keldeo."," Adventure, Comedy, Fantasy, Shounen", 0, Completed, Pokemon Movie 15; Pokemon Best Wishes! Season 2
Pokemon the Movie, Movie, One of the two Pokemon Best Wishes movies that will premiere simultaneously on July 16th. The two titles are," Adventure, Comedy, Shounen", 0, Completed, ポケットモンスター ベストウィッシュ 「ビクティニと黒き英雄」; Pokemon Best Wishes!
Pokemon XY, TV Series," The XY series is based on the events of the Generation VI games. As with the previous three series, the XY series begins with only Satoshi heading off to a new region with his Pikachuu; his previous companions, Irisand Dent, have left the series. Satoshi's journey through the Kalos Region begins in Miare City, and soon he will be joined by Serena, Citron, and Eureka."," Adventure, Comedy, Fantasy, Kids, Shounen", 2013, Completed, Pokémon The Series
Pokemon XY - Pikachu and the Pokemon Musicians (Dub), Movie, Pikachu and the Pokémon Music Squad is the Pikachu short that debuted alongside Pokémon The Movie - Hoopa and the Clash of Ages.," Adventure, Comedy, Kids", 2015, Completed, Pikachu to Pokémon ongakutai; ピカチュウとポケモンおんがくたい; Pikachu and the Pokémon Music Squad; Pikachu and the Pokémon Band
"Pokemon XY - Pikachu, What Kind of Keys are These? (Dub)", Movie," The Key Pokémon Cleffy appears before Pikachu and friends!When keys that possess mysterious powers are inserted into the keyholes floating in mid-air, the keyholes light up and expand and a magical subspace spreads out before the Pokémon! Cleffy has keys that lead to all kinds of worlds. What kind of world does the key Pikachu receives take the Pokémon to?"," Adventure, Comedy, Kids", 0, Completed," Pikachu, Kore Nan no Kagi?; ピカチュウ、これなんのカギ？"
Pokemon XY (Dub), TV Series," A young boy named Satoshi embarks on a journey to become a ""Pokemon Master"" with his first Pokemon, Pikachu. Joining him on his travels are Takeshi, a girl-obsessed Rock Pokemon Trainer, and Kasumi, a tomboyish Water Pokemon Trainer who may have a crush on him. Satoshi and Co. end up traveling through various regions, including Kanto, the Orange Islands, and Johto, and then enter the Pokemon League competitions there. Along the way, they run into many confrontations with Musashi, Kojirou, and Nyarth, a trio of Pokemon thieves who are apart of an evil organization called ""Team Rocket."" But every time Team Rocket tries to do their evil deeds, they fail thanks to Satoshi and his Pokemon."," Action, Adventure, Comedy, Fantasy, Kids", 2015, Completed, Pokémon The Series
Pokemon XY 000 Road to Kalos, Special," The XY series is based on the events of the Generation VI games. As with the previous three series, the XY series begins with only Satoshi heading off to a new region with his Pikachuu; his previous companions, Irisand Dent, have left the series. Satoshi's journey through the Kalos Region begins in Miare City, and soon he will be joined by Serena, Citron, and Eureka."," Adventure, Comedy, Fantasy, Kids, Shounen", 2013, Completed, Pokemon XY SP
Pokemon XY, Movie," The story is set in Diamond Ore Country, of which Diancie is the princess.This is a country located deep underground, where the Pokémon Carbink live together in peace. The energy source of this country is a giant diamond called the Sacred Diamond, which can only be created by princess Diancie. However, the current princess doesn't yet possess the power to create such a diamond, and the current Sacred Diamond's power is soon going to run out, which would result in the end of the country. Diancie meets up with Ash and Pikachu, and set off together with them to search for the legendary Pokemon Xerneas, which possesses sacred power, but on the way, they find the cocoon where the Destruction Pokémon, Yveltal, who was said to have once destroyed life in Kalos, lies in wait.(Source"," Adventure, Fantasy, Kids", 2014, Completed, Pokemon the Movie
Pokemon XY, Movie," Prequel to the 17th Pokémon movie, Pokemon XY"," Fantasy, Kids", 2014, Completed," Diancie, Princess of the Ore Country; 鉱国のプリンセス ディアンシー"
Pokemon XY, TV Series," Mega Evolution"""," Adventure, Comedy, Fantasy, Kids, Shounen", 2014, Completed, Pokemon XY
Pokemon XY, Movie," Mega Evolution - a new form of evolution that has spread through the Kalos region. However, is Mega Evolution something all Pokemon are capable of? This story is centered around a young Trainer named Alan and his partner Lizardon. ""To master Mega Evolution, to defeat all mega evolved Pokemon and stand on top as the strongest"""," Adventure, Comedy, Fantasy, Kids, Shounen", 2014, Completed, Pokemon XY
